  101 2.041147808 10.18.98.174 → 172.217.6.227 TCP 74 39060 → 443 [SYN] Seq=0 Win=29200 Len=0 MSS=1460 SACK_PERM=1 TSval=2187452607 TSecr=0 WS=128
  106 2.044272604 10.18.98.174 → 172.217.10.225 TCP 74 40972 → 443 [SYN] Seq=0 Win=29200 Len=0 MSS=1460 SACK_PERM=1 TSval=891163919 TSecr=0 WS=128
  107 2.044711099 172.217.6.227 → 10.18.98.174 TCP 74 443 → 39060 [SYN, ACK] Seq=0 Ack=1 Win=60192 Len=0 MSS=1300 SACK_PERM=1 TSval=2293531971 TSecr=2187452607 WS=256
  112 2.047778773 172.217.10.225 → 10.18.98.174 TCP 74 443 → 40972 [SYN, ACK] Seq=0 Ack=1 Win=60192 Len=0 MSS=1300 SACK_PERM=1 TSval=1202393523 TSecr=891163919 WS=256
  127 2.058568586 10.18.98.174 → 172.217.12.195 TCP 74 57098 → 443 [SYN] Seq=0 Win=29200 Len=0 MSS=1460 SACK_PERM=1 TSval=3874905484 TSecr=0 WS=128
  128 2.061911275 172.217.12.195 → 10.18.98.174 TCP 74 443 → 57098 [SYN, ACK] Seq=0 Ack=1 Win=60192 Len=0 MSS=1300 SACK_PERM=1 TSval=548936945 TSecr=3874905484 WS=256
  254 2.864748847 10.18.98.174 → 104.25.219.21 TCP 74 37392 → 443 [SYN] Seq=0 Win=29200 Len=0 MSS=1460 SACK_PERM=1 TSval=2684812065 TSecr=0 WS=128
  265 2.878419019 104.25.219.21 → 10.18.98.174 TCP 66 443 → 37392 [SYN, ACK] Seq=0 Ack=1 Win=29200 Len=0 MSS=1300 SACK_PERM=1 WS=1024
  301 3.057185239 10.18.98.174 → 104.25.219.21 TCP 74 37394 → 443 [SYN] Seq=0 Win=29200 Len=0 MSS=1460 SACK_PERM=1 TSval=2684812257 TSecr=0 WS=128
  302 3.060892441 104.25.219.21 → 10.18.98.174 TCP 66 443 → 37394 [SYN, ACK] Seq=0 Ack=1 Win=29200 Len=0 MSS=1300 SACK_PERM=1 WS=1024
  306 3.168326599 10.18.98.174 → 104.25.218.21 TCP 74 41902 → 443 [SYN] Seq=0 Win=29200 Len=0 MSS=1460 SACK_PERM=1 TSval=488909767 TSecr=0 WS=128
  307 3.171920194 104.25.218.21 → 10.18.98.174 TCP 66 443 → 41902 [SYN, ACK] Seq=0 Ack=1 Win=29200 Len=0 MSS=1300 SACK_PERM=1 WS=1024
  397 3.544025016 10.18.98.174 → 172.217.10.238 TCP 74 48926 → 443 [SYN] Seq=0 Win=29200 Len=0 MSS=1460 SACK_PERM=1 TSval=1839991834 TSecr=0 WS=128
  402 3.547615740 172.217.10.238 → 10.18.98.174 TCP 74 443 → 48926 [SYN, ACK] Seq=0 Ack=1 Win=60192 Len=0 MSS=1300 SACK_PERM=1 TSval=469234286 TSecr=1839991834 WS=256
  686 9.011510576 10.18.98.174 → 93.184.216.34 TCP 74 41346 → 80 [SYN] Seq=0 Win=29200 Len=0 MSS=1460 SACK_PERM=1 TSval=1870555122 TSecr=0 WS=128
  687 9.015103536 93.184.216.34 → 10.18.98.174 TCP 74 80 → 41346 [SYN, ACK] Seq=0 Ack=1 Win=65535 Len=0 MSS=1300 SACK_PERM=1 TSval=1585708138 TSecr=1870555122 WS=512
  731 34.943336907 10.18.98.174 → 93.184.216.34 TCP 74 51388 → 443 [SYN] Seq=0 Win=29200 Len=0 MSS=1460 SACK_PERM=1 TSval=1870581053 TSecr=0 WS=128
  732 34.947277824 93.184.216.34 → 10.18.98.174 TCP 74 443 → 51388 [SYN, ACK] Seq=0 Ack=1 Win=65535 Len=0 MSS=1300 SACK_PERM=1 TSval=4059472010 TSecr=1870581053 WS=512
  767 49.760698543 10.18.98.174 → 31.13.71.36  TCP 74 49550 → 443 [SYN] Seq=0 Win=29200 Len=0 MSS=1460 SACK_PERM=1 TSval=1678838130 TSecr=0 WS=128
  768 49.763858465  31.13.71.36 → 10.18.98.174 TCP 74 443 → 49550 [SYN, ACK] Seq=0 Ack=1 Win=27760 Len=0 MSS=1300 SACK_PERM=1 TSval=2078469791 TSecr=1678838130 WS=256
  809 49.977489664 10.18.98.174 → 31.13.71.7   TCP 74 60110 → 443 [SYN] Seq=0 Win=29200 Len=0 MSS=1460 SACK_PERM=1 TSval=1037072490 TSecr=0 WS=128
  810 49.979021592 10.18.98.174 → 31.13.71.7   TCP 74 60112 → 443 [SYN] Seq=0 Win=29200 Len=0 MSS=1460 SACK_PERM=1 TSval=1037072492 TSecr=0 WS=128
  811 49.980358527   31.13.71.7 → 10.18.98.174 TCP 74 443 → 60110 [SYN, ACK] Seq=0 Ack=1 Win=27760 Len=0 MSS=1300 SACK_PERM=1 TSval=4090827225 TSecr=1037072490 WS=256
  813 49.981489704   31.13.71.7 → 10.18.98.174 TCP 74 443 → 60112 [SYN, ACK] Seq=0 Ack=1 Win=27760 Len=0 MSS=1300 SACK_PERM=1 TSval=513031699 TSecr=1037072492 WS=256
  874 50.436035292 10.18.98.174 → 31.13.71.7   TCP 74 60114 → 443 [SYN] Seq=0 Win=29200 Len=0 MSS=1460 SACK_PERM=1 TSval=1037072949 TSecr=0 WS=128
  875 50.438541895   31.13.71.7 → 10.18.98.174 TCP 74 443 → 60114 [SYN, ACK] Seq=0 Ack=1 Win=27760 Len=0 MSS=1300 SACK_PERM=1 TSval=2724545976 TSecr=1037072949 WS=256
  877 50.478838751 10.18.98.174 → 31.13.71.7   TCP 74 60116 → 443 [SYN] Seq=0 Win=29200 Len=0 MSS=1460 SACK_PERM=1 TSval=1037072991 TSecr=0 WS=128
  878 50.481351478   31.13.71.7 → 10.18.98.174 TCP 74 443 → 60116 [SYN, ACK] Seq=0 Ack=1 Win=27760 Len=0 MSS=1300 SACK_PERM=1 TSval=2705271041 TSecr=1037072991 WS=256
 1146 52.169577503 10.18.98.174 → 31.13.71.1   TCP 74 53650 → 443 [SYN] Seq=0 Win=29200 Len=0 MSS=1460 SACK_PERM=1 TSval=1348720268 TSecr=0 WS=128
 1148 52.173614567   31.13.71.1 → 10.18.98.174 TCP 74 443 → 53650 [SYN, ACK] Seq=0 Ack=1 Win=27760 Len=0 MSS=1300 SACK_PERM=1 TSval=3399987785 TSecr=1348720268 WS=256
 1163 52.183544150 10.18.98.174 → 31.13.71.1   TCP 74 53652 → 443 [SYN] Seq=0 Win=29200 Len=0 MSS=1460 SACK_PERM=1 TSval=1348720282 TSecr=0 WS=128
 1165 52.187082124   31.13.71.1 → 10.18.98.174 TCP 74 443 → 53652 [SYN, ACK] Seq=0 Ack=1 Win=27760 Len=0 MSS=1300 SACK_PERM=1 TSval=670526368 TSecr=1348720282 WS=256
 1567 99.399112517 10.18.98.174 → 172.217.10.5 TCP 74 55926 → 443 [SYN] Seq=0 Win=29200 Len=0 MSS=1460 SACK_PERM=1 TSval=4177662643 TSecr=0 WS=128
 1568 99.402245892 172.217.10.5 → 10.18.98.174 TCP 74 443 → 55926 [SYN, ACK] Seq=0 Ack=1 Win=60192 Len=0 MSS=1300 SACK_PERM=1 TSval=2416252447 TSecr=4177662643 WS=256
 1576 99.434947008 10.18.98.174 → 172.217.11.3 TCP 74 50378 → 80 [SYN] Seq=0 Win=29200 Len=0 MSS=1460 SACK_PERM=1 TSval=183613826 TSecr=0 WS=128
 1577 99.438995895 172.217.11.3 → 10.18.98.174 TCP 74 80 → 50378 [SYN, ACK] Seq=0 Ack=1 Win=60192 Len=0 MSS=1300 SACK_PERM=1 TSval=4108085846 TSecr=183613826 WS=256
 2221 102.363296399 10.18.98.174 → 172.217.6.206 TCP 74 40094 → 443 [SYN] Seq=0 Win=29200 Len=0 MSS=1460 SACK_PERM=1 TSval=2280212518 TSecr=0 WS=128
 2224 102.367442531 172.217.6.206 → 10.18.98.174 TCP 74 443 → 40094 [SYN, ACK] Seq=0 Ack=1 Win=60192 Len=0 MSS=1300 SACK_PERM=1 TSval=2695790943 TSecr=2280212518 WS=256
 2319 102.931402206 10.18.98.174 → 172.217.7.14 TCP 74 53624 → 443 [SYN] Seq=0 Win=29200 Len=0 MSS=1460 SACK_PERM=1 TSval=559737266 TSecr=0 WS=128
 2323 102.934370652 10.18.98.174 → 172.217.10.14 TCP 74 57092 → 443 [SYN] Seq=0 Win=29200 Len=0 MSS=1460 SACK_PERM=1 TSval=842247726 TSecr=0 WS=128
 2324 102.936013540 172.217.7.14 → 10.18.98.174 TCP 74 443 → 53624 [SYN, ACK] Seq=0 Ack=1 Win=60192 Len=0 MSS=1300 SACK_PERM=1 TSval=2428905330 TSecr=559737266 WS=256
 2327 102.937635303 172.217.10.14 → 10.18.98.174 TCP 74 443 → 57092 [SYN, ACK] Seq=0 Ack=1 Win=60192 Len=0 MSS=1300 SACK_PERM=1 TSval=3733729223 TSecr=842247726 WS=256
 2427 103.266647402 10.18.98.174 → 172.217.12.206 TCP 74 42066 → 443 [SYN] Seq=0 Win=29200 Len=0 MSS=1460 SACK_PERM=1 TSval=723327981 TSecr=0 WS=128
 2428 103.271560937 172.217.12.206 → 10.18.98.174 TCP 74 443 → 42066 [SYN, ACK] Seq=0 Ack=1 Win=60192 Len=0 MSS=1300 SACK_PERM=1 TSval=3821107590 TSecr=723327981 WS=256
 2470 103.421236947 10.18.98.174 → 172.217.7.14 TCP 74 53630 → 443 [SYN] Seq=0 Win=29200 Len=0 MSS=1460 SACK_PERM=1 TSval=559737756 TSecr=0 WS=128
 2471 103.427083029 172.217.7.14 → 10.18.98.174 TCP 74 443 → 53630 [SYN, ACK] Seq=0 Ack=1 Win=60192 Len=0 MSS=1300 SACK_PERM=1 TSval=3409752983 TSecr=559737756 WS=256
 2488 103.480195739 10.18.98.174 → 172.217.10.141 TCP 74 52680 → 443 [SYN] Seq=0 Win=29200 Len=0 MSS=1460 SACK_PERM=1 TSval=2980969865 TSecr=0 WS=128
 2494 103.483559821 172.217.10.141 → 10.18.98.174 TCP 74 443 → 52680 [SYN, ACK] Seq=0 Ack=1 Win=60192 Len=0 MSS=1300 SACK_PERM=1 TSval=1499375659 TSecr=2980969865 WS=256
 2610 103.694803570 10.18.98.174 → 172.217.10.74 TCP 74 57006 → 443 [SYN] Seq=0 Win=29200 Len=0 MSS=1460 SACK_PERM=1 TSval=1109061587 TSecr=0 WS=128
 2616 103.698727674 172.217.10.74 → 10.18.98.174 TCP 74 443 → 57006 [SYN, ACK] Seq=0 Ack=1 Win=60192 Len=0 MSS=1300 SACK_PERM=1 TSval=1201286745 TSecr=1109061587 WS=256
 2895 104.552509472 10.18.98.174 → 172.217.10.14 TCP 74 57102 → 443 [SYN] Seq=0 Win=29200 Len=0 MSS=1460 SACK_PERM=1 TSval=842249344 TSecr=0 WS=128
 2896 104.552605522 10.18.98.174 → 172.217.10.14 TCP 74 57104 → 443 [SYN] Seq=0 Win=29200 Len=0 MSS=1460 SACK_PERM=1 TSval=842249345 TSecr=0 WS=128
 2899 104.556391420 172.217.10.14 → 10.18.98.174 TCP 74 443 → 57104 [SYN, ACK] Seq=0 Ack=1 Win=60192 Len=0 MSS=1300 SACK_PERM=1 TSval=3733730842 TSecr=842249345 WS=256
 2902 104.557443737 172.217.10.14 → 10.18.98.174 TCP 74 443 → 57102 [SYN, ACK] Seq=0 Ack=1 Win=60192 Len=0 MSS=1300 SACK_PERM=1 TSval=1068986524 TSecr=842249344 WS=256
 3095 105.512671709 10.18.98.174 → 172.217.10.234 TCP 74 33146 → 443 [SYN] Seq=0 Win=29200 Len=0 MSS=1460 SACK_PERM=1 TSval=1350302810 TSecr=0 WS=128
 3099 105.516158427 172.217.10.234 → 10.18.98.174 TCP 74 443 → 33146 [SYN, ACK] Seq=0 Ack=1 Win=60192 Len=0 MSS=1300 SACK_PERM=1 TSval=822437367 TSecr=1350302810 WS=256
 3191 105.795071991 10.18.98.174 → 172.217.6.206 TCP 74 40114 → 443 [SYN] Seq=0 Win=29200 Len=0 MSS=1460 SACK_PERM=1 TSval=2280215950 TSecr=0 WS=128
 3195 105.798713498 172.217.6.206 → 10.18.98.174 TCP 74 443 → 40114 [SYN, ACK] Seq=0 Ack=1 Win=60192 Len=0 MSS=1300 SACK_PERM=1 TSval=1421120631 TSecr=2280215950 WS=256
 3456 107.301370643 10.18.98.174 → 172.217.197.189 TCP 74 38622 → 443 [SYN] Seq=0 Win=29200 Len=0 MSS=1460 SACK_PERM=1 TSval=1441950220 TSecr=0 WS=128
 3459 107.302697907 10.18.98.174 → 172.217.6.206 TCP 74 40118 → 443 [SYN] Seq=0 Win=29200 Len=0 MSS=1460 SACK_PERM=1 TSval=2280217458 TSecr=0 WS=128
 3484 107.309838260 172.217.6.206 → 10.18.98.174 TCP 74 443 → 40118 [SYN, ACK] Seq=0 Ack=1 Win=60192 Len=0 MSS=1300 SACK_PERM=1 TSval=2695795883 TSecr=2280217458 WS=256
 3501 107.318608154 172.217.197.189 → 10.18.98.174 TCP 74 443 → 38622 [SYN, ACK] Seq=0 Ack=1 Win=62392 Len=0 MSS=1300 SACK_PERM=1 TSval=2006412841 TSecr=1441950220 WS=256
 4281 128.357446570 10.18.98.174 → 172.217.12.138 TCP 74 40016 → 443 [SYN] Seq=0 Win=29200 Len=0 MSS=1460 SACK_PERM=1 TSval=319088629 TSecr=0 WS=128
 4282 128.360700347 172.217.12.138 → 10.18.98.174 TCP 74 443 → 40016 [SYN, ACK] Seq=0 Ack=1 Win=60192 Len=0 MSS=1300 SACK_PERM=1 TSval=1025500609 TSecr=319088629 WS=256
 4328 129.164870918 10.18.98.174 → 104.248.120.187 TCP 74 43504 → 443 [SYN] Seq=0 Win=29200 Len=0 MSS=1460 SACK_PERM=1 TSval=3632409641 TSecr=0 WS=128
 4329 129.168047577 104.248.120.187 → 10.18.98.174 TCP 70 443 → 43504 [SYN, ACK] Seq=0 Ack=1 Win=28960 Len=0 MSS=1300 SACK_PERM=1 TSval=3408381298 TSecr=3632409641
 4339 129.191447512 10.18.98.174 → 23.50.53.177 TCP 74 54814 → 80 [SYN] Seq=0 Win=29200 Len=0 MSS=1460 SACK_PERM=1 TSval=795095791 TSecr=0 WS=128
 4340 129.194582636 23.50.53.177 → 10.18.98.174 TCP 74 80 → 54814 [SYN, ACK] Seq=0 Ack=1 Win=28960 Len=0 MSS=1300 SACK_PERM=1 TSval=1968718389 TSecr=795095791 WS=128
 4363 129.341599076 10.18.98.174 → 172.217.9.234 TCP 74 59484 → 443 [SYN] Seq=0 Win=29200 Len=0 MSS=1460 SACK_PERM=1 TSval=757513583 TSecr=0 WS=128
 4365 129.345318001 172.217.9.234 → 10.18.98.174 TCP 74 443 → 59484 [SYN, ACK] Seq=0 Ack=1 Win=60192 Len=0 MSS=1300 SACK_PERM=1 TSval=1740222720 TSecr=757513583 WS=256
 4425 129.498593360 10.18.98.174 → 199.232.36.134 TCP 74 47492 → 443 [SYN] Seq=0 Win=29200 Len=0 MSS=1460 SACK_PERM=1 TSval=212094890 TSecr=0 WS=128
 4426 129.498653989 10.18.98.174 → 199.232.36.134 TCP 74 47494 → 443 [SYN] Seq=0 Win=29200 Len=0 MSS=1460 SACK_PERM=1 TSval=212094890 TSecr=0 WS=128
 4427 129.501532501 199.232.36.134 → 10.18.98.174 TCP 74 443 → 47492 [SYN, ACK] Seq=0 Ack=1 Win=28960 Len=0 MSS=1300 SACK_PERM=1 TSval=2169670569 TSecr=212094890 WS=512
 4429 129.501578134 199.232.36.134 → 10.18.98.174 TCP 74 443 → 47494 [SYN, ACK] Seq=0 Ack=1 Win=28960 Len=0 MSS=1300 SACK_PERM=1 TSval=647891728 TSecr=212094890 WS=512
 4487 129.806901870 10.18.98.174 → 151.101.128.134 TCP 74 42160 → 443 [SYN] Seq=0 Win=29200 Len=0 MSS=1460 SACK_PERM=1 TSval=1613096369 TSecr=0 WS=128
 4488 129.809291826 151.101.128.134 → 10.18.98.174 TCP 74 443 → 42160 [SYN, ACK] Seq=0 Ack=1 Win=28960 Len=0 MSS=1300 SACK_PERM=1 TSval=506530735 TSecr=1613096369 WS=512
 4529 130.439431303 10.18.98.174 → 104.16.78.166 TCP 74 46446 → 443 [SYN] Seq=0 Win=29200 Len=0 MSS=1460 SACK_PERM=1 TSval=3719439803 TSecr=0 WS=128
 4530 130.444008876 104.16.78.166 → 10.18.98.174 TCP 66 443 → 46446 [SYN, ACK] Seq=0 Ack=1 Win=29200 Len=0 MSS=1300 SACK_PERM=1 WS=1024
 4545 130.701053707 10.18.98.174 → 104.16.78.166 TCP 74 46448 → 443 [SYN] Seq=0 Win=29200 Len=0 MSS=1460 SACK_PERM=1 TSval=3719440065 TSecr=0 WS=128
 4550 130.704342588 104.16.78.166 → 10.18.98.174 TCP 66 443 → 46448 [SYN, ACK] Seq=0 Ack=1 Win=29200 Len=0 MSS=1300 SACK_PERM=1 WS=1024
 4563 130.726691750 10.18.98.174 → 151.139.128.14 TCP 74 60432 → 80 [SYN] Seq=0 Win=29200 Len=0 MSS=1460 SACK_PERM=1 TSval=1906414645 TSecr=0 WS=128
 4564 130.729461085 151.139.128.14 → 10.18.98.174 TCP 74 80 → 60432 [SYN, ACK] Seq=0 Ack=1 Win=28960 Len=0 MSS=1300 SACK_PERM=1 TSval=2934228751 TSecr=1906414645 WS=128
 4572 130.747925520 10.18.98.174 → 104.16.78.166 TCP 74 46452 → 443 [SYN] Seq=0 Win=29200 Len=0 MSS=1460 SACK_PERM=1 TSval=3719440111 TSecr=0 WS=128
 4573 130.750975498 104.16.78.166 → 10.18.98.174 TCP 66 443 → 46452 [SYN, ACK] Seq=0 Ack=1 Win=29200 Len=0 MSS=1300 SACK_PERM=1 WS=1024
 4580 130.771225673 10.18.98.174 → 104.16.78.166 TCP 74 46454 → 443 [SYN] Seq=0 Win=29200 Len=0 MSS=1460 SACK_PERM=1 TSval=3719440135 TSecr=0 WS=128
 4583 130.774690236 104.16.78.166 → 10.18.98.174 TCP 66 443 → 46454 [SYN, ACK] Seq=0 Ack=1 Win=29200 Len=0 MSS=1300 SACK_PERM=1 WS=1024
 4602 130.909260496 10.18.98.174 → 199.232.38.49 TCP 74 57734 → 443 [SYN] Seq=0 Win=29200 Len=0 MSS=1460 SACK_PERM=1 TSval=3745376322 TSecr=0 WS=128
 4603 130.911635452 199.232.38.49 → 10.18.98.174 TCP 74 443 → 57734 [SYN, ACK] Seq=0 Ack=1 Win=28960 Len=0 MSS=1300 SACK_PERM=1 TSval=2169670922 TSecr=3745376322 WS=512
 4632 131.019086530 10.18.98.174 → 104.16.80.166 TCP 74 55004 → 443 [SYN] Seq=0 Win=29200 Len=0 MSS=1460 SACK_PERM=1 TSval=482303281 TSecr=0 WS=128
 4633 131.022729672 104.16.80.166 → 10.18.98.174 TCP 66 443 → 55004 [SYN, ACK] Seq=0 Ack=1 Win=29200 Len=0 MSS=1300 SACK_PERM=1 WS=1024
 4657 131.587918817 10.18.98.174 → 96.6.23.248  TCP 74 56174 → 443 [SYN] Seq=0 Win=29200 Len=0 MSS=1460 SACK_PERM=1 TSval=2084106532 TSecr=0 WS=128
 4658 131.591005755  96.6.23.248 → 10.18.98.174 TCP 74 443 → 56174 [SYN, ACK] Seq=0 Ack=1 Win=28960 Len=0 MSS=1300 SACK_PERM=1 TSval=1005502478 TSecr=2084106532 WS=128
 4686 131.669974369 10.18.98.174 → 35.166.89.106 TCP 74 57456 → 443 [SYN] Seq=0 Win=29200 Len=0 MSS=1460 SACK_PERM=1 TSval=2561286218 TSecr=0 WS=128
 4687 131.670039420 10.18.98.174 → 35.166.89.106 TCP 74 57458 → 443 [SYN] Seq=0 Win=29200 Len=0 MSS=1460 SACK_PERM=1 TSval=2561286219 TSecr=0 WS=128
 4688 131.747393967 35.166.89.106 → 10.18.98.174 TCP 74 443 → 57458 [SYN, ACK] Seq=0 Ack=1 Win=26847 Len=0 MSS=1300 SACK_PERM=1 TSval=748333015 TSecr=2561286219 WS=256
 4690 131.748405750 35.166.89.106 → 10.18.98.174 TCP 74 443 → 57456 [SYN, ACK] Seq=0 Ack=1 Win=26847 Len=0 MSS=1300 SACK_PERM=1 TSval=748333015 TSecr=2561286218 WS=256
 4704 131.882326845 10.18.98.174 → 104.248.120.187 TCP 74 43536 → 443 [SYN] Seq=0 Win=29200 Len=0 MSS=1460 SACK_PERM=1 TSval=3632412359 TSecr=0 WS=128
 4705 131.885647365 104.248.120.187 → 10.18.98.174 TCP 70 443 → 43536 [SYN, ACK] Seq=0 Ack=1 Win=28960 Len=0 MSS=1300 SACK_PERM=1 TSval=3408384015 TSecr=3632412359
 5258 236.245645403 10.18.98.174 → 72.14.180.202 TCP 74 35168 → 443 [SYN] Seq=0 Win=29200 Len=0 MSS=1460 SACK_PERM=1 TSval=3854548680 TSecr=0 WS=128
 5259 236.287918408 72.14.180.202 → 10.18.98.174 TCP 74 443 → 35168 [SYN, ACK] Seq=0 Ack=1 Win=65160 Len=0 MSS=1300 SACK_PERM=1 TSval=2048763367 TSecr=3854548680 WS=128
 5272 236.370694928 10.18.98.174 → 72.21.91.29  TCP 74 33990 → 80 [SYN] Seq=0 Win=29200 Len=0 MSS=1460 SACK_PERM=1 TSval=4293106894 TSecr=0 WS=128
 5273 236.374040188  72.21.91.29 → 10.18.98.174 TCP 74 80 → 33990 [SYN, ACK] Seq=0 Ack=1 Win=65535 Len=0 MSS=1300 SACK_PERM=1 TSval=1063380366 TSecr=4293106894 WS=512
 5293 236.579264964 10.18.98.174 → 72.14.180.202 TCP 74 35172 → 443 [SYN] Seq=0 Win=29200 Len=0 MSS=1460 SACK_PERM=1 TSval=3854549013 TSecr=0 WS=128
 5294 236.579389152 10.18.98.174 → 72.14.180.202 TCP 74 35174 → 443 [SYN] Seq=0 Win=29200 Len=0 MSS=1460 SACK_PERM=1 TSval=3854549013 TSecr=0 WS=128
 5300 236.581623445 10.18.98.174 → 104.19.197.151 TCP 74 56244 → 443 [SYN] Seq=0 Win=29200 Len=0 MSS=1460 SACK_PERM=1 TSval=1385842431 TSecr=0 WS=128
 5302 236.583959987 10.18.98.174 → 94.31.29.138 TCP 74 33870 → 443 [SYN] Seq=0 Win=29200 Len=0 MSS=1460 SACK_PERM=1 TSval=455890379 TSecr=0 WS=128
 5303 236.584017372 10.18.98.174 → 94.31.29.138 TCP 74 33872 → 443 [SYN] Seq=0 Win=29200 Len=0 MSS=1460 SACK_PERM=1 TSval=455890379 TSecr=0 WS=128
 5304 236.584067159 10.18.98.174 → 94.31.29.138 TCP 74 33874 → 443 [SYN] Seq=0 Win=29200 Len=0 MSS=1460 SACK_PERM=1 TSval=455890379 TSecr=0 WS=128
 5305 236.584107337 10.18.98.174 → 94.31.29.138 TCP 74 33876 → 443 [SYN] Seq=0 Win=29200 Len=0 MSS=1460 SACK_PERM=1 TSval=455890379 TSecr=0 WS=128
 5306 236.584144086 10.18.98.174 → 94.31.29.138 TCP 74 33878 → 443 [SYN] Seq=0 Win=29200 Len=0 MSS=1460 SACK_PERM=1 TSval=455890379 TSecr=0 WS=128
 5307 236.584585893 104.19.197.151 → 10.18.98.174 TCP 66 443 → 56244 [SYN, ACK] Seq=0 Ack=1 Win=29200 Len=0 MSS=1300 SACK_PERM=1 WS=1024
 5311 236.587292840 94.31.29.138 → 10.18.98.174 TCP 66 443 → 33874 [SYN, ACK] Seq=0 Ack=1 Win=29200 Len=0 MSS=1300 SACK_PERM=1 WS=1024
 5314 236.588360952 94.31.29.138 → 10.18.98.174 TCP 66 443 → 33876 [SYN, ACK] Seq=0 Ack=1 Win=29200 Len=0 MSS=1300 SACK_PERM=1 WS=1024
 5316 236.589058507 94.31.29.138 → 10.18.98.174 TCP 66 443 → 33878 [SYN, ACK] Seq=0 Ack=1 Win=29200 Len=0 MSS=1300 SACK_PERM=1 WS=1024
 5320 236.590366994 94.31.29.138 → 10.18.98.174 TCP 66 443 → 33870 [SYN, ACK] Seq=0 Ack=1 Win=29200 Len=0 MSS=1300 SACK_PERM=1 WS=1024
 5322 236.590379745 94.31.29.138 → 10.18.98.174 TCP 66 443 → 33872 [SYN, ACK] Seq=0 Ack=1 Win=29200 Len=0 MSS=1300 SACK_PERM=1 WS=1024
 5374 236.621338055 72.14.180.202 → 10.18.98.174 TCP 74 443 → 35174 [SYN, ACK] Seq=0 Ack=1 Win=65160 Len=0 MSS=1300 SACK_PERM=1 TSval=2048763701 TSecr=3854549013 WS=128
 5380 236.623547585 72.14.180.202 → 10.18.98.174 TCP 74 443 → 35172 [SYN, ACK] Seq=0 Ack=1 Win=65160 Len=0 MSS=1300 SACK_PERM=1 TSval=2048763702 TSecr=3854549013 WS=128
 5402 236.628702953 10.18.98.174 → 151.139.128.14 TCP 74 60470 → 80 [SYN] Seq=0 Win=29200 Len=0 MSS=1460 SACK_PERM=1 TSval=1906520546 TSecr=0 WS=128
 5403 236.628733311 10.18.98.174 → 151.139.128.14 TCP 74 60472 → 80 [SYN] Seq=0 Win=29200 Len=0 MSS=1460 SACK_PERM=1 TSval=1906520546 TSecr=0 WS=128
 5404 236.628771342 10.18.98.174 → 151.139.128.14 TCP 74 60474 → 80 [SYN] Seq=0 Win=29200 Len=0 MSS=1460 SACK_PERM=1 TSval=1906520546 TSecr=0 WS=128
 5405 236.628799265 10.18.98.174 → 151.139.128.14 TCP 74 60476 → 80 [SYN] Seq=0 Win=29200 Len=0 MSS=1460 SACK_PERM=1 TSval=1906520546 TSecr=0 WS=128
 5466 236.632923092 151.139.128.14 → 10.18.98.174 TCP 74 80 → 60472 [SYN, ACK] Seq=0 Ack=1 Win=28960 Len=0 MSS=1300 SACK_PERM=1 TSval=2962843617 TSecr=1906520546 WS=128
 5469 236.634576756 151.139.128.14 → 10.18.98.174 TCP 74 80 → 60470 [SYN, ACK] Seq=0 Ack=1 Win=28960 Len=0 MSS=1300 SACK_PERM=1 TSval=2945482751 TSecr=1906520546 WS=128
 5472 236.635303064 151.139.128.14 → 10.18.98.174 TCP 74 80 → 60474 [SYN, ACK] Seq=0 Ack=1 Win=28960 Len=0 MSS=1300 SACK_PERM=1 TSval=2646665175 TSecr=1906520546 WS=128
 5477 236.636930031 151.139.128.14 → 10.18.98.174 TCP 74 80 → 60476 [SYN, ACK] Seq=0 Ack=1 Win=28960 Len=0 MSS=1300 SACK_PERM=1 TSval=3164716844 TSecr=1906520546 WS=128
 5480 236.637428223 10.18.98.174 → 151.139.128.14 TCP 74 60478 → 80 [SYN] Seq=0 Win=29200 Len=0 MSS=1460 SACK_PERM=1 TSval=1906520554 TSecr=0 WS=128
 5488 236.642269110 151.139.128.14 → 10.18.98.174 TCP 74 80 → 60478 [SYN, ACK] Seq=0 Ack=1 Win=28960 Len=0 MSS=1300 SACK_PERM=1 TSval=3148327373 TSecr=1906520554 WS=128
 5606 236.696460764 10.18.98.174 → 72.14.180.202 TCP 74 35198 → 443 [SYN] Seq=0 Win=29200 Len=0 MSS=1460 SACK_PERM=1 TSval=3854549131 TSecr=0 WS=128
 5607 236.696515415 10.18.98.174 → 72.14.180.202 TCP 74 35200 → 443 [SYN] Seq=0 Win=29200 Len=0 MSS=1460 SACK_PERM=1 TSval=3854549131 TSecr=0 WS=128
 5621 236.739094771 72.14.180.202 → 10.18.98.174 TCP 74 443 → 35200 [SYN, ACK] Seq=0 Ack=1 Win=65160 Len=0 MSS=1300 SACK_PERM=1 TSval=2048763818 TSecr=3854549131 WS=128
 5623 236.739552212 72.14.180.202 → 10.18.98.174 TCP 74 443 → 35198 [SYN, ACK] Seq=0 Ack=1 Win=65160 Len=0 MSS=1300 SACK_PERM=1 TSval=2048763818 TSecr=3854549131 WS=128
 5871 255.428188862 10.18.98.174 → 34.212.28.14 TCP 74 46998 → 443 [SYN] Seq=0 Win=29200 Len=0 MSS=1460 SACK_PERM=1 TSval=1506579532 TSecr=0 WS=128
 5872 255.505183642 34.212.28.14 → 10.18.98.174 TCP 74 443 → 46998 [SYN, ACK] Seq=0 Ack=1 Win=17898 Len=0 MSS=1300 SACK_PERM=1 TSval=3350270608 TSecr=1506579532 WS=128
 5891 255.930382407 10.18.98.174 → 52.40.171.86 TCP 74 41886 → 443 [SYN] Seq=0 Win=29200 Len=0 MSS=1460 SACK_PERM=1 TSval=1318946113 TSecr=0 WS=128
 5892 256.008828672 52.40.171.86 → 10.18.98.174 TCP 74 443 → 41886 [SYN, ACK] Seq=0 Ack=1 Win=26847 Len=0 MSS=1300 SACK_PERM=1 TSval=176256928 TSecr=1318946113 WS=256
 5960 257.152558450 10.18.98.174 → 34.95.71.207 TCP 74 47976 → 443 [SYN] Seq=0 Win=29200 Len=0 MSS=1460 SACK_PERM=1 TSval=527758287 TSecr=0 WS=128
 5961 257.156117757 34.95.71.207 → 10.18.98.174 TCP 74 443 → 47976 [SYN, ACK] Seq=0 Ack=1 Win=60192 Len=0 MSS=1300 SACK_PERM=1 TSval=693826859 TSecr=527758287 WS=256
 6102 265.415990482 10.18.98.174 → 31.13.71.7   TCP 74 60228 → 443 [SYN] Seq=0 Win=29200 Len=0 MSS=1460 SACK_PERM=1 TSval=1037287926 TSecr=0 WS=128
 6103 265.419964828   31.13.71.7 → 10.18.98.174 TCP 74 443 → 60228 [SYN, ACK] Seq=0 Ack=1 Win=27760 Len=0 MSS=1300 SACK_PERM=1 TSval=3197536464 TSecr=1037287926 WS=256
 6105 265.483902408 10.18.98.174 → 31.13.71.7   TCP 74 60230 → 443 [SYN] Seq=0 Win=29200 Len=0 MSS=1460 SACK_PERM=1 TSval=1037287994 TSecr=0 WS=128
 6106 265.486532390   31.13.71.7 → 10.18.98.174 TCP 74 443 → 60230 [SYN, ACK] Seq=0 Ack=1 Win=27760 Len=0 MSS=1300 SACK_PERM=1 TSval=4071804279 TSecr=1037287994 WS=256
 6256 269.647116103 10.18.98.174 → 216.165.47.13 TCP 74 37856 → 443 [SYN] Seq=0 Win=29200 Len=0 MSS=1460 SACK_PERM=1 TSval=1013759178 TSecr=0 WS=128
 6257 269.648940080 216.165.47.13 → 10.18.98.174 TCP 74 443 → 37856 [SYN, ACK] Seq=0 Ack=1 Win=3900 Len=0 MSS=1300 TSval=1347317141 TSecr=1013759178 SACK_PERM=1
 6682 347.727966941 10.18.98.174 → 34.212.28.14 TCP 74 47010 → 443 [SYN] Seq=0 Win=29200 Len=0 MSS=1460 SACK_PERM=1 TSval=1506671830 TSecr=0 WS=128
 6683 347.805139855 34.212.28.14 → 10.18.98.174 TCP 74 443 → 47010 [SYN, ACK] Seq=0 Ack=1 Win=17898 Len=0 MSS=1300 SACK_PERM=1 TSval=3350362908 TSecr=1506671830 WS=128
 6702 348.223901155 10.18.98.174 → 52.40.171.86 TCP 74 41898 → 443 [SYN] Seq=0 Win=29200 Len=0 MSS=1460 SACK_PERM=1 TSval=1319038405 TSecr=0 WS=128
 6703 348.300847971 52.40.171.86 → 10.18.98.174 TCP 74 443 → 41898 [SYN, ACK] Seq=0 Ack=1 Win=26847 Len=0 MSS=1300 SACK_PERM=1 TSval=176279959 TSecr=1319038405 WS=256
 7030 504.491702530 10.18.98.174 → 172.217.12.132 TCP 74 60406 → 443 [SYN] Seq=0 Win=29200 Len=0 MSS=1460 SACK_PERM=1 TSval=3014528432 TSecr=0 WS=128
 7031 504.497825066 172.217.12.132 → 10.18.98.174 TCP 74 443 → 60406 [SYN, ACK] Seq=0 Ack=1 Win=60192 Len=0 MSS=1300 SACK_PERM=1 TSval=1921680756 TSecr=3014528432 WS=256
 7033 504.838736641 10.18.98.174 → 172.217.12.132 TCP 74 60408 → 443 [SYN] Seq=0 Win=29200 Len=0 MSS=1460 SACK_PERM=1 TSval=3014528779 TSecr=0 WS=128
 7034 504.842855808 172.217.12.132 → 10.18.98.174 TCP 74 443 → 60408 [SYN, ACK] Seq=0 Ack=1 Win=60192 Len=0 MSS=1300 SACK_PERM=1 TSval=3209822326 TSecr=3014528779 WS=256
 7304 599.639050116 10.18.98.174 → 104.25.219.21 TCP 74 37538 → 443 [SYN] Seq=0 Win=29200 Len=0 MSS=1460 SACK_PERM=1 TSval=2685408831 TSecr=0 WS=128
 7305 599.642087769 104.25.219.21 → 10.18.98.174 TCP 66 443 → 37538 [SYN, ACK] Seq=0 Ack=1 Win=29200 Len=0 MSS=1300 SACK_PERM=1 WS=1024
 7458 609.335493533 10.18.98.174 → 192.0.73.2   TCP 74 46416 → 443 [SYN] Seq=0 Win=29200 Len=0 MSS=1460 SACK_PERM=1 TSval=2334896555 TSecr=0 WS=128
 7461 609.338557762   192.0.73.2 → 10.18.98.174 TCP 66 443 → 46416 [SYN, ACK] Seq=0 Ack=1 Win=29200 Len=0 MSS=1300 SACK_PERM=1 WS=512
 7673 646.288102428 10.18.98.174 → 151.101.193.69 TCP 74 57788 → 443 [SYN] Seq=0 Win=29200 Len=0 MSS=1460 SACK_PERM=1 TSval=3893124830 TSecr=0 WS=128
 7674 646.290456407 151.101.193.69 → 10.18.98.174 TCP 74 443 → 57788 [SYN, ACK] Seq=0 Ack=1 Win=28960 Len=0 MSS=1300 SACK_PERM=1 TSval=455006679 TSecr=3893124830 WS=512
 7701 646.438448354 10.18.98.174 → 151.101.65.69 TCP 74 53254 → 443 [SYN] Seq=0 Win=29200 Len=0 MSS=1460 SACK_PERM=1 TSval=2924020415 TSecr=0 WS=128
 7702 646.443272235 151.101.65.69 → 10.18.98.174 TCP 74 443 → 53254 [SYN, ACK] Seq=0 Ack=1 Win=28960 Len=0 MSS=1300 SACK_PERM=1 TSval=1415436993 TSecr=2924020415 WS=512
 7716 646.450133254 10.18.98.174 → 192.0.73.2   TCP 74 46422 → 443 [SYN] Seq=0 Win=29200 Len=0 MSS=1460 SACK_PERM=1 TSval=2334933669 TSecr=0 WS=128
 7718 646.450227402 10.18.98.174 → 192.0.73.2   TCP 74 46424 → 443 [SYN] Seq=0 Win=29200 Len=0 MSS=1460 SACK_PERM=1 TSval=2334933669 TSecr=0 WS=128
 7729 646.454240014   192.0.73.2 → 10.18.98.174 TCP 66 443 → 46422 [SYN, ACK] Seq=0 Ack=1 Win=29200 Len=0 MSS=1300 SACK_PERM=1 WS=512
 7733 646.454260808   192.0.73.2 → 10.18.98.174 TCP 66 443 → 46424 [SYN, ACK] Seq=0 Ack=1 Win=29200 Len=0 MSS=1300 SACK_PERM=1 WS=512
 7958 677.878016442 10.18.98.174 → 140.82.113.3 TCP 74 60706 → 443 [SYN] Seq=0 Win=29200 Len=0 MSS=1460 SACK_PERM=1 TSval=4245552092 TSecr=0 WS=128
 7959 677.885310187 140.82.113.3 → 10.18.98.174 TCP 74 443 → 60706 [SYN, ACK] Seq=0 Ack=1 Win=28480 Len=0 MSS=1300 SACK_PERM=1 TSval=237052138 TSecr=4245552092 WS=1024
 7968 677.903465953 10.18.98.174 → 72.21.91.29  TCP 74 34056 → 80 [SYN] Seq=0 Win=29200 Len=0 MSS=1460 SACK_PERM=1 TSval=4293548420 TSecr=0 WS=128
 7969 677.906750604  72.21.91.29 → 10.18.98.174 TCP 74 80 → 34056 [SYN, ACK] Seq=0 Ack=1 Win=65535 Len=0 MSS=1300 SACK_PERM=1 TSval=3484552194 TSecr=4293548420 WS=512
 8002 679.054011224 10.18.98.174 → 185.199.110.154 TCP 74 49614 → 443 [SYN] Seq=0 Win=29200 Len=0 MSS=1460 SACK_PERM=1 TSval=4254067009 TSecr=0 WS=128
 8003 679.054066862 10.18.98.174 → 185.199.110.154 TCP 74 49616 → 443 [SYN] Seq=0 Win=29200 Len=0 MSS=1460 SACK_PERM=1 TSval=4254067009 TSecr=0 WS=128
 8004 679.054098128 10.18.98.174 → 185.199.110.154 TCP 74 49618 → 443 [SYN] Seq=0 Win=29200 Len=0 MSS=1460 SACK_PERM=1 TSval=4254067009 TSecr=0 WS=128
 8005 679.054124892 10.18.98.174 → 185.199.110.154 TCP 74 49620 → 443 [SYN] Seq=0 Win=29200 Len=0 MSS=1460 SACK_PERM=1 TSval=4254067009 TSecr=0 WS=128
 8006 679.054150605 10.18.98.174 → 185.199.110.154 TCP 74 49622 → 443 [SYN] Seq=0 Win=29200 Len=0 MSS=1460 SACK_PERM=1 TSval=4254067009 TSecr=0 WS=128
 8007 679.056516784 185.199.110.154 → 10.18.98.174 TCP 74 443 → 49614 [SYN, ACK] Seq=0 Ack=1 Win=28960 Len=0 MSS=1300 SACK_PERM=1 TSval=2190629029 TSecr=4254067009 WS=512
 8009 679.057827790 185.199.110.154 → 10.18.98.174 TCP 74 443 → 49616 [SYN, ACK] Seq=0 Ack=1 Win=28960 Len=0 MSS=1300 SACK_PERM=1 TSval=509402436 TSecr=4254067009 WS=512
 8012 679.059005088 185.199.110.154 → 10.18.98.174 TCP 74 443 → 49622 [SYN, ACK] Seq=0 Ack=1 Win=28960 Len=0 MSS=1300 SACK_PERM=1 TSval=2171101686 TSecr=4254067009 WS=512
 8014 679.059041649 185.199.110.154 → 10.18.98.174 TCP 74 443 → 49620 [SYN, ACK] Seq=0 Ack=1 Win=28960 Len=0 MSS=1300 SACK_PERM=1 TSval=2191206750 TSecr=4254067009 WS=512
 8016 679.059048772 185.199.110.154 → 10.18.98.174 TCP 74 443 → 49618 [SYN, ACK] Seq=0 Ack=1 Win=28960 Len=0 MSS=1300 SACK_PERM=1 TSval=1414249692 TSecr=4254067009 WS=512
 8112 679.090777415 10.18.98.174 → 185.199.110.154 TCP 74 49624 → 443 [SYN] Seq=0 Win=29200 Len=0 MSS=1460 SACK_PERM=1 TSval=4254067046 TSecr=0 WS=128
 8113 679.090841262 10.18.98.174 → 185.199.110.154 TCP 74 49626 → 443 [SYN] Seq=0 Win=29200 Len=0 MSS=1460 SACK_PERM=1 TSval=4254067046 TSecr=0 WS=128
 8114 679.090891683 10.18.98.174 → 185.199.110.154 TCP 74 49628 → 443 [SYN] Seq=0 Win=29200 Len=0 MSS=1460 SACK_PERM=1 TSval=4254067046 TSecr=0 WS=128
 8116 679.090963878 10.18.98.174 → 185.199.110.154 TCP 74 49630 → 443 [SYN] Seq=0 Win=29200 Len=0 MSS=1460 SACK_PERM=1 TSval=4254067046 TSecr=0 WS=128
 8118 679.091017272 10.18.98.174 → 185.199.110.154 TCP 74 49632 → 443 [SYN] Seq=0 Win=29200 Len=0 MSS=1460 SACK_PERM=1 TSval=4254067046 TSecr=0 WS=128
 8142 679.106488459 185.199.110.154 → 10.18.98.174 TCP 74 443 → 49624 [SYN, ACK] Seq=0 Ack=1 Win=28960 Len=0 MSS=1300 SACK_PERM=1 TSval=506668056 TSecr=4254067046 WS=512
 8144 679.106505439 185.199.110.154 → 10.18.98.174 TCP 74 443 → 49626 [SYN, ACK] Seq=0 Ack=1 Win=28960 Len=0 MSS=1300 SACK_PERM=1 TSval=2171741214 TSecr=4254067046 WS=512
 8149 679.106559317 185.199.110.154 → 10.18.98.174 TCP 74 443 → 49628 [SYN, ACK] Seq=0 Ack=1 Win=28960 Len=0 MSS=1300 SACK_PERM=1 TSval=2169159115 TSecr=4254067046 WS=512
 8152 679.106579654 185.199.110.154 → 10.18.98.174 TCP 74 443 → 49630 [SYN, ACK] Seq=0 Ack=1 Win=28960 Len=0 MSS=1300 SACK_PERM=1 TSval=2171741215 TSecr=4254067046 WS=512
 8155 679.106595578 185.199.110.154 → 10.18.98.174 TCP 74 443 → 49632 [SYN, ACK] Seq=0 Ack=1 Win=28960 Len=0 MSS=1300 SACK_PERM=1 TSval=2191770665 TSecr=4254067046 WS=512
 8212 679.144366296 10.18.98.174 → 199.232.36.133 TCP 74 54180 → 443 [SYN] Seq=0 Win=29200 Len=0 MSS=1460 SACK_PERM=1 TSval=1026919812 TSecr=0 WS=128
 8215 679.144609647 10.18.98.174 → 199.232.36.133 TCP 74 54182 → 443 [SYN] Seq=0 Win=29200 Len=0 MSS=1460 SACK_PERM=1 TSval=1026919812 TSecr=0 WS=128
 8237 679.149013772 199.232.36.133 → 10.18.98.174 TCP 74 443 → 54180 [SYN, ACK] Seq=0 Ack=1 Win=28960 Len=0 MSS=1300 SACK_PERM=1 TSval=2193491135 TSecr=1026919812 WS=512
 8239 679.149025843 199.232.36.133 → 10.18.98.174 TCP 74 443 → 54182 [SYN, ACK] Seq=0 Ack=1 Win=28960 Len=0 MSS=1300 SACK_PERM=1 TSval=2191206773 TSecr=1026919812 WS=512
 8291 679.275751943 10.18.98.174 → 140.82.113.3 TCP 74 60734 → 443 [SYN] Seq=0 Win=29200 Len=0 MSS=1460 SACK_PERM=1 TSval=4245553490 TSecr=0 WS=128
 8293 679.284356629 140.82.113.3 → 10.18.98.174 TCP 74 443 → 60734 [SYN, ACK] Seq=0 Ack=1 Win=28480 Len=0 MSS=1300 SACK_PERM=1 TSval=229617535 TSecr=4245553490 WS=1024
 8329 679.384090169 10.18.98.174 → 192.30.253.125 TCP 74 51402 → 443 [SYN] Seq=0 Win=29200 Len=0 MSS=1460 SACK_PERM=1 TSval=3034959908 TSecr=0 WS=128
 8330 679.391564708 192.30.253.125 → 10.18.98.174 TCP 74 443 → 51402 [SYN, ACK] Seq=0 Ack=1 Win=28480 Len=0 MSS=1300 SACK_PERM=1 TSval=4294704305 TSecr=3034959908 WS=1024
 8546 731.751690897 10.18.98.174 → 185.199.111.154 TCP 74 46122 → 443 [SYN] Seq=0 Win=29200 Len=0 MSS=1460 SACK_PERM=1 TSval=3267528016 TSecr=0 WS=128
 8547 731.754874618 185.199.111.154 → 10.18.98.174 TCP 74 443 → 46122 [SYN, ACK] Seq=0 Ack=1 Win=28960 Len=0 MSS=1300 SACK_PERM=1 TSval=1413638897 TSecr=3267528016 WS=512
 8734 791.126163404 10.18.98.174 → 31.13.71.36  TCP 74 49730 → 443 [SYN] Seq=0 Win=29200 Len=0 MSS=1460 SACK_PERM=1 TSval=1679579485 TSecr=0 WS=128
 8735 791.128711923  31.13.71.36 → 10.18.98.174 TCP 74 443 → 49730 [SYN, ACK] Seq=0 Ack=1 Win=27760 Len=0 MSS=1300 SACK_PERM=1 TSval=3282045391 TSecr=1679579485 WS=256
 8826 792.349894840 10.18.98.174 → 31.13.71.7   TCP 74 60290 → 443 [SYN] Seq=0 Win=29200 Len=0 MSS=1460 SACK_PERM=1 TSval=1037814851 TSecr=0 WS=128
 8827 792.352399761   31.13.71.7 → 10.18.98.174 TCP 74 443 → 60290 [SYN, ACK] Seq=0 Ack=1 Win=27760 Len=0 MSS=1300 SACK_PERM=1 TSval=2499927281 TSecr=1037814851 WS=256
 8971 793.487981884 10.18.98.174 → 31.13.71.1   TCP 74 53824 → 443 [SYN] Seq=0 Win=29200 Len=0 MSS=1460 SACK_PERM=1 TSval=1349461575 TSecr=0 WS=128
 8972 793.492820645   31.13.71.1 → 10.18.98.174 TCP 74 443 → 53824 [SYN, ACK] Seq=0 Ack=1 Win=27760 Len=0 MSS=1300 SACK_PERM=1 TSval=1639563769 TSecr=1349461575 WS=256
 8984 793.503293785 10.18.98.174 → 31.13.71.1   TCP 74 53826 → 443 [SYN] Seq=0 Win=29200 Len=0 MSS=1460 SACK_PERM=1 TSval=1349461591 TSecr=0 WS=128
 8986 793.506647774   31.13.71.1 → 10.18.98.174 TCP 74 443 → 53826 [SYN, ACK] Seq=0 Ack=1 Win=27760 Len=0 MSS=1300 SACK_PERM=1 TSval=264055830 TSecr=1349461591 WS=256
 9304 949.591383047 10.18.98.174 → 34.212.28.14 TCP 74 47072 → 443 [SYN] Seq=0 Win=29200 Len=0 MSS=1460 SACK_PERM=1 TSval=1507273684 TSecr=0 WS=128
 9305 949.667718930 34.212.28.14 → 10.18.98.174 TCP 74 443 → 47072 [SYN, ACK] Seq=0 Ack=1 Win=17898 Len=0 MSS=1300 SACK_PERM=1 TSval=3350964771 TSecr=1507273684 WS=128
 9325 950.080342828 10.18.98.174 → 52.40.171.86 TCP 74 41960 → 443 [SYN] Seq=0 Win=29200 Len=0 MSS=1460 SACK_PERM=1 TSval=1319640252 TSecr=0 WS=128
 9326 950.156708666 52.40.171.86 → 10.18.98.174 TCP 74 443 → 41960 [SYN, ACK] Seq=0 Ack=1 Win=26847 Len=0 MSS=1300 SACK_PERM=1 TSval=176430423 TSecr=1319640252 WS=256
 9367 950.920680202 10.18.98.174 → 34.95.71.207 TCP 74 48050 → 443 [SYN] Seq=0 Win=29200 Len=0 MSS=1460 SACK_PERM=1 TSval=528452045 TSecr=0 WS=128
 9368 950.924120213 34.95.71.207 → 10.18.98.174 TCP 74 443 → 48050 [SYN, ACK] Seq=0 Ack=1 Win=60192 Len=0 MSS=1300 SACK_PERM=1 TSval=4084933127 TSecr=528452045 WS=256
 9584 1084.810556083 10.18.98.174 → 172.217.11.36 TCP 74 34238 → 443 [SYN] Seq=0 Win=29200 Len=0 MSS=1460 SACK_PERM=1 TSval=1098684488 TSecr=0 WS=128
 9585 1084.814362243 172.217.11.36 → 10.18.98.174 TCP 74 443 → 34238 [SYN, ACK] Seq=0 Ack=1 Win=60192 Len=0 MSS=1300 SACK_PERM=1 TSval=1139478233 TSecr=1098684488 WS=256
 9705 1086.059044490 10.18.98.174 → 172.217.10.99 TCP 74 59794 → 443 [SYN] Seq=0 Win=29200 Len=0 MSS=1460 SACK_PERM=1 TSval=62824768 TSecr=0 WS=128
 9707 1086.063000999 172.217.10.99 → 10.18.98.174 TCP 74 443 → 59794 [SYN, ACK] Seq=0 Ack=1 Win=60192 Len=0 MSS=1300 SACK_PERM=1 TSval=1878015390 TSecr=62824768 WS=256
 9820 1086.334084188 10.18.98.174 → 172.217.7.14 TCP 74 53802 → 443 [SYN] Seq=0 Win=29200 Len=0 MSS=1460 SACK_PERM=1 TSval=560720654 TSecr=0 WS=128
 9823 1086.334566681 10.18.98.174 → 172.217.12.206 TCP 74 42242 → 443 [SYN] Seq=0 Win=29200 Len=0 MSS=1460 SACK_PERM=1 TSval=724311033 TSecr=0 WS=128
 9827 1086.335534930 10.18.98.174 → 172.217.12.174 TCP 74 52308 → 443 [SYN] Seq=0 Win=29200 Len=0 MSS=1460 SACK_PERM=1 TSval=1950016458 TSecr=0 WS=128
 9829 1086.336799410 10.18.98.174 → 172.217.10.238 TCP 74 49136 → 443 [SYN] Seq=0 Win=29200 Len=0 MSS=1460 SACK_PERM=1 TSval=1841074610 TSecr=0 WS=128
 9830 1086.337549945 172.217.7.14 → 10.18.98.174 TCP 74 443 → 53802 [SYN, ACK] Seq=0 Ack=1 Win=60192 Len=0 MSS=1300 SACK_PERM=1 TSval=1086500665 TSecr=560720654 WS=256
 9832 1086.338154316 172.217.12.206 → 10.18.98.174 TCP 74 443 → 42242 [SYN, ACK] Seq=0 Ack=1 Win=60192 Len=0 MSS=1300 SACK_PERM=1 TSval=1610156674 TSecr=724311033 WS=256
 9837 1086.339257809 172.217.12.174 → 10.18.98.174 TCP 74 443 → 52308 [SYN, ACK] Seq=0 Ack=1 Win=60192 Len=0 MSS=1300 SACK_PERM=1 TSval=3957329261 TSecr=1950016458 WS=256
 9839 1086.340264878 172.217.10.238 → 10.18.98.174 TCP 74 443 → 49136 [SYN, ACK] Seq=0 Ack=1 Win=60192 Len=0 MSS=1300 SACK_PERM=1 TSval=3370119043 TSecr=1841074610 WS=256
10005 1089.974440812 10.18.98.174 → 172.217.7.14 TCP 74 53810 → 443 [SYN] Seq=0 Win=29200 Len=0 MSS=1460 SACK_PERM=1 TSval=560724294 TSecr=0 WS=128
10006 1089.977935914 172.217.7.14 → 10.18.98.174 TCP 74 443 → 53810 [SYN, ACK] Seq=0 Ack=1 Win=60192 Len=0 MSS=1300 SACK_PERM=1 TSval=1086504306 TSecr=560724294 WS=256
10336 1311.530250475 10.18.98.174 → 172.217.6.206 TCP 74 45154 → 80 [SYN] Seq=0 Win=29200 Len=0 MSS=1460 SACK_PERM=1 TSval=2281421666 TSecr=0 WS=128
10337 1311.530265902 10.18.98.174 → 91.189.91.26 TCP 74 39744 → 80 [SYN] Seq=0 Win=29200 Len=0 MSS=1460 SACK_PERM=1 TSval=2907833704 TSecr=0 WS=128
10338 1311.530371203 10.18.98.174 → 91.189.91.14 TCP 74 50678 → 80 [SYN] Seq=0 Win=29200 Len=0 MSS=1460 SACK_PERM=1 TSval=4182181675 TSecr=0 WS=128
10341 1311.531240804 10.18.98.174 → 91.189.95.83 TCP 74 53038 → 80 [SYN] Seq=0 Win=29200 Len=0 MSS=1460 SACK_PERM=1 TSval=3731603178 TSecr=0 WS=128
10342 1311.533796167 172.217.6.206 → 10.18.98.174 TCP 74 80 → 45154 [SYN, ACK] Seq=0 Ack=1 Win=60192 Len=0 MSS=1300 SACK_PERM=1 TSval=1422326365 TSecr=2281421666 WS=256
10345 1311.537410296 91.189.91.26 → 10.18.98.174 TCP 74 80 → 39744 [SYN, ACK] Seq=0 Ack=1 Win=28960 Len=0 MSS=1300 SACK_PERM=1 TSval=2534968161 TSecr=2907833704 WS=128
10348 1311.537920780 91.189.91.14 → 10.18.98.174 TCP 74 80 → 50678 [SYN, ACK] Seq=0 Ack=1 Win=28960 Len=0 MSS=1300 SACK_PERM=1 TSval=691523914 TSecr=4182181675 WS=128
10359 1311.546938447 10.18.98.174 → 91.189.91.26 TCP 74 39750 → 80 [SYN] Seq=0 Win=29200 Len=0 MSS=1460 SACK_PERM=1 TSval=2907833721 TSecr=0 WS=128
10364 1311.554836582 91.189.91.26 → 10.18.98.174 TCP 74 80 → 39750 [SYN, ACK] Seq=0 Ack=1 Win=28960 Len=0 MSS=1300 SACK_PERM=1 TSval=2534968161 TSecr=2907833721 WS=128
10371 1311.557638669 10.18.98.174 → 40.76.35.62  TCP 74 44034 → 80 [SYN] Seq=0 Win=29200 Len=0 MSS=1460 SACK_PERM=1 TSval=1320979190 TSecr=0 WS=128
10386 1311.567929620  40.76.35.62 → 10.18.98.174 TCP 74 80 → 44034 [SYN, ACK] Seq=0 Ack=1 Win=28960 Len=0 MSS=1300 SACK_PERM=1 TSval=169185212 TSecr=1320979190 WS=128
10467 1311.609076696 91.189.95.83 → 10.18.98.174 TCP 74 80 → 53038 [SYN, ACK] Seq=0 Ack=1 Win=28960 Len=0 MSS=1300 SACK_PERM=1 TSval=116958024 TSecr=3731603178 WS=256
10491 1311.617650900 10.18.98.174 → 91.189.91.26 TCP 74 39754 → 80 [SYN] Seq=0 Win=29200 Len=0 MSS=1460 SACK_PERM=1 TSval=2907833792 TSecr=0 WS=128
10493 1311.635316194 91.189.91.26 → 10.18.98.174 TCP 74 80 → 39754 [SYN, ACK] Seq=0 Ack=1 Win=28960 Len=0 MSS=1300 SACK_PERM=1 TSval=2534968225 TSecr=2907833792 WS=128
10563 1324.437026362 10.18.98.174 → 172.217.6.206 TCP 74 40298 → 443 [SYN] Seq=0 Win=29200 Len=0 MSS=1460 SACK_PERM=1 TSval=2281434573 TSecr=0 WS=128
10564 1324.440551194 172.217.6.206 → 10.18.98.174 TCP 74 443 → 40298 [SYN, ACK] Seq=0 Ack=1 Win=60192 Len=0 MSS=1300 SACK_PERM=1 TSval=125080153 TSecr=2281434573 WS=256
10632 1400.692128291 10.18.98.174 → 54.69.207.70 TCP 74 56984 → 443 [SYN] Seq=0 Win=29200 Len=0 MSS=1460 SACK_PERM=1 TSval=3515288260 TSecr=0 WS=128
10633 1400.769402580 54.69.207.70 → 10.18.98.174 TCP 74 443 → 56984 [SYN, ACK] Seq=0 Ack=1 Win=26847 Len=0 MSS=1300 SACK_PERM=1 TSval=329175 TSecr=3515288260 WS=256
10642 1400.805568856 10.18.98.174 → 52.43.139.170 TCP 74 43938 → 443 [SYN] Seq=0 Win=29200 Len=0 MSS=1460 SACK_PERM=1 TSval=2056435564 TSecr=0 WS=128
10648 1400.882825739 52.43.139.170 → 10.18.98.174 TCP 74 443 → 43938 [SYN, ACK] Seq=0 Ack=1 Win=26847 Len=0 MSS=1300 SACK_PERM=1 TSval=748377651 TSecr=2056435564 WS=256
10660 1400.972910185 10.18.98.174 → 72.21.91.29  TCP 74 34136 → 80 [SYN] Seq=0 Win=29200 Len=0 MSS=1460 SACK_PERM=1 TSval=4294271477 TSecr=0 WS=128
10661 1400.976155695  72.21.91.29 → 10.18.98.174 TCP 74 80 → 34136 [SYN, ACK] Seq=0 Ack=1 Win=65535 Len=0 MSS=1300 SACK_PERM=1 TSval=125661030 TSecr=4294271477 WS=512
10830 1463.947486272 10.18.98.174 → 216.165.46.10 TCP 74 44186 → 443 [SYN] Seq=0 Win=29200 Len=0 MSS=1460 SACK_PERM=1 TSval=1578571269 TSecr=0 WS=128
10831 1463.948927024 216.165.46.10 → 10.18.98.174 TCP 74 443 → 44186 [SYN, ACK] Seq=0 Ack=1 Win=3900 Len=0 MSS=1300 TSval=1348513618 TSecr=1578571269 SACK_PERM=1
10843 1463.966861824 10.18.98.174 → 151.139.128.14 TCP 74 60604 → 80 [SYN] Seq=0 Win=29200 Len=0 MSS=1460 SACK_PERM=1 TSval=1907747864 TSecr=0 WS=128
10844 1463.969414805 151.139.128.14 → 10.18.98.174 TCP 74 80 → 60604 [SYN, ACK] Seq=0 Ack=1 Win=28960 Len=0 MSS=1300 SACK_PERM=1 TSval=1643941091 TSecr=1907747864 WS=512
