  203 14.188810944 192.168.8.128 → 192.168.8.1  TCP 74 60164 → 80 [SYN] Seq=0 Win=29200 Len=0 MSS=1460 SACK_PERM=1 TSval=1103324603 TSecr=0 WS=128
  204 14.189169940  192.168.8.1 → 192.168.8.128 TCP 74 80 → 60164 [SYN, ACK] Seq=0 Ack=1 Win=28960 Len=0 MSS=1460 SACK_PERM=1 TSval=275572 TSecr=1103324603 WS=16
  333 22.320200233 192.168.8.128 → 192.168.8.1  TCP 74 60166 → 80 [SYN] Seq=0 Win=29200 Len=0 MSS=1460 SACK_PERM=1 TSval=1103332727 TSecr=0 WS=128
  334 22.320551229  192.168.8.1 → 192.168.8.128 TCP 74 80 → 60166 [SYN, ACK] Seq=0 Ack=1 Win=28960 Len=0 MSS=1460 SACK_PERM=1 TSval=276385 TSecr=1103332727 WS=16
  461 30.576736267 192.168.8.128 → 192.168.8.1  TCP 74 60168 → 80 [SYN] Seq=0 Win=29200 Len=0 MSS=1460 SACK_PERM=1 TSval=1103340854 TSecr=0 WS=128
  462 30.577012264  192.168.8.1 → 192.168.8.128 TCP 74 80 → 60168 [SYN, ACK] Seq=0 Ack=1 Win=28960 Len=0 MSS=1460 SACK_PERM=1 TSval=277211 TSecr=1103340854 WS=16
  516 39.474781433 192.168.8.128 → 192.168.8.1  TCP 74 60170 → 80 [SYN] Seq=0 Win=29200 Len=0 MSS=1460 SACK_PERM=1 TSval=1103349889 TSecr=0 WS=128
  517 39.475144429  192.168.8.1 → 192.168.8.128 TCP 74 80 → 60170 [SYN, ACK] Seq=0 Ack=1 Win=28960 Len=0 MSS=1460 SACK_PERM=1 TSval=278101 TSecr=1103349889 WS=16
  533 40.158442998 192.168.8.128 → 23.10.134.216 TCP 74 46486 → 443 [SYN] Seq=0 Win=29200 Len=0 MSS=1460 SACK_PERM=1 TSval=1529904501 TSecr=0 WS=128
  534 40.177743788 23.10.134.216 → 192.168.8.128 TCP 74 443 → 46486 [SYN, ACK] Seq=0 Ack=1 Win=28960 Len=0 MSS=1300 SACK_PERM=1 TSval=4014240534 TSecr=1529904501 WS=128
  690 40.643012728 192.168.8.128 → 13.225.226.34 TCP 74 48270 → 443 [SYN] Seq=0 Win=29200 Len=0 MSS=1460 SACK_PERM=1 TSval=69929197 TSecr=0 WS=128
  725 40.673058402 192.168.8.128 → 13.225.226.34 TCP 74 48272 → 443 [SYN] Seq=0 Win=29200 Len=0 MSS=1460 SACK_PERM=1 TSval=69929233 TSecr=0 WS=128
  745 40.701183096 13.225.226.34 → 192.168.8.128 TCP 74 443 → 48270 [SYN, ACK] Seq=0 Ack=1 Win=28960 Len=0 MSS=1300 SACK_PERM=1 TSval=528887455 TSecr=69929197 WS=256
  746 40.701185096 13.225.226.34 → 192.168.8.128 TCP 74 443 → 48272 [SYN, ACK] Seq=0 Ack=1 Win=28960 Len=0 MSS=1300 SACK_PERM=1 TSval=528948358 TSecr=69929233 WS=256
  991 41.232818315 192.168.8.128 → 13.225.226.34 TCP 74 48274 → 443 [SYN] Seq=0 Win=29200 Len=0 MSS=1460 SACK_PERM=1 TSval=69929792 TSecr=0 WS=128
  992 41.233150312 192.168.8.128 → 13.225.226.34 TCP 74 48276 → 443 [SYN] Seq=0 Win=29200 Len=0 MSS=1460 SACK_PERM=1 TSval=69929792 TSecr=0 WS=128
  993 41.233446309 192.168.8.128 → 13.225.226.34 TCP 74 48278 → 443 [SYN] Seq=0 Win=29200 Len=0 MSS=1460 SACK_PERM=1 TSval=69929792 TSecr=0 WS=128
  994 41.233779305 192.168.8.128 → 13.225.226.34 TCP 74 48280 → 443 [SYN] Seq=0 Win=29200 Len=0 MSS=1460 SACK_PERM=1 TSval=69929792 TSecr=0 WS=128
  995 41.234004302 192.168.8.128 → 13.225.226.34 TCP 74 48282 → 443 [SYN] Seq=0 Win=29200 Len=0 MSS=1460 SACK_PERM=1 TSval=69929792 TSecr=0 WS=128
  996 41.234232300 192.168.8.128 → 13.225.226.34 TCP 74 48284 → 443 [SYN] Seq=0 Win=29200 Len=0 MSS=1460 SACK_PERM=1 TSval=69929792 TSecr=0 WS=128
  997 41.296423624 13.225.226.34 → 192.168.8.128 TCP 74 443 → 48278 [SYN, ACK] Seq=0 Ack=1 Win=28960 Len=0 MSS=1300 SACK_PERM=1 TSval=528905214 TSecr=69929792 WS=256
  998 41.296731620 13.225.226.34 → 192.168.8.128 TCP 74 443 → 48280 [SYN, ACK] Seq=0 Ack=1 Win=28960 Len=0 MSS=1300 SACK_PERM=1 TSval=528932414 TSecr=69929792 WS=256
  999 41.296735620 13.225.226.34 → 192.168.8.128 TCP 74 443 → 48282 [SYN, ACK] Seq=0 Ack=1 Win=28960 Len=0 MSS=1300 SACK_PERM=1 TSval=528865215 TSecr=69929792 WS=256
 1000 41.297027617 13.225.226.34 → 192.168.8.128 TCP 74 443 → 48274 [SYN, ACK] Seq=0 Ack=1 Win=28960 Len=0 MSS=1300 SACK_PERM=1 TSval=528932414 TSecr=69929792 WS=256
 1001 41.297031617 13.225.226.34 → 192.168.8.128 TCP 74 443 → 48276 [SYN, ACK] Seq=0 Ack=1 Win=28960 Len=0 MSS=1300 SACK_PERM=1 TSval=528895614 TSecr=69929792 WS=256
 1002 41.297359614 13.225.226.34 → 192.168.8.128 TCP 74 443 → 48284 [SYN, ACK] Seq=0 Ack=1 Win=28960 Len=0 MSS=1300 SACK_PERM=1 TSval=528916415 TSecr=69929792 WS=256
 1150 42.294734770 192.168.8.128 → 54.239.17.86 TCP 74 40338 → 443 [SYN] Seq=0 Win=29200 Len=0 MSS=1460 SACK_PERM=1 TSval=620017130 TSecr=0 WS=128
 1151 42.310565598 54.239.17.86 → 192.168.8.128 TCP 66 443 → 40338 [SYN, ACK] Seq=0 Ack=1 Win=8190 Len=0 MSS=1212 WS=64 SACK_PERM=1
 1182 42.419246417 192.168.8.128 → 13.225.218.88 TCP 74 38304 → 80 [SYN] Seq=0 Win=29200 Len=0 MSS=1460 SACK_PERM=1 TSval=2561255872 TSecr=0 WS=128
 1183 42.441847171 13.225.218.88 → 192.168.8.128 TCP 74 80 → 38304 [SYN, ACK] Seq=0 Ack=1 Win=28960 Len=0 MSS=1300 SACK_PERM=1 TSval=528921334 TSecr=2561255872 WS=256
 1262 45.096628316 192.168.8.128 → 52.1.109.222 TCP 74 46432 → 443 [SYN] Seq=0 Win=29200 Len=0 MSS=1460 SACK_PERM=1 TSval=1761379710 TSecr=0 WS=128
 1263 45.096994312 192.168.8.128 → 52.1.109.222 TCP 74 46434 → 443 [SYN] Seq=0 Win=29200 Len=0 MSS=1460 SACK_PERM=1 TSval=1761379710 TSecr=0 WS=128
 1264 45.097226310 192.168.8.128 → 52.1.109.222 TCP 74 46436 → 443 [SYN] Seq=0 Win=29200 Len=0 MSS=1460 SACK_PERM=1 TSval=1761379710 TSecr=0 WS=128
 1265 45.120223060 52.1.109.222 → 192.168.8.128 TCP 74 443 → 46432 [SYN, ACK] Seq=0 Ack=1 Win=26847 Len=0 MSS=1300 SACK_PERM=1 TSval=1505378893 TSecr=1761379710 WS=256
 1266 45.120515057 52.1.109.222 → 192.168.8.128 TCP 74 443 → 46434 [SYN, ACK] Seq=0 Ack=1 Win=26847 Len=0 MSS=1300 SACK_PERM=1 TSval=1505378893 TSecr=1761379710 WS=256
 1267 45.120729054 52.1.109.222 → 192.168.8.128 TCP 74 443 → 46436 [SYN, ACK] Seq=0 Ack=1 Win=26847 Len=0 MSS=1300 SACK_PERM=1 TSval=1505378893 TSecr=1761379710 WS=256
 1300 45.174664468 192.168.8.128 → 13.225.218.88 TCP 74 38312 → 80 [SYN] Seq=0 Win=29200 Len=0 MSS=1460 SACK_PERM=1 TSval=2561258627 TSecr=0 WS=128
 1301 45.174889466 192.168.8.128 → 13.225.218.88 TCP 74 38314 → 80 [SYN] Seq=0 Win=29200 Len=0 MSS=1460 SACK_PERM=1 TSval=2561258627 TSecr=0 WS=128
 1302 45.183371374 13.225.218.88 → 192.168.8.128 TCP 74 80 → 38312 [SYN, ACK] Seq=0 Ack=1 Win=28960 Len=0 MSS=1300 SACK_PERM=1 TSval=528897608 TSecr=2561258627 WS=256
 1303 45.183650371 13.225.218.88 → 192.168.8.128 TCP 74 80 → 38314 [SYN, ACK] Seq=0 Ack=1 Win=28960 Len=0 MSS=1300 SACK_PERM=1 TSval=528899209 TSecr=2561258627 WS=256
 1469 47.642851652 192.168.8.128 → 192.168.8.1  TCP 74 60204 → 80 [SYN] Seq=0 Win=29200 Len=0 MSS=1460 SACK_PERM=1 TSval=1103358056 TSecr=0 WS=128
 1470 47.643212648  192.168.8.1 → 192.168.8.128 TCP 74 80 → 60204 [SYN, ACK] Seq=0 Ack=1 Win=28960 Len=0 MSS=1460 SACK_PERM=1 TSval=278918 TSecr=1103358056 WS=16
 1538 55.997375950 192.168.8.128 → 192.168.8.1  TCP 74 60206 → 80 [SYN] Seq=0 Win=29200 Len=0 MSS=1460 SACK_PERM=1 TSval=1103366412 TSecr=0 WS=128
 1539 55.997700947  192.168.8.1 → 192.168.8.128 TCP 74 80 → 60206 [SYN, ACK] Seq=0 Ack=1 Win=28960 Len=0 MSS=1460 SACK_PERM=1 TSval=279753 TSecr=1103366412 WS=16
 1575 60.769495189 192.168.8.144 → 96.6.23.248  TCP 74 54060 → 443 [SYN] Seq=0 Win=64240 Len=0 MSS=1460 SACK_PERM=1 TSval=3167774743 TSecr=0 WS=128
 1576 60.804829806  96.6.23.248 → 192.168.8.144 TCP 74 443 → 54060 [SYN, ACK] Seq=0 Ack=1 Win=28960 Len=0 MSS=1300 SACK_PERM=1 TSval=896058100 TSecr=3167774743 WS=128
 1577 60.805082803  96.6.23.248 → 192.168.8.144 TCP 74 [TCP Out-Of-Order] 443 → 54060 [SYN, ACK] Seq=0 Ack=1 Win=28960 Len=0 MSS=1300 SACK_PERM=1 TSval=896058105 TSecr=3167774743 WS=128
 1733 72.306666191 192.168.8.128 → 192.168.8.1  TCP 74 60208 → 80 [SYN] Seq=0 Win=29200 Len=0 MSS=1460 SACK_PERM=1 TSval=1103382669 TSecr=0 WS=128
 1734 72.307034187  192.168.8.1 → 192.168.8.128 TCP 74 80 → 60208 [SYN, ACK] Seq=0 Ack=1 Win=28960 Len=0 MSS=1460 SACK_PERM=1 TSval=281384 TSecr=1103382669 WS=16
 1805 80.261220123 192.168.8.128 → 192.168.8.1  TCP 74 60210 → 80 [SYN] Seq=0 Win=29200 Len=0 MSS=1460 SACK_PERM=1 TSval=1103390675 TSecr=0 WS=128
 1806 80.261549119  192.168.8.1 → 192.168.8.128 TCP 74 80 → 60210 [SYN, ACK] Seq=0 Ack=1 Win=28960 Len=0 MSS=1460 SACK_PERM=1 TSval=282180 TSecr=1103390675 WS=16
 1872 88.279653456 192.168.8.128 → 192.168.8.1  TCP 74 60212 → 80 [SYN] Seq=0 Win=29200 Len=0 MSS=1460 SACK_PERM=1 TSval=1103398693 TSecr=0 WS=128
 1873 88.280020452  192.168.8.1 → 192.168.8.128 TCP 74 80 → 60212 [SYN, ACK] Seq=0 Ack=1 Win=28960 Len=0 MSS=1460 SACK_PERM=1 TSval=282982 TSecr=1103398693 WS=16
 1952 98.759631321 192.168.8.128 → 172.217.12.206 TCP 74 45520 → 443 [SYN] Seq=0 Win=29200 Len=0 MSS=1460 SACK_PERM=1 TSval=1122927788 TSecr=0 WS=128
 1953 98.810571772 172.217.12.206 → 192.168.8.128 TCP 74 443 → 45520 [SYN, ACK] Seq=0 Ack=1 Win=60192 Len=0 MSS=1300 SACK_PERM=1 TSval=3128572841 TSecr=1122927788 WS=256
 2028 104.487137556 192.168.8.128 → 192.168.8.1  TCP 74 60216 → 80 [SYN] Seq=0 Win=29200 Len=0 MSS=1460 SACK_PERM=1 TSval=1103414900 TSecr=0 WS=128
 2029 104.487497552  192.168.8.1 → 192.168.8.128 TCP 74 80 → 60216 [SYN, ACK] Seq=0 Ack=1 Win=28960 Len=0 MSS=1460 SACK_PERM=1 TSval=284602 TSecr=1103414900 WS=16
 2081 112.591022241 192.168.8.128 → 192.168.8.1  TCP 74 60218 → 80 [SYN] Seq=0 Win=29200 Len=0 MSS=1460 SACK_PERM=1 TSval=1103423004 TSecr=0 WS=128
 2082 112.591392237  192.168.8.1 → 192.168.8.128 TCP 74 80 → 60218 [SYN, ACK] Seq=0 Ack=1 Win=28960 Len=0 MSS=1460 SACK_PERM=1 TSval=285413 TSecr=1103423004 WS=16
 2135 120.613578891 192.168.8.128 → 192.168.8.1  TCP 74 60220 → 80 [SYN] Seq=0 Win=29200 Len=0 MSS=1460 SACK_PERM=1 TSval=1103431027 TSecr=0 WS=128
 2136 120.613924887  192.168.8.1 → 192.168.8.128 TCP 74 80 → 60220 [SYN, ACK] Seq=0 Ack=1 Win=28960 Len=0 MSS=1460 SACK_PERM=1 TSval=286215 TSecr=1103431027 WS=16
 2202 128.676439193 192.168.8.128 → 34.212.28.14 TCP 74 37968 → 443 [SYN] Seq=0 Win=29200 Len=0 MSS=1460 SACK_PERM=1 TSval=2214500045 TSecr=0 WS=128
 2203 128.753825361 34.212.28.14 → 192.168.8.128 TCP 74 443 → 37968 [SYN, ACK] Seq=0 Ack=1 Win=17898 Len=0 MSS=1300 SACK_PERM=1 TSval=3619130402 TSecr=2214500045 WS=128
 2215 128.860534214 192.168.8.128 → 192.168.8.1  TCP 74 60224 → 80 [SYN] Seq=0 Win=29200 Len=0 MSS=1460 SACK_PERM=1 TSval=1103439274 TSecr=0 WS=128
 2216 128.860728212  192.168.8.1 → 192.168.8.128 TCP 74 80 → 60224 [SYN, ACK] Seq=0 Ack=1 Win=28960 Len=0 MSS=1460 SACK_PERM=1 TSval=287040 TSecr=1103439274 WS=16
 2248 129.409419316 192.168.8.128 → 54.69.190.106 TCP 74 45120 → 443 [SYN] Seq=0 Win=29200 Len=0 MSS=1460 SACK_PERM=1 TSval=1931633877 TSecr=0 WS=128
 2249 129.502717313 54.69.190.106 → 192.168.8.128 TCP 74 443 → 45120 [SYN, ACK] Seq=0 Ack=1 Win=26847 Len=0 MSS=1300 SACK_PERM=1 TSval=267459863 TSecr=1931633877 WS=256
 2250 129.658701637 192.168.8.128 → 52.11.86.147 TCP 74 50998 → 443 [SYN] Seq=0 Win=29200 Len=0 MSS=1460 SACK_PERM=1 TSval=1812853434 TSecr=0 WS=128
 2255 129.769842442 52.11.86.147 → 192.168.8.128 TCP 74 443 → 50998 [SYN, ACK] Seq=0 Ack=1 Win=26847 Len=0 MSS=1300 SACK_PERM=1 TSval=67575869 TSecr=1812853434 WS=256
 2355 131.283900174 192.168.8.128 → 34.95.71.207 TCP 74 36962 → 443 [SYN] Seq=0 Win=29200 Len=0 MSS=1460 SACK_PERM=1 TSval=2961298605 TSecr=0 WS=128
 2356 131.291770090 34.95.71.207 → 192.168.8.128 TCP 74 443 → 36962 [SYN, ACK] Seq=0 Ack=1 Win=60192 Len=0 MSS=1300 SACK_PERM=1 TSval=52496198 TSecr=2961298605 WS=256
 2447 136.980239994 192.168.8.128 → 192.168.8.1  TCP 74 60232 → 80 [SYN] Seq=0 Win=29200 Len=0 MSS=1460 SACK_PERM=1 TSval=1103447393 TSecr=0 WS=128
 2448 136.980628990  192.168.8.1 → 192.168.8.128 TCP 74 80 → 60232 [SYN, ACK] Seq=0 Ack=1 Win=28960 Len=0 MSS=1460 SACK_PERM=1 TSval=287852 TSecr=1103447393 WS=16
 2506 145.005524872 192.168.8.128 → 192.168.8.1  TCP 74 60234 → 80 [SYN] Seq=0 Win=29200 Len=0 MSS=1460 SACK_PERM=1 TSval=1103455417 TSecr=0 WS=128
 2507 145.005890868  192.168.8.1 → 192.168.8.128 TCP 74 80 → 60234 [SYN, ACK] Seq=0 Ack=1 Win=28960 Len=0 MSS=1460 SACK_PERM=1 TSval=288654 TSecr=1103455417 WS=16
 2561 153.138625676 192.168.8.128 → 192.168.8.1  TCP 74 60236 → 80 [SYN] Seq=0 Win=29200 Len=0 MSS=1460 SACK_PERM=1 TSval=1103463551 TSecr=0 WS=128
 2562 153.138992672  192.168.8.1 → 192.168.8.128 TCP 74 80 → 60236 [SYN, ACK] Seq=0 Ack=1 Win=28960 Len=0 MSS=1460 SACK_PERM=1 TSval=289467 TSecr=1103463551 WS=16
 2655 162.181655822 192.168.8.128 → 192.168.8.1  TCP 74 60238 → 80 [SYN] Seq=0 Win=29200 Len=0 MSS=1460 SACK_PERM=1 TSval=1103472581 TSecr=0 WS=128
 2656 162.181930819  192.168.8.1 → 192.168.8.128 TCP 74 80 → 60238 [SYN, ACK] Seq=0 Ack=1 Win=28960 Len=0 MSS=1460 SACK_PERM=1 TSval=290372 TSecr=1103472581 WS=16
 2716 170.183359206 192.168.8.144 → 54.148.248.23 TCP 74 56502 → 443 [SYN] Seq=0 Win=64240 Len=0 MSS=1460 SACK_PERM=1 TSval=2924782800 TSecr=0 WS=128
 2717 170.190366131 192.168.8.128 → 192.168.8.1  TCP 74 60240 → 80 [SYN] Seq=0 Win=29200 Len=0 MSS=1460 SACK_PERM=1 TSval=1103480602 TSecr=0 WS=128
 2718 170.190635128  192.168.8.1 → 192.168.8.128 TCP 74 80 → 60240 [SYN, ACK] Seq=0 Ack=1 Win=28960 Len=0 MSS=1460 SACK_PERM=1 TSval=291173 TSecr=1103480602 WS=16
 2728 170.270705271 54.148.248.23 → 192.168.8.144 TCP 74 443 → 56502 [SYN, ACK] Seq=0 Ack=1 Win=26847 Len=0 MSS=1300 SACK_PERM=1 TSval=816184407 TSecr=2924782800 WS=256
 2751 170.832470264 192.168.8.144 → 72.21.91.29  TCP 74 39466 → 80 [SYN] Seq=0 Win=64240 Len=0 MSS=1460 SACK_PERM=1 TSval=3852834837 TSecr=0 WS=128
 2754 170.860873960  72.21.91.29 → 192.168.8.144 TCP 74 80 → 39466 [SYN, ACK] Seq=0 Ack=1 Win=65535 Len=0 MSS=1300 SACK_PERM=1 TSval=1368094857 TSecr=3852834837 WS=512
 2767 171.183936505 192.168.8.144 → 138.201.81.199 TCP 74 38162 → 80 [SYN] Seq=0 Win=64240 Len=0 MSS=1460 SACK_PERM=1 TSval=916405605 TSecr=0 WS=128
 2772 171.346208770 138.201.81.199 → 192.168.8.144 TCP 74 80 → 38162 [SYN, ACK] Seq=0 Ack=1 Win=65160 Len=0 MSS=1300 SACK_PERM=1 TSval=3138991445 TSecr=916405605 WS=128
 2827 178.295793484 192.168.8.128 → 192.168.8.1  TCP 74 60242 → 80 [SYN] Seq=0 Win=29200 Len=0 MSS=1460 SACK_PERM=1 TSval=1103488705 TSecr=0 WS=128
 2828 178.296182479  192.168.8.1 → 192.168.8.128 TCP 74 80 → 60242 [SYN, ACK] Seq=0 Ack=1 Win=28960 Len=0 MSS=1460 SACK_PERM=1 TSval=291983 TSecr=1103488705 WS=16
 2943 194.452069006 192.168.8.128 → 192.168.8.1  TCP 74 60244 → 80 [SYN] Seq=0 Win=29200 Len=0 MSS=1460 SACK_PERM=1 TSval=1103504864 TSecr=0 WS=128
 2944 194.452411002  192.168.8.1 → 192.168.8.128 TCP 74 80 → 60244 [SYN, ACK] Seq=0 Ack=1 Win=28960 Len=0 MSS=1460 SACK_PERM=1 TSval=293599 TSecr=1103504864 WS=16
 3008 202.598047157 192.168.8.128 → 192.168.8.1  TCP 74 60246 → 80 [SYN] Seq=0 Win=29200 Len=0 MSS=1460 SACK_PERM=1 TSval=1103513009 TSecr=0 WS=128
 3009 202.598383154  192.168.8.1 → 192.168.8.128 TCP 74 80 → 60246 [SYN, ACK] Seq=0 Ack=1 Win=28960 Len=0 MSS=1460 SACK_PERM=1 TSval=294413 TSecr=1103513009 WS=16
 3056 210.661513264 192.168.8.128 → 192.168.8.1  TCP 74 60248 → 80 [SYN] Seq=0 Win=29200 Len=0 MSS=1460 SACK_PERM=1 TSval=1103521036 TSecr=0 WS=128
 3057 210.661888260  192.168.8.1 → 192.168.8.128 TCP 74 80 → 60248 [SYN, ACK] Seq=0 Ack=1 Win=28960 Len=0 MSS=1460 SACK_PERM=1 TSval=295220 TSecr=1103521036 WS=16
 3173 226.744042165 192.168.8.128 → 192.168.8.1  TCP 74 60250 → 80 [SYN] Seq=0 Win=29200 Len=0 MSS=1460 SACK_PERM=1 TSval=1103537155 TSecr=0 WS=128
 3174 226.744403161  192.168.8.1 → 192.168.8.128 TCP 74 80 → 60250 [SYN, ACK] Seq=0 Ack=1 Win=28960 Len=0 MSS=1460 SACK_PERM=1 TSval=296828 TSecr=1103537155 WS=16
 3230 234.776115820 192.168.8.128 → 192.168.8.1  TCP 74 60252 → 80 [SYN] Seq=0 Win=29200 Len=0 MSS=1460 SACK_PERM=1 TSval=1103545177 TSecr=0 WS=128
 3231 234.776470816  192.168.8.1 → 192.168.8.128 TCP 74 80 → 60252 [SYN, ACK] Seq=0 Ack=1 Win=28960 Len=0 MSS=1460 SACK_PERM=1 TSval=297631 TSecr=1103545177 WS=16
 3276 242.885101727 192.168.8.128 → 192.168.8.1  TCP 74 60254 → 80 [SYN] Seq=0 Win=29200 Len=0 MSS=1460 SACK_PERM=1 TSval=1103553297 TSecr=0 WS=128
 3277 242.885411724  192.168.8.1 → 192.168.8.128 TCP 74 80 → 60254 [SYN, ACK] Seq=0 Ack=1 Win=28960 Len=0 MSS=1460 SACK_PERM=1 TSval=298442 TSecr=1103553297 WS=16
 3383 259.058754218 192.168.8.128 → 192.168.8.1  TCP 74 60256 → 80 [SYN] Seq=0 Win=29200 Len=0 MSS=1460 SACK_PERM=1 TSval=1103569469 TSecr=0 WS=128
 3384 259.059231213  192.168.8.1 → 192.168.8.128 TCP 74 80 → 60256 [SYN, ACK] Seq=0 Ack=1 Win=28960 Len=0 MSS=1460 SACK_PERM=1 TSval=300060 TSecr=1103569469 WS=16
 3433 267.204423941 192.168.8.128 → 192.168.8.1  TCP 74 60258 → 80 [SYN] Seq=0 Win=29200 Len=0 MSS=1460 SACK_PERM=1 TSval=1103577594 TSecr=0 WS=128
 3434 267.204792937  192.168.8.1 → 192.168.8.128 TCP 74 80 → 60258 [SYN, ACK] Seq=0 Ack=1 Win=28960 Len=0 MSS=1460 SACK_PERM=1 TSval=300874 TSecr=1103577594 WS=16
 3486 275.221365092 192.168.8.128 → 192.168.8.1  TCP 74 60260 → 80 [SYN] Seq=0 Win=29200 Len=0 MSS=1460 SACK_PERM=1 TSval=1103585632 TSecr=0 WS=128
 3487 275.221610089  192.168.8.1 → 192.168.8.128 TCP 74 80 → 60260 [SYN, ACK] Seq=0 Ack=1 Win=28960 Len=0 MSS=1460 SACK_PERM=1 TSval=301676 TSecr=1103585632 WS=16
 3548 284.227068854 192.168.8.128 → 192.168.8.1  TCP 74 60262 → 80 [SYN] Seq=0 Win=29200 Len=0 MSS=1460 SACK_PERM=1 TSval=1103594638 TSecr=0 WS=128
 3549 284.227435850  192.168.8.1 → 192.168.8.128 TCP 74 80 → 60262 [SYN, ACK] Seq=0 Ack=1 Win=28960 Len=0 MSS=1460 SACK_PERM=1 TSval=302576 TSecr=1103594638 WS=16
 3581 288.261847211 192.168.8.128 → 104.104.83.90 TCP 74 54050 → 443 [SYN] Seq=0 Win=29200 Len=0 MSS=1460 SACK_PERM=1 TSval=2037465453 TSecr=0 WS=128
 3582 288.295374857 104.104.83.90 → 192.168.8.128 TCP 74 443 → 54050 [SYN, ACK] Seq=0 Ack=1 Win=28960 Len=0 MSS=1300 SACK_PERM=1 TSval=1186256970 TSecr=2037465453 WS=128
 3585 288.315855640 104.104.83.90 → 192.168.8.128 TCP 74 [TCP Out-Of-Order] 443 → 54050 [SYN, ACK] Seq=0 Ack=1 Win=28960 Len=0 MSS=1300 SACK_PERM=1 TSval=1186256997 TSecr=2037465453 WS=128
 3634 292.264752920 192.168.8.128 → 192.168.8.1  TCP 74 60266 → 80 [SYN] Seq=0 Win=29200 Len=0 MSS=1460 SACK_PERM=1 TSval=1103602675 TSecr=0 WS=128
 3635 292.265100917  192.168.8.1 → 192.168.8.128 TCP 74 80 → 60266 [SYN, ACK] Seq=0 Ack=1 Win=28960 Len=0 MSS=1460 SACK_PERM=1 TSval=303380 TSecr=1103602675 WS=16
 3680 300.353421510 192.168.8.128 → 192.168.8.1  TCP 74 60268 → 80 [SYN] Seq=0 Win=29200 Len=0 MSS=1460 SACK_PERM=1 TSval=1103610765 TSecr=0 WS=128
 3681 300.353781506  192.168.8.1 → 192.168.8.128 TCP 74 80 → 60268 [SYN, ACK] Seq=0 Ack=1 Win=28960 Len=0 MSS=1460 SACK_PERM=1 TSval=304189 TSecr=1103610765 WS=16
 3781 316.581575337 192.168.8.128 → 192.168.8.1  TCP 74 60270 → 80 [SYN] Seq=0 Win=29200 Len=0 MSS=1460 SACK_PERM=1 TSval=1103626991 TSecr=0 WS=128
 3782 316.581924333  192.168.8.1 → 192.168.8.128 TCP 74 80 → 60270 [SYN, ACK] Seq=0 Ack=1 Win=28960 Len=0 MSS=1460 SACK_PERM=1 TSval=305812 TSecr=1103626991 WS=16
 3812 321.398884571 192.168.8.128 → 172.217.6.206 TCP 74 34370 → 443 [SYN] Seq=0 Win=29200 Len=0 MSS=1460 SACK_PERM=1 TSval=3319161512 TSecr=0 WS=128
 3813 321.483625678 172.217.6.206 → 192.168.8.128 TCP 74 443 → 34370 [SYN, ACK] Seq=0 Ack=1 Win=60192 Len=0 MSS=1300 SACK_PERM=1 TSval=3748958315 TSecr=3319161512 WS=256
 3866 324.728966490 192.168.8.128 → 192.168.8.1  TCP 74 60274 → 80 [SYN] Seq=0 Win=29200 Len=0 MSS=1460 SACK_PERM=1 TSval=1103635139 TSecr=0 WS=128
 3867 324.729268487  192.168.8.1 → 192.168.8.128 TCP 74 80 → 60274 [SYN, ACK] Seq=0 Ack=1 Win=28960 Len=0 MSS=1460 SACK_PERM=1 TSval=306627 TSecr=1103635139 WS=16
 3920 332.864676826 192.168.8.128 → 192.168.8.1  TCP 74 60276 → 80 [SYN] Seq=0 Win=29200 Len=0 MSS=1460 SACK_PERM=1 TSval=1103643275 TSecr=0 WS=128
 3921 332.865057822  192.168.8.1 → 192.168.8.128 TCP 74 80 → 60276 [SYN, ACK] Seq=0 Ack=1 Win=28960 Len=0 MSS=1460 SACK_PERM=1 TSval=307440 TSecr=1103643275 WS=16
 4013 348.996648138 192.168.8.128 → 192.168.8.1  TCP 74 60278 → 80 [SYN] Seq=0 Win=29200 Len=0 MSS=1460 SACK_PERM=1 TSval=1103659406 TSecr=0 WS=128
 4014 348.997004134  192.168.8.1 → 192.168.8.128 TCP 74 80 → 60278 [SYN, ACK] Seq=0 Ack=1 Win=28960 Len=0 MSS=1460 SACK_PERM=1 TSval=309053 TSecr=1103659406 WS=16
 4068 357.172788221 192.168.8.128 → 192.168.8.1  TCP 74 60280 → 80 [SYN] Seq=0 Win=29200 Len=0 MSS=1460 SACK_PERM=1 TSval=1103667583 TSecr=0 WS=128
 4069 357.173132217  192.168.8.1 → 192.168.8.128 TCP 74 80 → 60280 [SYN, ACK] Seq=0 Ack=1 Win=28960 Len=0 MSS=1460 SACK_PERM=1 TSval=309871 TSecr=1103667583 WS=16
 4113 365.285727023 192.168.8.128 → 192.168.8.1  TCP 74 60282 → 80 [SYN] Seq=0 Win=29200 Len=0 MSS=1460 SACK_PERM=1 TSval=1103675689 TSecr=0 WS=128
 4114 365.286070020  192.168.8.1 → 192.168.8.128 TCP 74 80 → 60282 [SYN, ACK] Seq=0 Ack=1 Win=28960 Len=0 MSS=1460 SACK_PERM=1 TSval=310682 TSecr=1103675689 WS=16
 4214 381.444728492 192.168.8.128 → 192.168.8.1  TCP 74 60284 → 80 [SYN] Seq=0 Win=29200 Len=0 MSS=1460 SACK_PERM=1 TSval=1103691839 TSecr=0 WS=128
 4215 381.445039489  192.168.8.1 → 192.168.8.128 TCP 74 80 → 60284 [SYN, ACK] Seq=0 Ack=1 Win=28960 Len=0 MSS=1460 SACK_PERM=1 TSval=312298 TSecr=1103691839 WS=16
 4277 389.452540557 192.168.8.128 → 192.168.8.1  TCP 74 60286 → 80 [SYN] Seq=0 Win=29200 Len=0 MSS=1460 SACK_PERM=1 TSval=1103699862 TSecr=0 WS=128
 4278 389.452881553  192.168.8.1 → 192.168.8.128 TCP 74 80 → 60286 [SYN, ACK] Seq=0 Ack=1 Win=28960 Len=0 MSS=1460 SACK_PERM=1 TSval=313099 TSecr=1103699862 WS=16
 4337 397.578780432 192.168.8.128 → 192.168.8.1  TCP 74 60288 → 80 [SYN] Seq=0 Win=29200 Len=0 MSS=1460 SACK_PERM=1 TSval=1103707985 TSecr=0 WS=128
 4338 397.579228427  192.168.8.1 → 192.168.8.128 TCP 74 80 → 60288 [SYN, ACK] Seq=0 Ack=1 Win=28960 Len=0 MSS=1460 SACK_PERM=1 TSval=313912 TSecr=1103707985 WS=16
 4361 399.103479466 192.168.8.128 → 172.217.10.46 TCP 74 41620 → 443 [SYN] Seq=0 Win=29200 Len=0 MSS=1460 SACK_PERM=1 TSval=1056560706 TSecr=0 WS=128
 4363 399.123921252 172.217.10.46 → 192.168.8.128 TCP 74 443 → 41620 [SYN, ACK] Seq=0 Ack=1 Win=60192 Len=0 MSS=1300 SACK_PERM=1 TSval=3170762184 TSecr=1056560706 WS=256
 4425 406.585800141 192.168.8.128 → 192.168.8.1  TCP 74 60292 → 80 [SYN] Seq=0 Win=29200 Len=0 MSS=1460 SACK_PERM=1 TSval=1103716995 TSecr=0 WS=128
 4426 406.586148137  192.168.8.1 → 192.168.8.128 TCP 74 80 → 60292 [SYN, ACK] Seq=0 Ack=1 Win=28960 Len=0 MSS=1460 SACK_PERM=1 TSval=314812 TSecr=1103716995 WS=16
 4470 414.693534317 192.168.8.128 → 192.168.8.1  TCP 74 60294 → 80 [SYN] Seq=0 Win=29200 Len=0 MSS=1460 SACK_PERM=1 TSval=1103725102 TSecr=0 WS=128
 4471 414.693907313  192.168.8.1 → 192.168.8.128 TCP 74 80 → 60294 [SYN, ACK] Seq=0 Ack=1 Win=28960 Len=0 MSS=1460 SACK_PERM=1 TSval=315623 TSecr=1103725102 WS=16
 4515 422.801577539 192.168.8.128 → 192.168.8.1  TCP 74 60296 → 80 [SYN] Seq=0 Win=29200 Len=0 MSS=1460 SACK_PERM=1 TSval=1103733210 TSecr=0 WS=128
 4516 422.801951535  192.168.8.1 → 192.168.8.128 TCP 74 80 → 60296 [SYN, ACK] Seq=0 Ack=1 Win=28960 Len=0 MSS=1460 SACK_PERM=1 TSval=316434 TSecr=1103733210 WS=16
 4615 439.059550692 192.168.8.128 → 192.168.8.1  TCP 74 60298 → 80 [SYN] Seq=0 Win=29200 Len=0 MSS=1460 SACK_PERM=1 TSval=1103749462 TSecr=0 WS=128
 4616 439.059778690  192.168.8.1 → 192.168.8.128 TCP 74 80 → 60298 [SYN, ACK] Seq=0 Ack=1 Win=28960 Len=0 MSS=1460 SACK_PERM=1 TSval=318060 TSecr=1103749462 WS=16
 4665 447.171543017 192.168.8.128 → 192.168.8.1  TCP 74 60300 → 80 [SYN] Seq=0 Win=29200 Len=0 MSS=1460 SACK_PERM=1 TSval=1103757580 TSecr=0 WS=128
 4666 447.171903013  192.168.8.1 → 192.168.8.128 TCP 74 80 → 60300 [SYN, ACK] Seq=0 Ack=1 Win=28960 Len=0 MSS=1460 SACK_PERM=1 TSval=318871 TSecr=1103757580 WS=16
 4714 455.290772313 192.168.8.128 → 192.168.8.1  TCP 74 60302 → 80 [SYN] Seq=0 Win=29200 Len=0 MSS=1460 SACK_PERM=1 TSval=1103765700 TSecr=0 WS=128
 4715 455.291113310  192.168.8.1 → 192.168.8.128 TCP 74 80 → 60302 [SYN, ACK] Seq=0 Ack=1 Win=28960 Len=0 MSS=1460 SACK_PERM=1 TSval=319683 TSecr=1103765700 WS=16
 4816 471.408581299 192.168.8.128 → 192.168.8.1  TCP 74 60304 → 80 [SYN] Seq=0 Win=29200 Len=0 MSS=1460 SACK_PERM=1 TSval=1103781816 TSecr=0 WS=128
 4817 471.408942295  192.168.8.1 → 192.168.8.128 TCP 74 80 → 60304 [SYN, ACK] Seq=0 Ack=1 Win=28960 Len=0 MSS=1460 SACK_PERM=1 TSval=321295 TSecr=1103781816 WS=16
 4826 471.538472946 192.168.8.144 → 138.201.81.199 TCP 74 38164 → 80 [SYN] Seq=0 Win=64240 Len=0 MSS=1460 SACK_PERM=1 TSval=916705860 TSecr=0 WS=128
 4827 471.660099679 138.201.81.199 → 192.168.8.144 TCP 74 80 → 38164 [SYN, ACK] Seq=0 Ack=1 Win=65160 Len=0 MSS=1300 SACK_PERM=1 TSval=3139291821 TSecr=916705860 WS=128
 4888 479.520045811 192.168.8.128 → 192.168.8.1  TCP 74 60306 → 80 [SYN] Seq=0 Win=29200 Len=0 MSS=1460 SACK_PERM=1 TSval=1103789928 TSecr=0 WS=128
 4889 479.520407807  192.168.8.1 → 192.168.8.128 TCP 74 80 → 60306 [SYN, ACK] Seq=0 Ack=1 Win=28960 Len=0 MSS=1460 SACK_PERM=1 TSval=322106 TSecr=1103789928 WS=16
 4936 487.670110964 192.168.8.128 → 192.168.8.1  TCP 74 60308 → 80 [SYN] Seq=0 Win=29200 Len=0 MSS=1460 SACK_PERM=1 TSval=1103798065 TSecr=0 WS=128
 4937 487.670467961  192.168.8.1 → 192.168.8.128 TCP 74 80 → 60308 [SYN, ACK] Seq=0 Ack=1 Win=28960 Len=0 MSS=1460 SACK_PERM=1 TSval=322921 TSecr=1103798065 WS=16
 4991 495.694980463 192.168.8.128 → 192.168.8.1  TCP 74 60310 → 80 [SYN] Seq=0 Win=29200 Len=0 MSS=1460 SACK_PERM=1 TSval=1103806099 TSecr=0 WS=128
 4992 495.695331460  192.168.8.1 → 192.168.8.128 TCP 74 80 → 60310 [SYN, ACK] Seq=0 Ack=1 Win=28960 Len=0 MSS=1460 SACK_PERM=1 TSval=323723 TSecr=1103806099 WS=16
 5041 503.842438729 192.168.8.128 → 192.168.8.1  TCP 74 60312 → 80 [SYN] Seq=0 Win=29200 Len=0 MSS=1460 SACK_PERM=1 TSval=1103814250 TSecr=0 WS=128
 5042 503.842808725  192.168.8.1 → 192.168.8.128 TCP 74 80 → 60312 [SYN, ACK] Seq=0 Ack=1 Win=28960 Len=0 MSS=1460 SACK_PERM=1 TSval=324538 TSecr=1103814250 WS=16
 5068 507.576155913 192.168.8.128 → 172.217.12.138 TCP 74 34676 → 443 [SYN] Seq=0 Win=29200 Len=0 MSS=1460 SACK_PERM=1 TSval=1675423623 TSecr=0 WS=128
 5070 507.689266737 172.217.12.138 → 192.168.8.128 TCP 74 443 → 34676 [SYN, ACK] Seq=0 Ack=1 Win=60192 Len=0 MSS=1300 SACK_PERM=1 TSval=1227094000 TSecr=1675423623 WS=256
 5130 511.986696071 192.168.8.128 → 192.168.8.1  TCP 74 60316 → 80 [SYN] Seq=0 Win=29200 Len=0 MSS=1460 SACK_PERM=1 TSval=1103822394 TSecr=0 WS=128
 5131 511.987065067  192.168.8.1 → 192.168.8.128 TCP 74 80 → 60316 [SYN, ACK] Seq=0 Ack=1 Win=28960 Len=0 MSS=1460 SACK_PERM=1 TSval=325352 TSecr=1103822394 WS=16
 5180 520.140963349 192.168.8.128 → 192.168.8.1  TCP 74 60318 → 80 [SYN] Seq=0 Win=29200 Len=0 MSS=1460 SACK_PERM=1 TSval=1103830548 TSecr=0 WS=128
 5181 520.141230346  192.168.8.1 → 192.168.8.128 TCP 74 80 → 60318 [SYN, ACK] Seq=0 Ack=1 Win=28960 Len=0 MSS=1460 SACK_PERM=1 TSval=326168 TSecr=1103830548 WS=16
 5209 522.893328762 192.168.8.128 → 96.6.23.248  TCP 74 60220 → 443 [SYN] Seq=0 Win=29200 Len=0 MSS=1460 SACK_PERM=1 TSval=106497682 TSecr=0 WS=128
 5210 522.919791487  96.6.23.248 → 192.168.8.128 TCP 74 443 → 60220 [SYN, ACK] Seq=0 Ack=1 Win=28960 Len=0 MSS=1300 SACK_PERM=1 TSval=896520212 TSecr=106497682 WS=128
 5213 522.952851143  96.6.23.248 → 192.168.8.128 TCP 74 [TCP Retransmission] 443 → 60220 [SYN, ACK] Seq=0 Ack=1 Win=28960 Len=0 MSS=1300 SACK_PERM=1 TSval=896520218 TSecr=106497682 WS=128
 5263 523.184113742 192.168.8.128 → 52.89.51.22  TCP 74 58398 → 443 [SYN] Seq=0 Win=29200 Len=0 MSS=1460 SACK_PERM=1 TSval=1081105659 TSecr=0 WS=128
 5264 523.184427738 192.168.8.128 → 52.89.51.22  TCP 74 58400 → 443 [SYN] Seq=0 Win=29200 Len=0 MSS=1460 SACK_PERM=1 TSval=1081105659 TSecr=0 WS=128
 5265 523.263169921  52.89.51.22 → 192.168.8.128 TCP 74 443 → 58398 [SYN, ACK] Seq=0 Ack=1 Win=26847 Len=0 MSS=1300 SACK_PERM=1 TSval=815361879 TSecr=1081105659 WS=256
 5266 523.263505917  52.89.51.22 → 192.168.8.128 TCP 74 443 → 58400 [SYN, ACK] Seq=0 Ack=1 Win=26847 Len=0 MSS=1300 SACK_PERM=1 TSval=815361879 TSecr=1081105659 WS=256
 5325 529.158116710 192.168.8.128 → 192.168.8.1  TCP 74 60326 → 80 [SYN] Seq=0 Win=29200 Len=0 MSS=1460 SACK_PERM=1 TSval=1103839566 TSecr=0 WS=128
 5326 529.158485706  192.168.8.1 → 192.168.8.128 TCP 74 80 → 60326 [SYN, ACK] Seq=0 Ack=1 Win=28960 Len=0 MSS=1460 SACK_PERM=1 TSval=327070 TSecr=1103839566 WS=16
 5386 536.619377264 192.168.8.245 → 17.248.187.68 TCP 78 57264 → 443 [SYN, ECN, CWR] Seq=0 Win=65535 Len=0 MSS=1460 WS=128 TSval=888602709 TSecr=0 SACK_PERM=1
 5400 536.634041112 17.248.187.68 → 192.168.8.245 TCP 74 443 → 57264 [SYN, ACK, ECN] Seq=0 Ack=1 Win=28960 Len=0 MSS=1300 TSval=2058135496 TSecr=888602709 WS=32
 5410 536.646777980 192.168.8.245 → 17.57.12.11  TCP 78 57265 → 443 [SYN, ECN, CWR] Seq=0 Win=65535 Len=0 MSS=1460 WS=128 TSval=888648963 TSecr=0 SACK_PERM=1
 5445 536.703638390 192.168.8.245 → 72.21.206.141 TCP 78 57266 → 443 [SYN, ECN, CWR] Seq=0 Win=65535 Len=0 MSS=1460 WS=128 TSval=888652188 TSecr=0 SACK_PERM=1
 5446 536.708756337 192.168.8.245 → 72.21.206.141 TCP 78 57267 → 443 [SYN, ECN, CWR] Seq=0 Win=65535 Len=0 MSS=1460 WS=128 TSval=888652189 TSecr=0 SACK_PERM=1
 5447 536.709268332 192.168.8.245 → 72.21.206.141 TCP 78 57268 → 443 [SYN, ECN, CWR] Seq=0 Win=65535 Len=0 MSS=1460 WS=128 TSval=888652189 TSecr=0 SACK_PERM=1
 5448 536.709512329 192.168.8.245 → 72.21.206.141 TCP 78 57269 → 443 [SYN, ECN, CWR] Seq=0 Win=65535 Len=0 MSS=1460 WS=128 TSval=888652191 TSecr=0 SACK_PERM=1
 5449 536.709666327 192.168.8.245 → 72.21.206.140 TCP 78 57270 → 443 [SYN, ECN, CWR] Seq=0 Win=65535 Len=0 MSS=1460 WS=128 TSval=888652191 TSecr=0 SACK_PERM=1
 5450 536.709844326 192.168.8.245 → 199.232.37.140 TCP 78 57271 → 443 [SYN, ECN, CWR] Seq=0 Win=65535 Len=0 MSS=1460 WS=128 TSval=888652193 TSecr=0 SACK_PERM=1
 5451 536.744140970 199.232.37.140 → 192.168.8.245 TCP 74 443 → 57271 [SYN, ACK] Seq=0 Ack=1 Win=28960 Len=0 MSS=1300 SACK_PERM=1 TSval=2235087344 TSecr=888652193 WS=512
 5454 536.744878962 72.21.206.141 → 192.168.8.245 TCP 66 443 → 57266 [SYN, ACK] Seq=0 Ack=1 Win=8190 Len=0 MSS=1212 WS=64 SACK_PERM=1
 5455 536.744882962 72.21.206.141 → 192.168.8.245 TCP 66 443 → 57269 [SYN, ACK] Seq=0 Ack=1 Win=8190 Len=0 MSS=1212 WS=64 SACK_PERM=1
 5456 536.745092960 72.21.206.141 → 192.168.8.245 TCP 66 443 → 57267 [SYN, ACK] Seq=0 Ack=1 Win=8190 Len=0 MSS=1212 WS=64 SACK_PERM=1
 5457 536.745280958 72.21.206.140 → 192.168.8.245 TCP 66 443 → 57270 [SYN, ACK] Seq=0 Ack=1 Win=8190 Len=0 MSS=1212 WS=64 SACK_PERM=1
 5458 536.745450956 72.21.206.141 → 192.168.8.245 TCP 66 443 → 57268 [SYN, ACK] Seq=0 Ack=1 Win=8190 Len=0 MSS=1212 WS=64 SACK_PERM=1
 5459 536.745624954  17.57.12.11 → 192.168.8.245 TCP 74 443 → 57265 [SYN, ACK, ECN] Seq=0 Ack=1 Win=28960 Len=0 MSS=1300 SACK_PERM=1 TSval=2904975117 TSecr=888648963 WS=512
 5637 537.060163690 192.168.8.245 → 72.21.206.141 TCP 78 57272 → 443 [SYN, ECN, CWR] Seq=0 Win=65535 Len=0 MSS=1460 WS=128 TSval=888652527 TSecr=0 SACK_PERM=1
 5642 537.101033266 72.21.206.141 → 192.168.8.245 TCP 66 443 → 57272 [SYN, ACK] Seq=0 Ack=1 Win=8190 Len=0 MSS=1212 WS=64 SACK_PERM=1
 5660 537.144138819 192.168.8.245 → 72.21.206.141 TCP 78 57273 → 443 [SYN, ECN, CWR] Seq=0 Win=65535 Len=0 MSS=1460 WS=128 TSval=888652608 TSecr=0 SACK_PERM=1
 5671 537.178250465 72.21.206.141 → 192.168.8.245 TCP 66 443 → 57273 [SYN, ACK] Seq=0 Ack=1 Win=8190 Len=0 MSS=1212 WS=64 SACK_PERM=1
 5685 537.193568306 192.168.8.245 → 72.21.206.141 TCP 78 57274 → 443 [SYN, ECN, CWR] Seq=0 Win=65535 Len=0 MSS=1460 WS=128 TSval=888652652 TSecr=0 SACK_PERM=1
 5692 537.218810044 72.21.206.141 → 192.168.8.245 TCP 66 443 → 57274 [SYN, ACK] Seq=0 Ack=1 Win=8190 Len=0 MSS=1212 WS=64 SACK_PERM=1
 5715 537.251530704 192.168.8.128 → 192.168.8.1  TCP 74 60328 → 80 [SYN] Seq=0 Win=29200 Len=0 MSS=1460 SACK_PERM=1 TSval=1103847659 TSecr=0 WS=128
 5716 537.251815701  192.168.8.1 → 192.168.8.128 TCP 74 80 → 60328 [SYN, ACK] Seq=0 Ack=1 Win=28960 Len=0 MSS=1460 SACK_PERM=1 TSval=327879 TSecr=1103847659 WS=16
 5889 545.288864320 192.168.8.128 → 192.168.8.1  TCP 74 60330 → 80 [SYN] Seq=0 Win=29200 Len=0 MSS=1460 SACK_PERM=1 TSval=1103855692 TSecr=0 WS=128
 5890 545.289250316  192.168.8.1 → 192.168.8.128 TCP 74 80 → 60330 [SYN, ACK] Seq=0 Ack=1 Win=28960 Len=0 MSS=1460 SACK_PERM=1 TSval=328683 TSecr=1103855692 WS=16
 5942 550.487366407 192.168.8.245 → 17.57.144.52 TCP 78 51975 → 5223 [SYN, ECN, CWR] Seq=0 Win=65535 Len=0 MSS=1460 WS=64 TSval=888575672 TSecr=0 SACK_PERM=1
 5943 550.495448323 17.57.144.52 → 192.168.8.245 TCP 74 5223 → 51975 [SYN, ACK, ECN] Seq=0 Ack=1 Win=28960 Len=0 MSS=1300 SACK_PERM=1 TSval=3946511870 TSecr=888575672 WS=128
 6018 551.379128160 192.168.8.245 → 172.217.10.10 TCP 78 57275 → 443 [SYN, ECN, CWR] Seq=0 Win=65535 Len=0 MSS=1460 WS=128 TSval=888667013 TSecr=0 SACK_PERM=1
 6020 551.397664968 172.217.10.10 → 192.168.8.245 TCP 74 443 → 57275 [SYN, ACK] Seq=0 Ack=1 Win=60192 Len=0 MSS=1300 SACK_PERM=1 TSval=3996227437 TSecr=888667013 WS=256
 6032 551.564327240 192.168.8.245 → 172.217.10.133 TCP 78 57276 → 443 [SYN, ECN, CWR] Seq=0 Win=65535 Len=0 MSS=1460 WS=128 TSval=888667195 TSecr=0 SACK_PERM=1
 6033 551.584346033 172.217.10.133 → 192.168.8.245 TCP 74 443 → 57276 [SYN, ACK] Seq=0 Ack=1 Win=60192 Len=0 MSS=1300 SACK_PERM=1 TSval=1927634271 TSecr=888667195 WS=256
 6106 551.840577376 192.168.8.245 → 172.217.10.133 TCP 78 57277 → 443 [SYN, ECN, CWR] Seq=0 Win=65535 Len=0 MSS=1460 WS=128 TSval=888667464 TSecr=0 SACK_PERM=1
 6107 551.879530972 172.217.10.133 → 192.168.8.245 TCP 74 443 → 57277 [SYN, ACK] Seq=0 Ack=1 Win=60192 Len=0 MSS=1300 SACK_PERM=1 TSval=1927634547 TSecr=888667464 WS=256
 6154 551.982701902 192.168.8.245 → 172.217.10.133 TCP 78 57278 → 443 [SYN, ECN, CWR] Seq=0 Win=65535 Len=0 MSS=1460 WS=128 TSval=888667598 TSecr=0 SACK_PERM=1
 6163 552.003165690 172.217.10.133 → 192.168.8.245 TCP 74 443 → 57278 [SYN, ACK] Seq=0 Ack=1 Win=60192 Len=0 MSS=1300 SACK_PERM=1 TSval=1204226015 TSecr=888667598 WS=256
 6263 552.363809951 192.168.8.245 → 172.217.12.161 TCP 78 57279 → 443 [SYN, ECN, CWR] Seq=0 Win=65535 Len=0 MSS=1460 WS=128 TSval=888667970 TSecr=0 SACK_PERM=1
 6276 552.393372644 192.168.8.245 → 172.217.12.161 TCP 78 57280 → 443 [SYN, ECN, CWR] Seq=0 Win=65535 Len=0 MSS=1460 WS=128 TSval=888667997 TSecr=0 SACK_PERM=1
 6281 552.455756997 172.217.12.161 → 192.168.8.245 TCP 74 443 → 57279 [SYN, ACK] Seq=0 Ack=1 Win=60192 Len=0 MSS=1300 SACK_PERM=1 TSval=2588755184 TSecr=888667970 WS=256
 6283 552.456218993 172.217.12.161 → 192.168.8.245 TCP 74 443 → 57280 [SYN, ACK] Seq=0 Ack=1 Win=60192 Len=0 MSS=1300 SACK_PERM=1 TSval=2461084540 TSecr=888667997 WS=256
 6292 552.463623916 192.168.8.245 → 172.217.12.161 TCP 78 57281 → 443 [SYN, ECN, CWR] Seq=0 Win=65535 Len=0 MSS=1460 WS=128 TSval=888668065 TSecr=0 SACK_PERM=1
 6293 552.465143900 192.168.8.245 → 172.217.12.161 TCP 78 57282 → 443 [SYN, ECN, CWR] Seq=0 Win=65535 Len=0 MSS=1460 WS=128 TSval=888668066 TSecr=0 SACK_PERM=1
 6299 552.484803696 172.217.12.161 → 192.168.8.245 TCP 74 443 → 57281 [SYN, ACK] Seq=0 Ack=1 Win=60192 Len=0 MSS=1300 SACK_PERM=1 TSval=2588755283 TSecr=888668065 WS=256
 6302 552.500292536 172.217.12.161 → 192.168.8.245 TCP 74 443 → 57282 [SYN, ACK] Seq=0 Ack=1 Win=60192 Len=0 MSS=1300 SACK_PERM=1 TSval=812085079 TSecr=888668066 WS=256
 6327 552.513846395 192.168.8.245 → 172.217.10.10 TCP 78 57283 → 443 [SYN, ECN, CWR] Seq=0 Win=65535 Len=0 MSS=1460 WS=128 TSval=888668111 TSecr=0 SACK_PERM=1
 6336 552.528555243 192.168.8.245 → 172.217.12.161 TCP 78 57284 → 443 [SYN, ECN, CWR] Seq=0 Win=65535 Len=0 MSS=1460 WS=128 TSval=888668122 TSecr=0 SACK_PERM=1
 6337 552.528852240 192.168.8.245 → 172.217.12.161 TCP 78 57285 → 443 [SYN, ECN, CWR] Seq=0 Win=65535 Len=0 MSS=1460 WS=128 TSval=888668122 TSecr=0 SACK_PERM=1
 6339 552.529567232 192.168.8.245 → 172.217.12.161 TCP 78 57286 → 443 [SYN, ECN, CWR] Seq=0 Win=65535 Len=0 MSS=1460 WS=128 TSval=888668123 TSecr=0 SACK_PERM=1
 6351 552.538812136 192.168.8.245 → 172.217.12.161 TCP 78 57287 → 443 [SYN, ECN, CWR] Seq=0 Win=65535 Len=0 MSS=1460 WS=128 TSval=888668131 TSecr=0 SACK_PERM=1
 6353 552.539815126 192.168.8.245 → 172.217.12.161 TCP 78 57288 → 443 [SYN, ECN, CWR] Seq=0 Win=65535 Len=0 MSS=1460 WS=128 TSval=888668132 TSecr=0 SACK_PERM=1
 6354 552.540064123 192.168.8.245 → 172.217.12.161 TCP 78 57289 → 443 [SYN, ECN, CWR] Seq=0 Win=65535 Len=0 MSS=1460 WS=128 TSval=888668132 TSecr=0 SACK_PERM=1
 6358 552.551218008 172.217.10.10 → 192.168.8.245 TCP 74 443 → 57283 [SYN, ACK] Seq=0 Ack=1 Win=60192 Len=0 MSS=1300 SACK_PERM=1 TSval=3996228569 TSecr=888668111 WS=256
 6360 552.553369985 192.168.8.245 → 172.217.12.161 TCP 78 57290 → 443 [SYN, ECN, CWR] Seq=0 Win=65535 Len=0 MSS=1460 WS=128 TSval=888668143 TSecr=0 SACK_PERM=1
 6361 552.553658982 192.168.8.245 → 172.217.12.161 TCP 78 57291 → 443 [SYN, ECN, CWR] Seq=0 Win=65535 Len=0 MSS=1460 WS=128 TSval=888668143 TSecr=0 SACK_PERM=1
 6362 552.553911980 192.168.8.245 → 172.217.12.161 TCP 78 57292 → 443 [SYN, ECN, CWR] Seq=0 Win=65535 Len=0 MSS=1460 WS=128 TSval=888668144 TSecr=0 SACK_PERM=1
 6376 552.611929378 172.217.12.161 → 192.168.8.245 TCP 74 443 → 57284 [SYN, ACK] Seq=0 Ack=1 Win=60192 Len=0 MSS=1300 SACK_PERM=1 TSval=2588755343 TSecr=888668122 WS=256
 6378 552.611933378 172.217.12.161 → 192.168.8.245 TCP 74 443 → 57285 [SYN, ACK] Seq=0 Ack=1 Win=60192 Len=0 MSS=1300 SACK_PERM=1 TSval=2461084678 TSecr=888668122 WS=256
 6379 552.611935378 172.217.12.161 → 192.168.8.245 TCP 74 443 → 57286 [SYN, ACK] Seq=0 Ack=1 Win=60192 Len=0 MSS=1300 SACK_PERM=1 TSval=2588755345 TSecr=888668123 WS=256
 6386 552.612779369 172.217.12.161 → 192.168.8.245 TCP 74 443 → 57289 [SYN, ACK] Seq=0 Ack=1 Win=60192 Len=0 MSS=1300 SACK_PERM=1 TSval=746430849 TSecr=888668132 WS=256
 6388 552.613570361 172.217.12.161 → 192.168.8.245 TCP 74 443 → 57287 [SYN, ACK] Seq=0 Ack=1 Win=60192 Len=0 MSS=1300 SACK_PERM=1 TSval=1927414834 TSecr=888668131 WS=256
 6389 552.613572361 172.217.12.161 → 192.168.8.245 TCP 74 443 → 57288 [SYN, ACK] Seq=0 Ack=1 Win=60192 Len=0 MSS=1300 SACK_PERM=1 TSval=746430849 TSecr=888668132 WS=256
 6392 552.614036356 172.217.12.161 → 192.168.8.245 TCP 74 443 → 57291 [SYN, ACK] Seq=0 Ack=1 Win=60192 Len=0 MSS=1300 SACK_PERM=1 TSval=2870417879 TSecr=888668143 WS=256
 6393 552.614423352 172.217.12.161 → 192.168.8.245 TCP 74 443 → 57290 [SYN, ACK] Seq=0 Ack=1 Win=60192 Len=0 MSS=1300 SACK_PERM=1 TSval=2870417879 TSecr=888668143 WS=256
 6394 552.614427352 172.217.12.161 → 192.168.8.245 TCP 74 443 → 57292 [SYN, ACK] Seq=0 Ack=1 Win=60192 Len=0 MSS=1300 SACK_PERM=1 TSval=1874127540 TSecr=888668144 WS=256
 8184 561.403378250 192.168.8.128 → 192.168.8.1  TCP 74 60332 → 80 [SYN] Seq=0 Win=29200 Len=0 MSS=1460 SACK_PERM=1 TSval=1103871804 TSecr=0 WS=128
 8185 561.403726246  192.168.8.1 → 192.168.8.128 TCP 74 80 → 60332 [SYN, ACK] Seq=0 Ack=1 Win=28960 Len=0 MSS=1460 SACK_PERM=1 TSval=330294 TSecr=1103871804 WS=16
 8265 569.518437172 192.168.8.128 → 192.168.8.1  TCP 74 60334 → 80 [SYN] Seq=0 Win=29200 Len=0 MSS=1460 SACK_PERM=1 TSval=1103879925 TSecr=0 WS=128
 8266 569.518805168  192.168.8.1 → 192.168.8.128 TCP 74 80 → 60334 [SYN, ACK] Seq=0 Ack=1 Win=28960 Len=0 MSS=1460 SACK_PERM=1 TSval=331105 TSecr=1103879925 WS=16
 8327 577.643985021 192.168.8.128 → 192.168.8.1  TCP 74 60336 → 80 [SYN] Seq=0 Win=29200 Len=0 MSS=1460 SACK_PERM=1 TSval=1103888039 TSecr=0 WS=128
 8328 577.644344017  192.168.8.1 → 192.168.8.128 TCP 74 80 → 60336 [SYN, ACK] Seq=0 Ack=1 Win=28960 Len=0 MSS=1460 SACK_PERM=1 TSval=331918 TSecr=1103888039 WS=16
 8341 578.054944766 192.168.8.245 → 17.253.97.207 TCP 78 57293 → 443 [SYN, ECN, CWR] Seq=0 Win=65535 Len=0 MSS=1460 WS=128 TSval=888644121 TSecr=0 SACK_PERM=1
 8342 578.066463647 17.253.97.207 → 192.168.8.245 TCP 74 443 → 57293 [SYN, ACK, ECN] Seq=0 Ack=1 Win=28880 Len=0 MSS=1300 SACK_PERM=1 TSval=950974318 TSecr=888644121 WS=256
 8352 578.183562435 192.168.8.245 → 17.253.97.207 TCP 78 57294 → 443 [SYN, ECN, CWR] Seq=0 Win=65535 Len=0 MSS=1460 WS=128 TSval=888644248 TSecr=0 SACK_PERM=1
 8357 578.203480228 17.253.97.207 → 192.168.8.245 TCP 74 443 → 57294 [SYN, ACK, ECN] Seq=0 Ack=1 Win=28880 Len=0 MSS=1300 SACK_PERM=1 TSval=1991075242 TSecr=888644248 WS=256
 8488 593.750949319 192.168.8.128 → 192.168.8.1  TCP 74 60338 → 80 [SYN] Seq=0 Win=29200 Len=0 MSS=1460 SACK_PERM=1 TSval=1103904152 TSecr=0 WS=128
 8489 593.751321316  192.168.8.1 → 192.168.8.128 TCP 74 80 → 60338 [SYN, ACK] Seq=0 Ack=1 Win=28960 Len=0 MSS=1460 SACK_PERM=1 TSval=333529 TSecr=1103904152 WS=16
