   38 13.582969634 192.168.8.128 → 172.217.12.132 TCP 74 49114 → 443 [SYN] Seq=0 Win=29200 Len=0 MSS=1460 SACK_PERM=1 TSval=1945965425 TSecr=0 WS=128
   39 13.587232488 172.217.12.132 → 192.168.8.128 TCP 74 443 → 49114 [SYN, ACK] Seq=0 Ack=1 Win=60192 Len=0 MSS=1300 SACK_PERM=1 TSval=2955320543 TSecr=1945965425 WS=256
   50 13.702384573 192.168.8.128 → 172.217.11.3 TCP 74 47954 → 80 [SYN] Seq=0 Win=29200 Len=0 MSS=1460 SACK_PERM=1 TSval=2381495409 TSecr=0 WS=128
   51 13.707270407 172.217.11.3 → 192.168.8.128 TCP 74 80 → 47954 [SYN, ACK] Seq=0 Ack=1 Win=60192 Len=0 MSS=1300 SACK_PERM=1 TSval=1569136729 TSecr=2381495409 WS=256
  118 14.440061553 192.168.8.128 → 35.186.241.40 TCP 74 47274 → 443 [SYN] Seq=0 Win=29200 Len=0 MSS=1460 SACK_PERM=1 TSval=401306690 TSecr=0 WS=128
  119 14.445006386 35.186.241.40 → 192.168.8.128 TCP 74 443 → 47274 [SYN, ACK] Seq=0 Ack=1 Win=60192 Len=0 MSS=1300 SACK_PERM=1 TSval=51127952 TSecr=401306690 WS=256
  146 14.733095638 192.168.8.128 → 172.217.10.138 TCP 74 41986 → 443 [SYN] Seq=0 Win=29200 Len=0 MSS=1460 SACK_PERM=1 TSval=2781525260 TSecr=0 WS=128
  148 14.737402493 172.217.10.138 → 192.168.8.128 TCP 74 443 → 41986 [SYN, ACK] Seq=0 Ack=1 Win=60192 Len=0 MSS=1300 SACK_PERM=1 TSval=2798327735 TSecr=2781525260 WS=256
  166 14.809119077 192.168.8.128 → 172.217.10.138 TCP 74 41988 → 443 [SYN] Seq=0 Win=29200 Len=0 MSS=1460 SACK_PERM=1 TSval=2781525334 TSecr=0 WS=128
  167 14.814262903 172.217.10.138 → 192.168.8.128 TCP 74 443 → 41988 [SYN, ACK] Seq=0 Ack=1 Win=60192 Len=0 MSS=1300 SACK_PERM=1 TSval=1510670983 TSecr=2781525334 WS=256
  220 17.793101335 192.168.8.128 → 192.168.8.1  TCP 74 56604 → 80 [SYN] Seq=0 Win=29200 Len=0 MSS=1460 SACK_PERM=1 TSval=1254603962 TSecr=0 WS=128
  221 17.793504321  192.168.8.1 → 192.168.8.128 TCP 74 80 → 56604 [SYN, ACK] Seq=0 Ack=1 Win=28960 Len=0 MSS=1460 SACK_PERM=1 TSval=33267 TSecr=1254603962 WS=16
  222 17.793721314 192.168.8.128 → 192.168.8.1  TCP 74 56606 → 80 [SYN] Seq=0 Win=29200 Len=0 MSS=1460 SACK_PERM=1 TSval=1254603963 TSecr=0 WS=128
  223 17.793727314  192.168.8.1 → 192.168.8.128 TCP 74 80 → 56606 [SYN, ACK] Seq=0 Ack=1 Win=28960 Len=0 MSS=1460 SACK_PERM=1 TSval=33267 TSecr=1254603963 WS=16
  244 18.348430999 192.168.8.128 → 192.168.8.1  TCP 74 56608 → 80 [SYN] Seq=0 Win=29200 Len=0 MSS=1460 SACK_PERM=1 TSval=1254604517 TSecr=0 WS=128
  245 18.348825986  192.168.8.1 → 192.168.8.128 TCP 74 80 → 56608 [SYN, ACK] Seq=0 Ack=1 Win=28960 Len=0 MSS=1460 SACK_PERM=1 TSval=33323 TSecr=1254604517 WS=16
  246 18.348829986 192.168.8.128 → 192.168.8.1  TCP 74 56610 → 80 [SYN] Seq=0 Win=29200 Len=0 MSS=1460 SACK_PERM=1 TSval=1254604518 TSecr=0 WS=128
  247 18.349140976  192.168.8.1 → 192.168.8.128 TCP 74 80 → 56610 [SYN, ACK] Seq=0 Ack=1 Win=28960 Len=0 MSS=1460 SACK_PERM=1 TSval=33323 TSecr=1254604518 WS=16
  248 18.349327970 192.168.8.128 → 192.168.8.1  TCP 74 56612 → 80 [SYN] Seq=0 Win=29200 Len=0 MSS=1460 SACK_PERM=1 TSval=1254604518 TSecr=0 WS=128
  249 18.349331970  192.168.8.1 → 192.168.8.128 TCP 74 80 → 56612 [SYN, ACK] Seq=0 Ack=1 Win=28960 Len=0 MSS=1460 SACK_PERM=1 TSval=33323 TSecr=1254604518 WS=16
  250 18.349576961 192.168.8.128 → 192.168.8.1  TCP 74 56614 → 80 [SYN] Seq=0 Win=29200 Len=0 MSS=1460 SACK_PERM=1 TSval=1254604518 TSecr=0 WS=128
  251 18.349874952  192.168.8.1 → 192.168.8.128 TCP 74 80 → 56614 [SYN, ACK] Seq=0 Ack=1 Win=28960 Len=0 MSS=1460 SACK_PERM=1 TSval=33323 TSecr=1254604518 WS=16
  252 18.350107944 192.168.8.128 → 192.168.8.1  TCP 74 56616 → 80 [SYN] Seq=0 Win=29200 Len=0 MSS=1460 SACK_PERM=1 TSval=1254604518 TSecr=0 WS=128
  253 18.350327937  192.168.8.1 → 192.168.8.128 TCP 74 80 → 56616 [SYN, ACK] Seq=0 Ack=1 Win=28960 Len=0 MSS=1460 SACK_PERM=1 TSval=33323 TSecr=1254604518 WS=16
  254 18.350331937 192.168.8.128 → 192.168.8.1  TCP 74 56618 → 80 [SYN] Seq=0 Win=29200 Len=0 MSS=1460 SACK_PERM=1 TSval=1254604518 TSecr=0 WS=128
  255 18.350592928  192.168.8.1 → 192.168.8.128 TCP 74 80 → 56618 [SYN, ACK] Seq=0 Ack=1 Win=28960 Len=0 MSS=1460 SACK_PERM=1 TSval=33323 TSecr=1254604518 WS=16
  341 19.844823908 192.168.8.128 → 128.59.64.28 TCP 74 53930 → 443 [SYN] Seq=0 Win=29200 Len=0 MSS=1460 SACK_PERM=1 TSval=2291083707 TSecr=0 WS=128
  342 19.848625785 128.59.64.28 → 192.168.8.128 TCP 74 443 → 53930 [SYN, ACK] Seq=0 Ack=1 Win=28960 Len=0 MSS=1300 SACK_PERM=1 TSval=1909532859 TSecr=2291083707 WS=128
  362 19.920898430 192.168.8.128 → 151.139.128.14 TCP 74 51792 → 80 [SYN] Seq=0 Win=29200 Len=0 MSS=1460 SACK_PERM=1 TSval=1161320966 TSecr=0 WS=128
  363 19.924708306 151.139.128.14 → 192.168.8.128 TCP 74 80 → 51792 [SYN, ACK] Seq=0 Ack=1 Win=28960 Len=0 MSS=1300 SACK_PERM=1 TSval=3317007035 TSecr=1161320966 WS=512
  660 24.459967569 192.168.8.128 → 172.217.7.14 TCP 74 59128 → 443 [SYN] Seq=0 Win=29200 Len=0 MSS=1460 SACK_PERM=1 TSval=1150984538 TSecr=0 WS=128
  661 24.460267560 192.168.8.128 → 172.217.7.14 TCP 74 59130 → 443 [SYN] Seq=0 Win=29200 Len=0 MSS=1460 SACK_PERM=1 TSval=1150984538 TSecr=0 WS=128
  662 24.464711419 172.217.7.14 → 192.168.8.128 TCP 74 443 → 59128 [SYN, ACK] Seq=0 Ack=1 Win=60192 Len=0 MSS=1300 SACK_PERM=1 TSval=3064448381 TSecr=1150984538 WS=256
  663 24.464932412 172.217.7.14 → 192.168.8.128 TCP 74 443 → 59130 [SYN, ACK] Seq=0 Ack=1 Win=60192 Len=0 MSS=1300 SACK_PERM=1 TSval=3064448381 TSecr=1150984538 WS=256
  674 24.483498823 192.168.8.128 → 172.217.12.206 TCP 74 48140 → 443 [SYN] Seq=0 Win=29200 Len=0 MSS=1460 SACK_PERM=1 TSval=4096154371 TSecr=0 WS=128
  675 24.483831812 192.168.8.128 → 172.217.12.206 TCP 74 48142 → 443 [SYN] Seq=0 Win=29200 Len=0 MSS=1460 SACK_PERM=1 TSval=4096154371 TSecr=0 WS=128
  676 24.488779656 172.217.12.206 → 192.168.8.128 TCP 74 443 → 48142 [SYN, ACK] Seq=0 Ack=1 Win=60192 Len=0 MSS=1300 SACK_PERM=1 TSval=4257586490 TSecr=4096154371 WS=256
  677 24.489028648 172.217.12.206 → 192.168.8.128 TCP 74 443 → 48140 [SYN, ACK] Seq=0 Ack=1 Win=60192 Len=0 MSS=1300 SACK_PERM=1 TSval=90731664 TSecr=4096154371 WS=256
  693 24.500621280 192.168.8.128 → 172.217.11.3 TCP 74 47990 → 80 [SYN] Seq=0 Win=29200 Len=0 MSS=1460 SACK_PERM=1 TSval=2381506207 TSecr=0 WS=128
  694 24.505734118 172.217.11.3 → 192.168.8.128 TCP 74 80 → 47990 [SYN, ACK] Seq=0 Ack=1 Win=60192 Len=0 MSS=1300 SACK_PERM=1 TSval=1794434603 TSecr=2381506207 WS=256
  707 24.523479555 192.168.8.128 → 172.217.11.3 TCP 74 47992 → 80 [SYN] Seq=0 Win=29200 Len=0 MSS=1460 SACK_PERM=1 TSval=2381506230 TSecr=0 WS=128
  708 24.525515490 192.168.8.128 → 172.217.11.3 TCP 74 47994 → 80 [SYN] Seq=0 Win=29200 Len=0 MSS=1460 SACK_PERM=1 TSval=2381506232 TSecr=0 WS=128
  709 24.527936414 172.217.11.3 → 192.168.8.128 TCP 74 80 → 47992 [SYN, ACK] Seq=0 Ack=1 Win=60192 Len=0 MSS=1300 SACK_PERM=1 TSval=2770261579 TSecr=2381506230 WS=256
  712 24.530432334 172.217.11.3 → 192.168.8.128 TCP 74 80 → 47994 [SYN, ACK] Seq=0 Ack=1 Win=60192 Len=0 MSS=1300 SACK_PERM=1 TSval=2772490544 TSecr=2381506232 WS=256
  786 24.595858259 192.168.8.128 → 172.217.10.46 TCP 74 43400 → 443 [SYN] Seq=0 Win=29200 Len=0 MSS=1460 SACK_PERM=1 TSval=2312698277 TSecr=0 WS=128
  790 24.601139092 172.217.10.46 → 192.168.8.128 TCP 74 443 → 43400 [SYN, ACK] Seq=0 Ack=1 Win=60192 Len=0 MSS=1300 SACK_PERM=1 TSval=2889018748 TSecr=2312698277 WS=256
  868 24.961442733 192.168.8.128 → 172.217.10.141 TCP 74 41642 → 443 [SYN] Seq=0 Win=29200 Len=0 MSS=1460 SACK_PERM=1 TSval=80692544 TSecr=0 WS=128
  870 24.964269644 192.168.8.128 → 172.217.11.42 TCP 74 55696 → 443 [SYN] Seq=0 Win=29200 Len=0 MSS=1460 SACK_PERM=1 TSval=1984633352 TSecr=0 WS=128
  871 24.966016589 172.217.10.141 → 192.168.8.128 TCP 74 443 → 41642 [SYN, ACK] Seq=0 Ack=1 Win=60192 Len=0 MSS=1300 SACK_PERM=1 TSval=2776850095 TSecr=80692544 WS=256
  873 24.968836500 172.217.11.42 → 192.168.8.128 TCP 74 443 → 55696 [SYN, ACK] Seq=0 Ack=1 Win=60192 Len=0 MSS=1300 SACK_PERM=1 TSval=3302000033 TSecr=1984633352 WS=256
  958 25.060329618 192.168.8.128 → 172.217.12.206 TCP 74 48156 → 443 [SYN] Seq=0 Win=29200 Len=0 MSS=1460 SACK_PERM=1 TSval=4096154948 TSecr=0 WS=128
  961 25.065385458 172.217.12.206 → 192.168.8.128 TCP 74 443 → 48156 [SYN, ACK] Seq=0 Ack=1 Win=60192 Len=0 MSS=1300 SACK_PERM=1 TSval=3495277917 TSecr=4096154948 WS=256
 1142 27.210880309 192.168.8.128 → 104.18.56.23 TCP 74 42736 → 443 [SYN] Seq=0 Win=29200 Len=0 MSS=1460 SACK_PERM=1 TSval=2979432465 TSecr=0 WS=128
 1143 27.215188175 104.18.56.23 → 192.168.8.128 TCP 66 443 → 42736 [SYN, ACK] Seq=0 Ack=1 Win=29200 Len=0 MSS=1300 SACK_PERM=1 WS=1024
 1157 27.254095965 192.168.8.128 → 151.139.128.14 TCP 74 51818 → 80 [SYN] Seq=0 Win=29200 Len=0 MSS=1460 SACK_PERM=1 TSval=1161328299 TSecr=0 WS=128
 1158 27.257921846 151.139.128.14 → 192.168.8.128 TCP 74 80 → 51818 [SYN, ACK] Seq=0 Ack=1 Win=28960 Len=0 MSS=1300 SACK_PERM=1 TSval=3301494211 TSecr=1161328299 WS=512
 1208 28.756190520 192.168.8.128 → 172.217.9.234 TCP 74 54424 → 443 [SYN] Seq=0 Win=29200 Len=0 MSS=1460 SACK_PERM=1 TSval=1769505986 TSecr=0 WS=128
 1209 28.760833377 172.217.9.234 → 192.168.8.128 TCP 74 443 → 54424 [SYN, ACK] Seq=0 Ack=1 Win=60192 Len=0 MSS=1300 SACK_PERM=1 TSval=30523436 TSecr=1769505986 WS=256
 1299 28.811319828 192.168.8.128 → 104.19.199.151 TCP 74 53334 → 443 [SYN] Seq=0 Win=29200 Len=0 MSS=1460 SACK_PERM=1 TSval=3954299718 TSecr=0 WS=128
 1300 28.811598820 192.168.8.128 → 104.19.199.151 TCP 74 53336 → 443 [SYN] Seq=0 Win=29200 Len=0 MSS=1460 SACK_PERM=1 TSval=3954299718 TSecr=0 WS=128
 1301 28.811925809 192.168.8.128 → 104.19.199.151 TCP 74 53338 → 443 [SYN] Seq=0 Win=29200 Len=0 MSS=1460 SACK_PERM=1 TSval=3954299718 TSecr=0 WS=128
 1302 28.812235800 192.168.8.128 → 104.19.199.151 TCP 74 53340 → 443 [SYN] Seq=0 Win=29200 Len=0 MSS=1460 SACK_PERM=1 TSval=3954299718 TSecr=0 WS=128
 1303 28.812499792 192.168.8.128 → 104.19.199.151 TCP 74 53342 → 443 [SYN] Seq=0 Win=29200 Len=0 MSS=1460 SACK_PERM=1 TSval=3954299718 TSecr=0 WS=128
 1309 28.814877719 104.19.199.151 → 192.168.8.128 TCP 66 443 → 53338 [SYN, ACK] Seq=0 Ack=1 Win=29200 Len=0 MSS=1300 SACK_PERM=1 WS=1024
 1310 28.815273707 104.19.199.151 → 192.168.8.128 TCP 66 443 → 53336 [SYN, ACK] Seq=0 Ack=1 Win=29200 Len=0 MSS=1300 SACK_PERM=1 WS=1024
 1311 28.815861689 104.19.199.151 → 192.168.8.128 TCP 66 443 → 53334 [SYN, ACK] Seq=0 Ack=1 Win=29200 Len=0 MSS=1300 SACK_PERM=1 WS=1024
 1312 28.816565667 104.19.199.151 → 192.168.8.128 TCP 66 443 → 53340 [SYN, ACK] Seq=0 Ack=1 Win=29200 Len=0 MSS=1300 SACK_PERM=1 WS=1024
 1313 28.816853658 104.19.199.151 → 192.168.8.128 TCP 66 443 → 53342 [SYN, ACK] Seq=0 Ack=1 Win=29200 Len=0 MSS=1300 SACK_PERM=1 WS=1024
 1508 29.124992204 192.168.8.128 → 172.217.6.195 TCP 74 51764 → 443 [SYN] Seq=0 Win=29200 Len=0 MSS=1460 SACK_PERM=1 TSval=3049662734 TSecr=0 WS=128
 1509 29.125304194 192.168.8.128 → 172.217.6.195 TCP 74 51766 → 443 [SYN] Seq=0 Win=29200 Len=0 MSS=1460 SACK_PERM=1 TSval=3049662734 TSecr=0 WS=128
 1511 29.127675122 192.168.8.128 → 172.217.6.195 TCP 74 51768 → 443 [SYN] Seq=0 Win=29200 Len=0 MSS=1460 SACK_PERM=1 TSval=3049662736 TSecr=0 WS=128
 1514 29.130120047 172.217.6.195 → 192.168.8.128 TCP 74 443 → 51764 [SYN, ACK] Seq=0 Ack=1 Win=60192 Len=0 MSS=1300 SACK_PERM=1 TSval=156785918 TSecr=3049662734 WS=256
 1515 29.130378039 172.217.6.195 → 192.168.8.128 TCP 74 443 → 51766 [SYN, ACK] Seq=0 Ack=1 Win=60192 Len=0 MSS=1300 SACK_PERM=1 TSval=1936562174 TSecr=3049662734 WS=256
 1516 29.130635031 192.168.8.128 → 199.232.36.134 TCP 74 56272 → 443 [SYN] Seq=0 Win=29200 Len=0 MSS=1460 SACK_PERM=1 TSval=2407554992 TSecr=0 WS=128
 1517 29.130966021 192.168.8.128 → 199.232.36.134 TCP 74 56274 → 443 [SYN] Seq=0 Win=29200 Len=0 MSS=1460 SACK_PERM=1 TSval=2407554992 TSecr=0 WS=128
 1520 29.132510973 172.217.6.195 → 192.168.8.128 TCP 74 443 → 51768 [SYN, ACK] Seq=0 Ack=1 Win=60192 Len=0 MSS=1300 SACK_PERM=1 TSval=764448380 TSecr=3049662736 WS=256
 1523 29.134518912 199.232.36.134 → 192.168.8.128 TCP 74 443 → 56274 [SYN, ACK] Seq=0 Ack=1 Win=28960 Len=0 MSS=1300 SACK_PERM=1 TSval=704486759 TSecr=2407554992 WS=512
 1524 29.134746905 199.232.36.134 → 192.168.8.128 TCP 74 443 → 56272 [SYN, ACK] Seq=0 Ack=1 Win=28960 Len=0 MSS=1300 SACK_PERM=1 TSval=534910557 TSecr=2407554992 WS=512
 1738 29.265090905 192.168.8.128 → 104.18.57.23 TCP 74 43986 → 443 [SYN] Seq=0 Win=29200 Len=0 MSS=1460 SACK_PERM=1 TSval=2638007933 TSecr=0 WS=128
 1786 29.281387405 104.18.57.23 → 192.168.8.128 TCP 66 443 → 43986 [SYN, ACK] Seq=0 Ack=1 Win=29200 Len=0 MSS=1300 SACK_PERM=1 WS=1024
 1816 29.458113983 192.168.8.128 → 151.101.192.134 TCP 74 58554 → 443 [SYN] Seq=0 Win=29200 Len=0 MSS=1460 SACK_PERM=1 TSval=3550295607 TSecr=0 WS=128
 1817 29.461625875 151.101.192.134 → 192.168.8.128 TCP 74 443 → 58554 [SYN, ACK] Seq=0 Ack=1 Win=28960 Len=0 MSS=1300 SACK_PERM=1 TSval=589980934 TSecr=3550295607 WS=512
 1846 29.666155607 192.168.8.128 → 104.16.80.166 TCP 74 53128 → 443 [SYN] Seq=0 Win=29200 Len=0 MSS=1460 SACK_PERM=1 TSval=1084168707 TSecr=0 WS=128
 1847 29.670592472 104.16.80.166 → 192.168.8.128 TCP 66 443 → 53128 [SYN, ACK] Seq=0 Ack=1 Win=29200 Len=0 MSS=1300 SACK_PERM=1 WS=1024
 2101 50.213499934 192.168.8.128 → 192.168.8.1  TCP 74 58850 → 53 [SYN] Seq=0 Win=29200 Len=0 MSS=1460 SACK_PERM=1 TSval=1254636383 TSecr=0 WS=128
 2102 50.213775926  192.168.8.1 → 192.168.8.128 TCP 74 53 → 58850 [SYN, ACK] Seq=0 Ack=1 Win=28960 Len=0 MSS=1460 SACK_PERM=1 TSval=36509 TSecr=1254636383 WS=16
 2110 50.229514505 192.168.8.128 → 52.85.98.43  TCP 74 39750 → 443 [SYN] Seq=0 Win=29200 Len=0 MSS=1460 SACK_PERM=1 TSval=2791280760 TSecr=0 WS=128
 2112 50.233775391  52.85.98.43 → 192.168.8.128 TCP 74 443 → 39750 [SYN, ACK] Seq=0 Ack=1 Win=28960 Len=0 MSS=1300 SACK_PERM=1 TSval=3439348143 TSecr=2791280760 WS=256
 2143 50.887646946 192.168.8.128 → 23.52.164.254 TCP 74 39502 → 443 [SYN] Seq=0 Win=29200 Len=0 MSS=1460 SACK_PERM=1 TSval=3514368638 TSecr=0 WS=128
 2144 50.892430819 23.52.164.254 → 192.168.8.128 TCP 74 443 → 39502 [SYN, ACK] Seq=0 Ack=1 Win=28960 Len=0 MSS=1300 SACK_PERM=1 TSval=1902152095 TSecr=3514368638 WS=128
 2147 50.897013697 23.52.164.254 → 192.168.8.128 TCP 74 [TCP Out-Of-Order] 443 → 39502 [SYN, ACK] Seq=0 Ack=1 Win=28960 Len=0 MSS=1300 SACK_PERM=1 TSval=1902152099 TSecr=3514368638 WS=128
 2156 50.921168055 192.168.8.128 → 72.21.91.29  TCP 74 42150 → 80 [SYN] Seq=0 Win=29200 Len=0 MSS=1460 SACK_PERM=1 TSval=421471796 TSecr=0 WS=128
 2157 50.925745933  72.21.91.29 → 192.168.8.128 TCP 74 80 → 42150 [SYN, ACK] Seq=0 Ack=1 Win=65535 Len=0 MSS=1300 SACK_PERM=1 TSval=4189645347 TSecr=421471796 WS=512
 2202 50.993374136 192.168.8.128 → 52.39.125.254 TCP 74 48828 → 443 [SYN] Seq=0 Win=29200 Len=0 MSS=1460 SACK_PERM=1 TSval=902818873 TSecr=0 WS=128
 2203 50.993757126 192.168.8.128 → 52.39.125.254 TCP 74 48830 → 443 [SYN] Seq=0 Win=29200 Len=0 MSS=1460 SACK_PERM=1 TSval=902818873 TSecr=0 WS=128
 2206 51.070803078 52.39.125.254 → 192.168.8.128 TCP 74 443 → 48830 [SYN, ACK] Seq=0 Ack=1 Win=26847 Len=0 MSS=1300 SACK_PERM=1 TSval=236913879 TSecr=902818873 WS=256
 2207 51.072066045 52.39.125.254 → 192.168.8.128 TCP 74 443 → 48828 [SYN, ACK] Seq=0 Ack=1 Win=26847 Len=0 MSS=1300 SACK_PERM=1 TSval=236913879 TSecr=902818873 WS=256
 2350 66.662778506 192.168.8.128 → 91.189.91.26 TCP 74 41638 → 80 [SYN] Seq=0 Win=29200 Len=0 MSS=1460 SACK_PERM=1 TSval=561706658 TSecr=0 WS=128
 2353 66.664963453 192.168.8.128 → 172.217.10.14 TCP 74 44888 → 80 [SYN] Seq=0 Win=29200 Len=0 MSS=1460 SACK_PERM=1 TSval=4093542648 TSecr=0 WS=128
 2360 66.669037355 172.217.10.14 → 192.168.8.128 TCP 74 80 → 44888 [SYN, ACK] Seq=0 Ack=1 Win=60192 Len=0 MSS=1300 SACK_PERM=1 TSval=212875099 TSecr=4093542648 WS=256
 2362 66.670099330 192.168.8.128 → 91.189.88.149 TCP 74 40962 → 80 [SYN] Seq=0 Win=29200 Len=0 MSS=1460 SACK_PERM=1 TSval=1897761857 TSecr=0 WS=128
 2363 66.670432322 192.168.8.128 → 91.189.95.83 TCP 74 33404 → 80 [SYN] Seq=0 Win=29200 Len=0 MSS=1460 SACK_PERM=1 TSval=2838793540 TSecr=0 WS=128
 2364 66.670723315 91.189.91.26 → 192.168.8.128 TCP 74 80 → 41638 [SYN, ACK] Seq=0 Ack=1 Win=28960 Len=0 MSS=1300 SACK_PERM=1 TSval=1220511005 TSecr=561706658 WS=128
 2374 66.678897119 192.168.8.128 → 40.76.35.62  TCP 74 36498 → 80 [SYN] Seq=0 Win=29200 Len=0 MSS=1460 SACK_PERM=1 TSval=2197207590 TSecr=0 WS=128
 2380 66.685164968 192.168.8.128 → 91.189.91.26 TCP 74 41648 → 80 [SYN] Seq=0 Win=29200 Len=0 MSS=1460 SACK_PERM=1 TSval=561706681 TSecr=0 WS=128
 2381 66.689406866  40.76.35.62 → 192.168.8.128 TCP 74 80 → 36498 [SYN, ACK] Seq=0 Ack=1 Win=28960 Len=0 MSS=1300 SACK_PERM=1 TSval=2736007875 TSecr=2197207590 WS=128
 2385 66.692934782 91.189.91.26 → 192.168.8.128 TCP 74 80 → 41648 [SYN, ACK] Seq=0 Ack=1 Win=28960 Len=0 MSS=1300 SACK_PERM=1 TSval=1220511062 TSecr=561706681 WS=128
 2448 66.743440569 91.189.88.149 → 192.168.8.128 TCP 74 80 → 40962 [SYN, ACK] Seq=0 Ack=1 Win=28960 Len=0 MSS=1300 SACK_PERM=1 TSval=1042177040 TSecr=1897761857 WS=128
 2449 66.743695563 91.189.95.83 → 192.168.8.128 TCP 74 80 → 33404 [SYN, ACK] Seq=0 Ack=1 Win=28960 Len=0 MSS=1300 SACK_PERM=1 TSval=1301953184 TSecr=2838793540 WS=256
 2510 66.766452017 192.168.8.128 → 91.189.91.26 TCP 74 41650 → 80 [SYN] Seq=0 Win=29200 Len=0 MSS=1460 SACK_PERM=1 TSval=561706761 TSecr=0 WS=128
 2513 66.774805816 91.189.91.26 → 192.168.8.128 TCP 74 80 → 41650 [SYN, ACK] Seq=0 Ack=1 Win=28960 Len=0 MSS=1300 SACK_PERM=1 TSval=1220511133 TSecr=561706761 WS=128
 2795 67.267734984 192.168.8.128 → 91.189.91.26 TCP 74 41652 → 80 [SYN] Seq=0 Win=29200 Len=0 MSS=1460 SACK_PERM=1 TSval=561707259 TSecr=0 WS=128
 2809 67.280435679 91.189.91.26 → 192.168.8.128 TCP 74 80 → 41652 [SYN, ACK] Seq=0 Ack=1 Win=28960 Len=0 MSS=1300 SACK_PERM=1 TSval=1220511645 TSecr=561707259 WS=128
 3159 67.586998320 192.168.8.128 → 91.189.91.26 TCP 74 41654 → 80 [SYN] Seq=0 Win=29200 Len=0 MSS=1460 SACK_PERM=1 TSval=561707583 TSecr=0 WS=128
 3161 67.595701111 91.189.91.26 → 192.168.8.128 TCP 74 80 → 41654 [SYN, ACK] Seq=0 Ack=1 Win=28960 Len=0 MSS=1300 SACK_PERM=1 TSval=1220511965 TSecr=561707583 WS=128
 3180 67.623663440 192.168.8.128 → 91.189.88.149 TCP 74 40976 → 80 [SYN] Seq=0 Win=29200 Len=0 MSS=1460 SACK_PERM=1 TSval=1897762810 TSecr=0 WS=128
 3378 67.707060451 91.189.88.149 → 192.168.8.128 TCP 74 80 → 40976 [SYN, ACK] Seq=0 Ack=1 Win=28960 Len=0 MSS=1300 SACK_PERM=1 TSval=1042178000 TSecr=1897762810 WS=128
 3534 67.910607595 192.168.8.128 → 91.189.91.26 TCP 74 41658 → 80 [SYN] Seq=0 Win=29200 Len=0 MSS=1460 SACK_PERM=1 TSval=561707906 TSecr=0 WS=128
 3536 67.918343411 91.189.91.26 → 192.168.8.128 TCP 74 80 → 41658 [SYN, ACK] Seq=0 Ack=1 Win=28960 Len=0 MSS=1300 SACK_PERM=1 TSval=1220512285 TSecr=561707906 WS=128
 3592 67.960635402 192.168.8.128 → 91.189.88.149 TCP 74 40980 → 80 [SYN] Seq=0 Win=29200 Len=0 MSS=1460 SACK_PERM=1 TSval=1897763148 TSecr=0 WS=128
 3766 68.033813656 91.189.88.149 → 192.168.8.128 TCP 74 80 → 40980 [SYN, ACK] Seq=0 Ack=1 Win=28960 Len=0 MSS=1300 SACK_PERM=1 TSval=1042178320 TSecr=1897763148 WS=128
 3844 68.081109528 192.168.8.128 → 91.189.91.26 TCP 74 41662 → 80 [SYN] Seq=0 Win=29200 Len=0 MSS=1460 SACK_PERM=1 TSval=561708074 TSecr=0 WS=128
 3846 68.088938341 91.189.91.26 → 192.168.8.128 TCP 74 80 → 41662 [SYN, ACK] Seq=0 Ack=1 Win=28960 Len=0 MSS=1300 SACK_PERM=1 TSval=1220512458 TSecr=561708074 WS=128
 3946 68.155383756 192.168.8.128 → 91.189.91.26 TCP 74 41664 → 80 [SYN] Seq=0 Win=29200 Len=0 MSS=1460 SACK_PERM=1 TSval=561708150 TSecr=0 WS=128
 3948 68.162854578 91.189.91.26 → 192.168.8.128 TCP 74 80 → 41664 [SYN, ACK] Seq=0 Ack=1 Win=28960 Len=0 MSS=1300 SACK_PERM=1 TSval=1220512477 TSecr=561708150 WS=128
 4047 68.241912692 192.168.8.128 → 91.189.88.149 TCP 74 40986 → 80 [SYN] Seq=0 Win=29200 Len=0 MSS=1460 SACK_PERM=1 TSval=1897763428 TSecr=0 WS=128
 4101 68.270211017 192.168.8.128 → 91.189.91.26 TCP 74 41668 → 80 [SYN] Seq=0 Win=29200 Len=0 MSS=1460 SACK_PERM=1 TSval=561708266 TSecr=0 WS=128
 4103 68.278242826 91.189.91.26 → 192.168.8.128 TCP 74 80 → 41668 [SYN, ACK] Seq=0 Ack=1 Win=28960 Len=0 MSS=1300 SACK_PERM=1 TSval=1220512605 TSecr=561708266 WS=128
 4124 68.313113994 91.189.88.149 → 192.168.8.128 TCP 74 80 → 40986 [SYN, ACK] Seq=0 Ack=1 Win=28960 Len=0 MSS=1300 SACK_PERM=1 TSval=1042178640 TSecr=1897763428 WS=128
 4418 68.490171770 192.168.8.128 → 91.189.91.26 TCP 74 41670 → 80 [SYN] Seq=0 Win=29200 Len=0 MSS=1460 SACK_PERM=1 TSval=561708486 TSecr=0 WS=128
 4420 68.497514595 91.189.91.26 → 192.168.8.128 TCP 74 80 → 41670 [SYN, ACK] Seq=0 Ack=1 Win=28960 Len=0 MSS=1300 SACK_PERM=1 TSval=1220512861 TSecr=561708486 WS=128
 4486 68.540204577 192.168.8.128 → 91.189.88.149 TCP 74 40992 → 80 [SYN] Seq=0 Win=29200 Len=0 MSS=1460 SACK_PERM=1 TSval=1897763727 TSecr=0 WS=128
 4656 68.617292738 91.189.88.149 → 192.168.8.128 TCP 74 80 → 40992 [SYN, ACK] Seq=0 Ack=1 Win=28960 Len=0 MSS=1300 SACK_PERM=1 TSval=1042178960 TSecr=1897763727 WS=128
 4811 68.939352103 192.168.8.128 → 91.189.91.26 TCP 74 41674 → 80 [SYN] Seq=0 Win=29200 Len=0 MSS=1460 SACK_PERM=1 TSval=561708935 TSecr=0 WS=128
 4813 68.947414912 91.189.91.26 → 192.168.8.128 TCP 74 80 → 41674 [SYN, ACK] Seq=0 Ack=1 Win=28960 Len=0 MSS=1300 SACK_PERM=1 TSval=1220513309 TSecr=561708935 WS=128
 4913 69.002370609 192.168.8.128 → 91.189.88.149 TCP 74 40996 → 80 [SYN] Seq=0 Win=29200 Len=0 MSS=1460 SACK_PERM=1 TSval=1897764189 TSecr=0 WS=128
 5147 69.097411356 91.189.88.149 → 192.168.8.128 TCP 74 80 → 40996 [SYN, ACK] Seq=0 Ack=1 Win=28960 Len=0 MSS=1300 SACK_PERM=1 TSval=1042179408 TSecr=1897764189 WS=128
 5200 69.384664547 192.168.8.128 → 91.189.91.26 TCP 74 41678 → 80 [SYN] Seq=0 Win=29200 Len=0 MSS=1460 SACK_PERM=1 TSval=561709380 TSecr=0 WS=128
 5202 69.392762355 91.189.91.26 → 192.168.8.128 TCP 74 80 → 41678 [SYN, ACK] Seq=0 Ack=1 Win=28960 Len=0 MSS=1300 SACK_PERM=1 TSval=1220513762 TSecr=561709380 WS=128
 5265 69.438976259 192.168.8.128 → 91.189.88.149 TCP 74 41000 → 80 [SYN] Seq=0 Win=29200 Len=0 MSS=1460 SACK_PERM=1 TSval=1897764624 TSecr=0 WS=128
 5413 69.520932316 91.189.88.149 → 192.168.8.128 TCP 74 80 → 41000 [SYN, ACK] Seq=0 Ack=1 Win=28960 Len=0 MSS=1300 SACK_PERM=1 TSval=1042179856 TSecr=1897764624 WS=128
 5474 69.543308786 192.168.8.128 → 91.189.91.26 TCP 74 41682 → 80 [SYN] Seq=0 Win=29200 Len=0 MSS=1460 SACK_PERM=1 TSval=561709538 TSecr=0 WS=128
 5476 69.551721586 91.189.91.26 → 192.168.8.128 TCP 74 80 → 41682 [SYN, ACK] Seq=0 Ack=1 Win=28960 Len=0 MSS=1300 SACK_PERM=1 TSval=1220513885 TSecr=561709538 WS=128
 5707 69.684132457 192.168.8.128 → 91.189.91.26 TCP 74 41684 → 80 [SYN] Seq=0 Win=29200 Len=0 MSS=1460 SACK_PERM=1 TSval=561709680 TSecr=0 WS=128
 5709 69.691823276 91.189.91.26 → 192.168.8.128 TCP 74 80 → 41684 [SYN, ACK] Seq=0 Ack=1 Win=28960 Len=0 MSS=1300 SACK_PERM=1 TSval=1220514013 TSecr=561709680 WS=128
 5729 69.712622786 192.168.8.128 → 91.189.88.149 TCP 74 41006 → 80 [SYN] Seq=0 Win=29200 Len=0 MSS=1460 SACK_PERM=1 TSval=1897764900 TSecr=0 WS=128
 5842 69.805056608 91.189.88.149 → 192.168.8.128 TCP 74 80 → 41006 [SYN, ACK] Seq=0 Ack=1 Win=28960 Len=0 MSS=1300 SACK_PERM=1 TSval=1042180112 TSecr=1897764900 WS=128
 6013 69.972492664 192.168.8.128 → 91.189.91.26 TCP 74 41688 → 80 [SYN] Seq=0 Win=29200 Len=0 MSS=1460 SACK_PERM=1 TSval=561709968 TSecr=0 WS=128
 6015 69.980714470 91.189.91.26 → 192.168.8.128 TCP 74 80 → 41688 [SYN, ACK] Seq=0 Ack=1 Win=28960 Len=0 MSS=1300 SACK_PERM=1 TSval=1220514350 TSecr=561709968 WS=128
 6418 70.209599078 192.168.8.128 → 91.189.88.149 TCP 74 41010 → 80 [SYN] Seq=0 Win=29200 Len=0 MSS=1460 SACK_PERM=1 TSval=1897765397 TSecr=0 WS=128
 6420 70.287830235 91.189.88.149 → 192.168.8.128 TCP 74 80 → 41010 [SYN, ACK] Seq=0 Ack=1 Win=28960 Len=0 MSS=1300 SACK_PERM=1 TSval=1042180624 TSecr=1897765397 WS=128
 6465 70.491519437 192.168.8.128 → 91.189.91.26 TCP 74 41692 → 80 [SYN] Seq=0 Win=29200 Len=0 MSS=1460 SACK_PERM=1 TSval=561710487 TSecr=0 WS=128
 6467 70.499319253 91.189.91.26 → 192.168.8.128 TCP 74 80 → 41692 [SYN, ACK] Seq=0 Ack=1 Win=28960 Len=0 MSS=1300 SACK_PERM=1 TSval=1220514868 TSecr=561710487 WS=128
 6477 70.515372875 192.168.8.128 → 91.189.91.26 TCP 74 41694 → 80 [SYN] Seq=0 Win=29200 Len=0 MSS=1460 SACK_PERM=1 TSval=561710511 TSecr=0 WS=128
 6479 70.522846699 91.189.91.26 → 192.168.8.128 TCP 74 80 → 41694 [SYN, ACK] Seq=0 Ack=1 Win=28960 Len=0 MSS=1300 SACK_PERM=1 TSval=1220514845 TSecr=561710511 WS=128
 6654 70.700261531 192.168.8.128 → 91.189.88.149 TCP 74 41016 → 80 [SYN] Seq=0 Win=29200 Len=0 MSS=1460 SACK_PERM=1 TSval=1897765888 TSecr=0 WS=128
 6656 70.770983876 91.189.88.149 → 192.168.8.128 TCP 74 80 → 41016 [SYN, ACK] Seq=0 Ack=1 Win=28960 Len=0 MSS=1300 SACK_PERM=1 TSval=1042181072 TSecr=1897765888 WS=128
 7890 260.080418234 192.168.8.128 → 172.217.12.197 TCP 74 34488 → 443 [SYN] Seq=0 Win=29200 Len=0 MSS=1460 SACK_PERM=1 TSval=3740420042 TSecr=0 WS=128
 7891 260.084902194 172.217.12.197 → 192.168.8.128 TCP 74 443 → 34488 [SYN, ACK] Seq=0 Ack=1 Win=60192 Len=0 MSS=1300 SACK_PERM=1 TSval=1973364762 TSecr=3740420042 WS=256
 7901 260.130597782 192.168.8.128 → 172.217.11.3 TCP 74 48110 → 80 [SYN] Seq=0 Win=29200 Len=0 MSS=1460 SACK_PERM=1 TSval=2381741835 TSecr=0 WS=128
 7902 260.135369739 172.217.11.3 → 192.168.8.128 TCP 74 80 → 48110 [SYN, ACK] Seq=0 Ack=1 Win=60192 Len=0 MSS=1300 SACK_PERM=1 TSval=1281952123 TSecr=2381741835 WS=256
 7923 260.234966842 192.168.8.128 → 172.217.11.36 TCP 74 49788 → 443 [SYN] Seq=0 Win=29200 Len=0 MSS=1460 SACK_PERM=1 TSval=3407827726 TSecr=0 WS=128
 7924 260.239745799 172.217.11.36 → 192.168.8.128 TCP 74 443 → 49788 [SYN, ACK] Seq=0 Ack=1 Win=60192 Len=0 MSS=1300 SACK_PERM=1 TSval=1863003296 TSecr=3407827726 WS=256
 7951 260.383218507 192.168.8.128 → 172.217.10.5 TCP 74 43854 → 443 [SYN] Seq=0 Win=29200 Len=0 MSS=1460 SACK_PERM=1 TSval=2062694339 TSecr=0 WS=128
 7952 260.387699467 172.217.10.5 → 192.168.8.128 TCP 74 443 → 43854 [SYN, ACK] Seq=0 Ack=1 Win=60192 Len=0 MSS=1300 SACK_PERM=1 TSval=808583861 TSecr=2062694339 WS=256
 8199 263.168673573 192.168.8.128 → 172.217.10.46 TCP 74 43520 → 443 [SYN] Seq=0 Win=29200 Len=0 MSS=1460 SACK_PERM=1 TSval=2312936848 TSecr=0 WS=128
 8200 263.173080534 172.217.10.46 → 192.168.8.128 TCP 74 443 → 43520 [SYN, ACK] Seq=0 Ack=1 Win=60192 Len=0 MSS=1300 SACK_PERM=1 TSval=1469067505 TSecr=2312936848 WS=256
 8234 263.646658316 192.168.8.128 → 172.217.7.14 TCP 74 59264 → 443 [SYN] Seq=0 Win=29200 Len=0 MSS=1460 SACK_PERM=1 TSval=1151223722 TSecr=0 WS=128
 8235 263.651298275 172.217.7.14 → 192.168.8.128 TCP 74 443 → 59264 [SYN, ACK] Seq=0 Ack=1 Win=60192 Len=0 MSS=1300 SACK_PERM=1 TSval=1501041982 TSecr=1151223722 WS=256
 8261 263.780941124 192.168.8.128 → 172.217.12.195 TCP 74 37918 → 443 [SYN] Seq=0 Win=29200 Len=0 MSS=1460 SACK_PERM=1 TSval=278925026 TSecr=0 WS=128
 8262 263.785839081 172.217.12.195 → 192.168.8.128 TCP 74 443 → 37918 [SYN, ACK] Seq=0 Ack=1 Win=60192 Len=0 MSS=1300 SACK_PERM=1 TSval=3935691715 TSecr=278925026 WS=256
 8287 263.904599027 192.168.8.128 → 172.217.10.141 TCP 74 41766 → 443 [SYN] Seq=0 Win=29200 Len=0 MSS=1460 SACK_PERM=1 TSval=80931485 TSecr=0 WS=128
 8288 263.908950988 172.217.10.141 → 192.168.8.128 TCP 74 443 → 41766 [SYN, ACK] Seq=0 Ack=1 Win=60192 Len=0 MSS=1300 SACK_PERM=1 TSval=3047817966 TSecr=80931485 WS=256
 8399 264.541268376 192.168.8.128 → 172.217.6.206 TCP 74 56464 → 443 [SYN] Seq=0 Win=29200 Len=0 MSS=1460 SACK_PERM=1 TSval=357858926 TSecr=0 WS=128
 8400 264.545901335 172.217.6.206 → 192.168.8.128 TCP 74 443 → 56464 [SYN, ACK] Seq=0 Ack=1 Win=60192 Len=0 MSS=1300 SACK_PERM=1 TSval=1520623562 TSecr=357858926 WS=256
 8473 265.090774514 192.168.8.128 → 172.217.7.14 TCP 74 59272 → 443 [SYN] Seq=0 Win=29200 Len=0 MSS=1460 SACK_PERM=1 TSval=1151225166 TSecr=0 WS=128
 8474 265.095508472 172.217.7.14 → 192.168.8.128 TCP 74 443 → 59272 [SYN, ACK] Seq=0 Ack=1 Win=60192 Len=0 MSS=1300 SACK_PERM=1 TSval=3064689013 TSecr=1151225166 WS=256
 8505 265.402011761 192.168.8.128 → 172.217.12.206 TCP 74 48282 → 443 [SYN] Seq=0 Win=29200 Len=0 MSS=1460 SACK_PERM=1 TSval=4096395286 TSecr=0 WS=128
 8506 265.406778719 172.217.12.206 → 192.168.8.128 TCP 74 443 → 48282 [SYN, ACK] Seq=0 Ack=1 Win=60192 Len=0 MSS=1300 SACK_PERM=1 TSval=4257827410 TSecr=4096395286 WS=256
 8558 266.151313152 192.168.8.128 → 172.217.12.138 TCP 74 49724 → 443 [SYN] Seq=0 Win=29200 Len=0 MSS=1460 SACK_PERM=1 TSval=4142095628 TSecr=0 WS=128
 8559 266.155828112 172.217.12.138 → 192.168.8.128 TCP 74 443 → 49724 [SYN, ACK] Seq=0 Ack=1 Win=60192 Len=0 MSS=1300 SACK_PERM=1 TSval=170922412 TSecr=4142095628 WS=256
 8624 267.356258557 192.168.8.128 → 172.217.10.99 TCP 74 53956 → 443 [SYN] Seq=0 Win=29200 Len=0 MSS=1460 SACK_PERM=1 TSval=1210838425 TSecr=0 WS=128
 8625 267.361122514 172.217.10.99 → 192.168.8.128 TCP 74 443 → 53956 [SYN, ACK] Seq=0 Ack=1 Win=60192 Len=0 MSS=1300 SACK_PERM=1 TSval=3892045293 TSecr=1210838425 WS=256
 8679 267.991544991 192.168.8.128 → 172.217.10.46 TCP 74 43538 → 443 [SYN] Seq=0 Win=29200 Len=0 MSS=1460 SACK_PERM=1 TSval=2312941670 TSecr=0 WS=128
 8681 267.996037951 172.217.10.46 → 192.168.8.128 TCP 74 443 → 43538 [SYN, ACK] Seq=0 Ack=1 Win=60192 Len=0 MSS=1300 SACK_PERM=1 TSval=1469072328 TSecr=2312941670 WS=256
 8753 268.796365955 192.168.8.128 → 172.217.9.234 TCP 74 54552 → 443 [SYN] Seq=0 Win=29200 Len=0 MSS=1460 SACK_PERM=1 TSval=1769746024 TSecr=0 WS=128
 8756 268.800933915 172.217.9.234 → 192.168.8.128 TCP 74 443 → 54552 [SYN, ACK] Seq=0 Ack=1 Win=60192 Len=0 MSS=1300 SACK_PERM=1 TSval=46076168 TSecr=1769746024 WS=256
 8788 268.855858436 192.168.8.128 → 172.217.6.206 TCP 74 56478 → 443 [SYN] Seq=0 Win=29200 Len=0 MSS=1460 SACK_PERM=1 TSval=357863240 TSecr=0 WS=128
 8792 268.860597395 172.217.6.206 → 192.168.8.128 TCP 74 443 → 56478 [SYN, ACK] Seq=0 Ack=1 Win=60192 Len=0 MSS=1300 SACK_PERM=1 TSval=792386170 TSecr=357863240 WS=256
 9003 271.171738311 192.168.8.128 → 172.217.197.189 TCP 74 36404 → 443 [SYN] Seq=0 Win=29200 Len=0 MSS=1460 SACK_PERM=1 TSval=708814514 TSecr=0 WS=128
 9004 271.189099161 172.217.197.189 → 192.168.8.128 TCP 74 443 → 36404 [SYN, ACK] Seq=0 Ack=1 Win=62392 Len=0 MSS=1300 SACK_PERM=1 TSval=814927395 TSecr=708814514 WS=256
 9035 271.289896289 192.168.8.128 → 172.217.6.206 TCP 74 56482 → 443 [SYN] Seq=0 Win=29200 Len=0 MSS=1460 SACK_PERM=1 TSval=357865674 TSecr=0 WS=128
 9040 271.294753246 172.217.6.206 → 192.168.8.128 TCP 74 443 → 56482 [SYN, ACK] Seq=0 Ack=1 Win=60192 Len=0 MSS=1300 SACK_PERM=1 TSval=587741018 TSecr=357865674 WS=256
 9177 273.839252331 192.168.8.128 → 67.231.154.66 TCP 74 47076 → 443 [SYN] Seq=0 Win=29200 Len=0 MSS=1460 SACK_PERM=1 TSval=2158578826 TSecr=0 WS=128
 9185 273.863347124 67.231.154.66 → 192.168.8.128 TCP 74 443 → 47076 [SYN, ACK] Seq=0 Ack=1 Win=7240 Len=0 MSS=1300 SACK_PERM=1 TSval=1759313702 TSecr=2158578826 WS=1
 9204 273.917784658 192.168.8.128 → 72.21.91.29  TCP 74 42254 → 80 [SYN] Seq=0 Win=29200 Len=0 MSS=1460 SACK_PERM=1 TSval=421694791 TSecr=0 WS=128
 9205 273.923101612  72.21.91.29 → 192.168.8.128 TCP 74 80 → 42254 [SYN, ACK] Seq=0 Ack=1 Win=65535 Len=0 MSS=1300 SACK_PERM=1 TSval=1464191662 TSecr=421694791 WS=512
 9227 274.064643400 192.168.8.128 → 52.202.62.236 TCP 74 48466 → 443 [SYN] Seq=0 Win=29200 Len=0 MSS=1460 SACK_PERM=1 TSval=1943853208 TSecr=0 WS=128
 9228 274.074806313 52.202.62.236 → 192.168.8.128 TCP 66 443 → 48466 [SYN, ACK] Seq=0 Ack=1 Win=26883 Len=0 MSS=1300 SACK_PERM=1 WS=4096
 9245 274.111002003 192.168.8.128 → 192.124.249.36 TCP 74 33814 → 80 [SYN] Seq=0 Win=29200 Len=0 MSS=1460 SACK_PERM=1 TSval=646355920 TSecr=0 WS=128
 9247 274.119106933 192.124.249.36 → 192.168.8.128 TCP 74 80 → 33814 [SYN, ACK] Seq=0 Ack=1 Win=28960 Len=0 MSS=1300 SACK_PERM=1 TSval=2502701925 TSecr=646355920 WS=512
 9270 274.481196831 192.168.8.128 → 54.230.51.224 TCP 74 58958 → 443 [SYN] Seq=0 Win=29200 Len=0 MSS=1460 SACK_PERM=1 TSval=1653358499 TSecr=0 WS=128
 9271 274.481491829 192.168.8.128 → 54.230.51.224 TCP 74 58960 → 443 [SYN] Seq=0 Win=29200 Len=0 MSS=1460 SACK_PERM=1 TSval=1653358499 TSecr=0 WS=128
 9272 274.481745827 192.168.8.128 → 54.230.51.224 TCP 74 58962 → 443 [SYN] Seq=0 Win=29200 Len=0 MSS=1460 SACK_PERM=1 TSval=1653358499 TSecr=0 WS=128
 9273 274.482049824 192.168.8.128 → 54.230.51.224 TCP 74 58964 → 443 [SYN] Seq=0 Win=29200 Len=0 MSS=1460 SACK_PERM=1 TSval=1653358499 TSecr=0 WS=128
 9274 274.482388821 192.168.8.128 → 54.230.51.224 TCP 74 58966 → 443 [SYN] Seq=0 Win=29200 Len=0 MSS=1460 SACK_PERM=1 TSval=1653358499 TSecr=0 WS=128
 9275 274.482688819 192.168.8.128 → 54.230.51.224 TCP 74 58968 → 443 [SYN] Seq=0 Win=29200 Len=0 MSS=1460 SACK_PERM=1 TSval=1653358499 TSecr=0 WS=128
 9276 274.485509795 54.230.51.224 → 192.168.8.128 TCP 74 443 → 58960 [SYN, ACK] Seq=0 Ack=1 Win=28960 Len=0 MSS=1300 SACK_PERM=1 TSval=3440965970 TSecr=1653358499 WS=256
 9277 274.485781792 54.230.51.224 → 192.168.8.128 TCP 74 443 → 58964 [SYN, ACK] Seq=0 Ack=1 Win=28960 Len=0 MSS=1300 SACK_PERM=1 TSval=3439004164 TSecr=1653358499 WS=256
 9278 274.485977791 54.230.51.224 → 192.168.8.128 TCP 74 443 → 58958 [SYN, ACK] Seq=0 Ack=1 Win=28960 Len=0 MSS=1300 SACK_PERM=1 TSval=3441332164 TSecr=1653358499 WS=256
 9279 274.486137789 54.230.51.224 → 192.168.8.128 TCP 74 443 → 58962 [SYN, ACK] Seq=0 Ack=1 Win=28960 Len=0 MSS=1300 SACK_PERM=1 TSval=3442046271 TSecr=1653358499 WS=256
 9280 274.486974782 54.230.51.224 → 192.168.8.128 TCP 74 443 → 58966 [SYN, ACK] Seq=0 Ack=1 Win=28960 Len=0 MSS=1300 SACK_PERM=1 TSval=3442052175 TSecr=1653358499 WS=256
 9281 274.487214780 54.230.51.224 → 192.168.8.128 TCP 74 443 → 58968 [SYN, ACK] Seq=0 Ack=1 Win=28960 Len=0 MSS=1300 SACK_PERM=1 TSval=3439220362 TSecr=1653358499 WS=256
 9939 274.949904826 192.168.8.128 → 54.230.51.224 TCP 74 58970 → 443 [SYN] Seq=0 Win=29200 Len=0 MSS=1460 SACK_PERM=1 TSval=1653358967 TSecr=0 WS=128
 9940 274.950139824 192.168.8.128 → 54.230.51.224 TCP 74 58972 → 443 [SYN] Seq=0 Win=29200 Len=0 MSS=1460 SACK_PERM=1 TSval=1653358968 TSecr=0 WS=128
 9941 274.953494796 54.230.51.224 → 192.168.8.128 TCP 74 443 → 58972 [SYN, ACK] Seq=0 Ack=1 Win=28960 Len=0 MSS=1300 SACK_PERM=1 TSval=3439004211 TSecr=1653358968 WS=256
 9942 274.953780793 54.230.51.224 → 192.168.8.128 TCP 74 443 → 58970 [SYN, ACK] Seq=0 Ack=1 Win=28960 Len=0 MSS=1300 SACK_PERM=1 TSval=3441326511 TSecr=1653358967 WS=256
10425 278.091968133 192.168.8.128 → 104.18.74.113 TCP 74 38860 → 443 [SYN] Seq=0 Win=29200 Len=0 MSS=1460 SACK_PERM=1 TSval=737011352 TSecr=0 WS=128
10426 278.096153098 104.18.74.113 → 192.168.8.128 TCP 66 443 → 38860 [SYN, ACK] Seq=0 Ack=1 Win=29200 Len=0 MSS=1300 SACK_PERM=1 WS=1024
10449 278.178030406 192.168.8.128 → 104.18.73.113 TCP 74 45130 → 443 [SYN] Seq=0 Win=29200 Len=0 MSS=1460 SACK_PERM=1 TSval=3782809823 TSecr=0 WS=128
10450 278.181882373 104.18.73.113 → 192.168.8.128 TCP 66 443 → 45130 [SYN, ACK] Seq=0 Ack=1 Win=29200 Len=0 MSS=1300 SACK_PERM=1 WS=1024
10490 278.252116780 192.168.8.128 → 104.18.71.113 TCP 74 33442 → 443 [SYN] Seq=0 Win=29200 Len=0 MSS=1460 SACK_PERM=1 TSval=2354129198 TSecr=0 WS=128
10491 278.256634742 104.18.71.113 → 192.168.8.128 TCP 66 443 → 33442 [SYN, ACK] Seq=0 Ack=1 Win=29200 Len=0 MSS=1300 SACK_PERM=1 WS=1024
10831 279.118608473 192.168.8.128 → 104.16.54.111 TCP 74 36478 → 443 [SYN] Seq=0 Win=29200 Len=0 MSS=1460 SACK_PERM=1 TSval=402110579 TSecr=0 WS=128
10832 279.123569431 104.16.54.111 → 192.168.8.128 TCP 66 443 → 36478 [SYN, ACK] Seq=0 Ack=1 Win=29200 Len=0 MSS=1300 SACK_PERM=1 WS=1024
10961 283.431203421 192.168.8.128 → 185.199.110.153 TCP 74 47558 → 443 [SYN] Seq=0 Win=29200 Len=0 MSS=1460 SACK_PERM=1 TSval=292115594 TSecr=0 WS=128
10962 283.434717391 185.199.110.153 → 192.168.8.128 TCP 74 443 → 47558 [SYN, ACK] Seq=0 Ack=1 Win=28960 Len=0 MSS=1300 SACK_PERM=1 TSval=1494208954 TSecr=292115594 WS=512
11180 286.865202083 192.168.8.128 → 172.217.10.138 TCP 74 42206 → 443 [SYN] Seq=0 Win=29200 Len=0 MSS=1460 SACK_PERM=1 TSval=2781797389 TSecr=0 WS=128
11181 286.869990044 172.217.10.138 → 192.168.8.128 TCP 74 443 → 42206 [SYN, ACK] Seq=0 Ack=1 Win=60192 Len=0 MSS=1300 SACK_PERM=1 TSval=3104691089 TSecr=2781797389 WS=256
11406 303.448149557 192.168.8.128 → 52.202.62.236 TCP 74 48498 → 443 [SYN] Seq=0 Win=29200 Len=0 MSS=1460 SACK_PERM=1 TSval=1943882591 TSecr=0 WS=128
11407 303.458844474 52.202.62.236 → 192.168.8.128 TCP 66 443 → 48498 [SYN, ACK] Seq=0 Ack=1 Win=26883 Len=0 MSS=1300 SACK_PERM=1 WS=4096
11543 315.894750409 192.168.8.128 → 52.202.62.238 TCP 74 37812 → 443 [SYN] Seq=0 Win=29200 Len=0 MSS=1460 SACK_PERM=1 TSval=459195018 TSecr=0 WS=128
11544 315.895123406 192.168.8.128 → 52.202.62.236 TCP 74 48502 → 443 [SYN] Seq=0 Win=29200 Len=0 MSS=1460 SACK_PERM=1 TSval=1943895037 TSecr=0 WS=128
11545 315.904734334 52.202.62.238 → 192.168.8.128 TCP 66 443 → 37812 [SYN, ACK] Seq=0 Ack=1 Win=26883 Len=0 MSS=1300 SACK_PERM=1 WS=4096
11546 315.905009332 52.202.62.236 → 192.168.8.128 TCP 66 443 → 48502 [SYN, ACK] Seq=0 Ack=1 Win=26883 Len=0 MSS=1300 SACK_PERM=1 WS=4096
11547 315.905762326 192.168.8.128 → 52.202.62.238 TCP 74 37816 → 443 [SYN] Seq=0 Win=29200 Len=0 MSS=1460 SACK_PERM=1 TSval=459195029 TSecr=0 WS=128
11550 315.916369246 52.202.62.238 → 192.168.8.128 TCP 66 443 → 37816 [SYN, ACK] Seq=0 Ack=1 Win=26883 Len=0 MSS=1300 SACK_PERM=1 WS=4096
11601 317.148891011 192.168.8.128 → 52.202.62.238 TCP 74 37818 → 443 [SYN] Seq=0 Win=29200 Len=0 MSS=1460 SACK_PERM=1 TSval=459196271 TSecr=0 WS=128
11602 317.158875937 52.202.62.238 → 192.168.8.128 TCP 66 443 → 37818 [SYN, ACK] Seq=0 Ack=1 Win=26883 Len=0 MSS=1300 SACK_PERM=1 WS=4096
11679 323.099449871 192.168.8.128 → 172.217.7.1  TCP 74 53928 → 443 [SYN] Seq=0 Win=29200 Len=0 MSS=1460 SACK_PERM=1 TSval=3812265901 TSecr=0 WS=128
11680 323.104186836  172.217.7.1 → 192.168.8.128 TCP 74 443 → 53928 [SYN, ACK] Seq=0 Ack=1 Win=60192 Len=0 MSS=1300 SACK_PERM=1 TSval=996559957 TSecr=3812265901 WS=256
11703 323.155432459 192.168.8.128 → 52.202.62.238 TCP 74 37822 → 443 [SYN] Seq=0 Win=29200 Len=0 MSS=1460 SACK_PERM=1 TSval=459202278 TSecr=0 WS=128
11704 323.165397386 52.202.62.238 → 192.168.8.128 TCP 66 443 → 37822 [SYN, ACK] Seq=0 Ack=1 Win=26883 Len=0 MSS=1300 SACK_PERM=1 WS=4096
11707 323.186145233 192.168.8.128 → 52.202.62.238 TCP 74 37824 → 443 [SYN] Seq=0 Win=29200 Len=0 MSS=1460 SACK_PERM=1 TSval=459202309 TSecr=0 WS=128
11708 323.186355232 192.168.8.128 → 52.202.62.236 TCP 74 48514 → 443 [SYN] Seq=0 Win=29200 Len=0 MSS=1460 SACK_PERM=1 TSval=1943902328 TSecr=0 WS=128
11709 323.196424158 52.202.62.236 → 192.168.8.128 TCP 66 443 → 48514 [SYN, ACK] Seq=0 Ack=1 Win=26883 Len=0 MSS=1300 SACK_PERM=1 WS=4096
11710 323.196670156 52.202.62.238 → 192.168.8.128 TCP 66 443 → 37824 [SYN, ACK] Seq=0 Ack=1 Win=26883 Len=0 MSS=1300 SACK_PERM=1 WS=4096
11776 323.589933263 192.168.8.128 → 162.255.38.7 TCP 74 60554 → 443 [SYN] Seq=0 Win=29200 Len=0 MSS=1460 SACK_PERM=1 TSval=3969187456 TSecr=0 WS=128
11781 323.604642155 192.168.8.128 → 162.255.38.8 TCP 74 35080 → 443 [SYN] Seq=0 Win=29200 Len=0 MSS=1460 SACK_PERM=1 TSval=2571850006 TSecr=0 WS=128
11782 323.640870889 162.255.38.7 → 192.168.8.128 TCP 74 443 → 60554 [SYN, ACK] Seq=0 Ack=1 Win=43440 Len=0 MSS=1300 SACK_PERM=1 TSval=4189730290 TSecr=3969187456 WS=4096
11785 323.655795779 162.255.38.8 → 192.168.8.128 TCP 74 443 → 35080 [SYN, ACK] Seq=0 Ack=1 Win=43440 Len=0 MSS=1300 SACK_PERM=1 TSval=494256978 TSecr=2571850006 WS=4096
11827 323.905167950 192.168.8.128 → 8.5.128.167  TCP 74 33472 → 443 [SYN] Seq=0 Win=29200 Len=0 MSS=1460 SACK_PERM=1 TSval=413556647 TSecr=0 WS=128
11836 323.958627558  8.5.128.167 → 192.168.8.128 TCP 74 443 → 33472 [SYN, ACK] Seq=0 Ack=1 Win=43440 Len=0 MSS=1300 SACK_PERM=1 TSval=479081679 TSecr=413556647 WS=4096
11928 324.985466032 192.168.8.128 → 172.217.11.36 TCP 74 49880 → 443 [SYN] Seq=0 Win=29200 Len=0 MSS=1460 SACK_PERM=1 TSval=3407892475 TSecr=0 WS=128
11929 324.985763030 192.168.8.128 → 172.217.7.1  TCP 74 53944 → 443 [SYN] Seq=0 Win=29200 Len=0 MSS=1460 SACK_PERM=1 TSval=3812267787 TSecr=0 WS=128
11930 324.989967999 172.217.11.36 → 192.168.8.128 TCP 74 443 → 49880 [SYN, ACK] Seq=0 Ack=1 Win=60192 Len=0 MSS=1300 SACK_PERM=1 TSval=795260284 TSecr=3407892475 WS=256
