   74 25.662981106 192.168.8.128 → 13.225.231.227 TCP 74 60306 → 443 [SYN] Seq=0 Win=29200 Len=0 MSS=1460 SACK_PERM=1 TSval=185581627 TSecr=0 WS=128
   75 25.667439072 13.225.231.227 → 192.168.8.128 TCP 74 443 → 60306 [SYN, ACK] Seq=0 Ack=1 Win=28960 Len=0 MSS=1300 SACK_PERM=1 TSval=513309022 TSecr=185581627 WS=256
  296 26.225157811 192.168.8.128 → 13.225.226.34 TCP 74 52134 → 443 [SYN] Seq=0 Win=29200 Len=0 MSS=1460 SACK_PERM=1 TSval=120581555 TSecr=0 WS=128
  297 26.225440809 192.168.8.128 → 13.225.226.34 TCP 74 52136 → 443 [SYN] Seq=0 Win=29200 Len=0 MSS=1460 SACK_PERM=1 TSval=120581555 TSecr=0 WS=128
  298 26.228371787 192.168.8.128 → 13.225.226.34 TCP 74 52138 → 443 [SYN] Seq=0 Win=29200 Len=0 MSS=1460 SACK_PERM=1 TSval=120581558 TSecr=0 WS=128
  299 26.229605777 13.225.226.34 → 192.168.8.128 TCP 74 443 → 52134 [SYN, ACK] Seq=0 Ack=1 Win=28960 Len=0 MSS=1300 SACK_PERM=1 TSval=513300976 TSecr=120581555 WS=256
  300 26.229822775 13.225.226.34 → 192.168.8.128 TCP 74 443 → 52136 [SYN, ACK] Seq=0 Ack=1 Win=28960 Len=0 MSS=1300 SACK_PERM=1 TSval=513248176 TSecr=120581555 WS=256
  303 26.233081751 13.225.226.34 → 192.168.8.128 TCP 74 443 → 52138 [SYN, ACK] Seq=0 Ack=1 Win=28960 Len=0 MSS=1300 SACK_PERM=1 TSval=513272176 TSecr=120581558 WS=256
  304 26.233458748 192.168.8.128 → 13.225.226.34 TCP 74 52140 → 443 [SYN] Seq=0 Win=29200 Len=0 MSS=1460 SACK_PERM=1 TSval=120581564 TSecr=0 WS=128
  306 26.234741738 192.168.8.128 → 13.225.226.34 TCP 74 52142 → 443 [SYN] Seq=0 Win=29200 Len=0 MSS=1460 SACK_PERM=1 TSval=120581565 TSecr=0 WS=128
  307 26.235529732 192.168.8.128 → 13.225.226.34 TCP 74 52144 → 443 [SYN] Seq=0 Win=29200 Len=0 MSS=1460 SACK_PERM=1 TSval=120581566 TSecr=0 WS=128
  308 26.238514709 192.168.8.128 → 13.225.226.34 TCP 74 52146 → 443 [SYN] Seq=0 Win=29200 Len=0 MSS=1460 SACK_PERM=1 TSval=120581569 TSecr=0 WS=128
  309 26.238833707 13.225.226.34 → 192.168.8.128 TCP 74 443 → 52142 [SYN, ACK] Seq=0 Ack=1 Win=28960 Len=0 MSS=1300 SACK_PERM=1 TSval=513259375 TSecr=120581565 WS=256
  310 26.239116704 13.225.226.34 → 192.168.8.128 TCP 74 443 → 52140 [SYN, ACK] Seq=0 Ack=1 Win=28960 Len=0 MSS=1300 SACK_PERM=1 TSval=513283479 TSecr=120581564 WS=256
  313 26.240331695 13.225.226.34 → 192.168.8.128 TCP 74 443 → 52144 [SYN, ACK] Seq=0 Ack=1 Win=28960 Len=0 MSS=1300 SACK_PERM=1 TSval=513326576 TSecr=120581566 WS=256
  315 26.242733677 13.225.226.34 → 192.168.8.128 TCP 74 443 → 52146 [SYN, ACK] Seq=0 Ack=1 Win=28960 Len=0 MSS=1300 SACK_PERM=1 TSval=513270577 TSecr=120581569 WS=256
  318 26.429818247 192.168.8.128 → 13.225.226.34 TCP 74 52148 → 443 [SYN] Seq=0 Win=29200 Len=0 MSS=1460 SACK_PERM=1 TSval=120581759 TSecr=0 WS=128
  320 26.434425212 13.225.226.34 → 192.168.8.128 TCP 74 443 → 52148 [SYN, ACK] Seq=0 Ack=1 Win=28960 Len=0 MSS=1300 SACK_PERM=1 TSval=513256095 TSecr=120581759 WS=256
  325 26.443147145 192.168.8.128 → 13.225.226.34 TCP 74 52150 → 443 [SYN] Seq=0 Win=29200 Len=0 MSS=1460 SACK_PERM=1 TSval=120581773 TSecr=0 WS=128
  329 26.447483112 13.225.226.34 → 192.168.8.128 TCP 74 443 → 52150 [SYN, ACK] Seq=0 Ack=1 Win=28960 Len=0 MSS=1300 SACK_PERM=1 TSval=513299399 TSecr=120581773 WS=256
  550 26.833196164 192.168.8.128 → 54.204.242.217 TCP 74 51622 → 443 [SYN] Seq=0 Win=29200 Len=0 MSS=1460 SACK_PERM=1 TSval=3580162178 TSecr=0 WS=128
  551 26.842839091 54.204.242.217 → 192.168.8.128 TCP 74 443 → 51622 [SYN, ACK] Seq=0 Ack=1 Win=26847 Len=0 MSS=1300 SACK_PERM=1 TSval=1119322369 TSecr=3580162178 WS=256
  753 27.552142669 192.168.8.128 → 52.94.228.73 TCP 74 60246 → 443 [SYN] Seq=0 Win=29200 Len=0 MSS=1460 SACK_PERM=1 TSval=1949744350 TSecr=0 WS=128
  754 27.562070593 52.94.228.73 → 192.168.8.128 TCP 66 443 → 60246 [SYN, ACK] Seq=0 Ack=1 Win=8190 Len=0 MSS=1212 WS=64 SACK_PERM=1
 1129 60.761349941 192.168.8.128 → 104.244.42.193 TCP 74 52360 → 443 [SYN] Seq=0 Win=29200 Len=0 MSS=1460 SACK_PERM=1 TSval=1441908334 TSecr=0 WS=128
 1130 60.781980781 104.244.42.193 → 192.168.8.128 TCP 74 443 → 52360 [SYN, ACK] Seq=0 Ack=1 Win=28960 Len=0 MSS=1300 SACK_PERM=1 TSval=2030847851 TSecr=1441908334 WS=256
 1208 61.118808169 192.168.8.128 → 72.21.91.70  TCP 74 54686 → 443 [SYN] Seq=0 Win=29200 Len=0 MSS=1460 SACK_PERM=1 TSval=4253127381 TSecr=0 WS=128
 1209 61.123798131  72.21.91.70 → 192.168.8.128 TCP 74 443 → 54686 [SYN, ACK] Seq=0 Ack=1 Win=65535 Len=0 MSS=1300 SACK_PERM=1 TSval=3708504270 TSecr=4253127381 WS=512
 1548 61.468252459 192.168.8.128 → 104.108.116.202 TCP 74 46068 → 443 [SYN] Seq=0 Win=29200 Len=0 MSS=1460 SACK_PERM=1 TSval=551272629 TSecr=0 WS=128
 1549 61.468563456 192.168.8.128 → 104.108.116.202 TCP 74 46070 → 443 [SYN] Seq=0 Win=29200 Len=0 MSS=1460 SACK_PERM=1 TSval=551272629 TSecr=0 WS=128
 1550 61.477279389 104.108.116.202 → 192.168.8.128 TCP 74 443 → 46070 [SYN, ACK] Seq=0 Ack=1 Win=28960 Len=0 MSS=1300 SACK_PERM=1 TSval=480657067 TSecr=551272629 WS=128
 1570 61.525115017 192.168.8.128 → 93.184.215.201 TCP 74 52424 → 443 [SYN] Seq=0 Win=29200 Len=0 MSS=1460 SACK_PERM=1 TSval=2067642245 TSecr=0 WS=128
 1572 61.530623975 93.184.215.201 → 192.168.8.128 TCP 66 443 → 52424 [SYN, ACK] Seq=0 Ack=1 Win=65535 Len=0 MSS=1300 SACK_PERM=1 WS=512
 1584 61.544334868 104.108.116.202 → 192.168.8.128 TCP 74 443 → 46068 [SYN, ACK] Seq=0 Ack=1 Win=28960 Len=0 MSS=1300 SACK_PERM=1 TSval=480657118 TSecr=551272629 WS=128
 1591 61.552779803 104.108.116.202 → 192.168.8.128 TCP 74 [TCP Out-Of-Order] 443 → 46068 [SYN, ACK] Seq=0 Ack=1 Win=28960 Len=0 MSS=1300 SACK_PERM=1 TSval=480657131 TSecr=551272629 WS=128
 1610 61.636725152 192.168.8.128 → 93.184.215.201 TCP 74 52426 → 443 [SYN] Seq=0 Win=29200 Len=0 MSS=1460 SACK_PERM=1 TSval=2067642357 TSecr=0 WS=128
 1611 61.641428115 93.184.215.201 → 192.168.8.128 TCP 66 443 → 52426 [SYN, ACK] Seq=0 Ack=1 Win=65535 Len=0 MSS=1300 SACK_PERM=1 WS=512
 1772 62.830509889 192.168.8.128 → 172.217.10.5 TCP 74 53030 → 443 [SYN] Seq=0 Win=29200 Len=0 MSS=1460 SACK_PERM=1 TSval=2235351750 TSecr=0 WS=128
 1773 62.835323852 172.217.10.5 → 192.168.8.128 TCP 74 443 → 53030 [SYN, ACK] Seq=0 Ack=1 Win=60192 Len=0 MSS=1300 SACK_PERM=1 TSval=1175442494 TSecr=2235351750 WS=256
 1927 75.971236631 192.168.8.128 → 31.13.71.7   TCP 74 36302 → 443 [SYN] Seq=0 Win=29200 Len=0 MSS=1460 SACK_PERM=1 TSval=2694188691 TSecr=0 WS=128
 1928 75.975015602   31.13.71.7 → 192.168.8.128 TCP 74 443 → 36302 [SYN, ACK] Seq=0 Ack=1 Win=27760 Len=0 MSS=1300 SACK_PERM=1 TSval=1476677459 TSecr=2694188691 WS=256
 1932 76.212890746 192.168.8.128 → 31.13.71.7   TCP 74 36304 → 443 [SYN] Seq=0 Win=29200 Len=0 MSS=1460 SACK_PERM=1 TSval=2694188933 TSecr=0 WS=128
 1934 76.215812723   31.13.71.7 → 192.168.8.128 TCP 74 443 → 36304 [SYN, ACK] Seq=0 Ack=1 Win=27760 Len=0 MSS=1300 SACK_PERM=1 TSval=3258860764 TSecr=2694188933 WS=256
 1935 76.216593717 192.168.8.128 → 31.13.71.7   TCP 74 36306 → 443 [SYN] Seq=0 Win=29200 Len=0 MSS=1460 SACK_PERM=1 TSval=2694188937 TSecr=0 WS=128
 1938 76.220415687   31.13.71.7 → 192.168.8.128 TCP 74 443 → 36306 [SYN, ACK] Seq=0 Ack=1 Win=27760 Len=0 MSS=1300 SACK_PERM=1 TSval=1005646051 TSecr=2694188937 WS=256
 1940 76.274708263 192.168.8.128 → 31.13.71.7   TCP 74 36308 → 443 [SYN] Seq=0 Win=29200 Len=0 MSS=1460 SACK_PERM=1 TSval=2694188995 TSecr=0 WS=128
 1941 76.278506234   31.13.71.7 → 192.168.8.128 TCP 74 443 → 36308 [SYN, ACK] Seq=0 Ack=1 Win=27760 Len=0 MSS=1300 SACK_PERM=1 TSval=2096924230 TSecr=2694188995 WS=256
 1943 76.308092003 192.168.8.128 → 31.13.71.7   TCP 74 36310 → 443 [SYN] Seq=0 Win=29200 Len=0 MSS=1460 SACK_PERM=1 TSval=2694189028 TSecr=0 WS=128
 1944 76.312129971   31.13.71.7 → 192.168.8.128 TCP 74 443 → 36310 [SYN, ACK] Seq=0 Ack=1 Win=27760 Len=0 MSS=1300 SACK_PERM=1 TSval=1721138486 TSecr=2694189028 WS=256
 1946 76.323922879 192.168.8.128 → 31.13.71.7   TCP 74 36312 → 443 [SYN] Seq=0 Win=29200 Len=0 MSS=1460 SACK_PERM=1 TSval=2694189044 TSecr=0 WS=128
 1947 76.328203846   31.13.71.7 → 192.168.8.128 TCP 74 443 → 36312 [SYN, ACK] Seq=0 Ack=1 Win=27760 Len=0 MSS=1300 SACK_PERM=1 TSval=3709546944 TSecr=2694189044 WS=256
 1949 76.378016457 192.168.8.128 → 31.13.71.7   TCP 74 36314 → 443 [SYN] Seq=0 Win=29200 Len=0 MSS=1460 SACK_PERM=1 TSval=2694189098 TSecr=0 WS=128
 1950 76.378315455 192.168.8.128 → 31.13.71.7   TCP 74 36316 → 443 [SYN] Seq=0 Win=29200 Len=0 MSS=1460 SACK_PERM=1 TSval=2694189098 TSecr=0 WS=128
 1951 76.379466446 192.168.8.128 → 31.13.71.7   TCP 74 36318 → 443 [SYN] Seq=0 Win=29200 Len=0 MSS=1460 SACK_PERM=1 TSval=2694189100 TSecr=0 WS=128
 1952 76.381777428   31.13.71.7 → 192.168.8.128 TCP 74 443 → 36316 [SYN, ACK] Seq=0 Ack=1 Win=27760 Len=0 MSS=1300 SACK_PERM=1 TSval=36507302 TSecr=2694189098 WS=256
 1953 76.381986426   31.13.71.7 → 192.168.8.128 TCP 74 443 → 36314 [SYN, ACK] Seq=0 Ack=1 Win=27760 Len=0 MSS=1300 SACK_PERM=1 TSval=4146076196 TSecr=2694189098 WS=256
 1956 76.384379407   31.13.71.7 → 192.168.8.128 TCP 74 443 → 36318 [SYN, ACK] Seq=0 Ack=1 Win=27760 Len=0 MSS=1300 SACK_PERM=1 TSval=411324478 TSecr=2694189100 WS=256
 2109 76.595263762 192.168.8.128 → 65.55.44.109 TCP 74 49712 → 443 [SYN] Seq=0 Win=29200 Len=0 MSS=1460 SACK_PERM=1 TSval=1232063339 TSecr=0 WS=128
 2116 76.613206622 65.55.44.109 → 192.168.8.128 TCP 74 443 → 49712 [SYN, ACK] Seq=0 Ack=1 Win=8192 Len=0 MSS=1300 WS=256 SACK_PERM=1 TSval=143417174 TSecr=1232063339
 2141 76.690777016 192.168.8.128 → 65.55.44.109 TCP 74 49714 → 443 [SYN] Seq=0 Win=29200 Len=0 MSS=1460 SACK_PERM=1 TSval=1232063434 TSecr=0 WS=128
 2147 76.706175896 65.55.44.109 → 192.168.8.128 TCP 74 443 → 49714 [SYN, ACK] Seq=0 Ack=1 Win=8192 Len=0 MSS=1300 WS=256 SACK_PERM=1 TSval=2161933496 TSecr=1232063434
 2268 78.329552222 192.168.8.128 → 31.13.71.1   TCP 74 36486 → 443 [SYN] Seq=0 Win=29200 Len=0 MSS=1460 SACK_PERM=1 TSval=2484410687 TSecr=0 WS=128
 2269 78.333740190   31.13.71.1 → 192.168.8.128 TCP 74 443 → 36486 [SYN, ACK] Seq=0 Ack=1 Win=27760 Len=0 MSS=1300 SACK_PERM=1 TSval=466466553 TSecr=2484410687 WS=256
 2300 79.509373006 192.168.8.128 → 192.168.8.1  TCP 74 41158 → 80 [SYN] Seq=0 Win=29200 Len=0 MSS=1460 SACK_PERM=1 TSval=2623229587 TSecr=0 WS=128
 2301 79.509647004  192.168.8.1 → 192.168.8.128 TCP 74 80 → 41158 [SYN, ACK] Seq=0 Ack=1 Win=28960 Len=0 MSS=1460 SACK_PERM=1 TSval=2086699 TSecr=2623229587 WS=16
 2469 88.474151841 192.168.8.128 → 52.94.228.73 TCP 74 60288 → 443 [SYN] Seq=0 Win=29200 Len=0 MSS=1460 SACK_PERM=1 TSval=1949805271 TSecr=0 WS=128
 2474 88.484123763 52.94.228.73 → 192.168.8.128 TCP 66 443 → 60288 [SYN, ACK] Seq=0 Ack=1 Win=8190 Len=0 MSS=1212 WS=64 SACK_PERM=1
 2568 95.865547807 192.168.8.128 → 31.13.71.7   TCP 74 36330 → 443 [SYN] Seq=0 Win=29200 Len=0 MSS=1460 SACK_PERM=1 TSval=2694208585 TSecr=0 WS=128
 2569 95.865830805 192.168.8.128 → 31.13.71.7   TCP 74 36332 → 443 [SYN] Seq=0 Win=29200 Len=0 MSS=1460 SACK_PERM=1 TSval=2694208585 TSecr=0 WS=128
 2570 95.869484776   31.13.71.7 → 192.168.8.128 TCP 74 443 → 36332 [SYN, ACK] Seq=0 Ack=1 Win=27760 Len=0 MSS=1300 SACK_PERM=1 TSval=3602979793 TSecr=2694208585 WS=256
 2571 95.869731774   31.13.71.7 → 192.168.8.128 TCP 74 443 → 36330 [SYN, ACK] Seq=0 Ack=1 Win=27760 Len=0 MSS=1300 SACK_PERM=1 TSval=276415651 TSecr=2694208585 WS=256
 2834 126.162704258 192.168.8.245 → 17.248.135.9 TCP 78 62141 → 443 [SYN] Seq=0 Win=65535 Len=0 MSS=1460 WS=128 TSval=832893085 TSecr=0 SACK_PERM=1
 2836 126.166828225 17.248.135.9 → 192.168.8.245 TCP 74 443 → 62141 [SYN, ACK] Seq=0 Ack=1 Win=28960 Len=0 MSS=1300 TSval=355231241 TSecr=832893085 WS=32
 2874 126.246162594 192.168.8.245 → 17.249.130.18 TCP 78 62142 → 443 [SYN] Seq=0 Win=65535 Len=0 MSS=1460 WS=128 TSval=832924621 TSecr=0 SACK_PERM=1
 2875 126.271004396 17.249.130.18 → 192.168.8.245 TCP 66 443 → 62142 [SYN, ACK] Seq=0 Ack=1 Win=8190 Len=0 MSS=1220 WS=128 SACK_PERM=1
 2998 127.824014046 192.168.8.245 → 17.188.196.69 TCP 78 62143 → 443 [SYN] Seq=0 Win=65535 Len=0 MSS=1460 WS=128 TSval=832894730 TSecr=0 SACK_PERM=1
 2999 127.834205965 17.188.196.69 → 192.168.8.245 TCP 66 443 → 62143 [SYN, ACK] Seq=0 Ack=1 Win=8190 Len=0 MSS=1220 WS=128 SACK_PERM=1
 3014 127.876202631 192.168.8.245 → 72.21.91.29  TCP 78 62144 → 80 [SYN] Seq=0 Win=65535 Len=0 MSS=1460 WS=128 TSval=832926623 TSecr=0 SACK_PERM=1
 3015 127.881087592  72.21.91.29 → 192.168.8.245 TCP 74 80 → 62144 [SYN, ACK] Seq=0 Ack=1 Win=65535 Len=0 MSS=1300 SACK_PERM=1 TSval=1698363964 TSecr=832926623 WS=512
 3035 128.000475643 192.168.8.245 → 17.248.135.9 TCP 78 62145 → 443 [SYN] Seq=0 Win=65535 Len=0 MSS=1460 WS=128 TSval=832927035 TSecr=0 SACK_PERM=1
 3036 128.004369612 17.248.135.9 → 192.168.8.245 TCP 74 443 → 62145 [SYN, ACK] Seq=0 Ack=1 Win=28960 Len=0 MSS=1300 TSval=355233079 TSecr=832927035 WS=32
 3061 128.056978193 192.168.8.245 → 17.57.144.6  TCP 78 49761 → 5223 [SYN] Seq=0 Win=65535 Len=0 MSS=1460 WS=64 TSval=832890337 TSecr=0 SACK_PERM=1
 3062 128.061159160  17.57.144.6 → 192.168.8.245 TCP 74 5223 → 49761 [SYN, ACK] Seq=0 Ack=1 Win=28960 Len=0 MSS=1300 SACK_PERM=1 TSval=1388692970 TSecr=832890337 WS=128
 3528 172.359665092 192.168.8.128 → 104.154.127.47 TCP 74 55536 → 80 [SYN] Seq=0 Win=29200 Len=0 MSS=1460 SACK_PERM=1 TSval=2545504266 TSecr=0 WS=128
 3531 172.390737841 104.154.127.47 → 192.168.8.128 TCP 74 80 → 55536 [SYN, ACK] Seq=0 Ack=1 Win=24560 Len=0 MSS=1240 SACK_PERM=1 TSval=527930616 TSecr=2545504266 WS=128
 3545 172.435034483 192.168.8.128 → 35.190.244.13 TCP 74 36538 → 4070 [SYN] Seq=0 Win=29200 Len=0 MSS=1460 SACK_PERM=1 TSval=415121405 TSecr=0 WS=128
 3546 172.465840234 35.190.244.13 → 192.168.8.128 TCP 74 4070 → 36538 [SYN, ACK] Seq=0 Ack=1 Win=42980 Len=0 MSS=1240 SACK_PERM=1 TSval=910699691 TSecr=415121405 WS=4096
 3623 172.691287414 192.168.8.128 → 35.186.224.53 TCP 74 43478 → 443 [SYN] Seq=0 Win=29200 Len=0 MSS=1460 SACK_PERM=1 TSval=1820979993 TSecr=0 WS=128
 3624 172.696118375 35.186.224.53 → 192.168.8.128 TCP 74 443 → 43478 [SYN, ACK] Seq=0 Ack=1 Win=60192 Len=0 MSS=1300 SACK_PERM=1 TSval=2961521172 TSecr=1820979993 WS=256
 3680 172.808409468 192.168.8.128 → 35.186.224.47 TCP 74 35558 → 443 [SYN] Seq=0 Win=29200 Len=0 MSS=1460 SACK_PERM=1 TSval=1281426700 TSecr=0 WS=128
 3681 172.813735425 35.186.224.47 → 192.168.8.128 TCP 74 443 → 35558 [SYN, ACK] Seq=0 Ack=1 Win=60192 Len=0 MSS=1300 SACK_PERM=1 TSval=3526782135 TSecr=1281426700 WS=256
 3722 172.975445120 192.168.8.128 → 31.13.71.1   TCP 74 36512 → 443 [SYN] Seq=0 Win=29200 Len=0 MSS=1460 SACK_PERM=1 TSval=2484505331 TSecr=0 WS=128
 3723 172.979322088   31.13.71.1 → 192.168.8.128 TCP 74 443 → 36512 [SYN, ACK] Seq=0 Ack=1 Win=27760 Len=0 MSS=1300 SACK_PERM=1 TSval=3168218297 TSecr=2484505331 WS=256
 3790 173.369935934 192.168.8.128 → 35.186.224.53 TCP 74 43484 → 443 [SYN] Seq=0 Win=29200 Len=0 MSS=1460 SACK_PERM=1 TSval=1820980671 TSecr=0 WS=128
 3792 173.374499897 35.186.224.53 → 192.168.8.128 TCP 74 443 → 43484 [SYN, ACK] Seq=0 Ack=1 Win=60192 Len=0 MSS=1300 SACK_PERM=1 TSval=4175202671 TSecr=1820980671 WS=256
 3886 173.904534616 192.168.8.128 → 35.186.224.53 TCP 74 43486 → 443 [SYN] Seq=0 Win=29200 Len=0 MSS=1460 SACK_PERM=1 TSval=1820981206 TSecr=0 WS=128
 3887 173.904826613 192.168.8.128 → 35.186.224.53 TCP 74 43488 → 443 [SYN] Seq=0 Win=29200 Len=0 MSS=1460 SACK_PERM=1 TSval=1820981206 TSecr=0 WS=128
 3888 173.909551575 35.186.224.53 → 192.168.8.128 TCP 74 443 → 43486 [SYN, ACK] Seq=0 Ack=1 Win=60192 Len=0 MSS=1300 SACK_PERM=1 TSval=4275449256 TSecr=1820981206 WS=256
 3889 173.909804573 35.186.224.53 → 192.168.8.128 TCP 74 443 → 43488 [SYN, ACK] Seq=0 Ack=1 Win=60192 Len=0 MSS=1300 SACK_PERM=1 TSval=4027865930 TSecr=1820981206 WS=256
 3904 173.993327899 192.168.8.128 → 35.186.224.53 TCP 74 43490 → 443 [SYN] Seq=0 Win=29200 Len=0 MSS=1460 SACK_PERM=1 TSval=1820981295 TSecr=0 WS=128
 3905 173.998256859 35.186.224.53 → 192.168.8.128 TCP 74 443 → 43490 [SYN, ACK] Seq=0 Ack=1 Win=60192 Len=0 MSS=1300 SACK_PERM=1 TSval=2123500931 TSecr=1820981295 WS=256
 3921 174.158945561 192.168.8.128 → 199.232.36.246 TCP 74 55834 → 443 [SYN] Seq=0 Win=29200 Len=0 MSS=1460 SACK_PERM=1 TSval=4242448321 TSecr=0 WS=128
 3922 174.162672531 199.232.36.246 → 192.168.8.128 TCP 74 443 → 55834 [SYN, ACK] Seq=0 Ack=1 Win=28960 Len=0 MSS=1300 SACK_PERM=1 TSval=538146736 TSecr=4242448321 WS=512
 3934 174.181041382 192.168.8.128 → 199.232.36.246 TCP 74 55836 → 443 [SYN] Seq=0 Win=29200 Len=0 MSS=1460 SACK_PERM=1 TSval=4242448342 TSecr=0 WS=128
 3935 174.184802352 199.232.36.246 → 192.168.8.128 TCP 74 443 → 55836 [SYN, ACK] Seq=0 Ack=1 Win=28960 Len=0 MSS=1300 SACK_PERM=1 TSval=2196584019 TSecr=4242448342 WS=512
 3961 174.350296015 192.168.8.128 → 199.232.36.246 TCP 74 55838 → 443 [SYN] Seq=0 Win=29200 Len=0 MSS=1460 SACK_PERM=1 TSval=4242448512 TSecr=0 WS=128
 3962 174.353931985 199.232.36.246 → 192.168.8.128 TCP 74 443 → 55838 [SYN, ACK] Seq=0 Ack=1 Win=28960 Len=0 MSS=1300 SACK_PERM=1 TSval=2219832274 TSecr=4242448512 WS=512
 3976 174.434540334 192.168.8.128 → 199.232.36.246 TCP 74 55840 → 443 [SYN] Seq=0 Win=29200 Len=0 MSS=1460 SACK_PERM=1 TSval=4242448596 TSecr=0 WS=128
 3977 174.434848332 192.168.8.128 → 199.232.36.246 TCP 74 55842 → 443 [SYN] Seq=0 Win=29200 Len=0 MSS=1460 SACK_PERM=1 TSval=4242448596 TSecr=0 WS=128
 3978 174.435045330 192.168.8.128 → 199.232.36.246 TCP 74 55844 → 443 [SYN] Seq=0 Win=29200 Len=0 MSS=1460 SACK_PERM=1 TSval=4242448596 TSecr=0 WS=128
 3981 174.438648301 199.232.36.246 → 192.168.8.128 TCP 74 443 → 55842 [SYN, ACK] Seq=0 Ack=1 Win=28960 Len=0 MSS=1300 SACK_PERM=1 TSval=2218122434 TSecr=4242448596 WS=512
 3982 174.438882299 199.232.36.246 → 192.168.8.128 TCP 74 443 → 55840 [SYN, ACK] Seq=0 Ack=1 Win=28960 Len=0 MSS=1300 SACK_PERM=1 TSval=2197869597 TSecr=4242448596 WS=512
 3983 174.439046298 199.232.36.246 → 192.168.8.128 TCP 74 443 → 55844 [SYN, ACK] Seq=0 Ack=1 Win=28960 Len=0 MSS=1300 SACK_PERM=1 TSval=667520913 TSecr=4242448596 WS=512
 3990 174.441790276 192.168.8.128 → 199.232.36.246 TCP 74 55846 → 443 [SYN] Seq=0 Win=29200 Len=0 MSS=1460 SACK_PERM=1 TSval=4242448603 TSecr=0 WS=128
 3993 174.444636253 199.232.36.246 → 192.168.8.128 TCP 74 443 → 55846 [SYN, ACK] Seq=0 Ack=1 Win=28960 Len=0 MSS=1300 SACK_PERM=1 TSval=534729687 TSecr=4242448603 WS=512
 4022 174.532990539 192.168.8.128 → 199.232.36.246 TCP 74 55848 → 443 [SYN] Seq=0 Win=29200 Len=0 MSS=1460 SACK_PERM=1 TSval=4242448694 TSecr=0 WS=128
 4023 174.533272536 192.168.8.128 → 199.232.36.246 TCP 74 55850 → 443 [SYN] Seq=0 Win=29200 Len=0 MSS=1460 SACK_PERM=1 TSval=4242448695 TSecr=0 WS=128
 4024 174.533510535 192.168.8.128 → 199.232.36.246 TCP 74 55852 → 443 [SYN] Seq=0 Win=29200 Len=0 MSS=1460 SACK_PERM=1 TSval=4242448695 TSecr=0 WS=128
 4025 174.533776532 192.168.8.128 → 199.232.36.246 TCP 74 55854 → 443 [SYN] Seq=0 Win=29200 Len=0 MSS=1460 SACK_PERM=1 TSval=4242448695 TSecr=0 WS=128
 4026 174.534049530 192.168.8.128 → 199.232.36.246 TCP 74 55856 → 443 [SYN] Seq=0 Win=29200 Len=0 MSS=1460 SACK_PERM=1 TSval=4242448695 TSecr=0 WS=128
 4027 174.538181497 199.232.36.246 → 192.168.8.128 TCP 74 443 → 55848 [SYN, ACK] Seq=0 Ack=1 Win=28960 Len=0 MSS=1300 SACK_PERM=1 TSval=676090781 TSecr=4242448694 WS=512
 4028 174.538425495 199.232.36.246 → 192.168.8.128 TCP 74 443 → 55850 [SYN, ACK] Seq=0 Ack=1 Win=28960 Len=0 MSS=1300 SACK_PERM=1 TSval=2199802869 TSecr=4242448695 WS=512
 4029 174.538644493 199.232.36.246 → 192.168.8.128 TCP 74 443 → 55854 [SYN, ACK] Seq=0 Ack=1 Win=28960 Len=0 MSS=1300 SACK_PERM=1 TSval=537464100 TSecr=4242448695 WS=512
 4030 174.538909491 199.232.36.246 → 192.168.8.128 TCP 74 443 → 55852 [SYN, ACK] Seq=0 Ack=1 Win=28960 Len=0 MSS=1300 SACK_PERM=1 TSval=2195937954 TSecr=4242448695 WS=512
 4031 174.539061490 199.232.36.246 → 192.168.8.128 TCP 74 443 → 55856 [SYN, ACK] Seq=0 Ack=1 Win=28960 Len=0 MSS=1300 SACK_PERM=1 TSval=538146830 TSecr=4242448695 WS=512
 4083 174.604878958 192.168.8.128 → 199.232.36.246 TCP 74 55858 → 443 [SYN] Seq=0 Win=29200 Len=0 MSS=1460 SACK_PERM=1 TSval=4242448766 TSecr=0 WS=128
 4091 174.608610928 199.232.36.246 → 192.168.8.128 TCP 74 443 → 55858 [SYN, ACK] Seq=0 Ack=1 Win=28960 Len=0 MSS=1300 SACK_PERM=1 TSval=1442311374 TSecr=4242448766 WS=512
 4116 174.616849861 192.168.8.128 → 199.232.36.246 TCP 74 55860 → 443 [SYN] Seq=0 Win=29200 Len=0 MSS=1460 SACK_PERM=1 TSval=4242448778 TSecr=0 WS=128
 4117 174.617141859 192.168.8.128 → 199.232.36.246 TCP 74 55862 → 443 [SYN] Seq=0 Win=29200 Len=0 MSS=1460 SACK_PERM=1 TSval=4242448778 TSecr=0 WS=128
 4142 174.622409816 199.232.36.246 → 192.168.8.128 TCP 74 443 → 55862 [SYN, ACK] Seq=0 Ack=1 Win=28960 Len=0 MSS=1300 SACK_PERM=1 TSval=2218690714 TSecr=4242448778 WS=512
 4143 174.622413816 199.232.36.246 → 192.168.8.128 TCP 74 443 → 55860 [SYN, ACK] Seq=0 Ack=1 Win=28960 Len=0 MSS=1300 SACK_PERM=1 TSval=667521994 TSecr=4242448778 WS=512
 4302 174.649641596 192.168.8.128 → 199.232.36.246 TCP 74 55864 → 443 [SYN] Seq=0 Win=29200 Len=0 MSS=1460 SACK_PERM=1 TSval=4242448810 TSecr=0 WS=128
 4353 174.659169519 199.232.36.246 → 192.168.8.128 TCP 74 443 → 55864 [SYN, ACK] Seq=0 Ack=1 Win=28960 Len=0 MSS=1300 SACK_PERM=1 TSval=2219832350 TSecr=4242448810 WS=512
 4589 174.834490103 192.168.8.128 → 199.232.36.246 TCP 74 55866 → 443 [SYN] Seq=0 Win=29200 Len=0 MSS=1460 SACK_PERM=1 TSval=4242448996 TSecr=0 WS=128
 4625 174.841810044 199.232.36.246 → 192.168.8.128 TCP 74 443 → 55866 [SYN, ACK] Seq=0 Ack=1 Win=28960 Len=0 MSS=1300 SACK_PERM=1 TSval=667522049 TSecr=4242448996 WS=512
 4687 174.924127379 192.168.8.128 → 199.232.36.246 TCP 74 55868 → 443 [SYN] Seq=0 Win=29200 Len=0 MSS=1460 SACK_PERM=1 TSval=4242449086 TSecr=0 WS=128
 4688 174.924403376 192.168.8.128 → 199.232.36.246 TCP 74 55870 → 443 [SYN] Seq=0 Win=29200 Len=0 MSS=1460 SACK_PERM=1 TSval=4242449086 TSecr=0 WS=128
 4691 174.927921348 199.232.36.246 → 192.168.8.128 TCP 74 443 → 55868 [SYN, ACK] Seq=0 Ack=1 Win=28960 Len=0 MSS=1300 SACK_PERM=1 TSval=2200443065 TSecr=4242449086 WS=512
 4692 174.928160346 199.232.36.246 → 192.168.8.128 TCP 74 443 → 55870 [SYN, ACK] Seq=0 Ack=1 Win=28960 Len=0 MSS=1300 SACK_PERM=1 TSval=676090879 TSecr=4242449086 WS=512
 4748 175.137594654 192.168.8.128 → 172.217.12.130 TCP 74 53092 → 443 [SYN] Seq=0 Win=29200 Len=0 MSS=1460 SACK_PERM=1 TSval=689785551 TSecr=0 WS=128
 4749 175.142166617 172.217.12.130 → 192.168.8.128 TCP 74 443 → 53092 [SYN, ACK] Seq=0 Ack=1 Win=60192 Len=0 MSS=1300 SACK_PERM=1 TSval=1526152480 TSecr=689785551 WS=256
 4765 175.183740281 192.168.8.128 → 199.232.36.246 TCP 74 55874 → 443 [SYN] Seq=0 Win=29200 Len=0 MSS=1460 SACK_PERM=1 TSval=4242449345 TSecr=0 WS=128
 4767 175.187354252 199.232.36.246 → 192.168.8.128 TCP 74 443 → 55874 [SYN, ACK] Seq=0 Ack=1 Win=28960 Len=0 MSS=1300 SACK_PERM=1 TSval=536087075 TSecr=4242449345 WS=512
 4799 175.305736295 192.168.8.128 → 172.217.12.130 TCP 74 53096 → 443 [SYN] Seq=0 Win=29200 Len=0 MSS=1460 SACK_PERM=1 TSval=689785719 TSecr=0 WS=128
 4800 175.310486257 172.217.12.130 → 192.168.8.128 TCP 74 443 → 53096 [SYN, ACK] Seq=0 Ack=1 Win=60192 Len=0 MSS=1300 SACK_PERM=1 TSval=1466442149 TSecr=689785719 WS=256
 4834 175.450639124 192.168.8.128 → 172.217.10.66 TCP 74 44152 → 443 [SYN] Seq=0 Win=29200 Len=0 MSS=1460 SACK_PERM=1 TSval=2474676809 TSecr=0 WS=128
 4835 175.455298086 172.217.10.66 → 192.168.8.128 TCP 74 443 → 44152 [SYN, ACK] Seq=0 Ack=1 Win=60192 Len=0 MSS=1300 SACK_PERM=1 TSval=2132689557 TSecr=2474676809 WS=256
 4954 175.987498785 192.168.8.128 → 199.232.36.246 TCP 74 55880 → 443 [SYN] Seq=0 Win=29200 Len=0 MSS=1460 SACK_PERM=1 TSval=4242450149 TSecr=0 WS=128
 4957 175.991193755 199.232.36.246 → 192.168.8.128 TCP 74 443 → 55880 [SYN, ACK] Seq=0 Ack=1 Win=28960 Len=0 MSS=1300 SACK_PERM=1 TSval=1445366513 TSecr=4242450149 WS=512
 5015 176.346649882 192.168.8.128 → 199.232.36.246 TCP 74 55882 → 443 [SYN] Seq=0 Win=29200 Len=0 MSS=1460 SACK_PERM=1 TSval=4242450508 TSecr=0 WS=128
 5017 176.350522850 199.232.36.246 → 192.168.8.128 TCP 74 443 → 55882 [SYN, ACK] Seq=0 Ack=1 Win=28960 Len=0 MSS=1300 SACK_PERM=1 TSval=537464553 TSecr=4242450508 WS=512
 5063 176.598385846 192.168.8.128 → 199.232.36.246 TCP 74 55884 → 443 [SYN] Seq=0 Win=29200 Len=0 MSS=1460 SACK_PERM=1 TSval=4242450760 TSecr=0 WS=128
 5064 176.599315839 192.168.8.128 → 199.232.36.246 TCP 74 55886 → 443 [SYN] Seq=0 Win=29200 Len=0 MSS=1460 SACK_PERM=1 TSval=4242450761 TSecr=0 WS=128
 5065 176.599620836 192.168.8.128 → 199.232.36.246 TCP 74 55888 → 443 [SYN] Seq=0 Win=29200 Len=0 MSS=1460 SACK_PERM=1 TSval=4242450761 TSecr=0 WS=128
 5068 176.602137816 199.232.36.246 → 192.168.8.128 TCP 74 443 → 55884 [SYN, ACK] Seq=0 Ack=1 Win=28960 Len=0 MSS=1300 SACK_PERM=1 TSval=534730227 TSecr=4242450760 WS=512
 5069 176.602377814 199.232.36.246 → 192.168.8.128 TCP 74 443 → 55886 [SYN, ACK] Seq=0 Ack=1 Win=28960 Len=0 MSS=1300 SACK_PERM=1 TSval=516558515 TSecr=4242450761 WS=512
 5074 176.604380798 199.232.36.246 → 192.168.8.128 TCP 74 443 → 55888 [SYN, ACK] Seq=0 Ack=1 Win=28960 Len=0 MSS=1300 SACK_PERM=1 TSval=2198512898 TSecr=4242450761 WS=512
 5137 176.866226681 192.168.8.128 → 104.154.127.47 TCP 74 60482 → 443 [SYN] Seq=0 Win=29200 Len=0 MSS=1460 SACK_PERM=1 TSval=2545508773 TSecr=0 WS=128
 5148 176.896706435 104.154.127.47 → 192.168.8.128 TCP 74 443 → 60482 [SYN, ACK] Seq=0 Ack=1 Win=24560 Len=0 MSS=1240 SACK_PERM=1 TSval=528576656 TSecr=2545508773 WS=128
 5417 180.622081296 192.168.8.128 → 35.186.224.30 TCP 74 40552 → 443 [SYN] Seq=0 Win=29200 Len=0 MSS=1460 SACK_PERM=1 TSval=2631569570 TSecr=0 WS=128
 5418 180.627278254 35.186.224.30 → 192.168.8.128 TCP 74 443 → 40552 [SYN, ACK] Seq=0 Ack=1 Win=60192 Len=0 MSS=1300 SACK_PERM=1 TSval=2345751722 TSecr=2631569570 WS=256
 5444 180.825838647 192.168.8.128 → 199.232.36.246 TCP 74 37604 → 80 [SYN] Seq=0 Win=29200 Len=0 MSS=1460 SACK_PERM=1 TSval=4242454987 TSecr=0 WS=128
 5445 180.829719616 199.232.36.246 → 192.168.8.128 TCP 74 80 → 37604 [SYN, ACK] Seq=0 Ack=1 Win=28960 Len=0 MSS=1300 SACK_PERM=1 TSval=534731283 TSecr=4242454987 WS=512
 6325 274.931185352 192.168.8.128 → 172.232.6.139 TCP 74 51972 → 443 [SYN] Seq=0 Win=29200 Len=0 MSS=1460 SACK_PERM=1 TSval=1736365989 TSecr=0 WS=128
 6326 274.936441309 172.232.6.139 → 192.168.8.128 TCP 74 443 → 51972 [SYN, ACK] Seq=0 Ack=1 Win=28960 Len=0 MSS=1300 SACK_PERM=1 TSval=1363280039 TSecr=1736365989 WS=128
 6380 275.041012439 192.168.8.128 → 35.186.224.30 TCP 74 40558 → 443 [SYN] Seq=0 Win=29200 Len=0 MSS=1460 SACK_PERM=1 TSval=2631663987 TSecr=0 WS=128
 6446 275.067543219 35.186.224.30 → 192.168.8.128 TCP 74 443 → 40558 [SYN, ACK] Seq=0 Ack=1 Win=60192 Len=0 MSS=1300 SACK_PERM=1 TSval=720327956 TSecr=2631663987 WS=256
 6490 275.167239390 192.168.8.128 → 199.232.36.246 TCP 74 37610 → 80 [SYN] Seq=0 Win=29200 Len=0 MSS=1460 SACK_PERM=1 TSval=4242549327 TSecr=0 WS=128
 6491 275.171136358 199.232.36.246 → 192.168.8.128 TCP 74 80 → 37610 [SYN, ACK] Seq=0 Ack=1 Win=28960 Len=0 MSS=1300 SACK_PERM=1 TSval=676115939 TSecr=4242549327 WS=512
 6498 275.175870319 192.168.8.128 → 199.232.36.246 TCP 74 37612 → 80 [SYN] Seq=0 Win=29200 Len=0 MSS=1460 SACK_PERM=1 TSval=4242549336 TSecr=0 WS=128
 6502 275.179721287 199.232.36.246 → 192.168.8.128 TCP 74 80 → 37612 [SYN, ACK] Seq=0 Ack=1 Win=28960 Len=0 MSS=1300 SACK_PERM=1 TSval=537489261 TSecr=4242549336 WS=512
 6948 306.622862914 192.168.8.128 → 34.212.28.14 TCP 74 58638 → 443 [SYN] Seq=0 Win=29200 Len=0 MSS=1460 SACK_PERM=1 TSval=2292904963 TSecr=0 WS=128
 6949 306.700858261 34.212.28.14 → 192.168.8.128 TCP 74 443 → 58638 [SYN, ACK] Seq=0 Ack=1 Win=17898 Len=0 MSS=1300 SACK_PERM=1 TSval=3463072979 TSecr=2292904963 WS=128
 6977 307.168855341 192.168.8.128 → 52.11.86.147 TCP 74 44536 → 443 [SYN] Seq=0 Win=29200 Len=0 MSS=1460 SACK_PERM=1 TSval=2843301037 TSecr=0 WS=128
 6978 307.247046686 52.11.86.147 → 192.168.8.128 TCP 74 443 → 44536 [SYN, ACK] Seq=0 Ack=1 Win=26847 Len=0 MSS=1300 SACK_PERM=1 TSval=28561367 TSecr=2843301037 WS=256
 7085 308.387289132 192.168.8.128 → 34.95.71.207 TCP 74 56384 → 443 [SYN] Seq=0 Win=29200 Len=0 MSS=1460 SACK_PERM=1 TSval=1160936433 TSecr=0 WS=128
 7086 308.391973093 34.95.71.207 → 192.168.8.128 TCP 74 443 → 56384 [SYN, ACK] Seq=0 Ack=1 Win=60192 Len=0 MSS=1300 SACK_PERM=1 TSval=3618125460 TSecr=1160936433 WS=256
 7875 400.162826319 192.168.8.128 → 199.232.37.140 TCP 74 35540 → 443 [SYN] Seq=0 Win=29200 Len=0 MSS=1460 SACK_PERM=1 TSval=4069672326 TSecr=0 WS=128
 7876 400.166392288 199.232.37.140 → 192.168.8.128 TCP 74 443 → 35540 [SYN, ACK] Seq=0 Ack=1 Win=28960 Len=0 MSS=1300 SACK_PERM=1 TSval=2219324821 TSecr=4069672326 WS=512
 8321 446.628024592 192.168.8.128 → 35.186.224.30 TCP 74 40572 → 443 [SYN] Seq=0 Win=29200 Len=0 MSS=1460 SACK_PERM=1 TSval=2631835572 TSecr=0 WS=128
 8323 446.632742551 35.186.224.30 → 192.168.8.128 TCP 74 443 → 40572 [SYN, ACK] Seq=0 Ack=1 Win=60192 Len=0 MSS=1300 SACK_PERM=1 TSval=2502798293 TSecr=2631835572 WS=256
 8345 446.727063738 192.168.8.128 → 199.232.36.246 TCP 74 37624 → 80 [SYN] Seq=0 Win=29200 Len=0 MSS=1460 SACK_PERM=1 TSval=4242720884 TSecr=0 WS=128
 8346 446.730898705 199.232.36.246 → 192.168.8.128 TCP 74 80 → 37624 [SYN, ACK] Seq=0 Ack=1 Win=28960 Len=0 MSS=1300 SACK_PERM=1 TSval=667590022 TSecr=4242720884 WS=512
 8530 467.722809488 192.168.8.128 → 172.217.12.170 TCP 74 49554 → 443 [SYN] Seq=0 Win=29200 Len=0 MSS=1460 SACK_PERM=1 TSval=1078608342 TSecr=0 WS=128
 8531 467.727641446 172.217.12.170 → 192.168.8.128 TCP 74 443 → 49554 [SYN, ACK] Seq=0 Ack=1 Win=60192 Len=0 MSS=1300 SACK_PERM=1 TSval=420148363 TSecr=1078608342 WS=256
 8806 497.479271530 192.168.8.128 → 173.194.68.189 TCP 74 41958 → 443 [SYN] Seq=0 Win=29200 Len=0 MSS=1460 SACK_PERM=1 TSval=2850800090 TSecr=0 WS=128
 8807 497.496964377 173.194.68.189 → 192.168.8.128 TCP 74 443 → 41958 [SYN, ACK] Seq=0 Ack=1 Win=62392 Len=0 MSS=1300 SACK_PERM=1 TSval=2087224298 TSecr=2850800090 WS=256
 8945 513.062148960 192.168.8.128 → 192.168.8.1  TCP 74 41278 → 80 [SYN] Seq=0 Win=29200 Len=0 MSS=1460 SACK_PERM=1 TSval=2623663129 TSecr=0 WS=128
 8946 513.062426957  192.168.8.1 → 192.168.8.128 TCP 74 80 → 41278 [SYN, ACK] Seq=0 Ack=1 Win=28960 Len=0 MSS=1460 SACK_PERM=1 TSval=2130054 TSecr=2623663129 WS=16
 9488 586.923809180 192.168.8.128 → 23.52.164.254 TCP 74 33308 → 443 [SYN] Seq=0 Win=29200 Len=0 MSS=1460 SACK_PERM=1 TSval=1313396451 TSecr=0 WS=128
 9489 586.928937135 23.52.164.254 → 192.168.8.128 TCP 74 443 → 33308 [SYN, ACK] Seq=0 Ack=1 Win=28960 Len=0 MSS=1300 SACK_PERM=1 TSval=2369982493 TSecr=1313396451 WS=128
 9491 586.934772083 23.52.164.254 → 192.168.8.128 TCP 74 [TCP Out-Of-Order] 443 → 33308 [SYN, ACK] Seq=0 Ack=1 Win=28960 Len=0 MSS=1300 SACK_PERM=1 TSval=2369982498 TSecr=1313396451 WS=128
 9555 587.069944894 192.168.8.128 → 54.149.29.182 TCP 74 38858 → 443 [SYN] Seq=0 Win=29200 Len=0 MSS=1460 SACK_PERM=1 TSval=1382647058 TSecr=0 WS=128
 9556 587.070245891 192.168.8.128 → 54.149.29.182 TCP 74 38860 → 443 [SYN] Seq=0 Win=29200 Len=0 MSS=1460 SACK_PERM=1 TSval=1382647058 TSecr=0 WS=128
 9557 587.146954216 54.149.29.182 → 192.168.8.128 TCP 74 443 → 38860 [SYN, ACK] Seq=0 Ack=1 Win=26847 Len=0 MSS=1300 SACK_PERM=1 TSval=776363242 TSecr=1382647058 WS=256
 9559 587.148548202 54.149.29.182 → 192.168.8.128 TCP 74 443 → 38858 [SYN, ACK] Seq=0 Ack=1 Win=26847 Len=0 MSS=1300 SACK_PERM=1 TSval=776363223 TSecr=1382647058 WS=256
10170 662.991245593 192.168.8.128 → 172.217.7.14 TCP 74 60274 → 443 [SYN] Seq=0 Win=29200 Len=0 MSS=1460 SACK_PERM=1 TSval=2055226738 TSecr=0 WS=128
10171 662.996300548 172.217.7.14 → 192.168.8.128 TCP 74 443 → 60274 [SYN, ACK] Seq=0 Ack=1 Win=60192 Len=0 MSS=1300 SACK_PERM=1 TSval=560611821 TSecr=2055226738 WS=256
10205 663.834467104 192.168.8.128 → 172.217.12.133 TCP 74 51944 → 443 [SYN] Seq=0 Win=29200 Len=0 MSS=1460 SACK_PERM=1 TSval=1628463855 TSecr=0 WS=128
10206 663.839042063 172.217.12.133 → 192.168.8.128 TCP 74 443 → 51944 [SYN, ACK] Seq=0 Ack=1 Win=60192 Len=0 MSS=1300 SACK_PERM=1 TSval=667740313 TSecr=1628463855 WS=256
10302 669.875515430 192.168.8.128 → 34.212.28.14 TCP 74 58666 → 443 [SYN] Seq=0 Win=29200 Len=0 MSS=1460 SACK_PERM=1 TSval=2293268210 TSecr=0 WS=128
10305 669.955259721 34.212.28.14 → 192.168.8.128 TCP 74 443 → 58666 [SYN, ACK] Seq=0 Ack=1 Win=17898 Len=0 MSS=1300 SACK_PERM=1 TSval=3463436231 TSecr=2293268210 WS=128
10330 670.428046519 192.168.8.128 → 52.11.86.147 TCP 74 44564 → 443 [SYN] Seq=0 Win=29200 Len=0 MSS=1460 SACK_PERM=1 TSval=2843664290 TSecr=0 WS=128
10333 670.505916826 52.11.86.147 → 192.168.8.128 TCP 74 443 → 44564 [SYN, ACK] Seq=0 Ack=1 Win=26847 Len=0 MSS=1300 SACK_PERM=1 TSval=28652214 TSecr=2843664290 WS=256
10387 671.079146731 192.168.8.128 → 34.95.71.207 TCP 74 56412 → 443 [SYN] Seq=0 Win=29200 Len=0 MSS=1460 SACK_PERM=1 TSval=1161299119 TSecr=0 WS=128
10388 671.083843689 34.95.71.207 → 192.168.8.128 TCP 74 443 → 56412 [SYN, ACK] Seq=0 Ack=1 Win=60192 Len=0 MSS=1300 SACK_PERM=1 TSval=711340722 TSecr=1161299119 WS=256
10514 676.465090841 192.168.8.128 → 65.55.44.109 TCP 74 49856 → 443 [SYN] Seq=0 Win=29200 Len=0 MSS=1460 SACK_PERM=1 TSval=1232663199 TSecr=0 WS=128
10515 676.481105699 65.55.44.109 → 192.168.8.128 TCP 74 443 → 49856 [SYN, ACK] Seq=0 Ack=1 Win=8192 Len=0 MSS=1300 WS=256 SACK_PERM=1 TSval=8282848 TSecr=1232663199
10683 694.992571891 192.168.8.128 → 35.186.224.53 TCP 74 43598 → 443 [SYN] Seq=0 Win=29200 Len=0 MSS=1460 SACK_PERM=1 TSval=1821502285 TSecr=0 WS=128
10684 694.997691846 35.186.224.53 → 192.168.8.128 TCP 74 443 → 43598 [SYN, ACK] Seq=0 Ack=1 Win=60192 Len=0 MSS=1300 SACK_PERM=1 TSval=3050766076 TSecr=1821502285 WS=256
10761 700.614776774 192.168.8.128 → 35.186.224.53 TCP 74 43600 → 443 [SYN] Seq=0 Win=29200 Len=0 MSS=1460 SACK_PERM=1 TSval=1821507907 TSecr=0 WS=128
10763 700.619843728 35.186.224.53 → 192.168.8.128 TCP 74 443 → 43600 [SYN, ACK] Seq=0 Ack=1 Win=60192 Len=0 MSS=1300 SACK_PERM=1 TSval=394506887 TSecr=1821507907 WS=256
10767 700.626189672 192.168.8.128 → 199.232.36.246 TCP 74 37654 → 80 [SYN] Seq=0 Win=29200 Len=0 MSS=1460 SACK_PERM=1 TSval=4242974779 TSecr=0 WS=128
10772 700.629865639 199.232.36.246 → 192.168.8.128 TCP 74 80 → 37654 [SYN, ACK] Seq=0 Ack=1 Win=28960 Len=0 MSS=1300 SACK_PERM=1 TSval=2218822216 TSecr=4242974779 WS=512
10791 700.643549517 192.168.8.128 → 35.186.224.30 TCP 74 40606 → 443 [SYN] Seq=0 Win=29200 Len=0 MSS=1460 SACK_PERM=1 TSval=2632089583 TSecr=0 WS=128
10824 700.650120459 35.186.224.30 → 192.168.8.128 TCP 74 443 → 40606 [SYN, ACK] Seq=0 Ack=1 Win=60192 Len=0 MSS=1300 SACK_PERM=1 TSval=4055658111 TSecr=2632089583 WS=256
11031 700.924015016 192.168.8.128 → 199.232.36.246 TCP 74 37658 → 80 [SYN] Seq=0 Win=29200 Len=0 MSS=1460 SACK_PERM=1 TSval=4242975074 TSecr=0 WS=128
11032 700.927770983 199.232.36.246 → 192.168.8.128 TCP 74 80 → 37658 [SYN, ACK] Seq=0 Ack=1 Win=28960 Len=0 MSS=1300 SACK_PERM=1 TSval=676222378 TSecr=4242975074 WS=512
