  589 12.635100806 10.23.10.235 → 31.13.71.7   TCP 74 47892 → 443 [SYN] Seq=0 Win=29200 Len=0 MSS=1460 SACK_PERM=1 TSval=3792801370 TSecr=0 WS=128
  590 12.685192955   31.13.71.7 → 10.23.10.235 TCP 74 443 → 47892 [SYN, ACK] Seq=0 Ack=1 Win=27760 Len=0 MSS=1300 SACK_PERM=1 TSval=1128453615 TSecr=3792801370 WS=256
  592 13.060161680 10.23.10.235 → 31.13.71.7   TCP 74 47894 → 443 [SYN] Seq=0 Win=29200 Len=0 MSS=1460 SACK_PERM=1 TSval=3792801795 TSecr=0 WS=128
  595 13.065344344   31.13.71.7 → 10.23.10.235 TCP 74 443 → 47894 [SYN, ACK] Seq=0 Ack=1 Win=27760 Len=0 MSS=1300 SACK_PERM=1 TSval=4180783572 TSecr=3792801795 WS=256
  599 13.121562210 10.23.10.235 → 31.13.71.14  TCP 74 45454 → 443 [SYN] Seq=0 Win=29200 Len=0 MSS=1460 SACK_PERM=1 TSval=3507302493 TSecr=0 WS=128
  600 13.126738594  31.13.71.14 → 10.23.10.235 TCP 74 443 → 45454 [SYN, ACK] Seq=0 Ack=1 Win=27760 Len=0 MSS=1300 SACK_PERM=1 TSval=3498769696 TSecr=3507302493 WS=256
  665 13.492573559 10.23.10.235 → 31.13.71.7   TCP 74 47898 → 443 [SYN] Seq=0 Win=29200 Len=0 MSS=1460 SACK_PERM=1 TSval=3792802227 TSecr=0 WS=128
  668 13.499059227   31.13.71.7 → 10.23.10.235 TCP 74 443 → 47898 [SYN, ACK] Seq=0 Ack=1 Win=27760 Len=0 MSS=1300 SACK_PERM=1 TSval=593506057 TSecr=3792802227 WS=256
  678 13.698182586 10.23.10.235 → 31.13.71.7   TCP 74 47900 → 443 [SYN] Seq=0 Win=29200 Len=0 MSS=1460 SACK_PERM=1 TSval=3792802433 TSecr=0 WS=128
  679 13.698776283 10.23.10.235 → 31.13.71.7   TCP 74 47902 → 443 [SYN] Seq=0 Win=29200 Len=0 MSS=1460 SACK_PERM=1 TSval=3792802434 TSecr=0 WS=128
  680 13.699246461 10.23.10.235 → 31.13.71.7   TCP 74 47904 → 443 [SYN] Seq=0 Win=29200 Len=0 MSS=1460 SACK_PERM=1 TSval=3792802434 TSecr=0 WS=128
  682 13.701481330   31.13.71.7 → 10.23.10.235 TCP 74 443 → 47900 [SYN, ACK] Seq=0 Ack=1 Win=27760 Len=0 MSS=1300 SACK_PERM=1 TSval=4249470725 TSecr=3792802433 WS=256
  684 13.702838804   31.13.71.7 → 10.23.10.235 TCP 74 443 → 47902 [SYN, ACK] Seq=0 Ack=1 Win=27760 Len=0 MSS=1300 SACK_PERM=1 TSval=3972943047 TSecr=3792802434 WS=256
  686 13.702873583   31.13.71.7 → 10.23.10.235 TCP 74 443 → 47904 [SYN, ACK] Seq=0 Ack=1 Win=27760 Len=0 MSS=1300 SACK_PERM=1 TSval=1367626459 TSecr=3792802434 WS=256
  708 15.138703837 10.23.10.235 → 31.13.71.1   TCP 74 59642 → 443 [SYN] Seq=0 Win=29200 Len=0 MSS=1460 SACK_PERM=1 TSval=1793549765 TSecr=0 WS=128
  724 15.267395008   31.13.71.1 → 10.23.10.235 TCP 74 443 → 59642 [SYN, ACK] Seq=0 Ack=1 Win=27760 Len=0 MSS=1300 SACK_PERM=1 TSval=839557539 TSecr=1793549765 WS=256
  815 22.440404610 10.23.10.235 → 34.213.214.155 TCP 74 48340 → 443 [SYN] Seq=0 Win=29200 Len=0 MSS=1460 SACK_PERM=1 TSval=3319668196 TSecr=0 WS=128
  816 22.516739568 34.213.214.155 → 10.23.10.235 TCP 74 443 → 48340 [SYN, ACK] Seq=0 Ack=1 Win=26847 Len=0 MSS=1300 SACK_PERM=1 TSval=771414807 TSecr=3319668196 WS=256
 1021 46.954352904 10.23.10.235 → 40.77.226.250 TCP 74 59700 → 443 [SYN] Seq=0 Win=29200 Len=0 MSS=1460 SACK_PERM=1 TSval=2334675501 TSecr=0 WS=128
 1023 47.104556386 40.77.226.250 → 10.23.10.235 TCP 74 443 → 59700 [SYN, ACK] Seq=0 Ack=1 Win=8192 Len=0 MSS=1300 WS=256 SACK_PERM=1 TSval=40457481 TSecr=2334675501
 1139 84.070184649 10.23.10.235 → 172.217.3.106 TCP 74 58986 → 443 [SYN] Seq=0 Win=29200 Len=0 MSS=1460 SACK_PERM=1 TSval=2168604998 TSecr=0 WS=128
 1140 84.073404271 172.217.3.106 → 10.23.10.235 TCP 74 443 → 58986 [SYN, ACK] Seq=0 Ack=1 Win=60192 Len=0 MSS=1300 SACK_PERM=1 TSval=1853337468 TSecr=2168604998 WS=256
 1214 101.290642027 10.23.10.235 → 31.13.71.7   TCP 74 47914 → 443 [SYN] Seq=0 Win=29200 Len=0 MSS=1460 SACK_PERM=1 TSval=3792890024 TSecr=0 WS=128
 1217 101.294856203   31.13.71.7 → 10.23.10.235 TCP 74 443 → 47914 [SYN, ACK] Seq=0 Ack=1 Win=27760 Len=0 MSS=1300 SACK_PERM=1 TSval=1848594082 TSecr=3792890024 WS=256
 1467 120.896194287 10.23.10.235 → 172.217.12.182 TCP 74 43584 → 443 [SYN] Seq=0 Win=29200 Len=0 MSS=1460 SACK_PERM=1 TSval=3163157783 TSecr=0 WS=128
 1468 120.902257367 172.217.12.182 → 10.23.10.235 TCP 74 443 → 43584 [SYN, ACK] Seq=0 Ack=1 Win=60192 Len=0 MSS=1300 SACK_PERM=1 TSval=451412677 TSecr=3163157783 WS=256
 1620 132.532574143 10.23.10.235 → 173.194.31.74 TCP 74 35938 → 443 [SYN] Seq=0 Win=29200 Len=0 MSS=1460 SACK_PERM=1 TSval=2160532419 TSecr=0 WS=128
 1621 132.532630234 10.23.10.235 → 173.194.31.74 TCP 74 35940 → 443 [SYN] Seq=0 Win=29200 Len=0 MSS=1460 SACK_PERM=1 TSval=2160532419 TSecr=0 WS=128
 1622 132.536118753 173.194.31.74 → 10.23.10.235 TCP 74 443 → 35938 [SYN, ACK] Seq=0 Ack=1 Win=65535 Len=0 MSS=1300 SACK_PERM=1 TSval=3581727051 TSecr=2160532419 WS=256
 1624 132.536650613 173.194.31.74 → 10.23.10.235 TCP 74 443 → 35940 [SYN, ACK] Seq=0 Ack=1 Win=65535 Len=0 MSS=1300 SACK_PERM=1 TSval=3581727051 TSecr=2160532419 WS=256
 1720 132.791225097 10.23.10.235 → 172.217.10.129 TCP 74 50814 → 443 [SYN] Seq=0 Win=29200 Len=0 MSS=1460 SACK_PERM=1 TSval=2785301531 TSecr=0 WS=128
 1727 132.796337024 172.217.10.129 → 10.23.10.235 TCP 74 443 → 50814 [SYN, ACK] Seq=0 Ack=1 Win=60192 Len=0 MSS=1300 SACK_PERM=1 TSval=4169773381 TSecr=2785301531 WS=256
 3812 144.762891034 10.23.10.235 → 52.85.95.245 TCP 74 51026 → 443 [SYN] Seq=0 Win=29200 Len=0 MSS=1460 SACK_PERM=1 TSval=718140418 TSecr=0 WS=128
 3813 144.766566852 52.85.95.245 → 10.23.10.235 TCP 74 443 → 51026 [SYN, ACK] Seq=0 Ack=1 Win=28960 Len=0 MSS=1300 SACK_PERM=1 TSval=3418147426 TSecr=718140418 WS=256
 4161 152.888862859 10.23.10.235 → 74.125.0.55  TCP 74 43012 → 443 [SYN] Seq=0 Win=29200 Len=0 MSS=1460 SACK_PERM=1 TSval=2775089874 TSecr=0 WS=128
 4162 152.888934308 10.23.10.235 → 74.125.0.55  TCP 74 43014 → 443 [SYN] Seq=0 Win=29200 Len=0 MSS=1460 SACK_PERM=1 TSval=2775089874 TSecr=0 WS=128
 4165 152.895140017  74.125.0.55 → 10.23.10.235 TCP 74 443 → 43012 [SYN, ACK] Seq=0 Ack=1 Win=65535 Len=0 MSS=1300 SACK_PERM=1 TSval=2141175964 TSecr=2775089874 WS=256
 4167 152.895636099  74.125.0.55 → 10.23.10.235 TCP 74 443 → 43014 [SYN, ACK] Seq=0 Ack=1 Win=65535 Len=0 MSS=1300 SACK_PERM=1 TSval=2141175964 TSecr=2775089874 WS=256
 5703 168.414857531 10.23.10.235 → 172.217.3.99 TCP 74 55674 → 443 [SYN] Seq=0 Win=29200 Len=0 MSS=1460 SACK_PERM=1 TSval=1537087016 TSecr=0 WS=128
 5704 168.418907608 172.217.3.99 → 10.23.10.235 TCP 74 443 → 55674 [SYN, ACK] Seq=0 Ack=1 Win=60192 Len=0 MSS=1300 SACK_PERM=1 TSval=94740122 TSecr=1537087016 WS=256
 6036 176.419529751 10.23.10.235 → 52.27.184.130 TCP 74 57458 → 443 [SYN] Seq=0 Win=29200 Len=0 MSS=1460 SACK_PERM=1 TSval=3879624123 TSecr=0 WS=128
 6037 176.495825134 52.27.184.130 → 10.23.10.235 TCP 74 443 → 57458 [SYN, ACK] Seq=0 Ack=1 Win=26847 Len=0 MSS=1300 SACK_PERM=1 TSval=985383191 TSecr=3879624123 WS=256
 6060 176.738473874 10.23.10.235 → 52.89.175.187 TCP 74 43108 → 443 [SYN] Seq=0 Win=29200 Len=0 MSS=1460 SACK_PERM=1 TSval=696392442 TSecr=0 WS=128
 6063 176.741993035 10.23.10.235 → 34.212.28.14 TCP 74 45866 → 443 [SYN] Seq=0 Win=29200 Len=0 MSS=1460 SACK_PERM=1 TSval=1515800979 TSecr=0 WS=128
 6064 176.817713500 52.89.175.187 → 10.23.10.235 TCP 74 443 → 43108 [SYN, ACK] Seq=0 Ack=1 Win=26847 Len=0 MSS=1300 SACK_PERM=1 TSval=3468836935 TSecr=696392442 WS=256
 6066 176.819981250 34.212.28.14 → 10.23.10.235 TCP 74 443 → 45866 [SYN, ACK] Seq=0 Ack=1 Win=17898 Len=0 MSS=1300 SACK_PERM=1 TSval=3438763920 TSecr=1515800979 WS=128
 6100 177.245005019 10.23.10.235 → 54.69.190.106 TCP 74 32920 → 443 [SYN] Seq=0 Win=29200 Len=0 MSS=1460 SACK_PERM=1 TSval=1737202778 TSecr=0 WS=128
 6102 177.321042886 54.69.190.106 → 10.23.10.235 TCP 74 443 → 32920 [SYN, ACK] Seq=0 Ack=1 Win=26847 Len=0 MSS=1300 SACK_PERM=1 TSval=222368215 TSecr=1737202778 WS=256
 6154 178.467440636 10.23.10.235 → 34.95.71.207 TCP 74 53602 → 443 [SYN] Seq=0 Win=29200 Len=0 MSS=1460 SACK_PERM=1 TSval=2332188101 TSecr=0 WS=128
 6155 178.480069515 34.95.71.207 → 10.23.10.235 TCP 74 443 → 53602 [SYN, ACK] Seq=0 Ack=1 Win=60192 Len=0 MSS=1300 SACK_PERM=1 TSval=4180244935 TSecr=2332188101 WS=256
 9163 246.881170074 10.23.10.235 → 172.217.12.164 TCP 74 57282 → 443 [SYN] Seq=0 Win=29200 Len=0 MSS=1460 SACK_PERM=1 TSval=3565084108 TSecr=0 WS=128
 9164 246.884491729 172.217.12.164 → 10.23.10.235 TCP 74 443 → 57282 [SYN, ACK] Seq=0 Ack=1 Win=60192 Len=0 MSS=1300 SACK_PERM=1 TSval=3392541821 TSecr=3565084108 WS=256
 9727 251.012234535 10.23.10.235 → 208.80.154.224 TCP 74 39174 → 443 [SYN] Seq=0 Win=29200 Len=0 MSS=1460 SACK_PERM=1 TSval=3343442779 TSecr=0 WS=128
 9728 251.262922847 10.23.10.235 → 208.80.154.224 TCP 74 39176 → 443 [SYN] Seq=0 Win=29200 Len=0 MSS=1460 SACK_PERM=1 TSval=3343443029 TSecr=0 WS=128
 9729 251.264047951 208.80.154.224 → 10.23.10.235 TCP 74 443 → 39174 [SYN, ACK] Seq=0 Ack=1 Win=28480 Len=0 MSS=1300 SACK_PERM=1 TSval=2036170799 TSecr=3343442779 WS=512
 9732 251.489214054 208.80.154.224 → 10.23.10.235 TCP 74 443 → 39176 [SYN, ACK] Seq=0 Ack=1 Win=28480 Len=0 MSS=1300 SACK_PERM=1 TSval=2036170841 TSecr=3343443029 WS=512
 9784 252.004172170 10.23.10.235 → 208.80.154.240 TCP 74 34556 → 443 [SYN] Seq=0 Win=29200 Len=0 MSS=1460 SACK_PERM=1 TSval=3785307433 TSecr=0 WS=128
 9797 252.015628651 208.80.154.240 → 10.23.10.235 TCP 74 443 → 34556 [SYN, ACK] Seq=0 Ack=1 Win=28480 Len=0 MSS=1300 SACK_PERM=1 TSval=1710478013 TSecr=3785307433 WS=512
10398 334.745268447 10.23.10.235 → 52.85.95.245 TCP 74 51052 → 443 [SYN] Seq=0 Win=29200 Len=0 MSS=1460 SACK_PERM=1 TSval=718330397 TSecr=0 WS=128
10399 334.748265501 52.85.95.245 → 10.23.10.235 TCP 74 443 → 51052 [SYN, ACK] Seq=0 Ack=1 Win=28960 Len=0 MSS=1300 SACK_PERM=1 TSval=3418166424 TSecr=718330397 WS=256
10556 366.081997912 10.23.10.235 → 172.217.12.133 TCP 74 34290 → 443 [SYN] Seq=0 Win=29200 Len=0 MSS=1460 SACK_PERM=1 TSval=3783352681 TSecr=0 WS=128
10557 366.085883764 172.217.12.133 → 10.23.10.235 TCP 74 443 → 34290 [SYN, ACK] Seq=0 Ack=1 Win=60192 Len=0 MSS=1300 SACK_PERM=1 TSval=2979192897 TSecr=3783352681 WS=256
10636 384.358533285 10.23.10.235 → 172.217.10.22 TCP 74 43314 → 443 [SYN] Seq=0 Win=29200 Len=0 MSS=1460 SACK_PERM=1 TSval=3149190923 TSecr=0 WS=128
10637 384.377467763 172.217.10.22 → 10.23.10.235 TCP 74 443 → 43314 [SYN, ACK] Seq=0 Ack=1 Win=60192 Len=0 MSS=1300 SACK_PERM=1 TSval=634389058 TSecr=3149190923 WS=256
10785 389.323295671 10.23.10.235 → 74.125.174.135 TCP 74 36242 → 443 [SYN] Seq=0 Win=29200 Len=0 MSS=1460 SACK_PERM=1 TSval=3853788416 TSecr=0 WS=128
10786 389.323365256 10.23.10.235 → 74.125.174.135 TCP 74 36244 → 443 [SYN] Seq=0 Win=29200 Len=0 MSS=1460 SACK_PERM=1 TSval=3853788416 TSecr=0 WS=128
10789 389.326761737 74.125.174.135 → 10.23.10.235 TCP 74 443 → 36244 [SYN, ACK] Seq=0 Ack=1 Win=65535 Len=0 MSS=1300 SACK_PERM=1 TSval=2396564885 TSecr=3853788416 WS=256
10791 389.327380245 74.125.174.135 → 10.23.10.235 TCP 74 443 → 36242 [SYN, ACK] Seq=0 Ack=1 Win=65535 Len=0 MSS=1300 SACK_PERM=1 TSval=2396564885 TSecr=3853788416 WS=256
13045 439.866104691 10.23.10.235 → 173.194.61.40 TCP 74 60958 → 443 [SYN] Seq=0 Win=29200 Len=0 MSS=1460 SACK_PERM=1 TSval=116667152 TSecr=0 WS=128
13046 439.866165601 10.23.10.235 → 173.194.61.40 TCP 74 60960 → 443 [SYN] Seq=0 Win=29200 Len=0 MSS=1460 SACK_PERM=1 TSval=116667152 TSecr=0 WS=128
13047 439.869251105 173.194.61.40 → 10.23.10.235 TCP 74 443 → 60958 [SYN, ACK] Seq=0 Ack=1 Win=65535 Len=0 MSS=1300 SACK_PERM=1 TSval=4035951006 TSecr=116667152 WS=256
13050 439.872621875 173.194.61.40 → 10.23.10.235 TCP 74 443 → 60960 [SYN, ACK] Seq=0 Ack=1 Win=65535 Len=0 MSS=1300 SACK_PERM=1 TSval=4035951006 TSecr=116667152 WS=256
16268 473.491193591 10.23.10.235 → 173.194.61.40 TCP 74 60962 → 443 [SYN] Seq=0 Win=29200 Len=0 MSS=1460 SACK_PERM=1 TSval=116700776 TSecr=0 WS=128
16276 473.495221971 173.194.61.40 → 10.23.10.235 TCP 74 443 → 60962 [SYN, ACK] Seq=0 Ack=1 Win=65535 Len=0 MSS=1300 SACK_PERM=1 TSval=4035984631 TSecr=116700776 WS=256
16978 478.820683322 10.23.10.235 → 172.217.12.174 TCP 74 54818 → 443 [SYN] Seq=0 Win=29200 Len=0 MSS=1460 SACK_PERM=1 TSval=1428397608 TSecr=0 WS=128
16979 478.850184664 172.217.12.174 → 10.23.10.235 TCP 74 443 → 54818 [SYN, ACK] Seq=0 Ack=1 Win=60192 Len=0 MSS=1300 SACK_PERM=1 TSval=1839638419 TSecr=1428397608 WS=256
19171 562.373487133 10.23.10.235 → 172.217.12.138 TCP 74 49548 → 443 [SYN] Seq=0 Win=29200 Len=0 MSS=1460 SACK_PERM=1 TSval=972120082 TSecr=0 WS=128
19172 562.376963595 172.217.12.138 → 10.23.10.235 TCP 74 443 → 49548 [SYN, ACK] Seq=0 Ack=1 Win=60192 Len=0 MSS=1300 SACK_PERM=1 TSval=2917365330 TSecr=972120082 WS=256
19254 566.833320145 10.23.10.235 → 172.217.6.225 TCP 74 33636 → 443 [SYN] Seq=0 Win=29200 Len=0 MSS=1460 SACK_PERM=1 TSval=3404808159 TSecr=0 WS=128
19255 566.849936620 172.217.6.225 → 10.23.10.235 TCP 74 443 → 33636 [SYN, ACK] Seq=0 Ack=1 Win=60192 Len=0 MSS=1300 SACK_PERM=1 TSval=3022345757 TSecr=3404808159 WS=256
19399 572.497347552 10.23.10.235 → 173.194.185.134 TCP 74 59148 → 443 [SYN] Seq=0 Win=29200 Len=0 MSS=1460 SACK_PERM=1 TSval=1578318598 TSecr=0 WS=128
19400 572.497422270 10.23.10.235 → 173.194.185.134 TCP 74 59150 → 443 [SYN] Seq=0 Win=29200 Len=0 MSS=1460 SACK_PERM=1 TSval=1578318598 TSecr=0 WS=128
19401 572.501104031 173.194.185.134 → 10.23.10.235 TCP 74 443 → 59148 [SYN, ACK] Seq=0 Ack=1 Win=65535 Len=0 MSS=1300 SACK_PERM=1 TSval=4015346467 TSecr=1578318598 WS=256
19404 572.504031729 173.194.185.134 → 10.23.10.235 TCP 74 443 → 59150 [SYN, ACK] Seq=0 Ack=1 Win=65535 Len=0 MSS=1300 SACK_PERM=1 TSval=4015346468 TSecr=1578318598 WS=256
22306 614.102326784 10.23.10.235 → 173.194.31.249 TCP 74 57198 → 443 [SYN] Seq=0 Win=29200 Len=0 MSS=1460 SACK_PERM=1 TSval=3385061487 TSecr=0 WS=128
22307 614.102471770 10.23.10.235 → 173.194.31.249 TCP 74 57200 → 443 [SYN] Seq=0 Win=29200 Len=0 MSS=1460 SACK_PERM=1 TSval=3385061488 TSecr=0 WS=128
22310 614.105962353 173.194.31.249 → 10.23.10.235 TCP 74 443 → 57198 [SYN, ACK] Seq=0 Ack=1 Win=65535 Len=0 MSS=1300 SACK_PERM=1 TSval=1410115369 TSecr=3385061487 WS=256
22312 614.106494810 173.194.31.249 → 10.23.10.235 TCP 74 443 → 57200 [SYN, ACK] Seq=0 Ack=1 Win=65535 Len=0 MSS=1300 SACK_PERM=1 TSval=1410115370 TSecr=3385061488 WS=256
26442 674.144679713 10.23.10.235 → 74.125.172.26 TCP 74 40788 → 443 [SYN] Seq=0 Win=29200 Len=0 MSS=1460 SACK_PERM=1 TSval=3069579898 TSecr=0 WS=128
26443 674.144766998 10.23.10.235 → 74.125.172.26 TCP 74 40790 → 443 [SYN] Seq=0 Win=29200 Len=0 MSS=1460 SACK_PERM=1 TSval=3069579898 TSecr=0 WS=128
26446 674.147352557 74.125.172.26 → 10.23.10.235 TCP 74 443 → 40788 [SYN, ACK] Seq=0 Ack=1 Win=65535 Len=0 MSS=1300 SACK_PERM=1 TSval=2562469406 TSecr=3069579898 WS=256
26448 674.147945277 74.125.172.26 → 10.23.10.235 TCP 74 443 → 40790 [SYN, ACK] Seq=0 Ack=1 Win=65535 Len=0 MSS=1300 SACK_PERM=1 TSval=2562469406 TSecr=3069579898 WS=256
27279 686.718739028 10.23.10.235 → 172.217.11.35 TCP 74 38430 → 443 [SYN] Seq=0 Win=29200 Len=0 MSS=1460 SACK_PERM=1 TSval=2878117931 TSecr=0 WS=128
27280 686.721904976 172.217.11.35 → 10.23.10.235 TCP 74 443 → 38430 [SYN, ACK] Seq=0 Ack=1 Win=60192 Len=0 MSS=1300 SACK_PERM=1 TSval=916240647 TSecr=2878117931 WS=256
28316 722.949287523 10.23.10.235 → 74.125.192.189 TCP 74 49552 → 443 [SYN] Seq=0 Win=29200 Len=0 MSS=1460 SACK_PERM=1 TSval=2294967404 TSecr=0 WS=128
28317 723.048814287 74.125.192.189 → 10.23.10.235 TCP 74 443 → 49552 [SYN, ACK] Seq=0 Ack=1 Win=62392 Len=0 MSS=1300 SACK_PERM=1 TSval=300083854 TSecr=2294967404 WS=256
29647 778.967908033 10.23.10.235 → 34.212.28.14 TCP 74 45918 → 443 [SYN] Seq=0 Win=29200 Len=0 MSS=1460 SACK_PERM=1 TSval=1516403197 TSecr=0 WS=128
29648 779.053239955 34.212.28.14 → 10.23.10.235 TCP 74 443 → 45918 [SYN, ACK] Seq=0 Ack=1 Win=17898 Len=0 MSS=1300 SACK_PERM=1 TSval=3439366145 TSecr=1516403197 WS=128
29673 779.482738289 10.23.10.235 → 54.69.190.106 TCP 74 32972 → 443 [SYN] Seq=0 Win=29200 Len=0 MSS=1460 SACK_PERM=1 TSval=1737805007 TSecr=0 WS=128
29674 779.562021646 54.69.190.106 → 10.23.10.235 TCP 74 443 → 32972 [SYN, ACK] Seq=0 Ack=1 Win=26847 Len=0 MSS=1300 SACK_PERM=1 TSval=222518802 TSecr=1737805007 WS=256
29728 780.636357232 10.23.10.235 → 34.95.71.207 TCP 74 53654 → 443 [SYN] Seq=0 Win=29200 Len=0 MSS=1460 SACK_PERM=1 TSval=2332790261 TSecr=0 WS=128
29729 780.639634878 34.95.71.207 → 10.23.10.235 TCP 74 443 → 53654 [SYN, ACK] Seq=0 Ack=1 Win=60192 Len=0 MSS=1300 SACK_PERM=1 TSval=1640042620 TSecr=2332790261 WS=256
30523 840.655537183 10.23.10.235 → 104.108.116.202 TCP 74 48618 → 443 [SYN] Seq=0 Win=29200 Len=0 MSS=1460 SACK_PERM=1 TSval=2394435876 TSecr=0 WS=128
30524 840.655738741 10.23.10.235 → 104.108.116.202 TCP 74 48620 → 443 [SYN] Seq=0 Win=29200 Len=0 MSS=1460 SACK_PERM=1 TSval=2394435876 TSecr=0 WS=128
30525 840.663271734 104.108.116.202 → 10.23.10.235 TCP 74 443 → 48618 [SYN, ACK] Seq=0 Ack=1 Win=28960 Len=0 MSS=1300 SACK_PERM=1 TSval=3748070714 TSecr=2394435876 WS=128
30528 840.663897657 104.108.116.202 → 10.23.10.235 TCP 74 443 → 48620 [SYN, ACK] Seq=0 Ack=1 Win=28960 Len=0 MSS=1300 SACK_PERM=1 TSval=3748070714 TSecr=2394435876 WS=128
30567 840.745243974 10.23.10.235 → 93.184.215.201 TCP 74 51942 → 443 [SYN] Seq=0 Win=29200 Len=0 MSS=1460 SACK_PERM=1 TSval=3493024226 TSecr=0 WS=128
30569 840.746799287 10.23.10.235 → 93.184.215.201 TCP 74 51944 → 443 [SYN] Seq=0 Win=29200 Len=0 MSS=1460 SACK_PERM=1 TSval=3493024228 TSecr=0 WS=128
30571 840.748427198 93.184.215.201 → 10.23.10.235 TCP 66 443 → 51942 [SYN, ACK] Seq=0 Ack=1 Win=65535 Len=0 MSS=1300 SACK_PERM=1 WS=512
30574 840.750531494 93.184.215.201 → 10.23.10.235 TCP 66 443 → 51944 [SYN, ACK] Seq=0 Ack=1 Win=65535 Len=0 MSS=1300 SACK_PERM=1 WS=512
30624 841.566210909 10.23.10.235 → 152.199.4.33 TCP 74 36800 → 443 [SYN] Seq=0 Win=29200 Len=0 MSS=1460 SACK_PERM=1 TSval=1842685306 TSecr=0 WS=128
30625 841.569902851 152.199.4.33 → 10.23.10.235 TCP 66 443 → 36800 [SYN, ACK] Seq=0 Ack=1 Win=65535 Len=0 MSS=1300 SACK_PERM=1 WS=512
30897 855.820416265 10.23.10.235 → 65.55.44.109 TCP 74 45190 → 443 [SYN] Seq=0 Win=29200 Len=0 MSS=1460 SACK_PERM=1 TSval=2828660152 TSecr=0 WS=128
30898 855.834433384 65.55.44.109 → 10.23.10.235 TCP 74 443 → 45190 [SYN, ACK] Seq=0 Ack=1 Win=8192 Len=0 MSS=1300 WS=256 SACK_PERM=1 TSval=47627641 TSecr=2828660152
30905 855.868651709 10.23.10.235 → 65.55.44.109 TCP 74 45192 → 443 [SYN] Seq=0 Win=29200 Len=0 MSS=1460 SACK_PERM=1 TSval=2828660200 TSecr=0 WS=128
30907 855.884622563 65.55.44.109 → 10.23.10.235 TCP 74 443 → 45192 [SYN, ACK] Seq=0 Ack=1 Win=8192 Len=0 MSS=1300 WS=256 SACK_PERM=1 TSval=581559539 TSecr=2828660200
31098 859.823104958 10.23.10.235 → 104.42.78.153 TCP 74 45672 → 443 [SYN] Seq=0 Win=29200 Len=0 MSS=1460 SACK_PERM=1 TSval=3127821657 TSecr=0 WS=128
31099 859.898799794 104.42.78.153 → 10.23.10.235 TCP 74 443 → 45672 [SYN, ACK] Seq=0 Ack=1 Win=8192 Len=0 MSS=1300 WS=256 SACK_PERM=1 TSval=1495962909 TSecr=3127821657
31167 862.023649141 10.23.10.235 → 172.217.10.42 TCP 74 38250 → 443 [SYN] Seq=0 Win=29200 Len=0 MSS=1460 SACK_PERM=1 TSval=1259693424 TSecr=0 WS=128
31179 862.028048140 172.217.10.42 → 10.23.10.235 TCP 74 443 → 38250 [SYN, ACK] Seq=0 Ack=1 Win=60192 Len=0 MSS=1300 SACK_PERM=1 TSval=3330392794 TSecr=1259693424 WS=256
31321 862.321633590 10.23.10.235 → 172.217.11.3 TCP 74 55556 → 443 [SYN] Seq=0 Win=29200 Len=0 MSS=1460 SACK_PERM=1 TSval=1903583761 TSecr=0 WS=128
31334 862.328803817 172.217.11.3 → 10.23.10.235 TCP 74 443 → 55556 [SYN, ACK] Seq=0 Ack=1 Win=60192 Len=0 MSS=1300 SACK_PERM=1 TSval=1078419231 TSecr=1903583761 WS=256
31468 866.552186958 10.23.10.235 → 172.217.6.206 TCP 74 37594 → 443 [SYN] Seq=0 Win=29200 Len=0 MSS=1460 SACK_PERM=1 TSval=523924548 TSecr=0 WS=128
31469 866.552279286 10.23.10.235 → 172.217.6.206 TCP 74 37596 → 443 [SYN] Seq=0 Win=29200 Len=0 MSS=1460 SACK_PERM=1 TSval=523924549 TSecr=0 WS=128
31472 866.556482674 172.217.6.206 → 10.23.10.235 TCP 74 443 → 37594 [SYN, ACK] Seq=0 Ack=1 Win=60192 Len=0 MSS=1300 SACK_PERM=1 TSval=3912501814 TSecr=523924548 WS=256
31474 866.556522603 172.217.6.206 → 10.23.10.235 TCP 74 443 → 37596 [SYN, ACK] Seq=0 Ack=1 Win=60192 Len=0 MSS=1300 SACK_PERM=1 TSval=32289060 TSecr=523924549 WS=256
31521 866.655681567 10.23.10.235 → 173.194.185.108 TCP 74 40538 → 443 [SYN] Seq=0 Win=29200 Len=0 MSS=1460 SACK_PERM=1 TSval=2972926443 TSecr=0 WS=128
31522 866.655760988 10.23.10.235 → 173.194.185.108 TCP 74 40540 → 443 [SYN] Seq=0 Win=29200 Len=0 MSS=1460 SACK_PERM=1 TSval=2972926443 TSecr=0 WS=128
31524 866.658978467 173.194.185.108 → 10.23.10.235 TCP 74 443 → 40538 [SYN, ACK] Seq=0 Ack=1 Win=65535 Len=0 MSS=1300 SACK_PERM=1 TSval=4236225915 TSecr=2972926443 WS=256
31526 866.659977949 173.194.185.108 → 10.23.10.235 TCP 74 443 → 40540 [SYN, ACK] Seq=0 Ack=1 Win=65535 Len=0 MSS=1300 SACK_PERM=1 TSval=4236225915 TSecr=2972926443 WS=256
31565 866.752079639 10.23.10.235 → 173.194.185.103 TCP 74 52636 → 443 [SYN] Seq=0 Win=29200 Len=0 MSS=1460 SACK_PERM=1 TSval=2119123317 TSecr=0 WS=128
31567 866.771553789 10.23.10.235 → 173.194.185.103 TCP 74 52638 → 443 [SYN] Seq=0 Win=29200 Len=0 MSS=1460 SACK_PERM=1 TSval=2119123337 TSecr=0 WS=128
31581 866.842576791 173.194.185.103 → 10.23.10.235 TCP 74 443 → 52636 [SYN, ACK] Seq=0 Ack=1 Win=65535 Len=0 MSS=1300 SACK_PERM=1 TSval=119044326 TSecr=2119123317 WS=256
31586 866.873303887 173.194.185.103 → 10.23.10.235 TCP 74 443 → 52638 [SYN, ACK] Seq=0 Ack=1 Win=65535 Len=0 MSS=1300 SACK_PERM=1 TSval=119044355 TSecr=2119123337 WS=256
33173 875.198968423 10.23.10.235 → 65.55.44.109 TCP 74 45212 → 443 [SYN] Seq=0 Win=29200 Len=0 MSS=1460 SACK_PERM=1 TSval=2828679530 TSecr=0 WS=128
33174 875.213063691 65.55.44.109 → 10.23.10.235 TCP 74 443 → 45212 [SYN, ACK] Seq=0 Ack=1 Win=8192 Len=0 MSS=1300 WS=256 SACK_PERM=1 TSval=24065355 TSecr=2828679530
35377 899.876288567 10.23.10.235 → 172.217.12.164 TCP 74 57368 → 443 [SYN] Seq=0 Win=29200 Len=0 MSS=1460 SACK_PERM=1 TSval=3565737093 TSecr=0 WS=128
35410 899.893945687 172.217.12.164 → 10.23.10.235 TCP 74 443 → 57368 [SYN, ACK] Seq=0 Ack=1 Win=60192 Len=0 MSS=1300 SACK_PERM=1 TSval=2271640129 TSecr=3565737093 WS=256
35750 901.913834508 10.23.10.235 → 172.217.10.110 TCP 74 39218 → 443 [SYN] Seq=0 Win=29200 Len=0 MSS=1460 SACK_PERM=1 TSval=2562560956 TSecr=0 WS=128
35758 901.915688635 10.23.10.235 → 172.217.3.110 TCP 74 37950 → 443 [SYN] Seq=0 Win=29200 Len=0 MSS=1460 SACK_PERM=1 TSval=690735229 TSecr=0 WS=128
35778 901.925546187 172.217.10.110 → 10.23.10.235 TCP 74 443 → 39218 [SYN, ACK] Seq=0 Ack=1 Win=60192 Len=0 MSS=1300 SACK_PERM=1 TSval=462974832 TSecr=2562560956 WS=256
35794 901.925601699 172.217.3.110 → 10.23.10.235 TCP 74 443 → 37950 [SYN, ACK] Seq=0 Ack=1 Win=60192 Len=0 MSS=1300 SACK_PERM=1 TSval=1702625310 TSecr=690735229 WS=256
35943 904.834361971 10.23.10.235 → 208.80.154.224 TCP 74 39264 → 443 [SYN] Seq=0 Win=29200 Len=0 MSS=1460 SACK_PERM=1 TSval=3344096591 TSecr=0 WS=128
35944 904.844104709 208.80.154.224 → 10.23.10.235 TCP 74 443 → 39264 [SYN, ACK] Seq=0 Ack=1 Win=28480 Len=0 MSS=1300 SACK_PERM=1 TSval=2036334220 TSecr=3344096591 WS=512
35984 905.090634295 10.23.10.235 → 208.80.154.240 TCP 74 34644 → 443 [SYN] Seq=0 Win=29200 Len=0 MSS=1460 SACK_PERM=1 TSval=3785960509 TSecr=0 WS=128
36011 905.106771730 208.80.154.240 → 10.23.10.235 TCP 74 443 → 34644 [SYN, ACK] Seq=0 Ack=1 Win=28480 Len=0 MSS=1300 SACK_PERM=1 TSval=1710641285 TSecr=3785960509 WS=512
36999 916.668862249 10.23.10.235 → 172.217.6.206 TCP 74 37618 → 443 [SYN] Seq=0 Win=29200 Len=0 MSS=1460 SACK_PERM=1 TSval=523974664 TSecr=0 WS=128
37001 916.672652036 172.217.6.206 → 10.23.10.235 TCP 74 443 → 37618 [SYN, ACK] Seq=0 Ack=1 Win=60192 Len=0 MSS=1300 SACK_PERM=1 TSval=2945455682 TSecr=523974664 WS=256
37097 917.761546975 10.23.10.235 → 104.244.42.1 TCP 74 48910 → 443 [SYN] Seq=0 Win=29200 Len=0 MSS=1460 SACK_PERM=1 TSval=3369620749 TSecr=0 WS=128
37098 917.791505767 104.244.42.1 → 10.23.10.235 TCP 74 443 → 48910 [SYN, ACK] Seq=0 Ack=1 Win=28960 Len=0 MSS=1300 SACK_PERM=1 TSval=3327080615 TSecr=3369620749 WS=256
37111 917.840894648 10.23.10.235 → 72.21.91.29  TCP 74 40528 → 80 [SYN] Seq=0 Win=29200 Len=0 MSS=1460 SACK_PERM=1 TSval=1982197933 TSecr=0 WS=128
37112 917.844271342  72.21.91.29 → 10.23.10.235 TCP 74 80 → 40528 [SYN, ACK] Seq=0 Ack=1 Win=65535 Len=0 MSS=1300 SACK_PERM=1 TSval=11488340 TSecr=1982197933 WS=512
37162 918.433040559 10.23.10.235 → 192.229.173.16 TCP 74 54098 → 443 [SYN] Seq=0 Win=29200 Len=0 MSS=1460 SACK_PERM=1 TSval=3812373603 TSecr=0 WS=128
37163 918.433125479 10.23.10.235 → 192.229.173.16 TCP 74 54100 → 443 [SYN] Seq=0 Win=29200 Len=0 MSS=1460 SACK_PERM=1 TSval=3812373603 TSecr=0 WS=128
37164 918.433194530 10.23.10.235 → 192.229.173.16 TCP 74 54102 → 443 [SYN] Seq=0 Win=29200 Len=0 MSS=1460 SACK_PERM=1 TSval=3812373604 TSecr=0 WS=128
37165 918.436294546 192.229.173.16 → 10.23.10.235 TCP 74 443 → 54098 [SYN, ACK] Seq=0 Ack=1 Win=65535 Len=0 MSS=1300 SACK_PERM=1 TSval=3230664861 TSecr=3812373603 WS=512
37167 918.436840148 192.229.173.16 → 10.23.10.235 TCP 74 443 → 54102 [SYN, ACK] Seq=0 Ack=1 Win=65535 Len=0 MSS=1300 SACK_PERM=1 TSval=4131564162 TSecr=3812373604 WS=512
37169 918.436864299 192.229.173.16 → 10.23.10.235 TCP 74 443 → 54100 [SYN, ACK] Seq=0 Ack=1 Win=65535 Len=0 MSS=1300 SACK_PERM=1 TSval=4189224811 TSecr=3812373603 WS=512
37254 918.483421427 10.23.10.235 → 192.229.173.16 TCP 74 54104 → 443 [SYN] Seq=0 Win=29200 Len=0 MSS=1460 SACK_PERM=1 TSval=3812373654 TSecr=0 WS=128
37255 918.483520673 10.23.10.235 → 192.229.173.16 TCP 74 54106 → 443 [SYN] Seq=0 Win=29200 Len=0 MSS=1460 SACK_PERM=1 TSval=3812373654 TSecr=0 WS=128
37256 918.483584401 10.23.10.235 → 192.229.173.16 TCP 74 54108 → 443 [SYN] Seq=0 Win=29200 Len=0 MSS=1460 SACK_PERM=1 TSval=3812373654 TSecr=0 WS=128
37257 918.483637179 10.23.10.235 → 192.229.173.16 TCP 74 54110 → 443 [SYN] Seq=0 Win=29200 Len=0 MSS=1460 SACK_PERM=1 TSval=3812373654 TSecr=0 WS=128
37258 918.483696530 10.23.10.235 → 192.229.173.16 TCP 74 54112 → 443 [SYN] Seq=0 Win=29200 Len=0 MSS=1460 SACK_PERM=1 TSval=3812373654 TSecr=0 WS=128
37259 918.483754115 10.23.10.235 → 192.229.173.16 TCP 74 54114 → 443 [SYN] Seq=0 Win=29200 Len=0 MSS=1460 SACK_PERM=1 TSval=3812373654 TSecr=0 WS=128
37267 918.491048200 192.229.173.16 → 10.23.10.235 TCP 74 443 → 54106 [SYN, ACK] Seq=0 Ack=1 Win=65535 Len=0 MSS=1300 SACK_PERM=1 TSval=3199512809 TSecr=3812373654 WS=512
37269 918.491078838 192.229.173.16 → 10.23.10.235 TCP 74 443 → 54104 [SYN, ACK] Seq=0 Ack=1 Win=65535 Len=0 MSS=1300 SACK_PERM=1 TSval=2040521168 TSecr=3812373654 WS=512
37271 918.491087507 192.229.173.16 → 10.23.10.235 TCP 74 443 → 54108 [SYN, ACK] Seq=0 Ack=1 Win=65535 Len=0 MSS=1300 SACK_PERM=1 TSval=407076786 TSecr=3812373654 WS=512
37273 918.491934686 192.229.173.16 → 10.23.10.235 TCP 74 443 → 54114 [SYN, ACK] Seq=0 Ack=1 Win=65535 Len=0 MSS=1300 SACK_PERM=1 TSval=3784589494 TSecr=3812373654 WS=512
37275 918.491965406 192.229.173.16 → 10.23.10.235 TCP 74 443 → 54110 [SYN, ACK] Seq=0 Ack=1 Win=65535 Len=0 MSS=1300 SACK_PERM=1 TSval=4160266469 TSecr=3812373654 WS=512
37278 918.494086456 192.229.173.16 → 10.23.10.235 TCP 74 443 → 54112 [SYN, ACK] Seq=0 Ack=1 Win=65535 Len=0 MSS=1300 SACK_PERM=1 TSval=1258760984 TSecr=3812373654 WS=512
38385 920.556447818 10.23.10.235 → 104.244.42.66 TCP 74 41578 → 443 [SYN] Seq=0 Win=29200 Len=0 MSS=1460 SACK_PERM=1 TSval=3994442126 TSecr=0 WS=128
38469 920.611114401 104.244.42.66 → 10.23.10.235 TCP 74 443 → 41578 [SYN, ACK] Seq=0 Ack=1 Win=28960 Len=0 MSS=1300 SACK_PERM=1 TSval=2132828050 TSecr=3994442126 WS=256
38694 920.906017181 10.23.10.235 → 192.229.173.16 TCP 74 54118 → 443 [SYN] Seq=0 Win=29200 Len=0 MSS=1460 SACK_PERM=1 TSval=3812376076 TSecr=0 WS=128
38695 920.906094874 10.23.10.235 → 192.229.173.16 TCP 74 54120 → 443 [SYN] Seq=0 Win=29200 Len=0 MSS=1460 SACK_PERM=1 TSval=3812376076 TSecr=0 WS=128
38698 920.909580461 192.229.173.16 → 10.23.10.235 TCP 74 443 → 54118 [SYN, ACK] Seq=0 Ack=1 Win=65535 Len=0 MSS=1300 SACK_PERM=1 TSval=2864043309 TSecr=3812376076 WS=512
38700 920.909761001 192.229.173.16 → 10.23.10.235 TCP 74 443 → 54120 [SYN, ACK] Seq=0 Ack=1 Win=65535 Len=0 MSS=1300 SACK_PERM=1 TSval=2662542569 TSecr=3812376076 WS=512
38786 921.468150252 10.23.10.235 → 199.232.36.158 TCP 74 58402 → 443 [SYN] Seq=0 Win=29200 Len=0 MSS=1460 SACK_PERM=1 TSval=1900159705 TSecr=0 WS=128
38787 921.470258565 199.232.36.158 → 10.23.10.235 TCP 74 443 → 58402 [SYN, ACK] Seq=0 Ack=1 Win=28960 Len=0 MSS=1300 SACK_PERM=1 TSval=528177769 TSecr=1900159705 WS=512
40261 962.050784913 10.23.10.235 → 81.20.48.118 TCP 74 55986 → 443 [SYN] Seq=0 Win=29200 Len=0 MSS=1460 SACK_PERM=1 TSval=3513649303 TSecr=0 WS=128
40262 962.125514738 81.20.48.118 → 10.23.10.235 TCP 74 443 → 55986 [SYN, ACK] Seq=0 Ack=1 Win=28960 Len=0 MSS=1300 SACK_PERM=1 TSval=1692671245 TSecr=3513649303 WS=128
40300 963.180181931 10.23.10.235 → 23.52.160.110 TCP 74 57210 → 443 [SYN] Seq=0 Win=29200 Len=0 MSS=1460 SACK_PERM=1 TSval=2665319201 TSecr=0 WS=128
40303 963.183834043 23.52.160.110 → 10.23.10.235 TCP 74 443 → 57210 [SYN, ACK] Seq=0 Ack=1 Win=28960 Len=0 MSS=1300 SACK_PERM=1 TSval=51233286 TSecr=2665319201 WS=128
40345 963.231321234 10.23.10.235 → 81.20.48.118 TCP 74 55990 → 443 [SYN] Seq=0 Win=29200 Len=0 MSS=1460 SACK_PERM=1 TSval=3513650484 TSecr=0 WS=128
40365 963.253591447 10.23.10.235 → 81.20.48.118 TCP 74 55992 → 443 [SYN] Seq=0 Win=29200 Len=0 MSS=1460 SACK_PERM=1 TSval=3513650506 TSecr=0 WS=128
40369 963.254605676 10.23.10.235 → 81.20.48.118 TCP 74 55994 → 443 [SYN] Seq=0 Win=29200 Len=0 MSS=1460 SACK_PERM=1 TSval=3513650507 TSecr=0 WS=128
40421 963.305905979 10.23.10.235 → 81.20.48.126 TCP 74 50098 → 443 [SYN] Seq=0 Win=29200 Len=0 MSS=1460 SACK_PERM=1 TSval=4202949364 TSecr=0 WS=128
40513 963.392138932 81.20.48.118 → 10.23.10.235 TCP 74 443 → 55990 [SYN, ACK] Seq=0 Ack=1 Win=28960 Len=0 MSS=1300 SACK_PERM=1 TSval=1692671541 TSecr=3513650484 WS=128
40515 963.392166138 81.20.48.118 → 10.23.10.235 TCP 74 443 → 55994 [SYN, ACK] Seq=0 Ack=1 Win=28960 Len=0 MSS=1300 SACK_PERM=1 TSval=1692671546 TSecr=3513650507 WS=128
40517 963.392179003 81.20.48.118 → 10.23.10.235 TCP 74 443 → 55992 [SYN, ACK] Seq=0 Ack=1 Win=28960 Len=0 MSS=1300 SACK_PERM=1 TSval=1692671546 TSecr=3513650506 WS=128
40520 963.392200768 81.20.48.126 → 10.23.10.235 TCP 74 443 → 50098 [SYN, ACK] Seq=0 Ack=1 Win=28960 Len=0 MSS=1300 SACK_PERM=1 TSval=3551663397 TSecr=4202949364 WS=128
40526 963.410379348 10.23.10.235 → 23.52.162.36 TCP 74 35432 → 443 [SYN] Seq=0 Win=29200 Len=0 MSS=1460 SACK_PERM=1 TSval=3263587568 TSecr=0 WS=128
40527 963.410637473 10.23.10.235 → 31.13.71.174 TCP 74 46834 → 443 [SYN] Seq=0 Win=29200 Len=0 MSS=1460 SACK_PERM=1 TSval=3404369490 TSecr=0 WS=128
40528 963.417954816 31.13.71.174 → 10.23.10.235 TCP 74 443 → 46834 [SYN, ACK] Seq=0 Ack=1 Win=27760 Len=0 MSS=1300 SACK_PERM=1 TSval=2808198154 TSecr=3404369490 WS=256
40530 963.418021001 23.52.162.36 → 10.23.10.235 TCP 74 443 → 35432 [SYN, ACK] Seq=0 Ack=1 Win=28960 Len=0 MSS=1300 SACK_PERM=1 TSval=1982872083 TSecr=3263587568 WS=128
40670 963.769813782 10.23.10.235 → 81.20.48.118 TCP 74 56002 → 443 [SYN] Seq=0 Win=29200 Len=0 MSS=1460 SACK_PERM=1 TSval=3513651022 TSecr=0 WS=128
40671 963.770041235 10.23.10.235 → 81.20.48.118 TCP 74 56004 → 443 [SYN] Seq=0 Win=29200 Len=0 MSS=1460 SACK_PERM=1 TSval=3513651023 TSecr=0 WS=128
40672 963.770314764 10.23.10.235 → 81.20.48.118 TCP 74 56006 → 443 [SYN] Seq=0 Win=29200 Len=0 MSS=1460 SACK_PERM=1 TSval=3513651023 TSecr=0 WS=128
40715 963.845639092 10.23.10.235 → 81.20.48.118 TCP 74 56008 → 443 [SYN] Seq=0 Win=29200 Len=0 MSS=1460 SACK_PERM=1 TSval=3513651098 TSecr=0 WS=128
40721 963.847852480 81.20.48.118 → 10.23.10.235 TCP 74 443 → 56006 [SYN, ACK] Seq=0 Ack=1 Win=28960 Len=0 MSS=1300 SACK_PERM=1 TSval=1692671675 TSecr=3513651023 WS=128
40723 963.847901300 81.20.48.118 → 10.23.10.235 TCP 74 443 → 56002 [SYN, ACK] Seq=0 Ack=1 Win=28960 Len=0 MSS=1300 SACK_PERM=1 TSval=1692671675 TSecr=3513651022 WS=128
40725 963.849108142 81.20.48.118 → 10.23.10.235 TCP 74 443 → 56004 [SYN, ACK] Seq=0 Ack=1 Win=28960 Len=0 MSS=1300 SACK_PERM=1 TSval=1692671676 TSecr=3513651023 WS=128
40734 963.865248226 10.23.10.235 → 34.242.193.4 TCP 74 54538 → 443 [SYN] Seq=0 Win=29200 Len=0 MSS=1460 SACK_PERM=1 TSval=3392909855 TSecr=0 WS=128
40737 963.920781563 81.20.48.118 → 10.23.10.235 TCP 74 443 → 56008 [SYN, ACK] Seq=0 Ack=1 Win=28960 Len=0 MSS=1300 SACK_PERM=1 TSval=1692671693 TSecr=3513651098 WS=128
40753 963.952518051 34.242.193.4 → 10.23.10.235 TCP 74 443 → 54538 [SYN, ACK] Seq=0 Ack=1 Win=26847 Len=0 MSS=1300 SACK_PERM=1 TSval=24174441 TSecr=3392909855 WS=128
40770 964.027331417 10.23.10.235 → 81.20.48.118 TCP 74 56012 → 443 [SYN] Seq=0 Win=29200 Len=0 MSS=1460 SACK_PERM=1 TSval=3513651280 TSecr=0 WS=128
40771 964.027638462 10.23.10.235 → 81.20.48.118 TCP 74 56014 → 443 [SYN] Seq=0 Win=29200 Len=0 MSS=1460 SACK_PERM=1 TSval=3513651280 TSecr=0 WS=128
40802 964.049890915 10.23.10.235 → 13.225.224.91 TCP 74 46068 → 443 [SYN] Seq=0 Win=29200 Len=0 MSS=1460 SACK_PERM=1 TSval=1193862807 TSecr=0 WS=128
40803 964.056745003 13.225.224.91 → 10.23.10.235 TCP 74 443 → 46068 [SYN, ACK] Seq=0 Ack=1 Win=28960 Len=0 MSS=1300 SACK_PERM=1 TSval=510933540 TSecr=1193862807 WS=256
40810 964.066670741 10.23.10.235 → 81.20.48.118 TCP 74 56018 → 443 [SYN] Seq=0 Win=29200 Len=0 MSS=1460 SACK_PERM=1 TSval=3513651319 TSecr=0 WS=128
40848 964.103679769 81.20.48.118 → 10.23.10.235 TCP 74 443 → 56012 [SYN, ACK] Seq=0 Ack=1 Win=28960 Len=0 MSS=1300 SACK_PERM=1 TSval=1692671739 TSecr=3513651280 WS=128
40851 964.121120363 81.20.48.118 → 10.23.10.235 TCP 74 443 → 56014 [SYN, ACK] Seq=0 Ack=1 Win=28960 Len=0 MSS=1300 SACK_PERM=1 TSval=1692671740 TSecr=3513651280 WS=128
40868 964.141365690 81.20.48.118 → 10.23.10.235 TCP 74 443 → 56018 [SYN, ACK] Seq=0 Ack=1 Win=28960 Len=0 MSS=1300 SACK_PERM=1 TSval=1692671748 TSecr=3513651319 WS=128
40922 964.245928950 10.23.10.235 → 23.52.162.36 TCP 74 35454 → 443 [SYN] Seq=0 Win=29200 Len=0 MSS=1460 SACK_PERM=1 TSval=3263588404 TSecr=0 WS=128
40933 964.253012571 23.52.162.36 → 10.23.10.235 TCP 74 443 → 35454 [SYN, ACK] Seq=0 Ack=1 Win=28960 Len=0 MSS=1300 SACK_PERM=1 TSval=1982872917 TSecr=3263588404 WS=128
40995 964.372673412 10.23.10.235 → 81.20.48.118 TCP 74 56022 → 443 [SYN] Seq=0 Win=29200 Len=0 MSS=1460 SACK_PERM=1 TSval=3513651625 TSecr=0 WS=128
40996 964.372779453 10.23.10.235 → 81.20.48.118 TCP 74 56024 → 443 [SYN] Seq=0 Win=29200 Len=0 MSS=1460 SACK_PERM=1 TSval=3513651625 TSecr=0 WS=128
41008 964.508420259 81.20.48.118 → 10.23.10.235 TCP 74 443 → 56022 [SYN, ACK] Seq=0 Ack=1 Win=28960 Len=0 MSS=1300 SACK_PERM=1 TSval=1692671825 TSecr=3513651625 WS=128
41010 964.508499655 81.20.48.118 → 10.23.10.235 TCP 74 443 → 56024 [SYN, ACK] Seq=0 Ack=1 Win=28960 Len=0 MSS=1300 SACK_PERM=1 TSval=1692671825 TSecr=3513651625 WS=128
41150 965.100967945 10.23.10.235 → 31.13.71.52  TCP 74 50778 → 443 [SYN] Seq=0 Win=29200 Len=0 MSS=1460 SACK_PERM=1 TSval=56391162 TSecr=0 WS=128
41151 965.101052979 10.23.10.235 → 31.13.71.52  TCP 74 50780 → 443 [SYN] Seq=0 Win=29200 Len=0 MSS=1460 SACK_PERM=1 TSval=56391162 TSecr=0 WS=128
41152 965.101107578 10.23.10.235 → 31.13.71.52  TCP 74 50782 → 443 [SYN] Seq=0 Win=29200 Len=0 MSS=1460 SACK_PERM=1 TSval=56391162 TSecr=0 WS=128
41153 965.101158386 10.23.10.235 → 31.13.71.52  TCP 74 50784 → 443 [SYN] Seq=0 Win=29200 Len=0 MSS=1460 SACK_PERM=1 TSval=56391162 TSecr=0 WS=128
41154 965.103454690  31.13.71.52 → 10.23.10.235 TCP 74 443 → 50778 [SYN, ACK] Seq=0 Ack=1 Win=27760 Len=0 MSS=1300 SACK_PERM=1 TSval=3459890145 TSecr=56391162 WS=256
41156 965.103990422  31.13.71.52 → 10.23.10.235 TCP 74 443 → 50780 [SYN, ACK] Seq=0 Ack=1 Win=27760 Len=0 MSS=1300 SACK_PERM=1 TSval=1519419847 TSecr=56391162 WS=256
41158 965.104013011  31.13.71.52 → 10.23.10.235 TCP 74 443 → 50784 [SYN, ACK] Seq=0 Ack=1 Win=27760 Len=0 MSS=1300 SACK_PERM=1 TSval=2609226843 TSecr=56391162 WS=256
41160 965.104020463  31.13.71.52 → 10.23.10.235 TCP 74 443 → 50782 [SYN, ACK] Seq=0 Ack=1 Win=27760 Len=0 MSS=1300 SACK_PERM=1 TSval=4212747029 TSecr=56391162 WS=256
41183 965.134748935 10.23.10.235 → 72.21.91.29  TCP 74 40604 → 80 [SYN] Seq=0 Win=29200 Len=0 MSS=1460 SACK_PERM=1 TSval=1982245226 TSecr=0 WS=128
41184 965.135426286 10.23.10.235 → 72.21.91.29  TCP 74 40606 → 80 [SYN] Seq=0 Win=29200 Len=0 MSS=1460 SACK_PERM=1 TSval=1982245227 TSecr=0 WS=128
41185 965.136094499 10.23.10.235 → 72.21.91.29  TCP 74 40608 → 80 [SYN] Seq=0 Win=29200 Len=0 MSS=1460 SACK_PERM=1 TSval=1982245228 TSecr=0 WS=128
41186 965.137897371  72.21.91.29 → 10.23.10.235 TCP 74 80 → 40604 [SYN, ACK] Seq=0 Ack=1 Win=65535 Len=0 MSS=1300 SACK_PERM=1 TSval=3796089376 TSecr=1982245226 WS=512
41189 965.140070166  72.21.91.29 → 10.23.10.235 TCP 74 80 → 40606 [SYN, ACK] Seq=0 Ack=1 Win=65535 Len=0 MSS=1300 SACK_PERM=1 TSval=4104698900 TSecr=1982245227 WS=512
41195 965.141888081  72.21.91.29 → 10.23.10.235 TCP 74 80 → 40608 [SYN, ACK] Seq=0 Ack=1 Win=65535 Len=0 MSS=1300 SACK_PERM=1 TSval=3217643675 TSecr=1982245228 WS=512
41327 965.482231495 10.23.10.235 → 23.52.160.110 TCP 74 57262 → 443 [SYN] Seq=0 Win=29200 Len=0 MSS=1460 SACK_PERM=1 TSval=2665321503 TSecr=0 WS=128
41328 965.486514140 23.52.160.110 → 10.23.10.235 TCP 74 443 → 57262 [SYN, ACK] Seq=0 Ack=1 Win=28960 Len=0 MSS=1300 SACK_PERM=1 TSval=51235588 TSecr=2665321503 WS=128
41364 965.655160285 10.23.10.235 → 52.17.121.244 TCP 74 59054 → 443 [SYN] Seq=0 Win=29200 Len=0 MSS=1460 SACK_PERM=1 TSval=3274111904 TSecr=0 WS=128
41365 965.658066054 10.23.10.235 → 52.17.121.244 TCP 74 59056 → 443 [SYN] Seq=0 Win=29200 Len=0 MSS=1460 SACK_PERM=1 TSval=3274111907 TSecr=0 WS=128
41366 965.740997708 52.17.121.244 → 10.23.10.235 TCP 74 443 → 59054 [SYN, ACK] Seq=0 Ack=1 Win=2048 Len=0 MSS=1300 SACK_PERM=1 TSval=2288651997 TSecr=3274111904 WS=512
41369 965.742625863 52.17.121.244 → 10.23.10.235 TCP 74 443 → 59056 [SYN, ACK] Seq=0 Ack=1 Win=2048 Len=0 MSS=1300 SACK_PERM=1 TSval=2288652000 TSecr=3274111907 WS=512
41390 965.839046808 10.23.10.235 → 151.139.128.14 TCP 74 60072 → 80 [SYN] Seq=0 Win=29200 Len=0 MSS=1460 SACK_PERM=1 TSval=649947024 TSecr=0 WS=128
41391 965.839142793 10.23.10.235 → 151.139.128.14 TCP 74 60074 → 80 [SYN] Seq=0 Win=29200 Len=0 MSS=1460 SACK_PERM=1 TSval=649947024 TSecr=0 WS=128
41392 965.841883016 151.139.128.14 → 10.23.10.235 TCP 74 80 → 60072 [SYN, ACK] Seq=0 Ack=1 Win=28960 Len=0 MSS=1300 SACK_PERM=1 TSval=1755436058 TSecr=649947024 WS=512
41395 965.842900629 151.139.128.14 → 10.23.10.235 TCP 74 80 → 60074 [SYN, ACK] Seq=0 Ack=1 Win=28960 Len=0 MSS=1300 SACK_PERM=1 TSval=1750358378 TSecr=649947024 WS=512
41471 966.829478249 10.23.10.235 → 13.225.224.76 TCP 74 36806 → 443 [SYN] Seq=0 Win=29200 Len=0 MSS=1460 SACK_PERM=1 TSval=1174408650 TSecr=0 WS=128
41472 966.832550424 13.225.224.76 → 10.23.10.235 TCP 74 443 → 36806 [SYN, ACK] Seq=0 Ack=1 Win=28960 Len=0 MSS=1300 SACK_PERM=1 TSval=510921119 TSecr=1174408650 WS=256
41494 966.947046972 10.23.10.235 → 23.52.160.110 TCP 74 57274 → 443 [SYN] Seq=0 Win=29200 Len=0 MSS=1460 SACK_PERM=1 TSval=2665322968 TSecr=0 WS=128
41497 966.951306669 23.52.160.110 → 10.23.10.235 TCP 74 443 → 57274 [SYN, ACK] Seq=0 Ack=1 Win=28960 Len=0 MSS=1300 SACK_PERM=1 TSval=51237053 TSecr=2665322968 WS=128
41507 966.967652266 10.23.10.235 → 172.217.12.165 TCP 74 50274 → 443 [SYN] Seq=0 Win=29200 Len=0 MSS=1460 SACK_PERM=1 TSval=852532220 TSecr=0 WS=128
41511 966.975348253 172.217.12.165 → 10.23.10.235 TCP 74 443 → 50274 [SYN, ACK] Seq=0 Ack=1 Win=60192 Len=0 MSS=1300 SACK_PERM=1 TSval=3684650844 TSecr=852532220 WS=256
41539 967.002685451 10.23.10.235 → 23.21.242.28 TCP 74 53996 → 443 [SYN] Seq=0 Win=29200 Len=0 MSS=1460 SACK_PERM=1 TSval=2053522321 TSecr=0 WS=128
41540 967.012402107 23.21.242.28 → 10.23.10.235 TCP 74 443 → 53996 [SYN, ACK] Seq=0 Ack=1 Win=17898 Len=0 MSS=1300 SACK_PERM=1 TSval=4077433338 TSecr=2053522321 WS=512
41560 967.056187859 10.23.10.235 → 192.124.249.24 TCP 74 58192 → 80 [SYN] Seq=0 Win=29200 Len=0 MSS=1460 SACK_PERM=1 TSval=1788423644 TSecr=0 WS=128
41564 967.064250587 192.124.249.24 → 10.23.10.235 TCP 74 80 → 58192 [SYN, ACK] Seq=0 Ack=1 Win=28960 Len=0 MSS=1300 SACK_PERM=1 TSval=2271741273 TSecr=1788423644 WS=512
41612 967.343232246 10.23.10.235 → 13.225.208.28 TCP 74 41746 → 443 [SYN] Seq=0 Win=29200 Len=0 MSS=1460 SACK_PERM=1 TSval=3374475510 TSecr=0 WS=128
