  107 20.425073116 192.168.8.228 → 172.217.7.14 TCP 74 56172 → 80 [SYN] Seq=0 Win=29200 Len=0 MSS=1460 SACK_PERM=1 TSval=2057358346 TSecr=0 WS=64
  108 20.430410070 172.217.7.14 → 192.168.8.228 TCP 74 80 → 56172 [SYN, ACK] Seq=0 Ack=1 Win=60192 Len=0 MSS=1300 SACK_PERM=1 TSval=1810192099 TSecr=2057358346 WS=256
  296 35.549186194 192.168.8.228 → 31.13.71.36  TCP 74 52274 → 80 [SYN] Seq=0 Win=29200 Len=0 MSS=1460 SACK_PERM=1 TSval=2643437454 TSecr=0 WS=64
  297 35.553617156  31.13.71.36 → 192.168.8.228 TCP 74 80 → 52274 [SYN, ACK] Seq=0 Ack=1 Win=27760 Len=0 MSS=1300 SACK_PERM=1 TSval=3852084433 TSecr=2643437454 WS=256
  389 42.438165777 192.168.8.228 → 93.184.216.34 TCP 74 42336 → 80 [SYN] Seq=0 Win=29200 Len=0 MSS=1460 SACK_PERM=1 TSval=516235231 TSecr=0 WS=64
  390 42.443248734 93.184.216.34 → 192.168.8.228 TCP 74 80 → 42336 [SYN, ACK] Seq=0 Ack=1 Win=65535 Len=0 MSS=1300 SACK_PERM=1 TSval=2768984580 TSecr=516235231 WS=512
  500 57.876093111 192.168.8.228 → 93.184.216.34 TCP 74 42338 → 80 [SYN] Seq=0 Win=29200 Len=0 MSS=1460 SACK_PERM=1 TSval=516250669 TSecr=0 WS=64
  501 57.881694063 93.184.216.34 → 192.168.8.228 TCP 74 80 → 42338 [SYN, ACK] Seq=0 Ack=1 Win=65535 Len=0 MSS=1300 SACK_PERM=1 TSval=705390209 TSecr=516250669 WS=512
  674 75.782737045 192.168.8.228 → 93.184.216.34 TCP 74 42340 → 80 [SYN] Seq=0 Win=29200 Len=0 MSS=1460 SACK_PERM=1 TSval=516268576 TSecr=0 WS=64
  675 75.788195999 93.184.216.34 → 192.168.8.228 TCP 74 80 → 42340 [SYN, ACK] Seq=0 Ack=1 Win=65535 Len=0 MSS=1300 SACK_PERM=1 TSval=4091869347 TSecr=516268576 WS=512
  796 95.848197533 192.168.8.228 → 93.184.216.34 TCP 74 42342 → 80 [SYN] Seq=0 Win=29200 Len=0 MSS=1460 SACK_PERM=1 TSval=516288641 TSecr=0 WS=64
  797 95.853120491 93.184.216.34 → 192.168.8.228 TCP 74 80 → 42342 [SYN, ACK] Seq=0 Ack=1 Win=65535 Len=0 MSS=1300 SACK_PERM=1 TSval=4264200247 TSecr=516288641 WS=512
 6758 1400.206857710 192.168.8.128 → 172.217.12.132 TCP 74 46080 → 443 [SYN] Seq=0 Win=29200 Len=0 MSS=1460 SACK_PERM=1 TSval=863016803 TSecr=0 WS=128
 6759 1400.211659629 172.217.12.132 → 192.168.8.128 TCP 74 443 → 46080 [SYN, ACK] Seq=0 Ack=1 Win=60192 Len=0 MSS=1300 SACK_PERM=1 TSval=1250365826 TSecr=863016803 WS=256
 7323 1459.513896692 192.168.8.128 → 172.217.9.234 TCP 74 45674 → 443 [SYN] Seq=0 Win=29200 Len=0 MSS=1460 SACK_PERM=1 TSval=3070189750 TSecr=0 WS=128
 7324 1459.518439619 172.217.9.234 → 192.168.8.128 TCP 74 443 → 45674 [SYN, ACK] Seq=0 Ack=1 Win=60192 Len=0 MSS=1300 SACK_PERM=1 TSval=2778250178 TSecr=3070189750 WS=256
 7551 1486.374712674 192.168.8.128 → 31.13.71.14  TCP 74 51974 → 443 [SYN] Seq=0 Win=29200 Len=0 MSS=1460 SACK_PERM=1 TSval=3122076103 TSecr=0 WS=128
 7552 1486.378603613  31.13.71.14 → 192.168.8.128 TCP 74 443 → 51974 [SYN, ACK] Seq=0 Ack=1 Win=27760 Len=0 MSS=1300 SACK_PERM=1 TSval=1120247238 TSecr=3122076103 WS=256
 7797 1509.594159181 192.168.8.128 → 54.192.54.20 TCP 74 40886 → 443 [SYN] Seq=0 Win=29200 Len=0 MSS=1460 SACK_PERM=1 TSval=881589495 TSecr=0 WS=128
 7799 1509.598362117 54.192.54.20 → 192.168.8.128 TCP 74 443 → 40886 [SYN, ACK] Seq=0 Ack=1 Win=28960 Len=0 MSS=1300 SACK_PERM=1 TSval=3368725411 TSecr=881589495 WS=256
 7870 1519.616132488 192.168.8.128 → 54.192.54.20 TCP 74 40888 → 443 [SYN] Seq=0 Win=29200 Len=0 MSS=1460 SACK_PERM=1 TSval=881599517 TSecr=0 WS=128
 7871 1519.638331148 54.192.54.20 → 192.168.8.128 TCP 74 443 → 40888 [SYN, ACK] Seq=0 Ack=1 Win=28960 Len=0 MSS=1300 SACK_PERM=1 TSval=3366559839 TSecr=881599517 WS=256
 7913 1524.707947830 192.168.8.128 → 34.212.28.14 TCP 74 56636 → 443 [SYN] Seq=0 Win=29200 Len=0 MSS=1460 SACK_PERM=1 TSval=2279861212 TSecr=0 WS=128
 7914 1524.785081656 34.212.28.14 → 192.168.8.128 TCP 74 443 → 56636 [SYN, ACK] Seq=0 Ack=1 Win=17898 Len=0 MSS=1300 SACK_PERM=1 TSval=3450029039 TSecr=2279861212 WS=128
 7937 1525.218189063 192.168.8.128 → 52.11.86.147 TCP 74 42534 → 443 [SYN] Seq=0 Win=29200 Len=0 MSS=1460 SACK_PERM=1 TSval=2830257250 TSecr=0 WS=128
 7940 1525.297281859 52.11.86.147 → 192.168.8.128 TCP 74 443 → 42534 [SYN, ACK] Seq=0 Ack=1 Win=26847 Len=0 MSS=1300 SACK_PERM=1 TSval=25300375 TSecr=2830257250 WS=256
 8015 1526.268299089 192.168.8.128 → 34.95.71.207 TCP 74 54382 → 443 [SYN] Seq=0 Win=29200 Len=0 MSS=1460 SACK_PERM=1 TSval=1147892478 TSecr=0 WS=128
 8016 1526.273318012 34.95.71.207 → 192.168.8.128 TCP 74 443 → 54382 [SYN, ACK] Seq=0 Ack=1 Win=60192 Len=0 MSS=1300 SACK_PERM=1 TSval=2362707616 TSecr=1147892478 WS=256
 8177 1542.239985602 192.168.8.128 → 31.13.71.1   TCP 74 34596 → 443 [SYN] Seq=0 Win=29200 Len=0 MSS=1460 SACK_PERM=1 TSval=2471612757 TSecr=0 WS=128
 8178 1542.243854544   31.13.71.1 → 192.168.8.128 TCP 74 443 → 34596 [SYN, ACK] Seq=0 Ack=1 Win=27760 Len=0 MSS=1300 SACK_PERM=1 TSval=2640531382 TSecr=2471612757 WS=256
 8884 1610.151023075 192.168.8.245 → 17.57.144.5  TCP 78 49720 → 5223 [SYN] Seq=0 Win=65535 Len=0 MSS=1460 WS=64 TSval=831134289 TSecr=0 SACK_PERM=1
 8885 1610.155279014  17.57.144.5 → 192.168.8.245 TCP 74 5223 → 49720 [SYN, ACK] Seq=0 Ack=1 Win=28960 Len=0 MSS=1300 SACK_PERM=1 TSval=1376532084 TSecr=831134289 WS=128
 8927 1610.332723467 192.168.8.245 → 17.142.169.199 TCP 78 61527 → 443 [SYN] Seq=0 Win=65535 Len=0 MSS=1460 WS=128 TSval=831169282 TSecr=0 SACK_PERM=1
 8940 1610.407204397 17.142.169.199 → 192.168.8.245 TCP 66 443 → 61527 [SYN, ACK] Seq=0 Ack=1 Win=8190 Len=0 MSS=1212 WS=128 SACK_PERM=1
 8966 1611.050677161 192.168.8.245 → 17.249.121.246 TCP 78 61528 → 443 [SYN] Seq=0 Win=65535 Len=0 MSS=1460 WS=128 TSval=831170771 TSecr=0 SACK_PERM=1
 8967 1611.054913100 17.249.121.246 → 192.168.8.245 TCP 74 443 → 61528 [SYN, ACK] Seq=0 Ack=1 Win=28960 Len=0 MSS=1300 TSval=2099799414 TSecr=831170771 WS=512
 8992 1611.117976195 192.168.8.245 → 17.249.121.246 TCP 78 61529 → 443 [SYN] Seq=0 Win=65535 Len=0 MSS=1460 WS=128 TSval=831170835 TSecr=0 SACK_PERM=1
 8993 1611.122060136 17.249.121.246 → 192.168.8.245 TCP 74 443 → 61529 [SYN, ACK] Seq=0 Ack=1 Win=28960 Len=0 MSS=1300 TSval=2104822686 TSecr=831170835 WS=512
 9011 1611.165422514 192.168.8.245 → 17.249.121.246 TCP 78 61530 → 443 [SYN] Seq=0 Win=65535 Len=0 MSS=1460 WS=128 TSval=831170879 TSecr=0 SACK_PERM=1
 9012 1611.169307459 17.249.121.246 → 192.168.8.245 TCP 74 443 → 61530 [SYN, ACK] Seq=0 Ack=1 Win=28960 Len=0 MSS=1300 TSval=2104822733 TSecr=831170879 WS=512
 9033 1611.199157030 192.168.8.245 → 17.249.121.246 TCP 78 61531 → 443 [SYN] Seq=0 Win=65535 Len=0 MSS=1460 WS=128 TSval=831170907 TSecr=0 SACK_PERM=1
 9034 1611.202898977 17.249.121.246 → 192.168.8.245 TCP 74 443 → 61531 [SYN, ACK] Seq=0 Ack=1 Win=28960 Len=0 MSS=1300 TSval=2097516603 TSecr=831170907 WS=512
 9052 1611.231550566 192.168.8.245 → 17.249.121.246 TCP 78 61532 → 443 [SYN] Seq=0 Win=65535 Len=0 MSS=1460 WS=128 TSval=831170935 TSecr=0 SACK_PERM=1
 9059 1611.299386593 192.168.8.245 → 17.248.135.176 TCP 78 61533 → 443 [SYN] Seq=0 Win=65535 Len=0 MSS=1460 WS=128 TSval=831140589 TSecr=0 SACK_PERM=1
 9060 1611.303465534 17.248.135.176 → 192.168.8.245 TCP 74 443 → 61533 [SYN, ACK] Seq=0 Ack=1 Win=28960 Len=0 MSS=1300 TSval=3886733248 TSecr=831140589 WS=32
 9096 1611.409588012 192.168.8.245 → 17.249.121.246 TCP 78 [TCP Retransmission] 61532 → 443 [SYN] Seq=0 Win=65535 Len=0 MSS=1460 WS=128 TSval=831171089 TSecr=0 SACK_PERM=1
 9100 1611.474083087 192.168.8.245 → 17.249.121.246 TCP 78 [TCP Retransmission] 61532 → 443 [SYN] Seq=0 Win=65535 Len=0 MSS=1460 WS=128 TSval=831171177 TSecr=0 SACK_PERM=1
 9102 1611.539181153 192.168.8.245 → 17.249.121.246 TCP 78 [TCP Retransmission] 61532 → 443 [SYN] Seq=0 Win=65535 Len=0 MSS=1460 WS=128 TSval=831171242 TSecr=0 SACK_PERM=1
 9112 1611.675945191 192.168.8.245 → 17.249.121.246 TCP 78 [TCP Retransmission] 61532 → 443 [SYN] Seq=0 Win=65535 Len=0 MSS=1460 WS=128 TSval=831171377 TSecr=0 SACK_PERM=1
 9123 1611.774791773 192.168.8.245 → 17.249.121.246 TCP 78 [TCP Retransmission] 61532 → 443 [SYN] Seq=0 Win=65535 Len=0 MSS=1460 WS=128 TSval=831171475 TSecr=0 SACK_PERM=1
 9130 1611.807542303 192.168.8.245 → 17.248.135.117 TCP 78 61534 → 443 [SYN] Seq=0 Win=65535 Len=0 MSS=1460 WS=128 TSval=831171528 TSecr=0 SACK_PERM=1
 9131 1611.811747243 17.248.135.117 → 192.168.8.245 TCP 74 443 → 61534 [SYN, ACK] Seq=0 Ack=1 Win=28960 Len=0 MSS=1300 TSval=2417626692 TSecr=831171528 WS=32
 9196 1611.921742665 192.168.8.245 → 17.249.121.246 TCP 78 [TCP Retransmission] 61532 → 443 [SYN] Seq=0 Win=65535 Len=0 MSS=1460 WS=128 TSval=831171623 TSecr=0 SACK_PERM=1
 9207 1612.089674256 192.168.8.245 → 17.249.121.246 TCP 78 [TCP Retransmission] 61532 → 443 [SYN] Seq=0 Win=65535 Len=0 MSS=1460 WS=128 TSval=831171790 TSecr=0 SACK_PERM=1
 9229 1612.464624881 192.168.8.245 → 17.249.121.246 TCP 78 [TCP Retransmission] 61532 → 443 [SYN] Seq=0 Win=65535 Len=0 MSS=1460 WS=128 TSval=831172159 TSecr=0 SACK_PERM=1
 9242 1613.041230615 192.168.8.245 → 17.249.121.246 TCP 78 [TCP Retransmission] 61532 → 443 [SYN] Seq=0 Win=65535 Len=0 MSS=1460 WS=128 TSval=831172740 TSecr=0 SACK_PERM=1
 9265 1614.030643440 192.168.8.245 → 17.249.121.246 TCP 62 [TCP Retransmission] 61532 → 443 [SYN] Seq=0 Win=65535 Len=0 MSS=1460 SACK_PERM=1
 9285 1614.645924630 192.168.8.245 → 17.248.187.68 TCP 78 61535 → 443 [SYN] Seq=0 Win=65535 Len=0 MSS=1460 WS=128 TSval=831174367 TSecr=0 SACK_PERM=1
 9287 1614.650039571 17.248.187.68 → 192.168.8.245 TCP 74 443 → 61535 [SYN, ACK] Seq=0 Ack=1 Win=28960 Len=0 MSS=1300 TSval=2283586347 TSecr=831174367 WS=32
 9323 1616.067033292 192.168.8.245 → 17.249.121.246 TCP 62 [TCP Retransmission] 61532 → 443 [SYN] Seq=0 Win=65535 Len=0 MSS=1460 SACK_PERM=1
 9346 1617.984014890 192.168.8.245 → 17.249.121.246 TCP 62 [TCP Retransmission] 61532 → 443 [SYN] Seq=0 Win=65535 Len=0 MSS=1460 SACK_PERM=1
 9490 1633.132254520 192.168.8.245 → 199.232.37.140 TCP 78 61536 → 443 [SYN] Seq=0 Win=65535 Len=0 MSS=1460 WS=128 TSval=831192612 TSecr=0 SACK_PERM=1
 9491 1633.135655472 199.232.37.140 → 192.168.8.245 TCP 74 443 → 61536 [SYN, ACK] Seq=0 Ack=1 Win=28960 Len=0 MSS=1300 SACK_PERM=1 TSval=532886056 TSecr=831192612 WS=512
 9525 1633.206040476 192.168.8.245 → 52.94.232.33 TCP 78 61537 → 443 [SYN] Seq=0 Win=65535 Len=0 MSS=1460 WS=128 TSval=831192679 TSecr=0 SACK_PERM=1
 9526 1633.206303472 192.168.8.245 → 52.94.232.33 TCP 78 61538 → 443 [SYN] Seq=0 Win=65535 Len=0 MSS=1460 WS=128 TSval=831192680 TSecr=0 SACK_PERM=1
 9527 1633.207758452 192.168.8.245 → 52.94.232.33 TCP 78 61539 → 443 [SYN] Seq=0 Win=65535 Len=0 MSS=1460 WS=128 TSval=831192680 TSecr=0 SACK_PERM=1
 9528 1633.208031448 192.168.8.245 → 72.21.206.140 TCP 78 61540 → 443 [SYN] Seq=0 Win=65535 Len=0 MSS=1460 WS=128 TSval=831192681 TSecr=0 SACK_PERM=1
 9529 1633.215540342 52.94.232.33 → 192.168.8.245 TCP 66 443 → 61538 [SYN, ACK] Seq=0 Ack=1 Win=8190 Len=0 MSS=1212 WS=64 SACK_PERM=1
 9530 1633.215793338 52.94.232.33 → 192.168.8.245 TCP 66 443 → 61537 [SYN, ACK] Seq=0 Ack=1 Win=8190 Len=0 MSS=1212 WS=64 SACK_PERM=1
 9531 1633.217472314 52.94.232.33 → 192.168.8.245 TCP 66 443 → 61539 [SYN, ACK] Seq=0 Ack=1 Win=8190 Len=0 MSS=1212 WS=64 SACK_PERM=1
 9532 1633.217719311 72.21.206.140 → 192.168.8.245 TCP 66 443 → 61540 [SYN, ACK] Seq=0 Ack=1 Win=8190 Len=0 MSS=1212 WS=64 SACK_PERM=1
 9624 1633.462877843 192.168.8.245 → 52.94.232.33 TCP 78 61541 → 443 [SYN] Seq=0 Win=65535 Len=0 MSS=1460 WS=128 TSval=831192922 TSecr=0 SACK_PERM=1
 9626 1633.464086826 192.168.8.245 → 52.94.232.33 TCP 78 61542 → 443 [SYN] Seq=0 Win=65535 Len=0 MSS=1460 WS=128 TSval=831192923 TSecr=0 SACK_PERM=1
 9630 1633.472764703 52.94.232.33 → 192.168.8.245 TCP 66 443 → 61542 [SYN, ACK] Seq=0 Ack=1 Win=8190 Len=0 MSS=1212 WS=64 SACK_PERM=1
 9631 1633.472995700 52.94.232.33 → 192.168.8.245 TCP 66 443 → 61541 [SYN, ACK] Seq=0 Ack=1 Win=8190 Len=0 MSS=1212 WS=64 SACK_PERM=1
 9686 1633.718704224 192.168.8.245 → 52.94.232.33 TCP 78 61543 → 443 [SYN] Seq=0 Win=65535 Len=0 MSS=1460 WS=128 TSval=831193168 TSecr=0 SACK_PERM=1
 9689 1633.728257089 52.94.232.33 → 192.168.8.245 TCP 66 443 → 61543 [SYN, ACK] Seq=0 Ack=1 Win=8190 Len=0 MSS=1212 WS=64 SACK_PERM=1
10076 1691.891532892 192.168.8.128 → 192.168.8.1  TCP 74 39268 → 80 [SYN] Seq=0 Win=29200 Len=0 MSS=1460 SACK_PERM=1 TSval=2610580129 TSecr=0 WS=128
10077 1691.891975886  192.168.8.1 → 192.168.8.128 TCP 74 80 → 39268 [SYN, ACK] Seq=0 Ack=1 Win=28960 Len=0 MSS=1460 SACK_PERM=1 TSval=821734 TSecr=2610580129 WS=16
10185 1703.943226888 192.168.8.128 → 172.217.10.69 TCP 74 51640 → 443 [SYN] Seq=0 Win=29200 Len=0 MSS=1460 SACK_PERM=1 TSval=3030371569 TSecr=0 WS=128
10186 1703.947997823 172.217.10.69 → 192.168.8.128 TCP 74 443 → 51640 [SYN, ACK] Seq=0 Ack=1 Win=60192 Len=0 MSS=1300 SACK_PERM=1 TSval=145524278 TSecr=3030371569 WS=256
10340 1723.531460712 192.168.8.128 → 104.108.116.202 TCP 74 44216 → 443 [SYN] Seq=0 Win=29200 Len=0 MSS=1460 SACK_PERM=1 TSval=538672850 TSecr=0 WS=128
10341 1723.531749708 192.168.8.128 → 104.108.116.202 TCP 74 44218 → 443 [SYN] Seq=0 Win=29200 Len=0 MSS=1460 SACK_PERM=1 TSval=538672850 TSecr=0 WS=128
10342 1723.540682588 104.108.116.202 → 192.168.8.128 TCP 74 443 → 44216 [SYN, ACK] Seq=0 Ack=1 Win=28960 Len=0 MSS=1300 SACK_PERM=1 TSval=29903776 TSecr=538672850 WS=128
10343 1723.540932585 104.108.116.202 → 192.168.8.128 TCP 74 443 → 44218 [SYN, ACK] Seq=0 Ack=1 Win=28960 Len=0 MSS=1300 SACK_PERM=1 TSval=29903776 TSecr=538672850 WS=128
10344 1723.549157474 104.108.116.202 → 192.168.8.128 TCP 74 [TCP Retransmission] 443 → 44216 [SYN, ACK] Seq=0 Ack=1 Win=28960 Len=0 MSS=1300 SACK_PERM=1 TSval=29903785 TSecr=538672850 WS=128
10345 1723.549411471 104.108.116.202 → 192.168.8.128 TCP 74 [TCP Retransmission] 443 → 44218 [SYN, ACK] Seq=0 Ack=1 Win=28960 Len=0 MSS=1300 SACK_PERM=1 TSval=29903785 TSecr=538672850 WS=128
10382 1723.629464397 192.168.8.128 → 93.184.215.201 TCP 74 50572 → 443 [SYN] Seq=0 Win=29200 Len=0 MSS=1460 SACK_PERM=1 TSval=2055042508 TSecr=0 WS=128
10385 1723.635688314 93.184.215.201 → 192.168.8.128 TCP 66 443 → 50572 [SYN, ACK] Seq=0 Ack=1 Win=65535 Len=0 MSS=1300 SACK_PERM=1 WS=512
10386 1723.635944310 192.168.8.128 → 93.184.215.201 TCP 74 50574 → 443 [SYN] Seq=0 Win=29200 Len=0 MSS=1460 SACK_PERM=1 TSval=2055042514 TSecr=0 WS=128
10389 1723.640897244 93.184.215.201 → 192.168.8.128 TCP 66 443 → 50574 [SYN, ACK] Seq=0 Ack=1 Win=65535 Len=0 MSS=1300 SACK_PERM=1 WS=512
10509 1730.618583842 192.168.8.128 → 152.199.4.33 TCP 74 51500 → 443 [SYN] Seq=0 Win=29200 Len=0 MSS=1460 SACK_PERM=1 TSval=3497153345 TSecr=0 WS=128
10510 1730.623057782 152.199.4.33 → 192.168.8.128 TCP 66 443 → 51500 [SYN, ACK] Seq=0 Ack=1 Win=65535 Len=0 MSS=1300 SACK_PERM=1 WS=512
10604 1738.721672824 192.168.8.128 → 40.77.226.250 TCP 74 49292 → 443 [SYN] Seq=0 Win=29200 Len=0 MSS=1460 SACK_PERM=1 TSval=532296123 TSecr=0 WS=128
10605 1738.721972820 192.168.8.128 → 40.77.226.250 TCP 74 49294 → 443 [SYN] Seq=0 Win=29200 Len=0 MSS=1460 SACK_PERM=1 TSval=532296123 TSecr=0 WS=128
10606 1738.797020821 40.77.226.250 → 192.168.8.128 TCP 74 443 → 49294 [SYN, ACK] Seq=0 Ack=1 Win=8192 Len=0 MSS=1300 WS=256 SACK_PERM=1 TSval=52698678 TSecr=532296123
10607 1738.797491815 40.77.226.250 → 192.168.8.128 TCP 74 443 → 49292 [SYN, ACK] Seq=0 Ack=1 Win=8192 Len=0 MSS=1300 WS=256 SACK_PERM=1 TSval=26387204 TSecr=532296123
10682 1742.734674505 192.168.8.128 → 104.42.78.153 TCP 74 58744 → 443 [SYN] Seq=0 Win=29200 Len=0 MSS=1460 SACK_PERM=1 TSval=1002369710 TSecr=0 WS=128
10683 1742.811284488 104.42.78.153 → 192.168.8.128 TCP 74 443 → 58744 [SYN, ACK] Seq=0 Ack=1 Win=8192 Len=0 MSS=1300 WS=256 SACK_PERM=1 TSval=1516568245 TSecr=1002369710
10810 1758.081809652 192.168.8.128 → 65.55.44.109 TCP 74 47850 → 443 [SYN] Seq=0 Win=29200 Len=0 MSS=1460 SACK_PERM=1 TSval=1219482983 TSecr=0 WS=128
10811 1758.105732337 65.55.44.109 → 192.168.8.128 TCP 74 443 → 47850 [SYN, ACK] Seq=0 Ack=1 Win=8192 Len=0 MSS=1300 WS=256 SACK_PERM=1 TSval=41914113 TSecr=1219482983
11415 1855.167571497 192.168.8.128 → 54.229.120.124 TCP 74 48530 → 443 [SYN] Seq=0 Win=29200 Len=0 MSS=1460 SACK_PERM=1 TSval=1644415670 TSecr=0 WS=128
11416 1855.253196423 54.229.120.124 → 192.168.8.128 TCP 74 443 → 48530 [SYN, ACK] Seq=0 Ack=1 Win=2048 Len=0 MSS=1300 SACK_PERM=1 TSval=2301083538 TSecr=1644415670 WS=512
11858 1916.148577628 192.168.8.128 → 172.217.12.195 TCP 74 39864 → 443 [SYN] Seq=0 Win=29200 Len=0 MSS=1460 SACK_PERM=1 TSval=2041727980 TSecr=0 WS=128
11859 1916.174013318 172.217.12.195 → 192.168.8.128 TCP 74 443 → 39864 [SYN, ACK] Seq=0 Ack=1 Win=60192 Len=0 MSS=1300 SACK_PERM=1 TSval=912441471 TSecr=2041727980 WS=256
11998 1933.433842220 192.168.8.128 → 104.131.184.78 TCP 74 52776 → 443 [SYN] Seq=0 Win=29200 Len=0 MSS=1460 SACK_PERM=1 TSval=3599355322 TSecr=0 WS=128
11999 1933.439412152 104.131.184.78 → 192.168.8.128 TCP 74 443 → 52776 [SYN, ACK] Seq=0 Ack=1 Win=28960 Len=0 MSS=1300 SACK_PERM=1 TSval=3322899899 TSecr=3599355322 WS=128
12503 1987.766794232 192.168.8.245 → 23.46.57.216 TCP 78 61544 → 443 [SYN] Seq=0 Win=65535 Len=0 MSS=1460 WS=128 TSval=831488184 TSecr=0 SACK_PERM=1
12504 1987.776268120 23.46.57.216 → 192.168.8.245 TCP 74 443 → 61544 [SYN, ACK] Seq=0 Ack=1 Win=28960 Len=0 MSS=1300 SACK_PERM=1 TSval=1125962550 TSecr=831488184 WS=128
12795 2032.510669235 192.168.8.128 → 199.232.37.140 TCP 74 33570 → 443 [SYN] Seq=0 Win=29200 Len=0 MSS=1460 SACK_PERM=1 TSval=4057042834 TSecr=0 WS=128
12796 2032.514561190 199.232.37.140 → 192.168.8.128 TCP 74 443 → 33570 [SYN, ACK] Seq=0 Ack=1 Win=28960 Len=0 MSS=1300 SACK_PERM=1 TSval=2194768610 TSecr=4057042834 WS=512
13027 2065.903492288 192.168.8.245 → 17.248.187.6 TCP 78 61545 → 443 [SYN] Seq=0 Win=65535 Len=0 MSS=1460 WS=128 TSval=831495218 TSecr=0 SACK_PERM=1
13028 2065.908000236 17.248.187.6 → 192.168.8.245 TCP 74 443 → 61545 [SYN, ACK] Seq=0 Ack=1 Win=28960 Len=0 MSS=1300 TSval=1999628061 TSecr=831495218 WS=32
13046 2065.924280048 192.168.8.245 → 172.217.7.10 TCP 78 61546 → 443 [SYN] Seq=0 Win=65535 Len=0 MSS=1460 WS=128 TSval=831525684 TSecr=0 SACK_PERM=1
13047 2065.928282002 172.217.7.10 → 192.168.8.245 TCP 74 443 → 61546 [SYN, ACK] Seq=0 Ack=1 Win=60192 Len=0 MSS=1300 SACK_PERM=1 TSval=1210833386 TSecr=831525684 WS=256
13092 2065.958698650 192.168.8.245 → 23.46.57.216 TCP 78 61547 → 443 [SYN] Seq=0 Win=65535 Len=0 MSS=1460 WS=128 TSval=831525739 TSecr=0 SACK_PERM=1
13101 2065.968319539 23.46.57.216 → 192.168.8.245 TCP 74 443 → 61547 [SYN, ACK] Seq=0 Ack=1 Win=28960 Len=0 MSS=1300 SACK_PERM=1 TSval=1126040740 TSecr=831525739 WS=128
13520 2126.835132182 192.168.8.128 → 34.212.28.14 TCP 74 56676 → 443 [SYN] Seq=0 Win=29200 Len=0 MSS=1460 SACK_PERM=1 TSval=2280463331 TSecr=0 WS=128
13521 2126.913229297 34.212.28.14 → 192.168.8.128 TCP 74 443 → 56676 [SYN, ACK] Seq=0 Ack=1 Win=17898 Len=0 MSS=1300 SACK_PERM=1 TSval=3450631168 TSecr=2280463331 WS=128
13546 2127.342397433 192.168.8.128 → 52.11.86.147 TCP 74 42574 → 443 [SYN] Seq=0 Win=29200 Len=0 MSS=1460 SACK_PERM=1 TSval=2830859363 TSecr=0 WS=128
13547 2127.420771545 52.11.86.147 → 192.168.8.128 TCP 74 443 → 42574 [SYN, ACK] Seq=0 Ack=1 Win=26847 Len=0 MSS=1300 SACK_PERM=1 TSval=25450938 TSecr=2830859363 WS=256
13621 2128.231090364 192.168.8.128 → 34.95.71.207 TCP 74 54422 → 443 [SYN] Seq=0 Win=29200 Len=0 MSS=1460 SACK_PERM=1 TSval=1148494434 TSecr=0 WS=128
13622 2128.236372304 34.95.71.207 → 192.168.8.128 TCP 74 443 → 54422 [SYN, ACK] Seq=0 Ack=1 Win=60192 Len=0 MSS=1300 SACK_PERM=1 TSval=1989109179 TSecr=1148494434 WS=256
13651 2128.393392526 192.168.8.128 → 192.168.8.1  TCP 74 39306 → 80 [SYN] Seq=0 Win=29200 Len=0 MSS=1460 SACK_PERM=1 TSval=2611016622 TSecr=0 WS=128
13652 2128.393396526  192.168.8.1 → 192.168.8.128 TCP 74 80 → 39306 [SYN, ACK] Seq=0 Ack=1 Win=28960 Len=0 MSS=1460 SACK_PERM=1 TSval=865385 TSecr=2611016622 WS=16
14226 2214.822659378 192.168.8.128 → 192.30.253.113 TCP 74 50890 → 443 [SYN] Seq=0 Win=29200 Len=0 MSS=1460 SACK_PERM=1 TSval=3370358314 TSecr=0 WS=128
14227 2214.831362282 192.30.253.113 → 192.168.8.128 TCP 74 443 → 50890 [SYN, ACK] Seq=0 Ack=1 Win=28480 Len=0 MSS=1300 SACK_PERM=1 TSval=2012347735 TSecr=3370358314 WS=1024
14282 2215.381585197 192.168.8.128 → 185.199.110.154 TCP 74 60400 → 443 [SYN] Seq=0 Win=29200 Len=0 MSS=1460 SACK_PERM=1 TSval=1175024365 TSecr=0 WS=128
14286 2215.385350155 185.199.110.154 → 192.168.8.128 TCP 74 443 → 60400 [SYN, ACK] Seq=0 Ack=1 Win=28960 Len=0 MSS=1300 SACK_PERM=1 TSval=2192882661 TSecr=1175024365 WS=512
14331 2215.433222626 192.168.8.128 → 199.232.36.133 TCP 74 43512 → 443 [SYN] Seq=0 Win=29200 Len=0 MSS=1460 SACK_PERM=1 TSval=673496927 TSecr=0 WS=128
14332 2215.436972584 199.232.36.133 → 192.168.8.128 TCP 74 443 → 43512 [SYN, ACK] Seq=0 Ack=1 Win=28960 Len=0 MSS=1300 SACK_PERM=1 TSval=2215635413 TSecr=673496927 WS=512
14335 2215.440204549 192.168.8.128 → 199.232.36.133 TCP 74 43514 → 443 [SYN] Seq=0 Win=29200 Len=0 MSS=1460 SACK_PERM=1 TSval=673496934 TSecr=0 WS=128
14336 2215.443551512 199.232.36.133 → 192.168.8.128 TCP 74 443 → 43514 [SYN, ACK] Seq=0 Ack=1 Win=28960 Len=0 MSS=1300 SACK_PERM=1 TSval=1440451532 TSecr=673496934 WS=512
14381 2215.738482250 192.168.8.128 → 199.232.36.133 TCP 74 43516 → 443 [SYN] Seq=0 Win=29200 Len=0 MSS=1460 SACK_PERM=1 TSval=673497232 TSecr=0 WS=128
14382 2215.742320208 199.232.36.133 → 192.168.8.128 TCP 74 443 → 43516 [SYN, ACK] Seq=0 Ack=1 Win=28960 Len=0 MSS=1300 SACK_PERM=1 TSval=1442310946 TSecr=673497232 WS=512
14434 2215.814684408 192.168.8.128 → 140.82.114.25 TCP 74 51996 → 443 [SYN] Seq=0 Win=29200 Len=0 MSS=1460 SACK_PERM=1 TSval=1997960523 TSecr=0 WS=128
14435 2215.823717308 140.82.114.25 → 192.168.8.128 TCP 74 443 → 51996 [SYN, ACK] Seq=0 Ack=1 Win=28480 Len=0 MSS=1300 SACK_PERM=1 TSval=1161674625 TSecr=1997960523 WS=1024
14558 2228.421429243 192.168.8.128 → 31.13.71.7   TCP 74 34488 → 443 [SYN] Seq=0 Win=29200 Len=0 MSS=1460 SACK_PERM=1 TSval=2682079293 TSecr=0 WS=128
14559 2228.425485198   31.13.71.7 → 192.168.8.128 TCP 74 443 → 34488 [SYN, ACK] Seq=0 Ack=1 Win=27760 Len=0 MSS=1300 SACK_PERM=1 TSval=3220076319 TSecr=2682079293 WS=256
14673 2240.311179397 192.168.8.128 → 172.217.10.42 TCP 74 59978 → 443 [SYN] Seq=0 Win=29200 Len=0 MSS=1460 SACK_PERM=1 TSval=1518155502 TSecr=0 WS=128
14674 2240.315878345 172.217.10.42 → 192.168.8.128 TCP 74 443 → 59978 [SYN, ACK] Seq=0 Ack=1 Win=60192 Len=0 MSS=1300 SACK_PERM=1 TSval=2896009758 TSecr=1518155502 WS=256
14762 2248.696849345 192.168.8.128 → 23.52.164.254 TCP 74 59584 → 443 [SYN] Seq=0 Win=29200 Len=0 MSS=1460 SACK_PERM=1 TSval=1300796384 TSecr=0 WS=128
14763 2248.701961289 23.52.164.254 → 192.168.8.128 TCP 74 443 → 59584 [SYN, ACK] Seq=0 Ack=1 Win=28960 Len=0 MSS=1300 SACK_PERM=1 TSval=2357382015 TSecr=1300796384 WS=128
14828 2248.771524526 192.168.8.128 → 54.68.132.173 TCP 74 56926 → 443 [SYN] Seq=0 Win=29200 Len=0 MSS=1460 SACK_PERM=1 TSval=2395655762 TSecr=0 WS=128
14829 2248.771836523 192.168.8.128 → 54.68.132.173 TCP 74 56928 → 443 [SYN] Seq=0 Win=29200 Len=0 MSS=1460 SACK_PERM=1 TSval=2395655762 TSecr=0 WS=128
14833 2248.848282684 54.68.132.173 → 192.168.8.128 TCP 74 443 → 56926 [SYN, ACK] Seq=0 Ack=1 Win=26847 Len=0 MSS=1300 SACK_PERM=1 TSval=774368958 TSecr=2395655762 WS=256
14834 2248.849104675 54.68.132.173 → 192.168.8.128 TCP 74 443 → 56928 [SYN, ACK] Seq=0 Ack=1 Win=26847 Len=0 MSS=1300 SACK_PERM=1 TSval=774368958 TSecr=2395655762 WS=256
15302 2304.551365856 192.168.8.128 → 172.217.10.69 TCP 74 51700 → 443 [SYN] Seq=0 Win=29200 Len=0 MSS=1460 SACK_PERM=1 TSval=3030972169 TSecr=0 WS=128
15303 2304.556093805 172.217.10.69 → 192.168.8.128 TCP 74 443 → 51700 [SYN, ACK] Seq=0 Ack=1 Win=60192 Len=0 MSS=1300 SACK_PERM=1 TSval=995787082 TSecr=3030972169 WS=256
15495 2320.569841762 192.168.8.245 → 17.57.144.165 TCP 78 49721 → 5223 [SYN] Seq=0 Win=65535 Len=0 MSS=1460 WS=64 TSval=831496769 TSecr=0 SACK_PERM=1
15496 2320.579126662 17.57.144.165 → 192.168.8.245 TCP 74 5223 → 49721 [SYN, ACK] Seq=0 Ack=1 Win=28960 Len=0 MSS=1300 SACK_PERM=1 TSval=1270974882 TSecr=831496769 WS=128
15604 2322.763250107 192.168.8.245 → 199.232.37.140 TCP 78 61548 → 443 [SYN] Seq=0 Win=65535 Len=0 MSS=1460 WS=128 TSval=831534375 TSecr=0 SACK_PERM=1
15605 2322.766878068 199.232.37.140 → 192.168.8.245 TCP 74 443 → 61548 [SYN, ACK] Seq=0 Ack=1 Win=28960 Len=0 MSS=1300 SACK_PERM=1 TSval=1441713712 TSecr=831534375 WS=512
15616 2322.784625877 192.168.8.245 → 72.21.206.140 TCP 78 61549 → 443 [SYN] Seq=0 Win=65535 Len=0 MSS=1460 WS=128 TSval=831534394 TSecr=0 SACK_PERM=1
15622 2322.789140828 192.168.8.245 → 52.46.157.171 TCP 78 61550 → 443 [SYN] Seq=0 Win=65535 Len=0 MSS=1460 WS=128 TSval=831534397 TSecr=0 SACK_PERM=1
15623 2322.789741821 192.168.8.245 → 52.46.157.171 TCP 78 61551 → 443 [SYN] Seq=0 Win=65535 Len=0 MSS=1460 WS=128 TSval=831534398 TSecr=0 SACK_PERM=1
15627 2322.792199795 192.168.8.245 → 52.46.157.171 TCP 78 61552 → 443 [SYN] Seq=0 Win=65535 Len=0 MSS=1460 WS=128 TSval=831534399 TSecr=0 SACK_PERM=1
15628 2322.795015765 72.21.206.140 → 192.168.8.245 TCP 66 443 → 61549 [SYN, ACK] Seq=0 Ack=1 Win=8190 Len=0 MSS=1212 WS=64 SACK_PERM=1
15631 2322.799473717 52.46.157.171 → 192.168.8.245 TCP 66 443 → 61550 [SYN, ACK] Seq=0 Ack=1 Win=8190 Len=0 MSS=1212 WS=64 SACK_PERM=1
15632 2322.799692714 52.46.157.171 → 192.168.8.245 TCP 66 443 → 61551 [SYN, ACK] Seq=0 Ack=1 Win=8190 Len=0 MSS=1212 WS=64 SACK_PERM=1
15637 2322.802655682 52.46.157.171 → 192.168.8.245 TCP 66 443 → 61552 [SYN, ACK] Seq=0 Ack=1 Win=8190 Len=0 MSS=1212 WS=64 SACK_PERM=1
15820 2325.944939814 192.168.8.245 → 23.192.76.107 TCP 78 61553 → 443 [SYN] Seq=0 Win=65535 Len=0 MSS=1460 WS=128 TSval=831507354 TSecr=0 SACK_PERM=1
15821 2325.949333766 23.192.76.107 → 192.168.8.245 TCP 74 443 → 61553 [SYN, ACK] Seq=0 Ack=1 Win=28960 Len=0 MSS=1300 SACK_PERM=1 TSval=3826172146 TSecr=831507354 WS=128
15964 2338.489134833 192.168.8.128 → 65.55.44.109 TCP 74 47892 → 443 [SYN] Seq=0 Win=29200 Len=0 MSS=1460 SACK_PERM=1 TSval=1220063383 TSecr=0 WS=128
15965 2338.505717655 65.55.44.109 → 192.168.8.128 TCP 74 443 → 47892 [SYN, ACK] Seq=0 Ack=1 Win=8192 Len=0 MSS=1300 WS=256 SACK_PERM=1 TSval=78409942 TSecr=1220063383
17339 2548.853011610 192.168.8.128 → 199.232.36.133 TCP 74 43534 → 443 [SYN] Seq=0 Win=29200 Len=0 MSS=1460 SACK_PERM=1 TSval=673830342 TSecr=0 WS=128
17340 2548.856752571 199.232.36.133 → 192.168.8.128 TCP 74 443 → 43534 [SYN, ACK] Seq=0 Ack=1 Win=28960 Len=0 MSS=1300 SACK_PERM=1 TSval=2197471041 TSecr=673830342 WS=512
17474 2560.053399666 192.168.8.128 → 192.168.8.1  TCP 74 39336 → 80 [SYN] Seq=0 Win=29200 Len=0 MSS=1460 SACK_PERM=1 TSval=2611448280 TSecr=0 WS=128
17475 2560.053680663  192.168.8.1 → 192.168.8.128 TCP 74 80 → 39336 [SYN, ACK] Seq=0 Ack=1 Win=28960 Len=0 MSS=1460 SACK_PERM=1 TSval=908551 TSecr=2611448280 WS=16
17589 2579.446591341 192.168.8.128 → 52.33.61.229 TCP 74 58876 → 443 [SYN] Seq=0 Win=29200 Len=0 MSS=1460 SACK_PERM=1 TSval=3457036764 TSecr=0 WS=128
17592 2579.524499537 52.33.61.229 → 192.168.8.128 TCP 74 443 → 58876 [SYN, ACK] Seq=0 Ack=1 Win=26847 Len=0 MSS=1300 SACK_PERM=1 TSval=774158743 TSecr=3457036764 WS=256
17974 2633.882397784 192.168.8.245 → 17.249.121.246 TCP 78 61554 → 443 [SYN] Seq=0 Win=65535 Len=0 MSS=1460 WS=128 TSval=831621289 TSecr=0 SACK_PERM=1
17975 2633.886453743 17.249.121.246 → 192.168.8.245 TCP 74 443 → 61554 [SYN, ACK] Seq=0 Ack=1 Win=28960 Len=0 MSS=1300 TSval=2098539288 TSecr=831621289 WS=512
18642 2728.731225497 192.168.8.128 → 34.212.28.14 TCP 74 56716 → 443 [SYN] Seq=0 Win=29200 Len=0 MSS=1460 SACK_PERM=1 TSval=2281065203 TSecr=0 WS=128
18643 2728.808477714 34.212.28.14 → 192.168.8.128 TCP 74 443 → 56716 [SYN, ACK] Seq=0 Ack=1 Win=17898 Len=0 MSS=1300 SACK_PERM=1 TSval=3451233065 TSecr=2281065203 WS=128
18670 2729.465429056 192.168.8.128 → 52.11.86.147 TCP 74 42614 → 443 [SYN] Seq=0 Win=29200 Len=0 MSS=1460 SACK_PERM=1 TSval=2831461482 TSecr=0 WS=128
18673 2729.542656273 52.11.86.147 → 192.168.8.128 TCP 74 443 → 42614 [SYN, ACK] Seq=0 Ack=1 Win=26847 Len=0 MSS=1300 SACK_PERM=1 TSval=25601431 TSecr=2831461482 WS=256
18767 2731.103820454 192.168.8.128 → 34.95.71.207 TCP 74 54462 → 443 [SYN] Seq=0 Win=29200 Len=0 MSS=1460 SACK_PERM=1 TSval=1149097298 TSecr=0 WS=128
18768 2731.108789403 34.95.71.207 → 192.168.8.128 TCP 74 443 → 54462 [SYN, ACK] Seq=0 Ack=1 Win=60192 Len=0 MSS=1300 SACK_PERM=1 TSval=1588281175 TSecr=1149097298 WS=256
19049 2767.317809183 192.168.8.128 → 172.217.10.5 TCP 74 51244 → 443 [SYN] Seq=0 Win=29200 Len=0 MSS=1460 SACK_PERM=1 TSval=2223794378 TSecr=0 WS=128
19050 2767.322441136 172.217.10.5 → 192.168.8.128 TCP 74 443 → 51244 [SYN, ACK] Seq=0 Ack=1 Win=60192 Len=0 MSS=1300 SACK_PERM=1 TSval=3097457107 TSecr=2223794378 WS=256
19389 2812.907366883 192.168.8.128 → 52.24.14.176 TCP 74 55758 → 443 [SYN] Seq=0 Win=29200 Len=0 MSS=1460 SACK_PERM=1 TSval=2821172861 TSecr=0 WS=128
19390 2812.986183091 52.24.14.176 → 192.168.8.128 TCP 74 443 → 55758 [SYN, ACK] Seq=0 Ack=1 Win=26847 Len=0 MSS=1300 SACK_PERM=1 TSval=746907951 TSecr=2821172861 WS=256
19411 2813.222280717 192.168.8.128 → 52.26.63.175 TCP 74 40604 → 443 [SYN] Seq=0 Win=29200 Len=0 MSS=1460 SACK_PERM=1 TSval=807124700 TSecr=0 WS=128
19413 2813.234374596 192.168.8.128 → 34.212.28.14 TCP 74 56728 → 443 [SYN] Seq=0 Win=29200 Len=0 MSS=1460 SACK_PERM=1 TSval=2281149721 TSecr=0 WS=128
19416 2813.299708939 52.26.63.175 → 192.168.8.128 TCP 74 443 → 40604 [SYN, ACK] Seq=0 Ack=1 Win=26847 Len=0 MSS=1300 SACK_PERM=1 TSval=3741695856 TSecr=807124700 WS=256
19419 2813.312873806 34.212.28.14 → 192.168.8.128 TCP 74 443 → 56728 [SYN, ACK] Seq=0 Ack=1 Win=17898 Len=0 MSS=1300 SACK_PERM=1 TSval=3451317568 TSecr=2281149721 WS=128
19460 2813.761247299 192.168.8.128 → 54.69.190.106 TCP 74 38588 → 443 [SYN] Seq=0 Win=29200 Len=0 MSS=1460 SACK_PERM=1 TSval=2386652168 TSecr=0 WS=128
19461 2813.851896387 54.69.190.106 → 192.168.8.128 TCP 74 443 → 38588 [SYN, ACK] Seq=0 Ack=1 Win=26847 Len=0 MSS=1300 SACK_PERM=1 TSval=225506647 TSecr=2386652168 WS=256
19554 2816.952888217 192.168.8.128 → 172.217.10.234 TCP 74 52300 → 443 [SYN] Seq=0 Win=29200 Len=0 MSS=1460 SACK_PERM=1 TSval=1613386127 TSecr=0 WS=128
19555 2816.957797168 172.217.10.234 → 192.168.8.128 TCP 74 443 → 52300 [SYN, ACK] Seq=0 Ack=1 Win=60192 Len=0 MSS=1300 SACK_PERM=1 TSval=2289842211 TSecr=1613386127 WS=256
