   16 10.818188414 192.168.8.128 → 192.168.8.1  TCP 74 38962 → 80 [SYN] Seq=0 Win=29200 Len=0 MSS=1460 SACK_PERM=1 TSval=1127760429 TSecr=0 WS=128
   17 10.818588411  192.168.8.1 → 192.168.8.128 TCP 74 80 → 38962 [SYN, ACK] Seq=0 Ack=1 Win=28960 Len=0 MSS=1460 SACK_PERM=1 TSval=371693 TSecr=1127760429 WS=16
   88 20.016977905 192.168.8.128 → 192.30.253.124 TCP 74 49312 → 443 [SYN] Seq=0 Win=29200 Len=0 MSS=1460 SACK_PERM=1 TSval=3762051014 TSecr=0 WS=128
   89 20.075393439 192.30.253.124 → 192.168.8.128 TCP 74 443 → 49312 [SYN, ACK] Seq=0 Ack=1 Win=28480 Len=0 MSS=1300 SACK_PERM=1 TSval=1738838657 TSecr=3762051014 WS=1024
  157 29.283388963 192.168.8.128 → 23.217.149.114 TCP 74 43922 → 443 [SYN] Seq=0 Win=29200 Len=0 MSS=1460 SACK_PERM=1 TSval=364092857 TSecr=0 WS=128
  158 29.287442930 23.217.149.114 → 192.168.8.128 TCP 74 443 → 43922 [SYN, ACK] Seq=0 Ack=1 Win=28960 Len=0 MSS=1300 SACK_PERM=1 TSval=4160262549 TSecr=364092857 WS=128
  280 41.055712175 192.168.8.128 → 192.168.8.1  TCP 74 38968 → 80 [SYN] Seq=0 Win=29200 Len=0 MSS=1460 SACK_PERM=1 TSval=1127790667 TSecr=0 WS=128
  281 41.056057172  192.168.8.1 → 192.168.8.128 TCP 74 80 → 38968 [SYN, ACK] Seq=0 Ack=1 Win=28960 Len=0 MSS=1460 SACK_PERM=1 TSval=374717 TSecr=1127790667 WS=16
  548 71.180007926 192.168.8.128 → 192.168.8.1  TCP 74 38970 → 80 [SYN] Seq=0 Win=29200 Len=0 MSS=1460 SACK_PERM=1 TSval=1127820790 TSecr=0 WS=128
  549 71.180349923  192.168.8.1 → 192.168.8.128 TCP 74 80 → 38970 [SYN, ACK] Seq=0 Ack=1 Win=28960 Len=0 MSS=1460 SACK_PERM=1 TSval=377730 TSecr=1127820790 WS=16
  749 101.378249114 192.168.8.128 → 192.168.8.1  TCP 74 38972 → 80 [SYN] Seq=0 Win=29200 Len=0 MSS=1460 SACK_PERM=1 TSval=1127850987 TSecr=0 WS=128
  750 101.378528112  192.168.8.1 → 192.168.8.128 TCP 74 80 → 38972 [SYN, ACK] Seq=0 Ack=1 Win=28960 Len=0 MSS=1460 SACK_PERM=1 TSval=380749 TSecr=1127850987 WS=16
  916 131.562945376 192.168.8.128 → 192.168.8.1  TCP 74 38974 → 80 [SYN] Seq=0 Win=29200 Len=0 MSS=1460 SACK_PERM=1 TSval=1127881171 TSecr=0 WS=128
  917 131.563343373  192.168.8.1 → 192.168.8.128 TCP 74 80 → 38974 [SYN, ACK] Seq=0 Ack=1 Win=28960 Len=0 MSS=1460 SACK_PERM=1 TSval=383768 TSecr=1127881171 WS=16
 1082 161.721040758 192.168.8.128 → 192.168.8.1  TCP 74 38976 → 80 [SYN] Seq=0 Win=29200 Len=0 MSS=1460 SACK_PERM=1 TSval=1127911329 TSecr=0 WS=128
 1083 161.721410755  192.168.8.1 → 192.168.8.128 TCP 74 80 → 38976 [SYN, ACK] Seq=0 Ack=1 Win=28960 Len=0 MSS=1460 SACK_PERM=1 TSval=386784 TSecr=1127911329 WS=16
 1157 170.492943098 192.168.8.128 → 172.217.9.234 TCP 74 38430 → 443 [SYN] Seq=0 Win=29200 Len=0 MSS=1460 SACK_PERM=1 TSval=2513165651 TSecr=0 WS=128
 1158 170.496500070 172.217.9.234 → 192.168.8.128 TCP 74 443 → 38430 [SYN, ACK] Seq=0 Ack=1 Win=60192 Len=0 MSS=1300 SACK_PERM=1 TSval=1681432170 TSecr=2513165651 WS=256
 1221 173.798151245 192.168.8.128 → 35.186.224.30 TCP 74 39540 → 443 [SYN] Seq=0 Win=29200 Len=0 MSS=1460 SACK_PERM=1 TSval=2835034763 TSecr=0 WS=128
 1222 173.802233213 35.186.224.30 → 192.168.8.128 TCP 74 443 → 39540 [SYN, ACK] Seq=0 Ack=1 Win=60192 Len=0 MSS=1300 SACK_PERM=1 TSval=1716117474 TSecr=2835034763 WS=256
 1224 173.804713194 192.168.8.128 → 199.232.36.246 TCP 74 40712 → 80 [SYN] Seq=0 Win=29200 Len=0 MSS=1460 SACK_PERM=1 TSval=2110634033 TSecr=0 WS=128
 1226 173.807844170 199.232.36.246 → 192.168.8.128 TCP 74 80 → 40712 [SYN, ACK] Seq=0 Ack=1 Win=28960 Len=0 MSS=1300 SACK_PERM=1 TSval=2243038164 TSecr=2110634033 WS=512
 1348 173.906228400 192.168.8.128 → 199.232.36.246 TCP 74 40714 → 80 [SYN] Seq=0 Win=29200 Len=0 MSS=1460 SACK_PERM=1 TSval=2110634135 TSecr=0 WS=128
 1350 173.908901379 199.232.36.246 → 192.168.8.128 TCP 74 80 → 40714 [SYN, ACK] Seq=0 Ack=1 Win=28960 Len=0 MSS=1300 SACK_PERM=1 TSval=2264436982 TSecr=2110634135 WS=512
 1434 183.563219924 192.168.8.128 → 54.85.61.81  TCP 74 33252 → 443 [SYN] Seq=0 Win=29200 Len=0 MSS=1460 SACK_PERM=1 TSval=873984925 TSecr=0 WS=128
 1435 183.571714858  54.85.61.81 → 192.168.8.128 TCP 74 443 → 33252 [SYN, ACK] Seq=0 Ack=1 Win=26847 Len=0 MSS=1300 SACK_PERM=1 TSval=1305286085 TSecr=873984925 WS=256
 1501 191.903298809 192.168.8.128 → 192.168.8.1  TCP 74 38988 → 80 [SYN] Seq=0 Win=29200 Len=0 MSS=1460 SACK_PERM=1 TSval=1127941511 TSecr=0 WS=128
 1502 191.903663806  192.168.8.1 → 192.168.8.128 TCP 74 80 → 38988 [SYN, ACK] Seq=0 Ack=1 Win=28960 Len=0 MSS=1460 SACK_PERM=1 TSval=389802 TSecr=1127941511 WS=16
 1646 222.110141479 192.168.8.128 → 192.168.8.1  TCP 74 38990 → 80 [SYN] Seq=0 Win=29200 Len=0 MSS=1460 SACK_PERM=1 TSval=1127971717 TSecr=0 WS=128
 1647 222.110430476  192.168.8.1 → 192.168.8.128 TCP 74 80 → 38990 [SYN, ACK] Seq=0 Ack=1 Win=28960 Len=0 MSS=1460 SACK_PERM=1 TSval=392823 TSecr=1127971717 WS=16
 1663 222.836562829 192.168.8.128 → 172.217.12.132 TCP 74 33822 → 443 [SYN] Seq=0 Win=29200 Len=0 MSS=1460 SACK_PERM=1 TSval=3892281489 TSecr=0 WS=128
 1664 222.840095802 172.217.12.132 → 192.168.8.128 TCP 74 443 → 33822 [SYN, ACK] Seq=0 Ack=1 Win=60192 Len=0 MSS=1300 SACK_PERM=1 TSval=2975352626 TSecr=3892281489 WS=256
 1842 223.632470639 192.168.8.128 → 172.217.10.99 TCP 74 44308 → 443 [SYN] Seq=0 Win=29200 Len=0 MSS=1460 SACK_PERM=1 TSval=3759733031 TSecr=0 WS=128
 1843 223.636159611 172.217.10.99 → 192.168.8.128 TCP 74 443 → 44308 [SYN, ACK] Seq=0 Ack=1 Win=60192 Len=0 MSS=1300 SACK_PERM=1 TSval=1017478644 TSecr=3759733031 WS=256
 1951 223.996189811 192.168.8.128 → 172.217.12.206 TCP 74 52534 → 443 [SYN] Seq=0 Win=29200 Len=0 MSS=1460 SACK_PERM=1 TSval=1147492224 TSecr=0 WS=128
 1952 224.000030781 172.217.12.206 → 192.168.8.128 TCP 74 443 → 52534 [SYN, ACK] Seq=0 Ack=1 Win=60192 Len=0 MSS=1300 SACK_PERM=1 TSval=789609633 TSecr=1147492224 WS=256
 2036 224.501408883 192.168.8.128 → 172.217.10.238 TCP 74 38418 → 443 [SYN] Seq=0 Win=29200 Len=0 MSS=1460 SACK_PERM=1 TSval=253257438 TSecr=0 WS=128
 2037 224.505195853 172.217.10.238 → 192.168.8.128 TCP 74 443 → 38418 [SYN, ACK] Seq=0 Ack=1 Win=60192 Len=0 MSS=1300 SACK_PERM=1 TSval=3072338010 TSecr=253257438 WS=256
 2043 224.516097768 192.168.8.128 → 172.217.11.14 TCP 74 57126 → 443 [SYN] Seq=0 Win=29200 Len=0 MSS=1460 SACK_PERM=1 TSval=18305015 TSecr=0 WS=128
 2044 224.517126760 192.168.8.128 → 172.217.10.238 TCP 74 38422 → 443 [SYN] Seq=0 Win=29200 Len=0 MSS=1460 SACK_PERM=1 TSval=253257454 TSecr=0 WS=128
 2045 224.521301728 172.217.11.14 → 192.168.8.128 TCP 74 443 → 57126 [SYN, ACK] Seq=0 Ack=1 Win=60192 Len=0 MSS=1300 SACK_PERM=1 TSval=2971892804 TSecr=18305015 WS=256
 2046 224.521538726 172.217.10.238 → 192.168.8.128 TCP 74 443 → 38422 [SYN, ACK] Seq=0 Ack=1 Win=60192 Len=0 MSS=1300 SACK_PERM=1 TSval=2764911658 TSecr=253257454 WS=256
 2183 230.158540907 192.168.8.128 → 140.82.114.25 TCP 74 47312 → 443 [SYN] Seq=0 Win=29200 Len=0 MSS=1460 SACK_PERM=1 TSval=4059248817 TSecr=0 WS=128
 2184 230.166544845 140.82.114.25 → 192.168.8.128 TCP 74 443 → 47312 [SYN, ACK] Seq=0 Ack=1 Win=28480 Len=0 MSS=1300 SACK_PERM=1 TSval=411787203 TSecr=4059248817 WS=1024
 2236 232.956779165 192.168.8.128 → 172.217.10.14 TCP 74 44690 → 443 [SYN] Seq=0 Win=29200 Len=0 MSS=1460 SACK_PERM=1 TSval=3557223106 TSecr=0 WS=128
 2237 232.957087163 192.168.8.128 → 172.217.10.14 TCP 74 44692 → 443 [SYN] Seq=0 Win=29200 Len=0 MSS=1460 SACK_PERM=1 TSval=3557223106 TSecr=0 WS=128
 2243 232.962083124 172.217.10.14 → 192.168.8.128 TCP 74 443 → 44690 [SYN, ACK] Seq=0 Ack=1 Win=60192 Len=0 MSS=1300 SACK_PERM=1 TSval=1651283391 TSecr=3557223106 WS=256
 2244 232.962399122 172.217.10.14 → 192.168.8.128 TCP 74 443 → 44692 [SYN, ACK] Seq=0 Ack=1 Win=60192 Len=0 MSS=1300 SACK_PERM=1 TSval=622762888 TSecr=3557223106 WS=256
 2388 252.145314244 192.168.8.128 → 192.168.8.1  TCP 74 39010 → 80 [SYN] Seq=0 Win=29200 Len=0 MSS=1460 SACK_PERM=1 TSval=1128001752 TSecr=0 WS=128
 2389 252.145681241  192.168.8.1 → 192.168.8.128 TCP 74 80 → 39010 [SYN, ACK] Seq=0 Ack=1 Win=28960 Len=0 MSS=1460 SACK_PERM=1 TSval=395826 TSecr=1128001752 WS=16
 2415 254.949157508 192.168.8.128 → 172.217.12.206 TCP 74 52550 → 443 [SYN] Seq=0 Win=29200 Len=0 MSS=1460 SACK_PERM=1 TSval=1147523176 TSecr=0 WS=128
 2416 254.952968479 172.217.12.206 → 192.168.8.128 TCP 74 443 → 52550 [SYN, ACK] Seq=0 Ack=1 Win=60192 Len=0 MSS=1300 SACK_PERM=1 TSval=1819899472 TSecr=1147523176 WS=256
 2469 259.599047475 192.168.8.128 → 35.166.225.102 TCP 74 38572 → 443 [SYN] Seq=0 Win=29200 Len=0 MSS=1460 SACK_PERM=1 TSval=1703529925 TSecr=0 WS=128
 2470 259.676445875 35.166.225.102 → 192.168.8.128 TCP 74 443 → 38572 [SYN, ACK] Seq=0 Ack=1 Win=26847 Len=0 MSS=1300 SACK_PERM=1 TSval=1325982959 TSecr=1703529925 WS=256
 2497 259.893325195 192.168.8.128 → 35.165.119.189 TCP 74 42896 → 443 [SYN] Seq=0 Win=29200 Len=0 MSS=1460 SACK_PERM=1 TSval=1980775883 TSecr=0 WS=128
 2498 259.894025190 192.168.8.128 → 34.212.28.14 TCP 74 44996 → 443 [SYN] Seq=0 Win=29200 Len=0 MSS=1460 SACK_PERM=1 TSval=2239070456 TSecr=0 WS=128
 2501 259.969253607 35.165.119.189 → 192.168.8.128 TCP 74 443 → 42896 [SYN, ACK] Seq=0 Ack=1 Win=26847 Len=0 MSS=1300 SACK_PERM=1 TSval=10962708 TSecr=1980775883 WS=256
 2503 259.972059585 34.212.28.14 → 192.168.8.128 TCP 74 443 → 44996 [SYN, ACK] Seq=0 Ack=1 Win=17898 Len=0 MSS=1300 SACK_PERM=1 TSval=3643701147 TSecr=2239070456 WS=128
 2541 260.378248438 192.168.8.128 → 52.11.86.147 TCP 74 58022 → 443 [SYN] Seq=0 Win=29200 Len=0 MSS=1460 SACK_PERM=1 TSval=1837423348 TSecr=0 WS=128
 2542 260.456380833 52.11.86.147 → 192.168.8.128 TCP 74 443 → 58022 [SYN, ACK] Seq=0 Ack=1 Win=26847 Len=0 MSS=1300 SACK_PERM=1 TSval=73718423 TSecr=1837423348 WS=256
 2616 261.432026275 192.168.8.128 → 34.95.71.207 TCP 74 43986 → 443 [SYN] Seq=0 Win=29200 Len=0 MSS=1460 SACK_PERM=1 TSval=2985867947 TSecr=0 WS=128
 2617 261.436752239 34.95.71.207 → 192.168.8.128 TCP 74 443 → 43986 [SYN, ACK] Seq=0 Ack=1 Win=60192 Len=0 MSS=1300 SACK_PERM=1 TSval=2283747324 TSecr=2985867947 WS=256
 2776 282.139392040 192.168.8.128 → 192.30.253.124 TCP 74 49372 → 443 [SYN] Seq=0 Win=29200 Len=0 MSS=1460 SACK_PERM=1 TSval=3762313137 TSecr=0 WS=128
 2777 282.147353978 192.30.253.124 → 192.168.8.128 TCP 74 443 → 49372 [SYN, ACK] Seq=0 Ack=1 Win=28480 Len=0 MSS=1300 SACK_PERM=1 TSval=3126845565 TSecr=3762313137 WS=1024
 2791 282.201208562 192.168.8.128 → 192.168.8.1  TCP 74 39026 → 80 [SYN] Seq=0 Win=29200 Len=0 MSS=1460 SACK_PERM=1 TSval=1128031808 TSecr=0 WS=128
 2792 282.201535559  192.168.8.1 → 192.168.8.128 TCP 74 80 → 39026 [SYN, ACK] Seq=0 Ack=1 Win=28960 Len=0 MSS=1460 SACK_PERM=1 TSval=398832 TSecr=1128031808 WS=16
 2991 312.319956068 192.168.8.128 → 192.168.8.1  TCP 74 39028 → 80 [SYN] Seq=0 Win=29200 Len=0 MSS=1460 SACK_PERM=1 TSval=1128061925 TSecr=0 WS=128
 2992 312.320305065  192.168.8.1 → 192.168.8.128 TCP 74 80 → 39028 [SYN, ACK] Seq=0 Ack=1 Win=28960 Len=0 MSS=1460 SACK_PERM=1 TSval=401844 TSecr=1128061925 WS=16
 3173 342.373457713 192.168.8.128 → 192.168.8.1  TCP 74 39030 → 80 [SYN] Seq=0 Win=29200 Len=0 MSS=1460 SACK_PERM=1 TSval=1128091978 TSecr=0 WS=128
 3174 342.373713711  192.168.8.1 → 192.168.8.128 TCP 74 80 → 39030 [SYN, ACK] Seq=0 Ack=1 Win=28960 Len=0 MSS=1460 SACK_PERM=1 TSval=404849 TSecr=1128091978 WS=16
 3365 372.499268402 192.168.8.128 → 192.168.8.1  TCP 74 39032 → 80 [SYN] Seq=0 Win=29200 Len=0 MSS=1460 SACK_PERM=1 TSval=1128122104 TSecr=0 WS=128
 3366 372.499589400  192.168.8.1 → 192.168.8.128 TCP 74 80 → 39032 [SYN, ACK] Seq=0 Ack=1 Win=28960 Len=0 MSS=1460 SACK_PERM=1 TSval=407861 TSecr=1128122104 WS=16
 3537 402.720262930 192.168.8.128 → 192.168.8.1  TCP 74 39034 → 80 [SYN] Seq=0 Win=29200 Len=0 MSS=1460 SACK_PERM=1 TSval=1128152324 TSecr=0 WS=128
 3538 402.720626927  192.168.8.1 → 192.168.8.128 TCP 74 80 → 39034 [SYN, ACK] Seq=0 Ack=1 Win=28960 Len=0 MSS=1460 SACK_PERM=1 TSval=410884 TSecr=1128152324 WS=16
 3551 403.085893132 192.168.8.128 → 208.80.154.224 TCP 74 35090 → 443 [SYN] Seq=0 Win=29200 Len=0 MSS=1460 SACK_PERM=1 TSval=2568690731 TSecr=0 WS=128
 3552 403.094661065 208.80.154.224 → 192.168.8.128 TCP 74 443 → 35090 [SYN, ACK] Seq=0 Ack=1 Win=28480 Len=0 MSS=1300 SACK_PERM=1 TSval=601924546 TSecr=2568690731 WS=512
 3656 403.540175657 192.168.8.128 → 208.80.154.240 TCP 74 41322 → 443 [SYN] Seq=0 Win=29200 Len=0 MSS=1460 SACK_PERM=1 TSval=3436679360 TSecr=0 WS=128
 3657 403.540572654 192.168.8.128 → 208.80.154.240 TCP 74 41324 → 443 [SYN] Seq=0 Win=29200 Len=0 MSS=1460 SACK_PERM=1 TSval=3436679360 TSecr=0 WS=128
 3658 403.540877652 192.168.8.128 → 208.80.154.240 TCP 74 41326 → 443 [SYN] Seq=0 Win=29200 Len=0 MSS=1460 SACK_PERM=1 TSval=3436679360 TSecr=0 WS=128
 3659 403.541134650 192.168.8.128 → 208.80.154.240 TCP 74 41328 → 443 [SYN] Seq=0 Win=29200 Len=0 MSS=1460 SACK_PERM=1 TSval=3436679361 TSecr=0 WS=128
 3660 403.541395648 192.168.8.128 → 208.80.154.240 TCP 74 41330 → 443 [SYN] Seq=0 Win=29200 Len=0 MSS=1460 SACK_PERM=1 TSval=3436679361 TSecr=0 WS=128
 3678 403.546666608 192.168.8.128 → 208.80.154.240 TCP 74 41332 → 443 [SYN] Seq=0 Win=29200 Len=0 MSS=1460 SACK_PERM=1 TSval=3436679365 TSecr=0 WS=128
 3695 403.551885568 208.80.154.240 → 192.168.8.128 TCP 74 443 → 41324 [SYN, ACK] Seq=0 Ack=1 Win=28480 Len=0 MSS=1300 SACK_PERM=1 TSval=1762763912 TSecr=3436679360 WS=512
 3696 403.552145566 208.80.154.240 → 192.168.8.128 TCP 74 443 → 41322 [SYN, ACK] Seq=0 Ack=1 Win=28480 Len=0 MSS=1300 SACK_PERM=1 TSval=1762763912 TSecr=3436679360 WS=512
 3700 403.552836560 208.80.154.240 → 192.168.8.128 TCP 74 443 → 41328 [SYN, ACK] Seq=0 Ack=1 Win=28480 Len=0 MSS=1300 SACK_PERM=1 TSval=1762763913 TSecr=3436679361 WS=512
 3701 403.552838560 208.80.154.240 → 192.168.8.128 TCP 74 443 → 41326 [SYN, ACK] Seq=0 Ack=1 Win=28480 Len=0 MSS=1300 SACK_PERM=1 TSval=1762763913 TSecr=3436679360 WS=512
 3712 403.556664531 208.80.154.240 → 192.168.8.128 TCP 74 443 → 41330 [SYN, ACK] Seq=0 Ack=1 Win=28480 Len=0 MSS=1300 SACK_PERM=1 TSval=1762763913 TSecr=3436679361 WS=512
 3725 403.560675500 208.80.154.240 → 192.168.8.128 TCP 74 443 → 41332 [SYN, ACK] Seq=0 Ack=1 Win=28480 Len=0 MSS=1300 SACK_PERM=1 TSval=1762763915 TSecr=3436679365 WS=512
 4114 404.228543392 192.168.8.128 → 208.80.154.224 TCP 74 35104 → 443 [SYN] Seq=0 Win=29200 Len=0 MSS=1460 SACK_PERM=1 TSval=2568691874 TSecr=0 WS=128
 4115 404.236623330 208.80.154.224 → 192.168.8.128 TCP 74 443 → 35104 [SYN, ACK] Seq=0 Ack=1 Win=28480 Len=0 MSS=1300 SACK_PERM=1 TSval=601924832 TSecr=2568691874 WS=512
 4141 404.325737648 192.168.8.128 → 208.80.154.224 TCP 74 35106 → 443 [SYN] Seq=0 Win=29200 Len=0 MSS=1460 SACK_PERM=1 TSval=2568691971 TSecr=0 WS=128
 4142 404.335390574 208.80.154.224 → 192.168.8.128 TCP 74 443 → 35106 [SYN, ACK] Seq=0 Ack=1 Win=28480 Len=0 MSS=1300 SACK_PERM=1 TSval=601924856 TSecr=2568691971 WS=512
 4244 418.400849041 192.168.8.128 → 172.217.197.189 TCP 74 60412 → 443 [SYN] Seq=0 Win=29200 Len=0 MSS=1460 SACK_PERM=1 TSval=1978431943 TSecr=0 WS=128
 4245 418.417282915 172.217.197.189 → 192.168.8.128 TCP 74 443 → 60412 [SYN, ACK] Seq=0 Ack=1 Win=62392 Len=0 MSS=1300 SACK_PERM=1 TSval=2088434870 TSecr=1978431943 WS=256
 4324 432.196290681 192.168.8.128 → 140.82.114.3 TCP 74 43898 → 443 [SYN] Seq=0 Win=29200 Len=0 MSS=1460 SACK_PERM=1 TSval=3919686888 TSecr=0 WS=128
 4325 432.204161621 140.82.114.3 → 192.168.8.128 TCP 74 443 → 43898 [SYN, ACK] Seq=0 Ack=1 Win=28480 Len=0 MSS=1300 SACK_PERM=1 TSval=1212401619 TSecr=3919686888 WS=1024
 4375 432.723185659 192.168.8.128 → 185.199.110.154 TCP 74 35922 → 443 [SYN] Seq=0 Win=29200 Len=0 MSS=1460 SACK_PERM=1 TSval=1734253663 TSecr=0 WS=128
 4376 432.723590656 192.168.8.128 → 185.199.110.154 TCP 74 35924 → 443 [SYN] Seq=0 Win=29200 Len=0 MSS=1460 SACK_PERM=1 TSval=1734253663 TSecr=0 WS=128
 4377 432.723922654 192.168.8.128 → 185.199.110.154 TCP 74 35926 → 443 [SYN] Seq=0 Win=29200 Len=0 MSS=1460 SACK_PERM=1 TSval=1734253663 TSecr=0 WS=128
 4378 432.724167652 192.168.8.128 → 185.199.110.154 TCP 74 35928 → 443 [SYN] Seq=0 Win=29200 Len=0 MSS=1460 SACK_PERM=1 TSval=1734253663 TSecr=0 WS=128
 4379 432.724514649 192.168.8.128 → 185.199.110.154 TCP 74 35930 → 443 [SYN] Seq=0 Win=29200 Len=0 MSS=1460 SACK_PERM=1 TSval=1734253663 TSecr=0 WS=128
 4380 432.726986630 185.199.110.154 → 192.168.8.128 TCP 74 443 → 35922 [SYN, ACK] Seq=0 Ack=1 Win=28960 Len=0 MSS=1300 SACK_PERM=1 TSval=2243745653 TSecr=1734253663 WS=512
 4381 432.727241628 185.199.110.154 → 192.168.8.128 TCP 74 443 → 35924 [SYN, ACK] Seq=0 Ack=1 Win=28960 Len=0 MSS=1300 SACK_PERM=1 TSval=1489975432 TSecr=1734253663 WS=512
 4382 432.727432627 185.199.110.154 → 192.168.8.128 TCP 74 443 → 35926 [SYN, ACK] Seq=0 Ack=1 Win=28960 Len=0 MSS=1300 SACK_PERM=1 TSval=561791270 TSecr=1734253663 WS=512
 4383 432.727610626 185.199.110.154 → 192.168.8.128 TCP 74 443 → 35928 [SYN, ACK] Seq=0 Ack=1 Win=28960 Len=0 MSS=1300 SACK_PERM=1 TSval=2265065592 TSecr=1734253663 WS=512
 4384 432.727863624 185.199.110.154 → 192.168.8.128 TCP 74 443 → 35930 [SYN, ACK] Seq=0 Ack=1 Win=28960 Len=0 MSS=1300 SACK_PERM=1 TSval=2241171226 TSecr=1734253663 WS=512
 4461 432.781767212 192.168.8.128 → 185.199.110.154 TCP 74 35932 → 443 [SYN] Seq=0 Win=29200 Len=0 MSS=1460 SACK_PERM=1 TSval=1734253718 TSecr=0 WS=128
 4462 432.782046210 192.168.8.128 → 185.199.110.154 TCP 74 35934 → 443 [SYN] Seq=0 Win=29200 Len=0 MSS=1460 SACK_PERM=1 TSval=1734253718 TSecr=0 WS=128
 4463 432.782348208 192.168.8.128 → 185.199.110.154 TCP 74 35936 → 443 [SYN] Seq=0 Win=29200 Len=0 MSS=1460 SACK_PERM=1 TSval=1734253718 TSecr=0 WS=128
 4485 432.787360169 185.199.110.154 → 192.168.8.128 TCP 74 443 → 35932 [SYN, ACK] Seq=0 Ack=1 Win=28960 Len=0 MSS=1300 SACK_PERM=1 TSval=2245036156 TSecr=1734253718 WS=512
 4486 432.787615167 185.199.110.154 → 192.168.8.128 TCP 74 443 → 35934 [SYN, ACK] Seq=0 Ack=1 Win=28960 Len=0 MSS=1300 SACK_PERM=1 TSval=579269117 TSecr=1734253718 WS=512
 4489 432.788161163 185.199.110.154 → 192.168.8.128 TCP 74 443 → 35936 [SYN, ACK] Seq=0 Ack=1 Win=28960 Len=0 MSS=1300 SACK_PERM=1 TSval=712755260 TSecr=1734253718 WS=512
 4810 432.880747457 192.168.8.128 → 192.168.8.1  TCP 74 39074 → 80 [SYN] Seq=0 Win=29200 Len=0 MSS=1460 SACK_PERM=1 TSval=1128182484 TSecr=0 WS=128
 4811 432.881010455  192.168.8.1 → 192.168.8.128 TCP 74 80 → 39074 [SYN, ACK] Seq=0 Ack=1 Win=28960 Len=0 MSS=1460 SACK_PERM=1 TSval=413900 TSecr=1128182484 WS=16
 4896 433.089530863 192.168.8.128 → 140.82.114.3 TCP 74 43918 → 443 [SYN] Seq=0 Win=29200 Len=0 MSS=1460 SACK_PERM=1 TSval=3919687781 TSecr=0 WS=128
 4897 433.097117805 140.82.114.3 → 192.168.8.128 TCP 74 443 → 43918 [SYN, ACK] Seq=0 Ack=1 Win=28480 Len=0 MSS=1300 SACK_PERM=1 TSval=1209681174 TSecr=3919687781 WS=1024
 4934 433.330299025 192.168.8.128 → 199.232.36.133 TCP 74 35150 → 443 [SYN] Seq=0 Win=29200 Len=0 MSS=1460 SACK_PERM=1 TSval=3987029049 TSecr=0 WS=128
 4935 433.333127004 199.232.36.133 → 192.168.8.128 TCP 74 443 → 35150 [SYN, ACK] Seq=0 Ack=1 Win=28960 Len=0 MSS=1300 SACK_PERM=1 TSval=2244396773 TSecr=3987029049 WS=512
 5092 458.541265769 192.168.8.128 → 35.186.224.53 TCP 74 34130 → 443 [SYN] Seq=0 Win=29200 Len=0 MSS=1460 SACK_PERM=1 TSval=3161738832 TSecr=0 WS=128
 5093 458.545359738 35.186.224.53 → 192.168.8.128 TCP 74 443 → 34130 [SYN, ACK] Seq=0 Ack=1 Win=60192 Len=0 MSS=1300 SACK_PERM=1 TSval=2926058926 TSecr=3161738832 WS=256
 5133 463.066851293 192.168.8.128 → 192.168.8.1  TCP 74 39082 → 80 [SYN] Seq=0 Win=29200 Len=0 MSS=1460 SACK_PERM=1 TSval=1128212669 TSecr=0 WS=128
 5134 463.067225290  192.168.8.1 → 192.168.8.128 TCP 74 80 → 39082 [SYN, ACK] Seq=0 Ack=1 Win=28960 Len=0 MSS=1460 SACK_PERM=1 TSval=416918 TSecr=1128212669 WS=16
 5156 463.799003717 192.168.8.128 → 199.232.36.246 TCP 74 40814 → 80 [SYN] Seq=0 Win=29200 Len=0 MSS=1460 SACK_PERM=1 TSval=2110924022 TSecr=0 WS=128
 5157 463.801805695 199.232.36.246 → 192.168.8.128 TCP 74 80 → 40814 [SYN, ACK] Seq=0 Ack=1 Win=28960 Len=0 MSS=1300 SACK_PERM=1 TSval=2264509455 TSecr=2110924022 WS=512
 5161 463.803573682 192.168.8.128 → 35.186.224.53 TCP 74 34136 → 443 [SYN] Seq=0 Win=29200 Len=0 MSS=1460 SACK_PERM=1 TSval=3161744094 TSecr=0 WS=128
 5165 463.807564652 35.186.224.53 → 192.168.8.128 TCP 74 443 → 34136 [SYN, ACK] Seq=0 Ack=1 Win=60192 Len=0 MSS=1300 SACK_PERM=1 TSval=2781465213 TSecr=3161744094 WS=256
 5222 463.847998344 192.168.8.128 → 35.186.224.30 TCP 74 39648 → 443 [SYN] Seq=0 Win=29200 Len=0 MSS=1460 SACK_PERM=1 TSval=2835324808 TSecr=0 WS=128
 5224 463.851988313 35.186.224.30 → 192.168.8.128 TCP 74 443 → 39648 [SYN, ACK] Seq=0 Ack=1 Win=60192 Len=0 MSS=1300 SACK_PERM=1 TSval=410082079 TSecr=2835324808 WS=256
 5366 464.229577437 192.168.8.128 → 199.232.36.246 TCP 74 40820 → 80 [SYN] Seq=0 Win=29200 Len=0 MSS=1460 SACK_PERM=1 TSval=2110924453 TSecr=0 WS=128
 5367 464.232379416 199.232.36.246 → 192.168.8.128 TCP 74 80 → 40820 [SYN, ACK] Seq=0 Ack=1 Win=28960 Len=0 MSS=1300 SACK_PERM=1 TSval=2241825255 TSecr=2110924453 WS=512
 5416 467.124472392 192.168.8.128 → 207.38.94.47 TCP 74 58850 → 80 [SYN] Seq=0 Win=29200 Len=0 MSS=1460 SACK_PERM=1 TSval=3911672179 TSecr=0 WS=128
 5419 467.153625170 207.38.94.47 → 192.168.8.128 TCP 74 80 → 58850 [SYN, ACK] Seq=0 Ack=1 Win=28960 Len=0 MSS=1300 TSval=960804001 TSecr=3911672179 WS=128
 5433 467.402445275 192.168.8.128 → 207.38.94.47 TCP 74 58852 → 80 [SYN] Seq=0 Win=29200 Len=0 MSS=1460 SACK_PERM=1 TSval=3911672456 TSecr=0 WS=128
 5434 467.431138056 207.38.94.47 → 192.168.8.128 TCP 74 80 → 58852 [SYN, ACK] Seq=0 Ack=1 Win=28960 Len=0 MSS=1300 TSval=960804279 TSecr=3911672456 WS=128
 5617 493.077963937 192.168.8.128 → 192.168.8.1  TCP 74 39096 → 80 [SYN] Seq=0 Win=29200 Len=0 MSS=1460 SACK_PERM=1 TSval=1128242680 TSecr=0 WS=128
 5618 493.078343934  192.168.8.1 → 192.168.8.128 TCP 74 80 → 39096 [SYN, ACK] Seq=0 Ack=1 Win=28960 Len=0 MSS=1460 SACK_PERM=1 TSval=419919 TSecr=1128242680 WS=16
 5794 523.222525012 192.168.8.128 → 192.168.8.1  TCP 74 39098 → 80 [SYN] Seq=0 Win=29200 Len=0 MSS=1460 SACK_PERM=1 TSval=1128272824 TSecr=0 WS=128
 5795 523.222997009  192.168.8.1 → 192.168.8.128 TCP 74 80 → 39098 [SYN, ACK] Seq=0 Ack=1 Win=28960 Len=0 MSS=1460 SACK_PERM=1 TSval=422934 TSecr=1128272824 WS=16
 6005 553.367957402 192.168.8.128 → 192.168.8.1  TCP 74 39100 → 80 [SYN] Seq=0 Win=29200 Len=0 MSS=1460 SACK_PERM=1 TSval=1128302969 TSecr=0 WS=128
 6006 553.368312392  192.168.8.1 → 192.168.8.128 TCP 74 80 → 39100 [SYN, ACK] Seq=0 Ack=1 Win=28960 Len=0 MSS=1460 SACK_PERM=1 TSval=425948 TSecr=1128302969 WS=16
 6172 583.504291834 192.168.8.128 → 192.168.8.1  TCP 74 39102 → 80 [SYN] Seq=0 Win=29200 Len=0 MSS=1460 SACK_PERM=1 TSval=1128333105 TSecr=0 WS=128
 6173 583.504667824  192.168.8.1 → 192.168.8.128 TCP 74 80 → 39102 [SYN, ACK] Seq=0 Ack=1 Win=28960 Len=0 MSS=1460 SACK_PERM=1 TSval=428962 TSecr=1128333105 WS=16
 6244 595.903230208 192.168.8.128 → 172.217.12.206 TCP 74 52642 → 443 [SYN] Seq=0 Win=29200 Len=0 MSS=1460 SACK_PERM=1 TSval=1147864125 TSecr=0 WS=128
 6245 595.907071104 172.217.12.206 → 192.168.8.128 TCP 74 443 → 52642 [SYN, ACK] Seq=0 Ack=1 Win=60192 Len=0 MSS=1300 SACK_PERM=1 TSval=3119826501 TSecr=1147864125 WS=256
 6342 605.921236010 192.168.8.245 → 17.57.144.165 TCP 78 52102 → 5223 [SYN] Seq=0 Win=65535 Len=0 MSS=1460 WS=64 TSval=894826970 TSecr=0 SACK_PERM=1
 6343 605.929230797 17.57.144.165 → 192.168.8.245 TCP 74 5223 → 52102 [SYN, ACK] Seq=0 Ack=1 Win=28960 Len=0 MSS=1300 SACK_PERM=1 TSval=1462994465 TSecr=894826970 WS=128
 6437 606.238347572 192.168.8.245 → 52.94.232.33 TCP 78 58321 → 443 [SYN] Seq=0 Win=65535 Len=0 MSS=1460 WS=128 TSval=894922145 TSecr=0 SACK_PERM=1
 6438 606.238670563 192.168.8.245 → 52.94.232.33 TCP 78 58322 → 443 [SYN] Seq=0 Win=65535 Len=0 MSS=1460 WS=128 TSval=894922146 TSecr=0 SACK_PERM=1
 6440 606.240887504 192.168.8.245 → 199.232.37.140 TCP 78 58323 → 443 [SYN] Seq=0 Win=65535 Len=0 MSS=1460 WS=128 TSval=894922147 TSecr=0 SACK_PERM=1
 6441 606.243493435 199.232.37.140 → 192.168.8.245 TCP 74 443 → 58323 [SYN, ACK] Seq=0 Ack=1 Win=28960 Len=0 MSS=1300 SACK_PERM=1 TSval=2245079520 TSecr=894922147 WS=512
 6444 606.247444330 52.94.232.33 → 192.168.8.245 TCP 66 443 → 58321 [SYN, ACK] Seq=0 Ack=1 Win=8190 Len=0 MSS=1212 WS=64 SACK_PERM=1
 6445 606.247709323 52.94.232.33 → 192.168.8.245 TCP 66 443 → 58322 [SYN, ACK] Seq=0 Ack=1 Win=8190 Len=0 MSS=1212 WS=64 SACK_PERM=1
 6455 606.373838971 192.168.8.245 → 52.94.232.33 TCP 78 [TCP Retransmission] 58322 → 443 [SYN] Seq=0 Win=65535 Len=0 MSS=1460 WS=128 TSval=894922223 TSecr=0 SACK_PERM=1
 6456 606.374050965 192.168.8.245 → 52.94.232.33 TCP 78 [TCP Retransmission] 58321 → 443 [SYN] Seq=0 Win=65535 Len=0 MSS=1460 WS=128 TSval=894922223 TSecr=0 SACK_PERM=1
 6457 606.374233960 192.168.8.245 → 52.94.232.33 TCP 78 58324 → 443 [SYN] Seq=0 Win=65535 Len=0 MSS=1460 WS=128 TSval=894922250 TSecr=0 SACK_PERM=1
 6458 606.374459954 192.168.8.245 → 52.94.232.33 TCP 78 58325 → 443 [SYN] Seq=0 Win=65535 Len=0 MSS=1460 WS=128 TSval=894922261 TSecr=0 SACK_PERM=1
 6459 606.374767946 192.168.8.245 → 52.94.232.33 TCP 78 58326 → 443 [SYN] Seq=0 Win=65535 Len=0 MSS=1460 WS=128 TSval=894922261 TSecr=0 SACK_PERM=1
 6460 606.374985940 192.168.8.245 → 52.94.232.33 TCP 78 [TCP Retransmission] 58322 → 443 [SYN] Seq=0 Win=65535 Len=0 MSS=1460 WS=128 TSval=894922261 TSecr=0 SACK_PERM=1
 6461 606.375200935 192.168.8.245 → 52.94.232.33 TCP 78 [TCP Retransmission] 58321 → 443 [SYN] Seq=0 Win=65535 Len=0 MSS=1460 WS=128 TSval=894922261 TSecr=0 SACK_PERM=1
 6478 606.401854226 192.168.8.245 → 199.232.37.140 TCP 78 58327 → 443 [SYN] Seq=0 Win=65535 Len=0 MSS=1460 WS=128 TSval=894922309 TSecr=0 SACK_PERM=1
 6479 606.402227216 52.94.232.33 → 192.168.8.245 TCP 66 [TCP Retransmission] 443 → 58322 [SYN, ACK] Seq=0 Ack=1 Win=8190 Len=0 MSS=1212 WS=64 SACK_PERM=1
 6480 606.402468210 52.94.232.33 → 192.168.8.245 TCP 66 [TCP Retransmission] 443 → 58321 [SYN, ACK] Seq=0 Ack=1 Win=8190 Len=0 MSS=1212 WS=64 SACK_PERM=1
 6481 606.402672204 52.94.232.33 → 192.168.8.245 TCP 66 [TCP Retransmission] 443 → 58322 [SYN, ACK] Seq=0 Ack=1 Win=8190 Len=0 MSS=1212 WS=64 SACK_PERM=1
 6482 606.402831200 52.94.232.33 → 192.168.8.245 TCP 66 [TCP Retransmission] 443 → 58321 [SYN, ACK] Seq=0 Ack=1 Win=8190 Len=0 MSS=1212 WS=64 SACK_PERM=1
 6483 606.403190191 52.94.232.33 → 192.168.8.245 TCP 66 443 → 58324 [SYN, ACK] Seq=0 Ack=1 Win=8190 Len=0 MSS=1212 WS=64 SACK_PERM=1
 6484 606.403196190 52.94.232.33 → 192.168.8.245 TCP 66 443 → 58325 [SYN, ACK] Seq=0 Ack=1 Win=8190 Len=0 MSS=1212 WS=64 SACK_PERM=1
 6485 606.403486183 52.94.232.33 → 192.168.8.245 TCP 66 443 → 58326 [SYN, ACK] Seq=0 Ack=1 Win=8190 Len=0 MSS=1212 WS=64 SACK_PERM=1
 6491 606.404716150 199.232.37.140 → 192.168.8.245 TCP 74 443 → 58327 [SYN, ACK] Seq=0 Ack=1 Win=28960 Len=0 MSS=1300 SACK_PERM=1 TSval=697929429 TSecr=894922309 WS=512
 6519 606.412789935 192.168.8.245 → 72.21.206.140 TCP 78 58328 → 443 [SYN] Seq=0 Win=65535 Len=0 MSS=1460 WS=128 TSval=894922316 TSecr=0 SACK_PERM=1
 6537 606.421614701 72.21.206.140 → 192.168.8.245 TCP 66 443 → 58328 [SYN, ACK] Seq=0 Ack=1 Win=8190 Len=0 MSS=1212 WS=64 SACK_PERM=1
 6630 606.488667919 192.168.8.245 → 199.232.37.140 TCP 78 58329 → 443 [SYN] Seq=0 Win=65535 Len=0 MSS=1460 WS=128 TSval=894922381 TSecr=0 SACK_PERM=1
 6634 606.491344848 199.232.37.140 → 192.168.8.245 TCP 74 443 → 58329 [SYN, ACK] Seq=0 Ack=1 Win=28960 Len=0 MSS=1300 SACK_PERM=1 TSval=2266829489 TSecr=894922381 WS=512
 6701 606.785367033 192.168.8.245 → 52.94.232.33 TCP 78 58330 → 443 [SYN] Seq=0 Win=65535 Len=0 MSS=1460 WS=128 TSval=894922667 TSecr=0 SACK_PERM=1
 6702 606.793941805 52.94.232.33 → 192.168.8.245 TCP 66 443 → 58330 [SYN, ACK] Seq=0 Ack=1 Win=8190 Len=0 MSS=1212 WS=64 SACK_PERM=1
 6703 606.794735784 192.168.8.245 → 52.94.232.33 TCP 78 58331 → 443 [SYN] Seq=0 Win=65535 Len=0 MSS=1460 WS=128 TSval=894922676 TSecr=0 SACK_PERM=1
 6706 606.800090642 192.168.8.245 → 52.94.232.33 TCP 78 58332 → 443 [SYN] Seq=0 Win=65535 Len=0 MSS=1460 WS=128 TSval=894922680 TSecr=0 SACK_PERM=1
 6707 606.803240558 52.94.232.33 → 192.168.8.245 TCP 66 443 → 58331 [SYN, ACK] Seq=0 Ack=1 Win=8190 Len=0 MSS=1212 WS=64 SACK_PERM=1
 6711 606.811756332 52.94.232.33 → 192.168.8.245 TCP 66 443 → 58332 [SYN, ACK] Seq=0 Ack=1 Win=8190 Len=0 MSS=1212 WS=64 SACK_PERM=1
 6826 613.624958028 192.168.8.128 → 192.168.8.1  TCP 74 39106 → 80 [SYN] Seq=0 Win=29200 Len=0 MSS=1460 SACK_PERM=1 TSval=1128363226 TSecr=0 WS=128
 6827 613.625330019  192.168.8.1 → 192.168.8.128 TCP 74 80 → 39106 [SYN, ACK] Seq=0 Ack=1 Win=28960 Len=0 MSS=1460 SACK_PERM=1 TSval=431974 TSecr=1128363226 WS=16
 6949 623.429205215 192.168.8.128 → 104.154.127.47 TCP 74 45032 → 443 [SYN] Seq=0 Win=29200 Len=0 MSS=1460 SACK_PERM=1 TSval=1119456811 TSecr=0 WS=128
 6950 623.430386184 192.168.8.128 → 172.217.10.98 TCP 74 49822 → 443 [SYN] Seq=0 Win=29200 Len=0 MSS=1460 SACK_PERM=1 TSval=2273272891 TSecr=0 WS=128
 6952 623.432531129 192.168.8.128 → 8.43.72.75   TCP 74 50736 → 443 [SYN] Seq=0 Win=29200 Len=0 MSS=1460 SACK_PERM=1 TSval=208019 TSecr=0 WS=128
 6953 623.434939066 172.217.10.98 → 192.168.8.128 TCP 74 443 → 49822 [SYN, ACK] Seq=0 Ack=1 Win=60192 Len=0 MSS=1300 SACK_PERM=1 TSval=1119723704 TSecr=2273272891 WS=256
 6955 623.440942910   8.43.72.75 → 192.168.8.128 TCP 62 443 → 50736 [SYN, ACK] Seq=0 Ack=1 Win=29200 Len=0 MSS=1300 SACK_PERM=1
 6969 623.459106437 104.154.127.47 → 192.168.8.128 TCP 74 443 → 45032 [SYN, ACK] Seq=0 Ack=1 Win=24560 Len=0 MSS=1240 SACK_PERM=1 TSval=267920179 TSecr=1119456811 WS=128
 6989 623.583260205 192.168.8.128 → 216.152.140.87 TCP 74 47598 → 443 [SYN] Seq=0 Win=29200 Len=0 MSS=1460 SACK_PERM=1 TSval=836240870 TSecr=0 WS=128
 6991 623.591345995 216.152.140.87 → 192.168.8.128 TCP 74 443 → 47598 [SYN, ACK] Seq=0 Ack=1 Win=28960 Len=0 MSS=1300 SACK_PERM=1 TSval=1158262588 TSecr=836240870 WS=256
 7085 623.706530997 192.168.8.128 → 172.217.10.98 TCP 74 49828 → 443 [SYN] Seq=0 Win=29200 Len=0 MSS=1460 SACK_PERM=1 TSval=2273273165 TSecr=0 WS=128
 7086 623.706723992 192.168.8.128 → 216.152.140.87 TCP 74 47602 → 443 [SYN] Seq=0 Win=29200 Len=0 MSS=1460 SACK_PERM=1 TSval=836240991 TSecr=0 WS=128
 7087 623.707012985 192.168.8.128 → 104.154.127.47 TCP 74 45044 → 443 [SYN] Seq=0 Win=29200 Len=0 MSS=1460 SACK_PERM=1 TSval=1119457086 TSecr=0 WS=128
 7088 623.707299977 192.168.8.128 → 8.43.72.75   TCP 74 50746 → 443 [SYN] Seq=0 Win=29200 Len=0 MSS=1460 SACK_PERM=1 TSval=208291 TSecr=0 WS=128
 7108 623.713716810 172.217.10.98 → 192.168.8.128 TCP 74 443 → 49828 [SYN, ACK] Seq=0 Ack=1 Win=60192 Len=0 MSS=1300 SACK_PERM=1 TSval=4080759379 TSecr=2273273165 WS=256
 7116 623.715945752 216.152.140.87 → 192.168.8.128 TCP 74 443 → 47602 [SYN, ACK] Seq=0 Ack=1 Win=28960 Len=0 MSS=1300 SACK_PERM=1 TSval=1158262619 TSecr=836240991 WS=256
 7117 623.716500738   8.43.72.75 → 192.168.8.128 TCP 62 443 → 50746 [SYN, ACK] Seq=0 Ack=1 Win=29200 Len=0 MSS=1300 SACK_PERM=1
 7149 623.738436167 104.154.127.47 → 192.168.8.128 TCP 74 443 → 45044 [SYN, ACK] Seq=0 Ack=1 Win=24560 Len=0 MSS=1240 SACK_PERM=1 TSval=268082877 TSecr=1119457086 WS=128
 7174 623.789481838 192.168.8.128 → 208.185.50.26 TCP 74 35100 → 443 [SYN] Seq=0 Win=29200 Len=0 MSS=1460 SACK_PERM=1 TSval=3729215763 TSecr=0 WS=128
 7175 623.789828829 192.168.8.128 → 199.232.38.49 TCP 74 55450 → 443 [SYN] Seq=0 Win=29200 Len=0 MSS=1460 SACK_PERM=1 TSval=4195535275 TSecr=0 WS=128
 7176 623.790126821 192.168.8.128 → 216.200.232.172 TCP 74 43742 → 443 [SYN] Seq=0 Win=29200 Len=0 MSS=1460 SACK_PERM=1 TSval=2986640735 TSecr=0 WS=128
 7177 623.792909749 199.232.38.49 → 192.168.8.128 TCP 74 443 → 55450 [SYN, ACK] Seq=0 Ack=1 Win=28960 Len=0 MSS=1300 SACK_PERM=1 TSval=697933776 TSecr=4195535275 WS=512
 7180 623.797834621 208.185.50.26 → 192.168.8.128 TCP 62 443 → 35100 [SYN, ACK] Seq=0 Ack=1 Win=29200 Len=0 MSS=1300 SACK_PERM=1
 7187 623.811767258 216.200.232.172 → 192.168.8.128 TCP 74 443 → 43742 [SYN, ACK] Seq=0 Ack=1 Win=28960 Len=0 MSS=1300 SACK_PERM=1 TSval=741560766 TSecr=2986640735 WS=512
 7197 623.882177426 192.168.8.128 → 34.236.165.152 TCP 74 42404 → 443 [SYN] Seq=0 Win=29200 Len=0 MSS=1460 SACK_PERM=1 TSval=2244438916 TSecr=0 WS=128
 7198 623.882402420 192.168.8.128 → 52.44.140.161 TCP 74 57736 → 443 [SYN] Seq=0 Win=29200 Len=0 MSS=1460 SACK_PERM=1 TSval=1993536807 TSecr=0 WS=128
 7199 623.882720411 192.168.8.128 → 54.164.252.155 TCP 74 35544 → 443 [SYN] Seq=0 Win=29200 Len=0 MSS=1460 SACK_PERM=1 TSval=3427570883 TSecr=0 WS=128
 7200 623.891024195 34.236.165.152 → 192.168.8.128 TCP 74 443 → 42404 [SYN, ACK] Seq=0 Ack=1 Win=26847 Len=0 MSS=1300 SACK_PERM=1 TSval=1019402654 TSecr=2244438916 WS=256
 7201 623.891291188 52.44.140.161 → 192.168.8.128 TCP 74 443 → 57736 [SYN, ACK] Seq=0 Ack=1 Win=26847 Len=0 MSS=1300 SACK_PERM=1 TSval=3513052935 TSecr=1993536807 WS=256
 7202 623.891811175 54.164.252.155 → 192.168.8.128 TCP 74 443 → 35544 [SYN, ACK] Seq=0 Ack=1 Win=26847 Len=0 MSS=1300 SACK_PERM=1 TSval=2652427909 TSecr=3427570883 WS=256
 7213 623.927937235 192.168.8.128 → 34.227.35.137 TCP 74 32888 → 443 [SYN] Seq=0 Win=29200 Len=0 MSS=1460 SACK_PERM=1 TSval=217262386 TSecr=0 WS=128
 7216 623.929316199 192.168.8.128 → 172.217.12.162 TCP 74 57860 → 443 [SYN] Seq=0 Win=29200 Len=0 MSS=1460 SACK_PERM=1 TSval=3687369698 TSecr=0 WS=128
 7217 623.929682189 192.168.8.128 → 23.20.153.16 TCP 74 42058 → 443 [SYN] Seq=0 Win=29200 Len=0 MSS=1460 SACK_PERM=1 TSval=781744744 TSecr=0 WS=128
 7218 623.929933183 192.168.8.128 → 209.15.36.31 TCP 74 54750 → 443 [SYN] Seq=0 Win=29200 Len=0 MSS=1460 SACK_PERM=1 TSval=3453179888 TSecr=0 WS=128
 7219 623.930197176 192.168.8.128 → 68.67.160.26 TCP 74 39618 → 443 [SYN] Seq=0 Win=29200 Len=0 MSS=1460 SACK_PERM=1 TSval=2784108352 TSecr=0 WS=128
 7221 623.933216097 172.217.12.162 → 192.168.8.128 TCP 74 443 → 57860 [SYN, ACK] Seq=0 Ack=1 Win=60192 Len=0 MSS=1300 SACK_PERM=1 TSval=2850293766 TSecr=3687369698 WS=256
 7223 623.934658060 68.67.160.26 → 192.168.8.128 TCP 74 443 → 39618 [SYN, ACK] Seq=0 Ack=1 Win=26544 Len=0 MSS=1300 SACK_PERM=1 TSval=1326578967 TSecr=2784108352 WS=512
 7225 623.936713006 34.227.35.137 → 192.168.8.128 TCP 74 443 → 32888 [SYN, ACK] Seq=0 Ack=1 Win=26847 Len=0 MSS=1300 SACK_PERM=1 TSval=1143455824 TSecr=217262386 WS=256
 7228 623.938218967 23.20.153.16 → 192.168.8.128 TCP 74 443 → 42058 [SYN, ACK] Seq=0 Ack=1 Win=26847 Len=0 MSS=1300 SACK_PERM=1 TSval=1143314408 TSecr=781744744 WS=256
 7229 623.938412962 209.15.36.31 → 192.168.8.128 TCP 62 443 → 54750 [SYN, ACK] Seq=0 Ack=1 Win=29200 Len=0 MSS=1300 WS=256
 7413 624.473575041 192.168.8.128 → 172.217.12.162 TCP 74 57868 → 443 [SYN] Seq=0 Win=29200 Len=0 MSS=1460 SACK_PERM=1 TSval=3687370242 TSecr=0 WS=128
 7422 624.478457914 172.217.12.162 → 192.168.8.128 TCP 74 443 → 57868 [SYN, ACK] Seq=0 Ack=1 Win=60192 Len=0 MSS=1300 SACK_PERM=1 TSval=4099070144 TSecr=3687370242 WS=256
 7506 624.576934354 192.168.8.128 → 216.200.232.172 TCP 74 43762 → 443 [SYN] Seq=0 Win=29200 Len=0 MSS=1460 SACK_PERM=1 TSval=2986641522 TSecr=0 WS=128
 7509 624.583800176 192.168.8.128 → 34.236.165.152 TCP 74 42424 → 443 [SYN] Seq=0 Win=29200 Len=0 MSS=1460 SACK_PERM=1 TSval=2244439618 TSecr=0 WS=128
 7518 624.593082935 34.236.165.152 → 192.168.8.128 TCP 74 443 → 42424 [SYN, ACK] Seq=0 Ack=1 Win=26847 Len=0 MSS=1300 SACK_PERM=1 TSval=1019402830 TSecr=2244439618 WS=256
 7526 624.597671815 216.200.232.172 → 192.168.8.128 TCP 74 443 → 43762 [SYN, ACK] Seq=0 Ack=1 Win=28960 Len=0 MSS=1300 SACK_PERM=1 TSval=741560962 TSecr=2986641522 WS=512
 7546 624.609297513 192.168.8.128 → 23.20.153.16 TCP 74 42070 → 443 [SYN] Seq=0 Win=29200 Len=0 MSS=1460 SACK_PERM=1 TSval=781745423 TSecr=0 WS=128
 7561 624.618584272 192.168.8.128 → 209.15.36.31 TCP 74 54762 → 443 [SYN] Seq=0 Win=29200 Len=0 MSS=1460 SACK_PERM=1 TSval=3453180576 TSecr=0 WS=128
 7562 624.618871264 192.168.8.128 → 199.232.38.49 TCP 74 55480 → 443 [SYN] Seq=0 Win=29200 Len=0 MSS=1460 SACK_PERM=1 TSval=4195536104 TSecr=0 WS=128
 7564 624.619660244 23.20.153.16 → 192.168.8.128 TCP 74 443 → 42070 [SYN, ACK] Seq=0 Ack=1 Win=26847 Len=0 MSS=1300 SACK_PERM=1 TSval=1143314578 TSecr=781745423 WS=256
 7568 624.623335148 199.232.38.49 → 192.168.8.128 TCP 74 443 → 55480 [SYN, ACK] Seq=0 Ack=1 Win=28960 Len=0 MSS=1300 SACK_PERM=1 TSval=712803219 TSecr=4195536104 WS=512
 7572 624.627007053 209.15.36.31 → 192.168.8.128 TCP 62 443 → 54762 [SYN, ACK] Seq=0 Ack=1 Win=29200 Len=0 MSS=1300 WS=256
 7581 624.708961922 192.168.8.128 → 100.25.70.183 TCP 74 59800 → 443 [SYN] Seq=0 Win=29200 Len=0 MSS=1460 SACK_PERM=1 TSval=2211174121 TSecr=0 WS=128
 7582 624.709287914 192.168.8.128 → 8.43.72.97   TCP 74 56688 → 443 [SYN] Seq=0 Win=29200 Len=0 MSS=1460 SACK_PERM=1 TSval=3055932194 TSecr=0 WS=128
 7583 624.709532907 192.168.8.128 → 8.43.72.97   TCP 74 56690 → 443 [SYN] Seq=0 Win=29200 Len=0 MSS=1460 SACK_PERM=1 TSval=3055932194 TSecr=0 WS=128
 7584 624.717353704   8.43.72.97 → 192.168.8.128 TCP 74 443 → 56688 [SYN, ACK] Seq=0 Ack=1 Win=14600 Len=0 MSS=1300 WS=4 SACK_PERM=1 TSval=2968514402 TSecr=3055932194
 7585 624.718078685   8.43.72.97 → 192.168.8.128 TCP 74 443 → 56690 [SYN, ACK] Seq=0 Ack=1 Win=14600 Len=0 MSS=1300 WS=4 SACK_PERM=1 TSval=2968514402 TSecr=3055932194
 7593 624.750656838 100.25.70.183 → 192.168.8.128 TCP 74 443 → 59800 [SYN, ACK] Seq=0 Ack=1 Win=26847 Len=0 MSS=1300 SACK_PERM=1 TSval=855161607 TSecr=2211174121 WS=256
 7648 624.978442917 192.168.8.128 → 8.43.72.97   TCP 74 56692 → 443 [SYN] Seq=0 Win=29200 Len=0 MSS=1460 SACK_PERM=1 TSval=3055932464 TSecr=0 WS=128
 7656 624.987117691   8.43.72.97 → 192.168.8.128 TCP 74 443 → 56692 [SYN, ACK] Seq=0 Ack=1 Win=14600 Len=0 MSS=1300 WS=4 SACK_PERM=1 TSval=2968514470 TSecr=3055932464
 7690 625.045790166 192.168.8.128 → 8.43.72.97   TCP 74 56694 → 443 [SYN] Seq=0 Win=29200 Len=0 MSS=1460 SACK_PERM=1 TSval=3055932530 TSecr=0 WS=128
 7699 625.054807932   8.43.72.97 → 192.168.8.128 TCP 74 443 → 56694 [SYN, ACK] Seq=0 Ack=1 Win=14600 Len=0 MSS=1300 WS=4 SACK_PERM=1 TSval=2968514487 TSecr=3055932530
 7871 643.745324757 192.168.8.128 → 192.168.8.1  TCP 74 39168 → 80 [SYN] Seq=0 Win=29200 Len=0 MSS=1460 SACK_PERM=1 TSval=1128393347 TSecr=0 WS=128
 7872 643.745679748  192.168.8.1 → 192.168.8.128 TCP 74 80 → 39168 [SYN, ACK] Seq=0 Ack=1 Win=28960 Len=0 MSS=1460 SACK_PERM=1 TSval=434986 TSecr=1128393347 WS=16
 7939 653.947135211 192.168.8.128 → 172.217.10.98 TCP 74 49882 → 443 [SYN] Seq=0 Win=29200 Len=0 MSS=1460 SACK_PERM=1 TSval=2273303407 TSecr=0 WS=128
 7940 653.947407204 192.168.8.128 → 8.43.72.75   TCP 74 50796 → 443 [SYN] Seq=0 Win=29200 Len=0 MSS=1460 SACK_PERM=1 TSval=238533 TSecr=0 WS=128
 7941 653.947729196 192.168.8.128 → 8.43.72.75   TCP 74 50798 → 443 [SYN] Seq=0 Win=29200 Len=0 MSS=1460 SACK_PERM=1 TSval=238534 TSecr=0 WS=128
 7942 653.948076187 192.168.8.128 → 8.43.72.75   TCP 74 50800 → 443 [SYN] Seq=0 Win=29200 Len=0 MSS=1460 SACK_PERM=1 TSval=238534 TSecr=0 WS=128
 7943 653.948372180 192.168.8.128 → 172.217.10.98 TCP 74 49890 → 443 [SYN] Seq=0 Win=29200 Len=0 MSS=1460 SACK_PERM=1 TSval=2273303408 TSecr=0 WS=128
 7944 653.948625173 192.168.8.128 → 216.152.140.87 TCP 74 47664 → 443 [SYN] Seq=0 Win=29200 Len=0 MSS=1460 SACK_PERM=1 TSval=836271234 TSecr=0 WS=128
 7945 653.948913166 192.168.8.128 → 104.154.127.47 TCP 74 45106 → 443 [SYN] Seq=0 Win=29200 Len=0 MSS=1460 SACK_PERM=1 TSval=1119487329 TSecr=0 WS=128
 7946 653.949240158 192.168.8.128 → 172.217.10.98 TCP 74 49896 → 443 [SYN] Seq=0 Win=29200 Len=0 MSS=1460 SACK_PERM=1 TSval=2273303408 TSecr=0 WS=128
 7947 653.949509151 192.168.8.128 → 216.152.140.87 TCP 74 47670 → 443 [SYN] Seq=0 Win=29200 Len=0 MSS=1460 SACK_PERM=1 TSval=836271234 TSecr=0 WS=128
 7949 653.949905141 192.168.8.128 → 172.217.10.98 TCP 74 49900 → 443 [SYN] Seq=0 Win=29200 Len=0 MSS=1460 SACK_PERM=1 TSval=2273303408 TSecr=0 WS=128
 7950 653.950122136 192.168.8.128 → 216.152.140.87 TCP 74 47674 → 443 [SYN] Seq=0 Win=29200 Len=0 MSS=1460 SACK_PERM=1 TSval=836271234 TSecr=0 WS=128
 7951 653.950392129 192.168.8.128 → 8.43.72.75   TCP 74 50816 → 443 [SYN] Seq=0 Win=29200 Len=0 MSS=1460 SACK_PERM=1 TSval=238534 TSecr=0 WS=128
 7952 653.950681122 192.168.8.128 → 104.154.127.47 TCP 74 45118 → 443 [SYN] Seq=0 Win=29200 Len=0 MSS=1460 SACK_PERM=1 TSval=1119487329 TSecr=0 WS=128
