    5 5.256506455 10.18.98.174 → 172.217.12.132 TCP 74 60532 → 443 [SYN] Seq=0 Win=29200 Len=0 MSS=1460 SACK_PERM=1 TSval=3015534012 TSecr=0 WS=128
    6 5.259740931 172.217.12.132 → 10.18.98.174 TCP 74 443 → 60532 [SYN, ACK] Seq=0 Ack=1 Win=60192 Len=0 MSS=1300 SACK_PERM=1 TSval=785214010 TSecr=3015534012 WS=256
  107 9.108337347 10.18.98.174 → 31.13.71.36  TCP 74 49808 → 443 [SYN] Seq=0 Win=29200 Len=0 MSS=1460 SACK_PERM=1 TSval=1680302287 TSecr=0 WS=128
  108 9.110885798  31.13.71.36 → 10.18.98.174 TCP 74 443 → 49808 [SYN, ACK] Seq=0 Ack=1 Win=27760 Len=0 MSS=1300 SACK_PERM=1 TSval=3058482595 TSecr=1680302287 WS=256
  192 10.507749988 10.18.98.174 → 31.13.71.7   TCP 74 60368 → 443 [SYN] Seq=0 Win=29200 Len=0 MSS=1460 SACK_PERM=1 TSval=1038537829 TSecr=0 WS=128
  196 10.511980076   31.13.71.7 → 10.18.98.174 TCP 74 443 → 60368 [SYN, ACK] Seq=0 Ack=1 Win=27760 Len=0 MSS=1300 SACK_PERM=1 TSval=952735142 TSecr=1038537829 WS=256
  493 46.622027444 10.18.98.174 → 52.27.184.130 TCP 74 37212 → 443 [SYN] Seq=0 Win=29200 Len=0 MSS=1460 SACK_PERM=1 TSval=2352785163 TSecr=0 WS=128
  494 46.698582247 52.27.184.130 → 10.18.98.174 TCP 74 443 → 37212 [SYN, ACK] Seq=0 Ack=1 Win=26847 Len=0 MSS=1300 SACK_PERM=1 TSval=963583979 TSecr=2352785163 WS=256
  510 46.929292177 10.18.98.174 → 52.89.175.187 TCP 74 55288 → 443 [SYN] Seq=0 Win=29200 Len=0 MSS=1460 SACK_PERM=1 TSval=1756542370 TSecr=0 WS=128
  513 46.960689203 10.18.98.174 → 34.212.28.14 TCP 74 47150 → 443 [SYN] Seq=0 Win=29200 Len=0 MSS=1460 SACK_PERM=1 TSval=1507875875 TSecr=0 WS=128
  514 47.006637347 52.89.175.187 → 10.18.98.174 TCP 74 443 → 55288 [SYN, ACK] Seq=0 Ack=1 Win=26847 Len=0 MSS=1300 SACK_PERM=1 TSval=3447037690 TSecr=1756542370 WS=256
  517 47.037144049 34.212.28.14 → 10.18.98.174 TCP 74 443 → 47150 [SYN, ACK] Seq=0 Ack=1 Win=17898 Len=0 MSS=1300 SACK_PERM=1 TSval=3351566971 TSecr=1507875875 WS=128
  544 47.447354829 10.18.98.174 → 52.40.171.86 TCP 74 42038 → 443 [SYN] Seq=0 Win=29200 Len=0 MSS=1460 SACK_PERM=1 TSval=1320242441 TSecr=0 WS=128
  545 47.523746154 52.40.171.86 → 10.18.98.174 TCP 74 443 → 42038 [SYN, ACK] Seq=0 Ack=1 Win=26847 Len=0 MSS=1300 SACK_PERM=1 TSval=176581014 TSecr=1320242441 WS=256
  585 48.229305765 10.18.98.174 → 34.95.71.207 TCP 74 48128 → 443 [SYN] Seq=0 Win=29200 Len=0 MSS=1460 SACK_PERM=1 TSval=529054175 TSecr=0 WS=128
  586 48.233077721 34.95.71.207 → 10.18.98.174 TCP 74 443 → 48128 [SYN, ACK] Seq=0 Ack=1 Win=60192 Len=0 MSS=1300 SACK_PERM=1 TSval=505409927 TSecr=529054175 WS=256
